rank,uri,artist_names,track_name,source,peak_rank,previous_rank,weeks_on_chart,streams
193,"spotify:track:1uYHfa5rjM1oUpKgst7U8F","Dj Aguilar, Dj Tchouzen, MC Marlon PH","Deixa Eu Mandar Meu Passinho","Dj Aguilar",193,-1,1,"1159462"
194,"spotify:track:0vFVkEDrV58pAPEtKJLvP5","Songs Five Music, José Jr","Yeshua - Ao Vivo","The Bow",182,182,2,"1158178"
195,"spotify:track:2o4hr5HCAKShrbFtmxm7Dg","Manu, Guilherme & Benuto","Torre Eiffel - Ao Vivo","manuoficial",3,-1,32,"1155448"
196,"spotify:track:6v6MmJlw7elqJUty23mvS4","Dj Tchouzen, Mc Rodrigo do CN","Cada Vez Mais Gostosa","Dj Tchouzen",196,-1,1,"1152516"
197,"spotify:track:4nTrxp4aH0g2yLVPkFmljF","Racionais MC's","Vida Loka, Pt. 2","Boogie Naipe",149,184,8,"1150539"
198,"spotify:track:5oI9blwsXC8AkTWw6wASY8","Matuê","Máquina do Tempo","Sony Music Entertainment",2,-1,83,"1149990"
199,"spotify:track:6gFQhcUOhNXaq965kYEdsH","Delacruz, Maria, Ducon, Luiz Lins, Diomedes Chinaski, BK, Kayuá, Pineapple StormTv","Poesia Acústica #2: Sobre Nós","Pineapple StormTV",91,188,91,"1148685"
200,"spotify:track:5vT4pYzoIJHEZhkBx2BgOU","Felipe Beats, Vitor Daslent's","Porsche Azul","Fb hits",57,169,12,"1148213"
