rank,uri,artist_names,track_name,source,peak_rank,previous_rank,weeks_on_chart,streams
190,"spotify:track:4WXVqLSRHF4ypdiBngbcqU","Dj GM, Mc Paiva ZS, Triz, MC Paulin da Capital, Mc Lipi, Mc Lele JP, MC Ryan SP, Gabb MC, Mc Daniel, MC Cebezinho, MC GH do 7, MC Marks, Mc Negão Original, GREGO","Set Dj Gm 6.0","Love Funk",90,172,26,"1157110"
191,"spotify:track:3PqU6gHWUaBTtIZi5oxEJ7","Zé Neto & Cristiano","Um Mês E Pouco - Ao Vivo","Som Livre",11,173,54,"1155011"
192,"spotify:track:3knAG9kd3jNNuJlZZUAOoQ","Gusttavo Lima, Murilo Huff","Cep Novo - Ao Vivo","Sony Music Entertainment",98,129,12,"1148580"
193,"spotify:track:2jPCbFrFlyGbKgblxub8Lm","The Outfield","Your Love","Columbia/Legacy",186,-1,3,"1146147"
194,"spotify:track:1VIKajJnDqtFwxTz3o6Pwm","Luiz Henrique e Leo, Lauana Prado","Piti - Ao Vivo","Terrível Music",194,-1,1,"1136004"
195,"spotify:track:3nv4vf4yi5HZVJxhzSejU8","Ramon e Randinho, Tarcísio do Acordeon","Vaquejada é Vaquejada","Sua Música Digital",195,-1,1,"1130553"
196,"spotify:track:5RKHkJ5tpJXeBRsWlxz1Ly","Henry Freitas, Xand Avião","Alteradão (feat. Xand Avião)","Sony Music Entertainment",80,113,5,"1125964"
197,"spotify:track:1JSTJqkT5qHq8MDJnJbRE1","The Police","Every Breath You Take","Polydor Records",140,-1,18,"1124666"
198,"spotify:track:0EMf4CzvPd1z50iqRbmLfl","Maria Marçal","Deixa","MK Music",136,-1,37,"1123714"
199,"spotify:track:54FV2rMVwLusAVnzROB0c1","Orochi, Caio Luccas, Pedro Lotto, Mainstreet, Galdino, Ribb","Mesma História","Mainstreet Records",56,125,38,"1119004"
200,"spotify:track:3IjUrdmAjmjiSY7LUbYXVd","Dj Victor, MC Tuto, MC LUUKY, Mc Kadu","Mó Fita","Nova Era Produtora",198,198,2,"1117431"
