rank,uri,artist_names,track_name,source,peak_rank,previous_rank,weeks_on_chart,streams,duration_ms
1,spotify:track:6s1kzj4EbhFLXbuAGJbhbn,"MC Tuto, DJ Glenner",Barbie,Sonar Music,1,1,9,9482656,192755
2,spotify:track:6RzcNTnS02dnqoQMdTkQwi,"Brenno & Matheus, DJ Ari SL",Descer Pra BC,New Music,2,3,4,8302323,166451
3,spotify:track:4pOGEJRVOuaa9oyy7qTGf6,"Nilo, Mc Paiva ZS, DJ Di Marques, Tropa da W&S, FamousKyo",Fui Mlk,WMD,3,7,4,7940171,174110
4,spotify:track:0NQyryTVbjGMtWMA1eSqIn,"J. Eskine, Alef Donk",Resenha do Arrocha,Latin Brega by HITLAB Records,4,44,2,7893787,354857
5,spotify:track:5TOvA5Uhxti7FPh0EIdClV,"MC LUUKY, DJ JB Mix",Malvadinho,EDITORA E GRAVADORA A BASE RECORDS,1,2,7,7880442,120115
6,spotify:track:4jUZymsR3lkia9wkP0o9cX,"DJ TOPO, Mc Livinho",MTG NA IMAGINAÇÃO - TOPO SESSIONS VOL. 1,DJ TOPO,6,6,11,7324254,144923
7,spotify:track:4y93vvzu2h8MITw7YyUTcI,Henrique & Juliano,Última Saudade (Ao Vivo),"Vida Nova Produções, sob licença exclusiva para Virgin Music Group",1,4,12,7027349,150449
8,spotify:track:6Kyl2nFgU0J8WBlbBvDv6g,Grupo Menos É Mais,Coração Partido (Corazón Partío) - Ao Vivo,Som Livre,1,5,16,6958611,195794
9,spotify:track:3cwVKjzKSTfvacYJF6Tkub,Léo Foguete,Última Noite - Solo,Acertei Produções,5,8,10,6453381,154553
10,spotify:track:4FbYt9D0katV4nXZaC01Yt,"Mc Negão Original, DJ Guh Mix, Mc Robert",Medley de Igaratá 3,Cria Hit BR,10,14,6,5965770,265750
11,spotify:track:2gfn28JSINCJGLrUimmu0l,Jorge & Mateus,Cantada Boba - Ao Vivo,Som Livre,11,13,6,5653960,183249
12,spotify:track:3TnSAp3TfGMYptOqv234uK,"MC Tuto, Grelo",Do Job,Sonar Music,12,18,5,5640785,193432
13,spotify:track:6ukVCqH77f6cwRHyJBhGgy,Israel & Rodolffo,Arruma Um Bão,Som Livre,13,17,11,5253836,175078
14,spotify:track:3H7eBmcTJyuEMStfmKuLmG,"MC Cebezinho, DJ Oreia, MC Tuto, Love Funk, Kako",A Danada Me Ligando,Love Funk,1,10,16,5139988,283636
15,spotify:track:44BehH5rk8B5K4OtRxqpez,"MC Tuto, Oldilla",E Aí Como Que Tá ?,Sonar Music,10,11,12,4962493,134000
16,spotify:track:63BroH3HiwxYD8T5qTZiJn,Gusttavo Lima,A Noite (La Notte) - Ao Vivo,Sony Music Entertainment,3,40,19,4766217,201557
17,spotify:track:5rHhO6SBSzo3E9m3KHyCtt,"Murilo Huff, Ana Castela",Peça Íntima,M Show,8,16,10,4716130,169634
18,spotify:track:7HrDxxY2b7vOKxJHtqdXN6,"Henry Freitas, Mc Th",Imã de Problema,Sony Music Entertainment,9,12,11,4676824,137293
19,spotify:track:2drZGdAOxfE2KoMGTkidmq,"MC Marks, MC Ryan SP, MC Jvila, MC Bruno MS, Mc Magal, Aaron Modesto, DJ Dael, MC LUUKY",365 Dias (Vida Mansa),Legenda Records,9,15,12,4491465,527220
20,spotify:track:5DxPUI3cMU7EkayHlYLJCI,Maiara & Maraisa,Vai Lá - Ao Vivo em Goiânia,Work Show,4,9,12,4381484,140438
21,spotify:track:4dGx53NJZJyuuLP5ownH1p,"Wesley Safadão, Natanzinho Lima",Mentira Estampada,Wesley Safadao,21,31,13,4377420,173206
22,spotify:track:280QfKhmWGn3LbyB39aA7u,Léo Foguete,Cópia Proibida,Acertei Produções,20,20,7,4367195,159480
23,spotify:track:4IlklRFZUgNQlwwW0PSLm7,"Grelo, Henrique & Juliano",Paredões,Henrique & Juliano,23,32,3,4276179,175621
24,spotify:track:6Ap9SM1WkmI4b4Mo2Cpa6f,"NATTAN, Léo Foguete",Última Noite,Nattan,24,49,9,4275363,157557
25,spotify:track:2KdyhL41F9solmRiyLQ3yl,Clayton & Romário,Sei Tocar Violão - Ao Vivo,WM Brazil,19,19,11,4177576,164596
26,spotify:track:2plbrEY59IikOBgBGLjaoe,"Lady Gaga, Bruno Mars",Die With A Smile,Interscope,5,22,18,4153186,251667
27,spotify:track:1AM8pZn5uY89vkItAH5bm3,"Felipe Araújo, Luan Pereira",Body Splash - Ao Vivo,Universal Music Ltda.,26,26,6,4075943,154727
28,spotify:track:6YdJ2jJOo143KhXT9qvQVe,"MC GP, MC Jvila, MC LUUKY, Dj Yuri Pedrada",300 no 7,MC GP & GR6,11,21,23,4035006,195572
29,spotify:track:3sv5Da5mGwNvLDc6h3sVzq,"MC Cebezinho, DJ Oreia, Menor Richard, MC GP, Mc Don Juan, Love Funk",A Bebê Quer Oque,Love Funk,24,24,5,3939748,248000
30,spotify:track:77X5UMAX4FjUx1aOaLqotz,Luan Santana,PARECE - Ao Vivo,Sony Music Entertainment,14,30,4,3829678,144461
31,spotify:track:2k7EhDUKXApmeYVew9xeDf,"Eric Land, Natanzinho Lima",Pilantra e Meio,Eric Land,23,23,6,3671611,188823
32,spotify:track:7l9Tq5phzkLnhWUyfp702G,"Kaique e Felipe, Luan Pereira",Saveiro,Sony Music Entertainment,1,29,21,3531374,144665
33,spotify:track:65vJAh07BdwurqR9SRa6f8,"Ferrugem, Sorriso Maroto",Apaguei Pra Todos - Ao Vivo,WM Brazil,26,33,35,3499220,198678
34,spotify:track:4TnEIYOXZ9KBGHOIqG5Xs5,"PEDRO SAMPAIO, Marina Sena",ESCADA DO PRÉDIO,WM Brazil,8,25,11,3410621,137272
35,spotify:track:2cGRf9skACWnKRK1eLYBJn,Guilherme & Benuto,Sujeito Homem - Ao Vivo,Sony Music Entertainment,35,38,9,3381264,178983
36,spotify:track:4Do0PK6qXYO28ifX9Y1Cle,Kaique e Felipe,Solteiro Iniciante,Sony Music Entertainment,36,41,3,3381149,154947
37,spotify:track:6UzGpz33nYXa3gAEJ1mndV,"Hugo & Guilherme, Maiara & Maraisa",O Meu Coração Em Suas Mãos (Colgando en tu manos) - Ao Vivo,Som Livre,10,36,20,3324316,204343
38,spotify:track:1noFyrFs89ASUPka2azbD9,"Mc IG, MC Ryan SP, Mc Luki, MC PH, Mc Don Juan, Mc Poze do Rodo, MC Marks, MC GP, MC Tuto, TrapLaudo, MC LUUKY, Mc Kadu, Ja Rule",Let's Go 5,GR6 Music,17,35,4,3324044,783117
39,spotify:track:2wXqRqVGiGB2fyy9eoPJbP,"Mc Lele JP, MC Marks, MC Leozinho ZS, MC Joãozinho VT",Eu sou Cantor Não Sou Bandido,A Luz Records,19,28,12,3295723,266666
40,spotify:track:7pkpWcko6KEZANj0xKsCsu,Matheus & Kauan,Cronômetro - Ao Vivo,Universal Music Ltda (S&D),15,42,24,3275110,165301
41,spotify:track:2xTM0m9HD3gIqNSutA0LNJ,"Jorge & Mateus, Henrique & Juliano",Xonei,Som Livre,3,37,18,3247651,154555
42,spotify:track:7BLjPZwgbxQSLZ4rWbboJY,"MC Joãozinho VT, MC Tuto, Deejhay RB",Vida de Artista,Sonar Music,12,27,12,3228686,196000
43,spotify:track:1RkyWVwtYMAChNGZYluilS,Felipe e Rodrigo,Banquinho (Ao Vivo),MK Records,43,43,3,3201086,158465
44,spotify:track:5Bp7TFENcgsdLCL8fMOSKs,"Supernova Ent, G.A, Ghard, Veigh, Niink","Adora a bunda, odeia o rosto (feat. Veigh & Niink)",Supernova Entertainment,44,-1,1,3067648,173859
45,spotify:track:5CtXR89REICvEZljUEK8r1,"DJ L30, MC Thaizinha",Do Jeito Que Você Mete,Conquista Records Agenciamento Artístico,10,51,13,2978942,120950
46,spotify:track:0prrifDVNELg91qIr1K4p2,"CountryBeat, Mc Daniel",Pampa,AgroPlay,22,54,10,2957082,119754
47,spotify:track:2MHQdlPaIcD49dJXHd6MYI,"MC Marks, GringoBeats808",Hoje o Dia Tá Bonito,WM Brazil,39,46,9,2948721,109571
48,spotify:track:4wJ5Qq0jBN4ajy7ouZIV1c,"ROSÉ, Bruno Mars",APT.,Atlantic Records,8,39,9,2870115,169917
49,spotify:track:7IFsTX5H1sWcEl8joV0IdD,"THE BOX, Mc Brinquedo, MC Cebezinho, MC Tuto, Mc Laranjinha, DJ Oreia",THE BOX MEDLEY FUNK 2,Sony Music Entertainment,1,52,34,2742970,266666
50,spotify:track:4VNRWHoiKHZJIoQHPbmJIv,Felipe e Rodrigo,Gosta De Rua (Ao Vivo),MK Records,1,55,37,2736057,171335
51,spotify:track:7Elw15XWLpOi4qzHyAwa9e,Gloria Groove,Nosso Primeiro Beijo - Ao Vivo,SB Music,18,50,29,2722269,168805
52,spotify:track:58UG7KIB6t6pZA4VMHBytT,"Henry Freitas, Arthurzim, Kadu Martins, Dodô Pressão",Toque De Romance - Remix Forró (feat. Dodô Pressão),Sony Music Entertainment,52,90,7,2658122,217568
53,spotify:track:6RjSXi9cPGroetXeNsWFGL,"DJ TOPO, Seu Jorge, Mc Leozin, MC G15",MTG QUEM NÃO QUER SOU EU,DJ TOPO,1,58,32,2652711,123692
54,spotify:track:0hWzBcYtmwsL1TwByzjiUG,"MC Joãozinho VT, Mc Negão Original, MC Tuto, Matheuszin DJ, Kako, MC Ryan SP",Boy Besta,Sonar Music,47,47,5,2584084,424615
55,spotify:track:0GbvYZsvz7bWyijBDESebX,Simone Mendes,Mulher Foda - Ao Vivo,Universal Music Ltda.,10,65,23,2553144,162190
56,spotify:track:6wLTQ0PQAsFaTf4SfBDyYc,"Matheus Fernandes, Matheus & Kauan",Triplex - Ao Vivo,Som Livre,4,53,28,2547175,178170
57,spotify:track:4f0aDk7HX37SfzerfznYlr,"Grupo Menos É Mais, Matheus Fernandes",Lapada Dela - Ao Vivo,Som Livre,4,60,95,2485819,159322
58,spotify:track:5k7JSycp97vL45zSOoUsTE,Henrique & Juliano,Seja Ex (Ao Vivo),"Vida Nova Produções, sob licença exclusiva para Virgin Music Group",20,45,12,2481742,192034
59,spotify:track:5asabafNzfAzjUecDvuNES,Henrique & Juliano,Aquela Pessoa (Ao Vivo),"Vida Nova Produções, sob licença exclusiva para Virgin Music Group",34,63,151,2472721,166838
60,spotify:track:3yCtRV7LMeGBpvSHDR8uMV,"Boladin 211, MC Rick, MC Leozinho ZS, CAO$, Dj Lv Mdp, Dj Vitin do Pc",Chapa Máxima,WM Brazil,60,95,2,2467185,151384
61,spotify:track:4DhDNNhIDdduS6nZMbSMbs,"Mc Rodrigo do CN, DJ JOAO DA INESTAN",Amantes da Foda,Mc Rodrigo Do CN,52,59,8,2452395,81230
62,spotify:track:5aMgTcyBPH90hWHhbNKTwR,Diego & Victor Hugo,Entregador de Flor - Ao Vivo em Brasília,Sony Music Entertainment,22,34,14,2433020,190276
63,spotify:track:5G0kKNRYFCoORvJ2VzwvrY,"Mc Livinho, DJ TOPO",MTG PASSA PASSA PRA EU SARRAR,Mc Livinho,29,72,27,2428893,141230
64,spotify:track:3EcLx5fFRgDIVAzfYwopuR,Matheus & Kauan,Me Ama Mesmo - Ao Vivo,Universal Music Ltda (S&D),57,57,5,2389667,181756
65,spotify:track:4MF0VMffyxHsy3GZwwUnAs,Matuê,A Morte do Autotune,30PRAUM,52,84,37,2378407,216710
66,spotify:track:610qP5fEpQMv7gzyLipesZ,"João Gomes, Pabllo Vittar",Vira Lata,JG Shows,66,97,2,2240510,130978
67,spotify:track:3eHeTsX6W9iIEfn8l2xrWO,Henrique & Juliano,Meu Amor (Ao Vivo),"Vida Nova Produções, sob licença exclusiva para Virgin Music Group",65,68,95,2237642,174134
68,spotify:track:6Tp4LCJ5r5IJaEf8lnlPfG,Henrique & Juliano,De Trás Pra Frente (Ao Vivo),"Vida Nova Produções, sob licença exclusiva para Virgin Music Group",17,66,114,2237390,163089
69,spotify:track:4ssHL7bSnOAE7HjiuLx6Co,Matuê,Crack com Mussilon,30PRAUM,1,56,15,2160374,154418
70,spotify:track:6KzzyjHmeQwWlr0NvAIAjz,Luan Pereira,DE ANTES PRA HOJE,Som Livre,62,62,4,2155739,204989
71,spotify:track:6mTpK40yIRk1xGGNvRMHGg,"Murilo Huff, Gustavo Mioto",Me Caiu Tão Bem - Ao Vivo,M Show,7,48,28,2136905,156146
72,spotify:track:6SfcAUMXsi6eW6vZki5tC5,"Felipe Amorim, MC Bruna Alves",Novinha do TKT,One Play,36,74,15,2123006,172727
73,spotify:track:5mPn4ueXc1oua018FDvknz,"MC Joãozinho VT, DJ JR No Beat",Calculista,Sonar Music,48,71,8,2104446,186165
74,spotify:track:6m51sam9gIqRMbJEKW4ADe,Grelo,De Graça ou Pagando,Henrique & Juliano,7,92,20,2088237,196702
75,spotify:track:6dOtVTDdiauQNBQEDOtlAB,Billie Eilish,BIRDS OF A FEATHER,Darkroom/Interscope Records,33,75,31,2079723,210373
76,spotify:track:1lflD04lIdgV10sCMwFYOu,"Mc Leozin, MC Rick, Boladin 211, Deliverymusic, Dj L Martins",Sorriso no Rosto,Delivery Music LTDA,12,70,21,2075182,155132
77,spotify:track:42JNab8NPeCADJ9D3Cl5wS,Zé Neto & Cristiano,Barulho Do Foguete - Ao Vivo,Som Livre,4,87,77,2072685,133546
78,spotify:track:5pd6ezOiCGn5wALw8HLMFW,Gusttavo Lima,Embaixador (Mãe),Sony Music Entertainment,78,79,3,2066320,187115
79,spotify:track:3FB06ULqN0WNUSQ3UaMZnF,blicko,Amor Na Praia,blicko,7,86,33,2022710,156150
80,spotify:track:4seW5sDVICaZw34NzrHPm0,"Nuzio Medeiros, Henry Freitas, Kadu Martins",Tando,Nuzio Medeiros,80,-1,1,2008129,212000
81,spotify:track:02I0Nm97YdmZ8teGFcIHEy,"MC Joãozinho VT, MC Tuto, MC Vine7, MC Ryan SP, Mc Duzinho SP, MC LUUKY, Caio Passos",Tropa do Sem K.O,Sonar Music,13,61,14,1958590,376000
82,spotify:track:6hK5NtpLhz9SZyGHzb50k4,"Guilherme & Santiago, Mari Fernandez",Tu Não Ama - Ao Vivo,Deolli Music,61,82,6,1944560,145211
83,spotify:track:6ehmOxh9Qq9BlLnvz4RYcV,"DJ LKS 067, Mc Menor Do Alvorada, Mc Luizinho, FreesTyle Sounds",Igual PC Da China,FreesTyle Sounds,83,88,3,1941245,109014
84,spotify:track:5gA82C4xfyvmRtpD1QdsDz,"MC LUUKY, Oldilla",Nem Ligo Pro Amor,EDITORA E GRAVADORA A BASE RECORDS,15,67,15,1937595,164307
85,spotify:track:0TiiRJdORJXd7PGLpFVdMN,Léo Foguete,Inconfiável,Acertei Produções,83,96,8,1925613,147553
86,spotify:track:2M2eRVCQbC3rHFSm9oT3YD,"Luan Pereira, Léo Foguete",UM PALMO - Ao Vivo,Som Livre,86,-1,1,1913997,138008
87,spotify:track:0zxWyvrKyz031tFfBnkYLr,Henrique & Juliano,Como É Que A Gente Fica (Ao Vivo),"Vida Nova Produções, sob licença exclusiva para Virgin Music Group",23,100,109,1887286,163913
88,spotify:track:2655xYZ347fG2N6OjkoMQ8,Jorge & Mateus,Logo Eu,Som Livre,88,148,22,1868301,155720
89,spotify:track:7tI8dRuH2Yc6RuoTjxo4dU,Jimin,Who,BIGHIT MUSIC,7,80,22,1852205,170887
90,spotify:track:37QloSdzrjx2xCH0m65800,"Gustavo Mioto, Grupo Menos É Mais",Nada Com Nada - Ao Vivo,Universal Music Ltda.,90,117,2,1852056,161866
91,spotify:track:1i2kguziI3ZbUZnZMKNhQ2,"Mc IG, DJ Jorgin",400K,GR6 Music,45,64,54,1836541,163500
92,spotify:track:3Na9gwLmFdEJH2l54AYwpk,"Lauana Prado, Zé Neto & Cristiano",Sombra Desconhecida - Ao Vivo,Universal Music Ltda.,23,77,26,1818414,160885
93,spotify:track:5g7sDjBhZ4I3gcFIpkrLuI,Bruno Mars,Locked out of Heaven,Atlantic Records,45,103,49,1815239,233653
94,spotify:track:4bDvY5oGtCWTYH5Vi36bc5,Henrique & Juliano,Mais Amor E Menos Drama (Ao Vivo),"Vida Nova Produções, sob licença exclusiva para Virgin Music Group",94,114,102,1804103,172179
95,spotify:track:4t4V2ptzeV94uXjUS1X18F,"Mc Jacaré, Hungria",Pinxadão,Croco Hits,29,81,17,1799251,138466
96,spotify:track:4UADn7KrfGSr4KjqMrvGzd,"MC Tuto, NATTAN, DG e Batidão Stronda, DJ Glenner",Gata - Barbie,Sonar Music,96,123,4,1763476,185454
97,spotify:track:1iYCb2ogLunulBHn3g3cPX,"MC Joãozinho VT, DJ BOY",Bebeto e Romário,Sonar Music,54,85,9,1761117,141818
98,spotify:track:2ThEetsRrVOEoCNpoFVDjM,Felipe e Rodrigo,Melhor Me Bloquear (Ao Vivo),MK Records,98,116,3,1752721,191623
99,spotify:track:2BfDOZLtOL79e6L6QphWlS,"MC LUUKY, Felipe Amorim, DG e Batidão Stronda",Vou Passar Gelinho,EDITORA E GRAVADORA A BASE RECORDS,99,121,15,1752152,142500
100,spotify:track:6FllOXq1UDCFDt1V4YvN3K,"Mc Daniel, DJ WN, Dj GM",Vamo de Pagodin,Lyons Produções,16,102,31,1741498,160864
101,spotify:track:0bPP5cDG1ZnbAVCEa3ZbQ1,Grelo,Só Fé,Henrique & Juliano,1,105,20,1726593,203337
102,spotify:track:6cFW2FPaUL4YRJfS9zFJaV,Simone Mendes,Dois Tristes - Ao Vivo,UME - Global Clearing House,4,158,40,1725843,189440
103,spotify:track:37bToUvlC32varJ3IT4XUE,"Guilherme & Benuto, NATTAN",Fechando o Circo - Ao Vivo,Sony Music Entertainment,103,-1,1,1724616,134159
104,spotify:track:4k5TLsSwr3I4KJma9XEjnn,Henrique Casttro,Besta Fui Eu - Ao Vivo,Sony Music Entertainment,104,134,2,1717063,171409
105,spotify:track:0S7o4sti5I5CAbbotTUzTM,"Traia Véia, Luan Pereira",Wi-Fi - Ao Vivo,Show Mix.,2,83,22,1710511,161312
106,spotify:track:708yXS1fLm1gAXFyIQxtX2,Henrique & Juliano,Romântico (Ao Vivo),"Vida Nova Produções, sob licença exclusiva para Virgin Music Group",106,169,7,1707388,183758
107,spotify:track:2t878JZCl8Ftd2mVzzakYc,"Jorge & Mateus, Lauana Prado",Haverá Sinais - Ao Vivo,Som Livre,2,126,43,1686315,191365
108,spotify:track:0W8KDmNxXeKo6baZTpQIeX,Murilo Huff,Se Eu Não Te Amasse Tanto Assim / Agora / Me Apaixonei Pela Pessoa Errada - Ao Vivo,M Show,93,93,2,1685652,310934
109,spotify:track:7Cf2Hsy3cPlA4e115tElXv,Henrique & Juliano,Liberdade Provisória (Live - Ibirapuera / 2019),"Vida Nova Produções, sob licença exclusiva para Virgin Music Group",1,130,143,1683980,186379
110,spotify:track:3iam4WkRoqMoBBCwDFZNgd,Henrique & Juliano,Quase Algo (Ao Vivo Em Nova Iorque) (2022),"Vida Nova Produções, sob licença exclusiva para Virgin Music Group",17,111,66,1675764,178251
111,spotify:track:1uGVaYQNjMPmVO0gAtzHnZ,"MC Luiggi, Mc Kitinho, DJ Lukas Matheus",Folga No Trampo,GR6 Music,111,131,7,1665597,143769
112,spotify:track:1pjpPXl66t4FeQaFscpG73,Henrique & Juliano,Cidade Vizinha (Ao Vivo),"Vida Nova Produções, sob licença exclusiva para Virgin Music Group",6,119,91,1652078,178903
113,spotify:track:6BPcUXYERAahpunmb0AovH,"Arcane, Stromae, Pomme",Ma Meilleure Ennemie (from the series Arcane League of Legends),Riot Games,36,78,4,1649761,147973
114,spotify:track:5K71WiSDgJv48q07H7NklJ,Léo Foguete,Cabelo de Sol,Acertei Produções,114,129,5,1636248,176556
115,spotify:track:1kjRfTPXU0rkHXhYR7usye,"Brenno & Matheus, New Music Play","Ai Cowboy - BeM Interior, Ao Vivo",New Music,77,106,5,1634706,144368
116,spotify:track:4ksSf8cL3VlUvQSkFcRHy3,Henrique & Juliano,Até Você Voltar - Ao Vivo,Som Livre,107,124,42,1631602,204080
117,spotify:track:64CovjRwInpOJW4PiGMprY,"MC Kevin o Chris, Dj Nk Da Serra, Mc Magrinho",Faz um Vuk Vuk (Teto Espelhado),MC Kevin o Chris,1,99,50,1617136,138461
118,spotify:track:2jpbtp5N679x92uB8s8p9h,"Suel, Grupo Menos É Mais",Vitamina C - Ao Vivo,Virgin Music Label And Artist Services (S&D),102,138,10,1609239,154170
119,spotify:track:5RHOhXxMVhpEaBcG6hIydA,"KayBlack, Wall Hein, AMUSIK",Maturidade,Elenko Music,39,76,54,1607707,142026
120,spotify:track:2fjqfFUq64thFsqfKN01kS,"Matuê, Veigh",Imagina esse Cenário,30PRAUM,4,94,15,1602010,155368
121,spotify:track:1STXKGtCJeeP791CzEAqf5,Mc Jacaré,Pelo Menos,Croco Hits,75,133,9,1593820,128894
122,spotify:track:1EDPVGbyPKJPeGqATwXZvN,Linkin Park,The Emptiness Machine,Warner Records,12,104,15,1584622,190427
123,spotify:track:6gjsnEQxLqVkieeloQTozN,"Lou Garcia, Dj Luan Gomes",Não Fosse Tão Tarde - MTG Remix,Universal Music Ltda.,11,107,25,1574919,117230
124,spotify:track:3xkHsmpQCBMytMJNiDf3Ii,Benson Boone,Beautiful Things,"Night Street Records, Inc./Warner Records Inc.",40,139,45,1573212,180304
125,spotify:track:6vq7r1Pqd3pyI07u63cPZV,Simone Mendes,Erro Gostoso - Ao Vivo,Universal Music Ltda.,3,199,99,1557703,178811
126,spotify:track:5DrDpWyvharQkhsloNTN9W,"Mc J Mito, DJ Borest",Clack Bum,Som Livre,32,112,22,1554206,141230
127,spotify:track:0KKkJNfGyhkQ5aFogxQAPU,Bruno Mars,That's What I Like,Atlantic Records,21,113,72,1551973,206693
128,spotify:track:2o2xhyri4aJUtgMGkf5P0J,"ANAVITÓRIA, Lenine",Lisboa,F/SIMAS,83,110,9,1551331,219302
129,spotify:track:5WD8Ctp0FgPSO3HCcKwxuT,"Yasmin Santos, Simone Mendes",Nem a Pau (feat. Simone Mendes) - Ao Vivo,Sony Music Entertainment,16,155,20,1550551,161920
130,spotify:track:0Syse8EMb8r8Woia0nsSNX,Traia Véia,Zoião de Mel - Ao Vivo,Show Mix.,89,89,4,1543342,137253
131,spotify:track:2sYFUcurlISdHlAsnYCEgD,Lauana Prado,Me Leva Pra Casa / Escrito Nas Estrelas / Saudade - Ao Vivo,Universal Music Ltda.,1,91,46,1540447,265450
132,spotify:track:10ccyY1qyhpOfjhMUWxbgk,Maiara & Maraisa,Exposição - Ao Vivo em Goiânia,Work Show,62,73,5,1539829,160311
133,spotify:track:2BlFIe0712LBUtTHxbqjme,"NATTAN, Felipe Amorim",Love Gostosinho - Ao Vivo,Vybbe,12,115,85,1535406,163833
134,spotify:track:11Y1IGMIThaxu4ijcXRNYs,Pixote,Nem de Graça,GR Shows,116,153,42,1527861,172202
135,spotify:track:6moJPcxZE7uiho8XKcEEyO,Bruno & Marrone,Nana - Ao Vivo,Worldshow Promoções e Eventos,135,185,2,1527579,181683
136,spotify:track:3IjUrdmAjmjiSY7LUbYXVd,"Dj Victor, MC Tuto, MC LUUKY, Mc Kadu",Mó Fita,Nova Era Produtora,63,109,26,1524072,256000
137,spotify:track:5QbtKOsjbEGkx0GMiQGBZt,"fhop music, Hamilton Rabelo",Tu és + Águas Purificadoras - Ao Vivo,FHOP Music,65,125,40,1495731,476736
138,spotify:track:6Hp39ODlBU7yusKfv3s0zP,Kleyton Souza,É Que Eu Sofri Demais,Best Music,34,178,6,1490428,190380
139,spotify:track:7ldcYtMOjtX1eFVEYzj2kJ,"Luísa Sonza, KayBlack",Sagrado Profano,Sony Music Entertainment,2,159,30,1489069,196601
140,spotify:track:2THXb1FE0uarBdzp42JL0Y,Gusttavo Lima,Morar Nesse Motel,Sony Music Entertainment,3,172,25,1488853,187037
141,spotify:track:53PpijFATt35Zxfl6LTxoK,Marília Mendonça,Leão,Som Livre,1,152,106,1485991,166774
142,spotify:track:4yEKHiUQA70cjfWnEL2m13,"Drops INA, Paulo Vicente",É Ele,Onimusic,102,122,10,1480324,495857
143,spotify:track:5f3QIak9nuAgDaF6ElHjmD,"Luan Pereira, Matheus & Kauan",SOGRA - Ao Vivo,Som Livre,143,-1,1,1476941,167734
144,spotify:track:2HRqTpkrJO5ggZyyK6NPWz,Sabrina Carpenter,Espresso,Island Records,49,118,36,1472226,175459
145,spotify:track:1sIg2HURWNfucJ8PPUCSJ4,"MC Cebezinho, DJ Oreia, MC Ryan SP, Menor Richard, Love Funk, MC Meno K, MC LUUKY",Olha pra Minha Cara Não,Love Funk,145,-1,1,1459809,344006
146,spotify:track:1JSTJqkT5qHq8MDJnJbRE1,The Police,Every Breath You Take,Polydor Records,140,150,27,1459610,253920
147,spotify:track:5k21RXqN11N0TIeLLySlDv,Isadora Pompeo,Ovelhinha (Ao Vivo),Sony Music Entertainment,115,132,26,1458171,276453
148,spotify:track:2InS5VWKJQbsFBKOsf1cJB,"Dj GBR, Mc IG, MC Ryan SP, MC PH, Mc Davi, Mc Luki, Mc Don Juan, Mc Kadu, TrapLaudo, MC GP, MC GH do 7",Let's Go 4,GR6 Music,1,127,67,1457211,641941
149,spotify:track:7BqBn9nzAq8spo5e7cZ0dJ,Bruno Mars,Just the Way You Are,Elektra (NEK),77,167,22,1455021,220734
150,spotify:track:2DlJmT7KLNuRWI2NXG5SZy,"Diego & Arnaldo, Lauana Prado",Desconhecido - Ao Vivo,Som Livre,104,145,10,1451811,172057
151,spotify:track:3xs03uDJOKoo9iaY6eZi3m,Vitor Limma,Amor de Fim de Noite / Por Favor / Nem Aí - Ao Vivo,3 Desejos Produções Artísticas,50,160,14,1443769,311316
152,spotify:track:52nb1PnO46yKrEfuotz5MV,"DJ Ws da Igrejinha, Mac Júlia, MC Xenon",Eu Te Amo Meu Amor / Faixa Rosa,Dalama Records,109,128,4,1441084,114045
153,spotify:track:1WHDOr19zyyqu6XXIvdgfX,"Hugo & Guilherme, Maiara & Maraisa",Morena De Goiânia - Ao Vivo,Som Livre,11,151,39,1438675,166804
154,spotify:track:1DLKuppSYytOuxhtI6KBGu,Tribalistas,Aliança,Phonomotor,74,136,15,1435417,237421
155,spotify:track:3XqhtjiycwDxCpGqUFTtlW,"Grupo Menos É Mais, Xand Avião",Matadinha De Saudade - Ao Vivo,Som Livre,111,147,14,1431738,176247
156,spotify:track:5ixUZmYrkYzEKDQIB8BjiE,"MC Tuto, DJ JR No Beat",Menina,Sonar Music,146,174,7,1429596,140160
157,spotify:track:6IFMz6Buh3dKoUjULWE26n,Mari Fernandez,Página De Ex - Ao Vivo,Som Livre,22,140,33,1423680,161610
158,spotify:track:7McCAKExE8KsI2q4Y8wx4U,"Murilo Huff, Marília Mendonça",Dois Enganados,M Show,49,161,125,1417567,172751
159,spotify:track:6QsHhB0W9GtLF3cI7mUVkQ,Matuê,1993,30PRAUM,7,101,15,1416258,127826
160,spotify:track:60a0Rd6pjrkxjPbaKzXjfq,Linkin Park,In the End,Warner Records,48,143,29,1411588,216880
161,spotify:track:6mIAta8vOaOhCM4yh8P2FJ,"George Henrique & Rodrigo, Henrique & Juliano",Seu Oposto,World Show Produções,73,192,35,1409489,150693
162,spotify:track:4fgnNikmEUvXze89h3X47m,NATTAN,Morena,Nattan,31,175,37,1403861,179234
163,spotify:track:17phhZDn6oGtzMe56NuWvj,Teddy Swims,Lose Control,Warner Records,82,157,44,1393203,210688
164,spotify:track:0dcHD9QhnWRA41zoLnC83X,"MC Cabelinho, Dallass",X1,MC Cabelinho,30,181,88,1393053,188852
165,spotify:track:0rosNwHC9T8YNu3EvXLPfX,Ferrugem,Me Bloqueia (Ao Vivo),WM Brazil,84,162,18,1383375,197027
166,spotify:track:7bukHRNgGLRySTJEVvLoIR,Henrique & Juliano,Briga Feia (Ao Vivo),"Vida Nova Produções, sob licença exclusiva para Virgin Music Group",22,-1,114,1382959,194580
167,spotify:track:7dKqPh21HpsysZvRWyNeM1,Isadora Pompeo,Bênçãos Que Não Têm Fim (Counting My Blessings),Sony Music Entertainment,10,135,58,1380395,209520
168,spotify:track:3IsTYAUWhdQgqEV35GlJYB,Ferrugem,Eu não sou de me entregar,WM Brazil,110,189,17,1375023,187053
169,spotify:track:3l5VjEAeUTqrlD50iEo8Yn,"KayBlack, CVSTRO, Wall Hein, AMUSIK",Licor 43,Elenko Music,29,170,118,1370749,142470
170,spotify:track:00hbGsdy4tMD2R0Y5n5E0C,Flozimbar,Hysteria,Robin,26,194,29,1360218,153466
171,spotify:track:5na9M4vuGBFxIAQdD3Hg9s,"Filipe Ret, Mãolee",Da Onde Eu Venho,Som Livre,129,149,5,1353748,137142
172,spotify:track:5XeFesFbtLpXzIVDNQP22n,Arctic Monkeys,I Wanna Be Yours,Domino Recording Co,78,154,119,1353035,183956
173,spotify:track:08adMS3hYWRQlYmUwGI5rB,"Filipe Ret, Mãolee, Maru2D",Acima De Mim Só Deus,Som Livre,99,146,5,1347899,150000
174,spotify:track:0cQVqPuHQP4KEwc7ZUQmj6,The Neighbourhood,Sweater Weather,Columbia,79,173,105,1344232,240426
175,spotify:track:3Sd5jsryYBah9GPAdVfsrA,Anderson & Vei da Pisadinha,Tu Xera,Anderson & Vei Da Pisadinha Digital Music,175,-1,1,1339178,163850
176,spotify:track:7f1tZNtc1t456ybBsl5sfK,"Murilo Huff, Hugo & Guilherme",Pula Fora - Ao Vivo,M Show,22,141,17,1336504,149323
177,spotify:track:5q0NlM6Pm8Pp3orq7zGiRn,"Matheus & Kauan, Jorge & Mateus",Quarta Cadeira - Ao Vivo,Universal Music Ltda.,10,171,80,1333795,224001
178,spotify:track:4VZNgofGpFZ8FrQM3VYosB,Zé Neto & Cristiano,Deu Moral - Ao Vivo,Som Livre,5,182,31,1331844,122169
179,spotify:track:6fau9Y2BEphKN2dRzTd2BT,"Turma do Pagode, Ferrugem, Mumuzinho",Duvido - Ao Vivo,Sony Music Entertainment,80,177,8,1324761,163300
180,spotify:track:0KDxhAvKeiVFL1bZccQVJs,Zé Neto & Cristiano,Pulando o Muro - Ao Vivo,Som Livre,169,-1,7,1321326,152279
181,spotify:track:4xyEa31HbbFrTfcI6OO4jv,"Zé Neto & Cristiano, Grupo Menos É Mais",Amizade Com Ex - Ao Vivo,Som Livre,181,-1,1,1319714,174627
182,spotify:track:5EEsPmKPqHkpVogSfWCUoc,Rogerinho,Tbt,Agito Produções,179,179,2,1313876,126854
183,spotify:track:2077eHXxwRgxDhEBtJV0wD,Jorge & Mateus,Amo Noite E Dia - Live In Sao Paulo / 2010,Universal Music Ltda.,183,-1,1,1307731,183480
184,spotify:track:2u1Rp2Ge0AaJGZTPLIQBUT,Luan Santana,CLONE - Ao Vivo,Sony Music Entertainment,5,156,17,1293959,164401
185,spotify:track:0d6x5YscwaTvZ11cwMt7e5,Turma do Pagode,Hoje é Dia - Ao Vivo,Sony Music Entertainment,185,-1,1,1293784,182924
186,spotify:track:7CyPwkp0oE8Ro9Dd5CUDjW,"The Weeknd, JENNIE, Lily-Rose Depp","One Of The Girls (with JENNIE, Lily Rose Depp)",XO / Republic Records,61,166,54,1291576,244684
187,spotify:track:6ispUK6ZFslsmc8Z3Uimaa,"Wesley Safadão, Heitor Costa",Reinventar,Wesley Safadao,187,187,5,1289050,175760
188,spotify:track:5HFvMPiNjclAq8DbEAPWMw,Gilsons,Várias Queixas,Xirê,143,183,62,1288256,170109
189,spotify:track:3aDV90V6vHUSYKKYDLNdQ8,"Israel & Rodolffo, Jorge & Mateus",Marca Evidente - Ao Vivo,DAMASCENO MUSIC,159,-1,3,1287786,190432
190,spotify:track:3QaPy1KgI7nu9FJEQUgn6h,Billie Eilish,WILDFLOWER,Darkroom/Interscope Records,66,168,22,1284576,261466
191,spotify:track:2GfxgssRHvY1azHtaRqKoK,Jorge & Mateus,Paredes - Ao Vivo,Som Livre,16,-1,69,1284014,184032
192,spotify:track:5r9CZJMoMmxio2AnJdxuDS,"Grupo Menos É Mais, Di Propósito, Vou Zuar",Pot-Pourri: Melhor Eu Ir / Ligando Os Fatos / Sonho de Amor / Deixa Eu Te Querer - Ao Vivo,Som Livre,21,196,197,1283910,521088
193,spotify:track:2pWxJlc5mZI69h4iu1rbRA,"Lauana Prado, Cristinas",Fetiche - Ao Vivo,Universal Music Ltda.,124,-1,5,1279016,141293
194,spotify:track:006pMMCuRo2TFjh8sNGSov,Charlie Brown Jr.,"Dias De Luta, Dias De Gloria",EMI Brazil,110,163,61,1276103,145466
195,spotify:track:72xB2J9ZeBl0Rzxq2XmzdY,"João Gustavo e Murilo, Analaga",Lençol Dobrado,WM Brazil,2,-1,114,1274544,179164
