rank,uri,artist_names,track_name,source,peak_rank,previous_rank,weeks_on_chart,streams
1,"spotify:track:1597vvneWf0zoQrg2D8yH6","MC MENOR HR, MC MENOR SG, DJ ESCOBAR","Evoque Prata","GUETTO RECORDS",1,1,5,"9128332"
2,"spotify:track:4ASA1PZyWGbuc4d9N8OAcF","Gustavo Mioto, Mari Fernandez","Eu Gosto Assim - Ao Vivo","Universal Music Ltda.",1,2,11,"6990461"
3,"spotify:track:4o6v3Oooyt7HF20idztRD4","Israel & Rodolffo, Ana Castela","Bombonzinho - Ao Vivo","Som Livre",3,3,4,"6979122"
4,"spotify:track:1ELsaYdj2NlxLvkx9g24xZ","Guilherme & Benuto, Hugo & Guilherme","Haja Colírio (feat. Hugo & Guilherme) - Ao Vivo","Sony Music Entertainment",2,4,23,"5493919"
5,"spotify:track:1OZ4uv7OAP24Ix6j3vojLt","Mc Paiva ZS, MC Ryan SP, Kotim","Casei Com a Putaria","Love Funk",1,5,21,"4979854"
6,"spotify:track:2M4kQD87lKnAS9vFlb4Bez","Matheus & Kauan, Jorge & Mateus","Pactos - Ao Vivo","Universal Music Ltda.",6,6,7,"4961159"
7,"spotify:track:2orGm2E68ODFYOURjaES62","WIU, MC Ryan SP","Felina","Sony Music Entertainment",5,8,10,"4729805"
8,"spotify:track:3yHXEidSu4gYVRqKoI653O","Guilherme & Benuto, Xand Avião","Assunto Delicado - Ao Vivo","Sony Music Entertainment",3,7,15,"4693760"
9,"spotify:track:77UrDaIQq6JZIJWeLgJaRf","Orochi, MC Ryan SP, Oruam, Xamã, Neo Beats, Kizzy, Mainstreet","Sereia","Mainstreet Records",9,11,5,"4394879"
10,"spotify:track:6gyhp7IcNhTYzwlk8utsgP","Diego & Victor Hugo, Jorge & Mateus","Beijo de Glicose - Ao Vivo","Sony Music Entertainment",6,9,13,"4309481"
11,"spotify:track:7LUZT12r4xmwR1Kh8TJgjv","Gusttavo Lima","Ex dos Meus Sonhos - Ao Vivo","Sony Music Entertainment",7,10,8,"3927552"
12,"spotify:track:2hkwwmmLC90T8BQ7t3xufq","Zé Felipe, Ana Castela, Luan Pereira","Roça Em Mim","Som Livre",12,35,2,"3860075"
13,"spotify:track:3gCWngngUs1uojw33vrE8K","Jorge & Mateus","5 Regras - Ao Vivo","Som Livre",7,12,18,"3730865"
14,"spotify:track:4UldILPVpnZO69ffK4B9aA","Dj LK da Escócia, Tchakabum, MC Ryan SP, mc jhenny, Mc RF","Tubarão Te Amo","Nas Nuvens Music Group",11,13,8,"3681995"
15,"spotify:track:6Zw25LRLP0j0MsezDFIUM4","Hugo & Guilherme, Marília Mendonça","Mal Feito - Ao Vivo","Som Livre",2,18,46,"3200555"
16,"spotify:track:0oB3IBEhbmgTrL7mV0VnFq","Kadu Martins","Novinha do Onlyfans - Tchan Ran Tchan Tchan","Kadu Martins",16,19,5,"3118123"
17,"spotify:track:7bhvRvE56NHBvedx0EeALS","Mari Fernandez, NATTAN","Comunicação Falhou - Ao Vivo","Sony Music Entertainment",12,14,31,"2937994"
18,"spotify:track:7AwVSKaQxpidrtYBerkHKk","Ana Castela, Melody, Dj Chris No Beat","Pipoco","Ana Castela",1,16,27,"2935849"
19,"spotify:track:5vC8UAOHeG95ehRzZChniB","L7NNON, DJ Biel do Furduncinho, Bianca","Ai preto","Papatunes Records",1,15,25,"2827804"
20,"spotify:track:7qoIhutxU269Zqo9PG5IOj","Pineapple StormTv, Chris MC, Salve Malak, Tz da Coronel, MC Cabelinho, Chefin, L7NNON, Luísa Sonza, Oruam, Xamã, N.I.N.A","Poesia Acústica 13","Pineapple StormTV",1,17,11,"2808422"
21,"spotify:track:4NNZZXHgn9F3cCgC1YGmLl","Jorge & Mateus","Todo Seu - Ao Vivo","Som Livre",9,20,30,"2779776"
22,"spotify:track:2YAOJkRWy382bRMXaj48FP","Guilherme & Benuto, Matheus & Kauan","Esse B.O é Meu - Ao Vivo","Sony Music Entertainment",22,38,4,"2726334"
23,"spotify:track:2HMbGPbGiqGaHXzFkQAmZI","Matheus & Kauan","Basiquinho - Ao Vivo","Universal Music Ltda.",16,22,17,"2647325"
24,"spotify:track:3nqQXoyQOWXiESFLlDF1hG","Sam Smith, Kim Petras","Unholy (feat. Kim Petras)","Capitol Records UK / EMI",5,21,10,"2622584"
25,"spotify:track:6bwx7pcKJY05D9S6CVa1k6","Israel & Rodolffo, Maiara & Maraisa","Nem Namorado e Nem Ficante - Ao Vivo | Faixa Bônus","Som Livre",22,23,27,"2615307"
26,"spotify:track:5DoYLtsVnNMcrgpMdEPOsI","DJ Dozabri, DJ Arana, Silva Mc, MC Luiggi, Meno Saaint","É Só Um Lance Lero Lero","Barulho Das Favelas",26,51,2,"2608950"
27,"spotify:track:6TnCI16uLWhyQCrHva9VWj","Kevi Jonny","Te Love - Ao Vivo","LG Produções",26,29,12,"2514230"
28,"spotify:track:4cxQWmXmmbFoWvV8qipQTe","Murilo Huff, Maiara & Maraisa","Perfeito Pra Ficar Sozinho - Ao Vivo","M Show",22,25,17,"2499594"
29,"spotify:track:4xxeEWGQNFQ6qehlnev5LS","Marília Mendonça","Te Amo Demais","Som Livre",4,30,19,"2403448"
30,"spotify:track:2XaEn8iznBz9ZE9YJqJdQ6","MC Ryan SP, MC Hariel, Mc Don Juan, MC Joãozinho VT, MD Chefe, Mc Daniel, Mc Davi, Mc IG, Mc Kevin, Mc Paiva ZS, POCAH","Revoada do Tubarão 3","WM Brazil",30,77,2,"2384921"
31,"spotify:track:1dMyIigB6MDsfD3xuG6TbO","Felipe e Rodrigo","Média Boa (Ao Vivo)","MK Records",31,55,7,"2382490"
32,"spotify:track:0XyPPyGes0omXppV5YE8gy","Felipe Amorim","Gostosinha é Ela","One Play",24,24,18,"2351876"
33,"spotify:track:2qmG7dokbGpDGD0T5wORWt","Matheus Fernandes, Xand Avião","Balanço da Rede","Som Livre",1,26,38,"2346065"
34,"spotify:track:0dcHD9QhnWRA41zoLnC83X","MC Cabelinho, Dallass","X1","MC Cabelinho",30,33,30,"2334964"
35,"spotify:track:42nZBOwXNdO24Ml032bLBS","Matheus & Kauan","Gatilho - Ao Vivo","Universal Music Ltda.",13,36,37,"2315709"
36,"spotify:track:4pjznsLeoyimnxGlVpmyJI","MC Cabelinho, Victor WAO, Bairro 13","NÉ SEGREDO","MC Cabelinho",34,34,10,"2310611"
37,"spotify:track:2ykYxd8UGHOsdjP3Z5jSHh","Hugo & Guilherme, Gusttavo Lima","Cheiro de Balada - Ao Vivo","Som Livre",11,32,17,"2240474"
38,"spotify:track:0i4UV3HjjvsUuV3BajEXoD","MC Tairon, Mc Vitin Da Igrejinha, Dj Win, life song","Baile no Morro","ID1642 - Life Song Records",1,28,24,"2213592"
39,"spotify:track:5PSkF3QpVMlAx8U5Inxj39","Mc Jacaré, Dj Tk","Vento Forte","A Chave",3,31,20,"2117544"
40,"spotify:track:04vzhKfl5HtPEgrdZJCZ7L","Mc Paiva ZS, Kotim","Bagulho Louco","Love Funk",27,37,29,"2109698"
41,"spotify:track:4Dvkj6JhhA12EX05fT7y2e","Harry Styles","As It Was","Columbia",10,42,35,"2103519"
42,"spotify:track:4x5q5T5mhE1xvoCVXY6qrN","DJ AK BR, Dj Darge, Niack","Melodia Alucinógena","DJ AK BR",7,27,18,"2080461"
43,"spotify:track:0oZrvoCYEbKGCsU7cQqNnw","Yago Oproprio, Rô Rosa, Skeeter Beats","Imprevisto","Som Livre",43,43,6,"2044721"
44,"spotify:track:4QWumyD2uwiePBBha9XBHI","Felipe Amorim","No Ouvidinho","One Play",1,40,36,"1937175"
45,"spotify:track:3gx9a8ea1nI0Wym9hJpdbJ","BIN, Orochi, Mc Daniel, Caio Passos, Mainstreet","Hino dos Mlks","Mainstreet Records",45,59,6,"1892253"
46,"spotify:track:3IMLoeLerS7TMpKjxUgAhx","Henrique & Juliano","Arranhão (Ao Vivo)","Vida Nova Produções, sob licença exclusiva para Virgin Music Group",1,48,69,"1887154"
47,"spotify:track:6bTdZ7xfKp3NqqADJ8HLyj","Matuê, WIU, Teto","Vampiro","Sony Music Entertainment",1,50,35,"1867075"
48,"spotify:track:3XF598RmEUF3XW4XKo1lyP","Hugo & Guilherme, Jorge & Mateus","Meu Número - Ao Vivo","Som Livre",17,47,33,"1848859"
49,"spotify:track:0Nmp2wrm2mDMxhNzX8uHkS","Gusttavo Lima","Fala Mal de Mim - Ao Vivo","Sony Music Entertainment",6,39,21,"1818642"
50,"spotify:track:5mJFh4iRzgmWuEVPG8257V","MC Marks, DJ BOY, Dj GM","Quem Não Conhece Tá Sem Internet","GR6 Music",40,41,12,"1796782"
51,"spotify:track:11fqunD6qlOCrRd88kMOk6","Henrique & Juliano","Evento Cancelado (Ao Vivo)","Vida Nova Produções, sob licença exclusiva para Virgin Music Group",22,54,28,"1771496"
52,"spotify:track:4vWh6tEfcLzdvYWp2IlOJS","Luan Santana, Luísa Sonza","CORAÇÃO CIGANO - Ao Vivo","Sony Music Entertainment",3,44,17,"1746024"
53,"spotify:track:3BJWcQu8hKIa6LoOfFi1lR","Gusttavo Lima","Termina Comigo Antes - Ao Vivo","Sony Music Entertainment",3,45,35,"1733936"
54,"spotify:track:6Ulh9GPYz6JKdv04qc3q2U","João Gomes","Dengo","JG Shows",3,49,30,"1721511"
55,"spotify:track:0tM4J8aID6qYZOE3e14sCj","Henrique & Juliano","Acordo (Ao Vivo)","Vida Nova Produções, sob licença exclusiva para Virgin Music Group",21,61,58,"1672783"
56,"spotify:track:2wSCalnGOnXdAJC0Fn8OUY","George Henrique & Rodrigo, Marília Mendonça","Vai Lá Em Casa Hoje - Ao Vivo","Worldshow Promoções e Eventos",1,63,58,"1646258"
57,"spotify:track:1RDvyOk4WtPCtoqciJwVn8","Jung Kook, BTS, FIFA Sound","Dreamers [Music from the FIFA World Cup Qatar 2022 Official Soundtrack]","Katara Studios | 2101 Records under exclusive license to UnitedMasters LLC",56,56,2,"1637315"
58,"spotify:track:0BWEkqsmPe3qOzrRVztHU3","Paulo e Nathan, Hugo & Guilherme","Acabei de Terminar - Ao Vivo","Sony Music Entertainment",22,62,34,"1624066"
59,"spotify:track:5cCwZJUf8QiCQGnyakhpmF","Oruam, Mainstreet","Papo de Agustinho","Mainstreet Records",59,65,7,"1610623"
60,"spotify:track:4aoZBldNDVYmTwmeoI49ud","Mc Gabzin, DJ TAK VADIÃO, dj sv","O Poder Dessa Garota","Sony Music Entertainment",56,66,31,"1606705"
61,"spotify:track:2TdOWHAolNaQx8gyRDVS1N","Luan Santana, Henrique & Juliano","ERRO PLANEJADO - Ao Vivo","Sony Music Entertainment",4,68,33,"1599885"
62,"spotify:track:1JIKO27MqvSpjrnUCT6fLC","DJ Patrick Muniz, Mc L3, MC DOM LP","A Caminho do Bega","Tratto Entretenimentos",62,67,9,"1571364"
63,"spotify:track:0jAAnWNbcHf6X1EXOtvOT7","MC Kevin o Chris","Incendeia","MC Kevin o Chris",14,46,21,"1565958"
64,"spotify:track:3ShKPhFkexrwl7WoyTtNND","Rogerinho, Wesley Safadão","Tchuco Nela","AgitoFunk",5,53,33,"1559559"
65,"spotify:track:2PtpfX7sX870xeOfdTMyx2","Guilherme & Benuto","Meus Vícios - Ao Vivo","Sony Music Entertainment",52,69,10,"1553329"
66,"spotify:track:5TGkZGCUoV1zvFxQOIQM5O","HITMAKER, Ana Castela","Reverse","Universal Music Ltda.",56,58,8,"1543748"
67,"spotify:track:2SOeAhvJfh7HsGYPVtGG8H","DJ CIRILO DE CAXIAS, Kaeny Mc","Aqui Na Parma Tu Vem Pra Fuder","Gufo Records",48,52,6,"1543121"
68,"spotify:track:3ITkrUvAA6gzxer2UIom3P","Jorge & Mateus","Molhando o Volante","Som Livre",8,80,51,"1529648"
69,"spotify:track:4qsOrxBv09HhNSpsgMRXdC","Marília Mendonça, Maiara & Maraisa","Esqueça-Me Se For Capaz","Som Livre",1,79,59,"1521840"
70,"spotify:track:5IgjP7X4th6nMNDh4akUHb","Chris Brown","Under The Influence","Chris Brown Entertainment/RCA Records",48,70,18,"1489825"
71,"spotify:track:7qD2vjd3btuOgwpQPEY7ci","Mc Don Juan, MC G15, Mc Davi","EU VOU COM CARINHO ELA QUER COM FORÇA","WM Brazil",4,57,28,"1470129"
72,"spotify:track:7woVi4HBuv0rsO98Ox2Fcq","Mc Paiva ZS, Love Funk, Kotim","Doce Veneno","Love Funk",60,60,11,"1458249"
73,"spotify:track:1xzi1Jcr7mEi9K2RfzLOqS","Beyoncé","CUFF IT","Parkwood Entertainment/Columbia",50,72,13,"1422289"
74,"spotify:track:4uUG5RXrOk84mYEfFvj3cK","David Guetta, Bebe Rexha","I'm Good (Blue)","Parlophone UK",51,78,12,"1408197"
75,"spotify:track:1t5dhHyXMwdbAcI3EQRqFV","Diego & Victor Hugo","Meio Fio - Ao Vivo","Sony Music Entertainment",60,82,17,"1371570"
76,"spotify:track:2bWVxK5GlPtS4D3FcLjGgQ","Gusttavo Lima","Cara da Derrota - Ao Vivo","Sony Music Entertainment",74,81,8,"1364468"
77,"spotify:track:7HdWqZjUmIHK5B8zwPCRds","Léo Santana, Mc Don Juan, Mari Fernandez","Áudio Que Te Entrega - Faixa Bônus","Universal Music Ltda.",19,76,36,"1355605"
78,"spotify:track:44U6wTQDkos958gqTbilSw","Mc Daniel, Caio Passos, OGBEATZZ","Balmain","Lyons Produções",78,85,6,"1355540"
79,"spotify:track:4QQTPEwqE4Aq7LXSyIgSci","Mc Kitinho, Mc guizinho niazi, DJ DEIVÃO, Silva Mc","Primeiro Beck Ela Me Mamou","Fluxos Records",28,64,12,"1330040"
80,"spotify:track:0MKd4uZd8Ag8qyReZBTarP","Murilo Huff","Pino da Granada - Ao Vivo em Rio Preto","M Show",35,84,27,"1328047"
81,"spotify:track:3sd2p4kE7xQmFH3lPnFl6h","Davi Kneip, Mc Frog, Dj Gabriel do Borel, Luísa Sonza","sentaDONA (Remix) s2","Davi Kneip",1,87,37,"1326329"
82,"spotify:track:6T5TyMUmqcg8ZIvTDYaJ1o","GIULIA BE","DEPOIS DO UNIVERSO","WM Brazil",57,93,4,"1312043"
83,"spotify:track:5A35xC90Nk6tXmcOAOOavi","Luan Santana","ABALO EMOCIONAL - Ao Vivo","Sony Music Entertainment",6,90,43,"1307727"
84,"spotify:track:0V3wPSX9ygBnCm8psDIegu","Taylor Swift","Anti-Hero","Taylor Swift",10,75,6,"1307530"
85,"spotify:track:1uFn76RxZ8KBXWRtF1D7Nl","Luan Santana","PERIGOSA - Ao Vivo","Sony Music Entertainment",77,92,3,"1282900"
86,"spotify:track:3l5VjEAeUTqrlD50iEo8Yn","KayBlack, CVSTRO, Wall Hein, AMUSIK","Licor 43","Elenko Music",86,89,11,"1277906"
87,"spotify:track:3o5LmE0gNsEBwz7VCmc3bV","Hugo & Vitor, Clayton & Romário","Problemão - Ao Vivo","Universal Music Ltda.",86,91,5,"1256744"
88,"spotify:track:2ebFBmle5uXcdbrCAOvPcZ","Guilherme & Benuto","Vagabundo Chora - Ao Vivo","Sony Music Entertainment",20,71,42,"1247461"
89,"spotify:track:57nvtO3EJuh6zuB67R3QeF","Mc Poze do Rodo, João Gomes, jess beats, DiCastro","Frio e Calculista","Mainstreet Records",83,83,3,"1228735"
90,"spotify:track:7afaZ37wJJL6880z1NRgJS","Teto","Fim de Semana no Rio","Sony Music Entertainment",3,102,35,"1220695"
91,"spotify:track:5IcPYzR2bkS4W3MabMpi4Z","Zé Neto & Cristiano","Melhor Ser uma Saudade","Som Livre",13,101,44,"1212488"
92,"spotify:track:52kcarcX0FQ6wPulXm2bMJ","Vulgo FK, MC Cebezinho, KayBlack, Pedro Lotto, AMUSIK","Meca Cereja","Elenko Music",92,119,4,"1198756"
93,"spotify:track:5TPXcKSOlPaz2pkYbWiWHU","Clayton & Romário","Ai Eu Chorei - Ao Vivo","Virgin Music Label And Artist Services (S&D)",45,98,22,"1182316"
94,"spotify:track:7fzgTaVhUxmEzjtcd9NdWo","Tayrone, Marília Mendonça","Cê Tá Preparada - Ao Vivo","Universal Music Ltda.",16,105,72,"1171090"
95,"spotify:track:14JKzKrJbPDflw8XyATMey","Henrique & Juliano","A Maior Saudade (Ao Vivo)","Vida Nova Produções, sob licença exclusiva para Virgin Music Group",10,106,65,"1163127"
96,"spotify:track:3EM71GPnUGJ75uDhkH77pq","LUDMILLA, Marília Mendonça","Insônia - Ao Vivo","WM Brazil",46,88,14,"1143020"
97,"spotify:track:5fstoJBdyj9Yvhe4W5hmEP","Dj GM, Mc Lipi, Oldilla, Mc Piedro, MC Paulin da Capital, MC Lemos, Mc Lele JP, MC Ryan SP, Gabb MC, Mc Paiva ZS, Love Funk","Set Wesley Alemão","Love Funk",55,94,13,"1125892"
98,"spotify:track:28m65cMH7QXHzFnZSTtNHY","Marília Mendonça, Maiara & Maraisa","Não Sei o Que Lá","Som Livre",21,114,61,"1122429"
99,"spotify:track:0yDMhYTryvQoR634wDgQ1j","MC Hariel, DJ BOY","O Fim é Triste (feat. DJ BOY)","WM Brazil",62,100,23,"1120558"
100,"spotify:track:71VNsncPcTfQiklVO9uXfB","Felipe & Murillo, Ana Castela","Ô Lá na Roça - Ao Vivo","Felipe & Murillo",97,97,14,"1113102"
101,"spotify:track:3ZtHHGpAPSWC7Gnios4lmK","sxmmerx","Metflix","sxmmerx",31,99,19,"1112674"
102,"spotify:track:0WtM2NBVQNNJLh6scP13H8","Rema, Selena Gomez","Calm Down (with Selena Gomez)","Mavin Records / Jonzing World",102,125,8,"1103590"
103,"spotify:track:58VUikMywNpRelwEx8khdh","Dj JL O Único, MC LENADRO ABUSADA, Funk Maia","Aqui no Baile do Egito","Funk Maia",90,104,8,"1103122"
104,"spotify:track:6OeBK3dJroqoXOHZLitRpW","GDM, KayBlack, Wall Hein","Carta pra Deus","GDM",104,-1,1,"1099335"
105,"spotify:track:5r9CZJMoMmxio2AnJdxuDS","Grupo Menos É Mais, Di Propósito, Vou Zuar","Pot-Pourri: Melhor Eu Ir / Ligando Os Fatos / Sonho de Amor / Deixa Eu Te Querer - Ao Vivo","Som Livre",21,109,130,"1086362"
106,"spotify:track:5ghSPv2tPkGZN8DESSvKZl","dreko","Ultimamente Speed","FUNDO REC",80,103,9,"1077297"
107,"spotify:track:5FNdfRpHs4u5vto9YdY3ft","Wesley Safadão","Eu Já Tava Bem - Ao Vivo","Wesley Safadao",19,115,52,"1072682"
108,"spotify:track:30rrBGpna63eIJ2BrXlWDC","Henrique & Juliano","Minha Cópia Atual (Ao Vivo)","Vida Nova Produções, sob licença exclusiva para Virgin Music Group",58,122,35,"1066352"
109,"spotify:track:5XeFesFbtLpXzIVDNQP22n","Arctic Monkeys","I Wanna Be Yours","Domino Recording Co",96,124,12,"1060045"
110,"spotify:track:6kNZdlmjH4BQnSUfHeJIuc","Dj GBR, Mc IG, MC Ryan SP, MC Marks, Mc Don Juan, MC PH, Mc Luki, Mc Paiva ZS, MC GP, Makalo","Let's Go 3 (feat. MC Marks, Mc Don Juan, MC PH, Mc Luki, Mc Paiva ZS, MC GP & Makalo)","Sony Music Entertainment",96,96,5,"1048014"
111,"spotify:track:0NBgyml7T0IvUNbXIkcSpH","Xamã, Gustah, Neo Beats, Bagua Records","Malvadão 3","Bagua Records",1,134,52,"1047549"
112,"spotify:track:0pZIBIJ253pH9gJtXE0Ouf","KayBlack, Marquinho no Beat, Wall Hein","Vestido da Fendi","Elenko Music",107,123,27,"1040642"
113,"spotify:track:7KWKWJnbGJ3Soag6Oopion","Luísa Sonza","CACHORRINHAS","Sony Music Entertainment",2,117,20,"1033016"
114,"spotify:track:48LEhRW4gLMCVSYFEZvt8b","João Bosco e Gabriel, Diego & Victor Hugo","Assume a Gente - Ao Vivo","Som Livre",40,126,36,"1030727"
115,"spotify:track:3lQnTQFBxk1HMsj8aa4syY","Kadu Martins","Virando o Olhinho","Kadu Martins",57,113,21,"1030060"
116,"spotify:track:4AAIAVjSyiq1N7SXKkwXZe","Marília Mendonça","Troca de Calçada","Som Livre",7,129,96,"1027983"
117,"spotify:track:4a0sqvCBo7aRIS4GzBQpnp","MC Braz, MC Tairon, Dj Win","Kikando e Me Olhando","Duetti",14,112,34,"1019629"
118,"spotify:track:14uWxelOuAUajP8fDvc0Ct","Thiaguinho","Falta Você","Virgin Music Label And Artist Services (S&D)",87,111,26,"1016864"
119,"spotify:track:7AD7hNwGOOSRe33QtnyprD","MC Guimê, Emicida","País do Futebol","Maximo",119,121,2,"1016610"
120,"spotify:track:6JIC3hbC28JZKZ8AlAqX8h","Elton John, Dua Lipa, PNAU","Cold Heart - PNAU Remix","EMI",52,130,64,"987559"
121,"spotify:track:0yL7K9MzC20uBesZTPY81r","DJ Matt D, Menor MC, MC GP, Vulgo FK","Pandora","GREE CASSUA",6,139,52,"983690"
122,"spotify:track:7yYrG1nIPeZdLoA9tfU8LL","Mc Jacaré","Boca de Mel","A Chave",95,108,12,"978380"
123,"spotify:track:1TyxXIXVVpHwhKaF73z8nw","Henrique & Juliano","Rasteira (Ao Vivo)","Vida Nova Produções, sob licença exclusiva para Virgin Music Group",46,141,63,"971638"
124,"spotify:track:2zpiccjPSl315SqthyDf9j","Mc Livinho, Theus Costa, MC Bruna Alves, Faixa Rosa","Na Movimentação (feat. Faixa Rosa)","MBB Diamond",80,116,14,"967345"
125,"spotify:track:6nkoWsFZeFt5dUdNmlIceh","Gusttavo Lima","Bloqueado - Ao Vivo","Sony Music Entertainment",4,144,53,"962940"
126,"spotify:track:7HjZD0NPC1hzFpjUjo45GR","Mc Poze do Rodo, Filipe Ret, Mainstreet, Ajaxx","Me Sinto Abençoado","Mainstreet Records",33,131,51,"961304"
127,"spotify:track:5PZAbR6JHYYV9xp5gv0XES","Zé Felipe, MC Mari","Bandido","Som Livre",1,74,24,"957504"
128,"spotify:track:6zJejIfVYLgjud3lTk4DLB","Rosa Linn","SNAP","Nvak Collective",91,137,18,"956246"
129,"spotify:track:4kpj0mNvse4mclBHpluw4g","Clayton & Romário","O Grau Bateu - Ao Vivo","Virgin Music Label And Artist Services (S&D)",107,107,3,"948275"
130,"spotify:track:6BF3nZQkAg9qvE0DLVSfyH","Baco Exu do Blues, Luísa Sonza","Hotel Caro","Baco Exu do Blues",4,156,25,"939163"
131,"spotify:track:4m8kG46clzxMxyrDuFo1Uq","WIU, Oruam","Horas Iguais","Sony Music Entertainment",77,145,8,"935354"
132,"spotify:track:7LRjGCQdXzkBJj03e1kHkq","Paulo e Nathan","Fala Alguma Coisa - Ao Vivo","Sony Music Entertainment",74,138,13,"935301"
133,"spotify:track:2VbKpQWIMRelKmEy8rSCAf","Kako, MC Erik, MC GP, MC Ryan SP, MC Marks, MC Joãozinho VT, DJ BOY, Dj GM","Set Tatuapé Conceito 2","Sonar Music",63,128,21,"931959"
134,"spotify:track:5PjdY0CKGZdEuoNab3yDmX","The Kid LAROI, Justin Bieber","STAY (with Justin Bieber)","Columbia",30,154,73,"930405"
135,"spotify:track:13Rf6RaZT13TW4xLQR3MQr","MC Cabelinho, Bob do Contra, Azzy, Filipe Ret, Dudu, Xamã, Orochi, Maquiny, Pineapple StormTv","Poesia Acústica #6 Era uma Vez","Pineapple StormTV",18,150,181,"927445"
136,"spotify:track:4EVzu5mYyigjyLrryKbZs7","Gloria Groove","VERMELHO","SB Music",9,148,42,"925529"
137,"spotify:track:4eTtgdIXEy2LvLeg7NNSov","Dallass, Anezzi, Tz da Coronel, Caio Luccas, PJ HOUDINI, MC Maneirinho, NADAMAL, Filipe Ret","Vizão de Cria 2","NadamalRecords",97,135,17,"923883"
138,"spotify:track:6m84TzSTM5nbwZxIxkYHz6","Jorge & Mateus","Namorando Com Saudade","Som Livre",39,152,70,"923375"
139,"spotify:track:25rz3D4oroFC0GXm3xFXnG","Nivaldo Marques, NATTAN","Tem Cabaré Essa Noite","SUA Musica/ WK Records",12,86,20,"922068"
140,"spotify:track:1RgJ4lexKGNBlKnyxB5SRt","Teto, Mateca","Balazul","Sony Music Entertainment",31,136,26,"915258"
141,"spotify:track:4GOs8fPjp4M9CBHanTMwsQ","Henrique & Juliano","Seu Perfil (Ao Vivo)","Vida Nova Produções, sob licença exclusiva para Virgin Music Group",67,143,42,"914147"
142,"spotify:track:2Cd9iWfcOpGDHLz6tVA3G4","Shakira, Freshlyground","Waka Waka (This Time for Africa) [The Official 2010 FIFA World Cup (TM) Song] (feat. Freshlyground)","Epic/Legacy",120,120,2,"911105"
143,"spotify:track:4h9wh7iOZ0GGn8QVp4RAOB","OneRepublic","I Ain't Worried","Interscope Records",103,142,13,"907744"
144,"spotify:track:2QjOHCTQ1Jl3zawyYOpxh6","The Neighbourhood","Sweater Weather","Columbia",121,168,45,"904816"
145,"spotify:track:7jtQIBanIiJOMS6RyCx6jZ","Tom Odell","Another Love","ITNO/Columbia",145,165,13,"901889"
146,"spotify:track:3xt7v3bMNnQ8ie8RjhmkX2","Matheus & Kauan","Imagina A Sentada - Ao Vivo","Universal Music Ltda.",18,173,51,"891945"
147,"spotify:track:7G2LNG0EDgU5IyeeP6pevW","Mari Fernandez, Xand Avião","Pode Apostar - Ao Vivo","Sony Music Entertainment",128,133,15,"891673"
148,"spotify:track:1XcmAgREOuJQb91sr68AAD","Dyamante DJ, Mc Gw","Sentadinha Diferente","NWS",51,127,21,"890659"
149,"spotify:track:3xdEjqUOiLBkRmTrSst1GX","Mc Don Juan, Mc Paiva ZS, DJ Yuri Martins","Final do Ano","WM Brazil",149,-1,1,"885400"
150,"spotify:track:5DhiTYpD599fu3q7fCepgL","BIN, Major RD, Mainstreet, Ajaxx","Dior","Mainstreet Records",54,159,24,"880127"
151,"spotify:track:1a5LfJGq0vuCWQ9Mme0Ac7","Maria Marçal","Deserto (Ao Vivo)","MK Network",149,166,8,"878839"
152,"spotify:track:3QGxgNaqaFSpORp2OVLXHR","Chefin, Mainstreet","212","Mainstreet Records",2,180,46,"878772"
153,"spotify:track:6igNhmOPWCEwgbqVM2fned","Tierry, Hugo & Guilherme","Lara - Ao Vivo","Virgin Music Label And Artist Services (S&D)",132,132,2,"874250"
154,"spotify:track:7GvJL7IG958R87MphADwR6","KayBlack, Wall Hein, AMUSIK","Maturidade","Elenko Music",154,176,7,"868653"
155,"spotify:track:2gkKA2pRAsMzbiGPo9gxsc","Clayton & Romário, Jorge & Mateus","Água Nos Zói - Ao Vivo","Virgin Music Label And Artist Services (S&D)",35,177,59,"868500"
156,"spotify:track:46HNZY1i7O6jwTA7Slo2PI","Coldplay, BTS","My Universe","Parlophone UK",57,196,45,"867206"
157,"spotify:track:6UelLqGlWMcVH1E5c4H7lY","Harry Styles","Watermelon Sugar","Columbia",27,175,147,"866668"
158,"spotify:track:72g37RoelSnovZakG5MwnF","Mari Fernandez, Marcynho Sensação","Parada Louca","Sony Music Entertainment",8,158,55,"864276"
159,"spotify:track:0K3u2t8YNuJ5NR9lKC1frv","Pabllo Vittar, Gloria Groove","AMEIANOITE","Sony Music Entertainment",52,95,6,"862640"
160,"spotify:track:0QHEIqNKsMoOY5urbzN48u","Meghan Trainor","Made You Look","Epic",160,167,2,"858918"
161,"spotify:track:0roEMqT0P7Z82rJTwcID3Z","Hugo & Guilherme","Felicidade Dela - Ao Vivo","Som Livre",42,171,36,"858416"
162,"spotify:track:68qqVn5kHBv4zc45SDGLnh","Filipe Ret, L7NNON, Chris Beats Zn","Corte Americano","Som Livre",60,164,84,"855449"
163,"spotify:track:4nRa5qkXIfswPbt20rkslI","Felipe Amorim, João Gomes","Debaixo do Cobertor","One Play",69,149,20,"851987"
164,"spotify:track:2rtsT3CefzKc05JdAm8aQ5","João Gomes, L7NNON","Digo ou Não Digo - Ao Vivo","JG Shows",147,147,6,"851916"
165,"spotify:track:0ssgd2ZvDawP0KHGfBYRpv","Filipe Ret, Caio Luccas, Dallass","Good Vibe","Som Livre",67,182,24,"845752"
166,"spotify:track:6KKT8dzP21J4WwBp9swjob","Filipe Ret, Mc Poze do Rodo, Nagalli","Sonho Dos Cria","Som Livre",48,170,24,"844125"
167,"spotify:track:54ipXppHLA8U4yqpOFTUhr","Imagine Dragons","Bones","Kid Ina Korner / Interscope",142,193,15,"841857"
168,"spotify:track:2xebCnKCjYWBhJ4Ai8hO5E","Mc Davi, Mc Kevin, Mc Don Juan, MC Hariel, MC Marks, MC G15, Mc Phe Cachorrera, Gaab, MC Menor da VG, MC Ryan SP, MC Kapela, Perera DJ, Veiga no Beat","Set dos Casados","GR6 Music",22,181,60,"840286"
169,"spotify:track:130HVxaVe9EYcLJmuOR9Rw","Henrique & Juliano","Até A Próxima Vida (Ao Vivo)","Vida Nova Produções, sob licença exclusiva para Virgin Music Group",87,160,40,"839259"
170,"spotify:track:4grGI2vFnknrfmHT1JOVFU","George Henrique & Rodrigo, Gusttavo Lima","Tesão Da Madrugada - Ao Vivo","World Show Produções",41,187,42,"838677"
171,"spotify:track:5vOLqik7QlFD5eq3otyXBm","Dj Mt Oliveira, Mc Alysson","Eu Vou Tacar x Essas Hora da Noite","Tiger Records",153,153,2,"837636"
172,"spotify:track:1iaPDgTbsKrlznVu13EWIf","MC Cabelinho, Bielzin, Mc Poze do Rodo, Tz da Coronel, Neo Beats","ESSÊNCIA DE CRIA","MC Cabelinho",64,169,49,"837533"
173,"spotify:track:5Odq8ohlgIbQKMZivbWkEo","Charlie Puth, Jung Kook, BTS","Left and Right (Feat. Jung Kook of BTS)","Atlantic Records",55,-1,18,"835102"
174,"spotify:track:4eoqnVPLzROP9tDxcFQAAK","Zé Neto & Cristiano","Alimentando Vontade","Som Livre",70,110,6,"822148"
175,"spotify:track:7qq40cRIYNKZCDt1STfBqt","Niack","Bruna, Tu Já Parou Pra Pensar","WM Brazil",76,155,22,"818024"
176,"spotify:track:5Z9KJZvQzH6PFmb8SNkxuk","Lil Nas X, Jack Harlow","INDUSTRY BABY (feat. Jack Harlow)","Columbia",8,198,71,"814861"
177,"spotify:track:3RjVR6vjFDotAeSTGSfmLT","Murilo Huff","Boca Enganada - Ao Vivo","M Show",95,174,7,"813829"
178,"spotify:track:3CIyK1V4JEJkg02E4EJnDl","Imagine Dragons, JID, Arcane, League of Legends","Enemy (with JID) - from the series Arcane League of Legends","Kid Ina Korner / Interscope",39,-1,56,"813315"
179,"spotify:track:1TFqH3zKOiTZoVe0OQuJte","Grupo Menos É Mais","Até Que Durou / Tu Mandas No Meu Coração / Adorei / Supera - Ao Vivo","Som Livre",131,162,24,"808124"
180,"spotify:track:3FkeNbs9Zeiqkr3WkbOiGp","Anitta","Envolver","Warner Records",1,-1,51,"808089"
181,"spotify:track:6QP9bF0ZypxoyQotcgl25J","Gusttavo Lima","Saudade Fudida - Ao Vivo","Sony Music Entertainment",83,163,8,"806657"
182,"spotify:track:65CB461aKF5FvIuuzqUgXu","Mc Poze do Rodo, Vulgo FK, Portugal No Beat, Galdino","Ai Calica","Mainstreet Records",151,151,3,"801903"
183,"spotify:track:4b5rbmik2mSrGo8IvjDUUp","PEDRO SAMPAIO, Pabllo Vittar","SAL","WM Brazil",101,146,3,"795000"
184,"spotify:track:0VjIjW4GlUZAMYd2vXMi3b","The Weeknd","Blinding Lights","Republic Records",25,-1,147,"791257"
185,"spotify:track:3PfIrDoz19wz7qK7tYeu62","Dua Lipa","Don't Start Now","Warner Records",2,194,150,"790351"
186,"spotify:track:5wAoMzm5LaIvGED0JNeBfY","Mari Fernandez","Cão Sem Dono","Sony Music Entertainment",136,161,8,"787320"
187,"spotify:track:5zNxUkUW9WiV5oyg6gh2wB","PEDRO SAMPAIO, Mc Pedrinho","DANÇARINA","WM Brazil",1,-1,39,"773178"
188,"spotify:track:4can6ssapSsRCEbZZfYL8K","Filipe Ret, Caio Luccas, BIN, BUDAH, Borges, Marina Sena, Teto, Luiz Lins, Pineapple StormTv","Poesia Acústica #12 Pra Sempre","Pineapple StormTV",24,184,40,"767076"
