rank,uri,artist_names,track_name,source,peak_rank,previous_rank,weeks_on_chart,streams
1,"spotify:track:6Emsu0BaMpG0ilZCRT8KHZ","Diego & Victor Hugo","Tubarões - Ao Vivo","Sony Music Entertainment",1,1,10,"7214755"
2,"spotify:track:17tg01y3RhlfRKMnd333yL","Danilo e Davi","Apaga Apaga Apaga - Ao Vivo","Som Livre",2,4,24,"5709247"
3,"spotify:track:4Hk1gmBr2KVEXr3hHwSgUi","DG e Batidão Stronda, Mc Davi, J. Eskine, MC G15","Mãe Solteira","FORTAL MUSIC",1,2,8,"5323068"
4,"spotify:track:2TSYxcrcrtLpdbsLY9NmzL","Simone Mendes","Me Ama Ou Me Larga - Ao Vivo","Universal Music Ltda.",3,3,12,"4716761"
5,"spotify:track:2tUIRX4wK0COoKEorOdEpZ","Murilo Huff, Zé Neto & Cristiano","Veneno - Ao Vivo","M Show",5,9,6,"4691931"
6,"spotify:track:40WZQRA3T6WZFIgskIAAz7","Simone Mendes","Saudade Proibida - Ao Vivo","Universal Music Ltda.",6,25,3,"4552979"
7,"spotify:track:6Kyl2nFgU0J8WBlbBvDv6g","Grupo Menos É Mais","Coração Partido (Corazón Partío) - Ao Vivo","Som Livre",1,8,34,"4422879"
8,"spotify:track:4y93vvzu2h8MITw7YyUTcI","Henrique & Juliano","Última Saudade (Ao Vivo)","Vida Nova Produções, sob licença exclusiva para Virgin Music Group",1,10,30,"4160080"
9,"spotify:track:5AoOD6SAzOOE6jwxvRIBPq","Nego Trufa, Dj TC, DJ Japa NK","Baile do Panta","GRINGOS WORLD PRODUTORA",9,23,2,"3953664"
10,"spotify:track:2OMkXPz6pHdKJSkzxG0MwZ","Kew, Dj LK da Escócia","Descer","Legenda Records",3,6,9,"3918429"
11,"spotify:track:4swtnATsndB7VJVq0n4EQE","DJ CZ, MC Nito, DJ TS, Mc Pogba, Prime Funk","Rabetão De Terremoto","Prime Funk",7,7,4,"3845763"
12,"spotify:track:6lrQgEPTuOKyvn4bQJuaRU","Luan Pereira, MC Tuto, Grelo","NÃO ERA LOVE","Som Livre",12,19,3,"3788335"
13,"spotify:track:3R8dmcSyROSR73XsdeSd7g","Clayton & Romário","Opa Cadê Eu - Ao Vivo","WM Brazil",13,18,11,"3746326"
14,"spotify:track:4pOGEJRVOuaa9oyy7qTGf6","Nilo, Mc Paiva ZS, DJ Di Marques, Tropa da W&S, FamousKyo","Fui Mlk","WMD",1,5,22,"3580632"
15,"spotify:track:7BGhllQfISbfkwYSkp5nRC","Teto","YES OR NO","30PRAUM",11,11,4,"3578584"
16,"spotify:track:3M4HJl7D77l86gL1QXGJHG","Lauana Prado, Simone Mendes","Saudade Burra - Ao Vivo","Universal Music Ltda.",11,15,15,"3358421"
17,"spotify:track:44CTudFZ0kbaIF9n0jk7oU","Matheus & Kauan, Ana Castela","Ilusão De Ótica - Ao Vivo","Universal Music Ltda (S&D)",13,13,13,"3338982"
18,"spotify:track:0BUkQGUXgcvf3gdCWYbtnJ","Oruam, Zé Felipe, MC Tuto, Dj Lc da Roça, Mc Rodrigo do CN, MC K9, mc pl alves","Oh Garota Eu Quero Você Só Pra Mim.","Mainstreet Records",1,12,18,"3264940"
19,"spotify:track:6s1kzj4EbhFLXbuAGJbhbn","MC Tuto, DJ Glenner","Barbie","Sonar Music",1,14,27,"3231544"
20,"spotify:track:07kLShG3HTeLXTqnFCqNAJ","Henrique & Juliano","Amigo Da Minha Saudade (Ao Vivo)","Vida Nova Produções, sob licença exclusiva para Virgin Music Group",20,28,16,"2995660"
21,"spotify:track:65vJAh07BdwurqR9SRa6f8","Ferrugem, Sorriso Maroto","Apaguei Pra Todos - Ao Vivo","WM Brazil",17,26,53,"2931403"
22,"spotify:track:3iDZj9V0RSElRwVgtmMYgJ","Oruam, Maurin, Victor WAO","Lei Anti O.R.U.A.M","Mainstreet",10,17,9,"2861815"
23,"spotify:track:5aMgTcyBPH90hWHhbNKTwR","Diego & Victor Hugo","Entregador de Flor - Ao Vivo em Brasília","Sony Music Entertainment",22,42,32,"2806922"
24,"spotify:track:7so0lgd0zP2Sbgs2d7a1SZ","Lady Gaga, Bruno Mars","Die With A Smile","Interscope Records",5,27,36,"2713765"
25,"spotify:track:6id4TFeHJgvVtCzrJEysl0","Henrique & Juliano","Saudade De Quem Eu Sou (Ao Vivo)","Vida Nova Produções, sob licença exclusiva para Virgin Music Group",23,33,6,"2680750"
26,"spotify:track:3WxetTBTlpfyknxJfPQ7eQ","MC Cebezinho, Dj Yuri Pedrada, Love Funk","Observando Essa Salada","Love Funk",8,30,13,"2674468"
27,"spotify:track:0vYrfm0eUQyi6fWbYnBiDc","DJ NATAN 22, Mc Rodrigo do CN, DJ DN do Dick","Meu Carro Nao Tem Porta Luva - Remastered 2024","Snafu Records",21,21,16,"2669886"
28,"spotify:track:3CvpnVAV75lKCcaTtUTpgW","Chefin, LB Único","Se Essa Bunda For Uma Empresa","Chefin Distribuição",16,16,7,"2663855"
29,"spotify:track:0NQyryTVbjGMtWMA1eSqIn","J. Eskine, Alef Donk","Resenha do Arrocha","Latin Brega by HITLAB Records",1,22,20,"2660747"
30,"spotify:track:2Z1DmmPWD3Lm0dWAxMfjxG","MC Jvila, Mc Negão Original, DJ Dael, DJ Guh Mix","Pirocada Quente","Legenda Records",24,24,10,"2655337"
31,"spotify:track:280QfKhmWGn3LbyB39aA7u","Léo Foguete","Cópia Proibida","Acertei Produções",5,37,25,"2619941"
32,"spotify:track:37QloSdzrjx2xCH0m65800","Gustavo Mioto, Grupo Menos É Mais","Nada Com Nada - Ao Vivo","Universal Music Ltda.",15,20,20,"2533279"
33,"spotify:track:096gZM7wp5GKHBwtWY3d0z","Link do Zap, pluglip","a última dança","Link do Zap",29,29,9,"2533222"
34,"spotify:track:2gfn28JSINCJGLrUimmu0l","Jorge & Mateus","Cantada Boba - Ao Vivo","Som Livre",11,34,24,"2516133"
35,"spotify:track:6XXqPj8USz1oebSmMPCBLC","DJ Gouveia, DJ Dozabri, Mc Rodrigo do CN","Tipo Nino Abravanel","Mandela Music",31,31,7,"2358623"
36,"spotify:track:4jUZymsR3lkia9wkP0o9cX","DJ TOPO, Mc Livinho","MTG NA IMAGINAÇÃO - TOPO SESSIONS VOL. 1","DJ TOPO",6,40,29,"2341378"
37,"spotify:track:0UGGLKM970ymsBBN5TKjsD","MC Tuto, DJ Oreia","2025","Sonar Produtora",11,32,17,"2340260"
38,"spotify:track:6ukVCqH77f6cwRHyJBhGgy","Israel & Rodolffo","Arruma Um Bão","Som Livre",13,44,29,"2322023"
39,"spotify:track:7l9Tq5phzkLnhWUyfp702G","Kaique e Felipe, Luan Pereira","Saveiro","Sony Music Entertainment",1,62,39,"2317804"
40,"spotify:track:6VH6SBNNL2RVWwImq046ce","Boladin 211, Dejinha, MC Rick, DJ AL4DDIN","Penélope Charmosa 2","Kave",5,39,15,"2313488"
41,"spotify:track:3bpNcH1SCEMn6zuynZGY5e","Orochi, TkN, RUXN, Kizzy, ProdSmile","Fashion","Mainstreet Records",36,36,7,"2295806"
42,"spotify:track:3TnSAp3TfGMYptOqv234uK","MC Tuto, Grelo","Do Job","Sonar Music",9,46,23,"2222093"
43,"spotify:track:77HhVmRv7IxDqkyMxElSrK","Anitta, Mc Danny, HITMAKER","Sei Que Tu Me Odeia","Universal Music Ltda.",3,38,14,"2192331"
44,"spotify:track:5asabafNzfAzjUecDvuNES","Henrique & Juliano","Aquela Pessoa (Ao Vivo)","Vida Nova Produções, sob licença exclusiva para Virgin Music Group",34,53,169,"2187565"
45,"spotify:track:2xTM0m9HD3gIqNSutA0LNJ","Jorge & Mateus, Henrique & Juliano","Xonei","Som Livre",3,55,36,"2177040"
46,"spotify:track:708yXS1fLm1gAXFyIQxtX2","Henrique & Juliano","Romântico (Ao Vivo)","Vida Nova Produções, sob licença exclusiva para Virgin Music Group",46,52,25,"2134815"
47,"spotify:track:5TOvA5Uhxti7FPh0EIdClV","MC LUUKY, DJ JB Mix","Malvadinho","EDITORA E GRAVADORA A BASE RECORDS",1,43,25,"2091080"
48,"spotify:track:1VpOT1TfTivUmFjSGSRt1U","MC LUUKY, MC Jvila, DJ Dael","Olha pra Cara de Quem Te...","EDITORA E GRAVADORA A BASE RECORDS",33,47,6,"2074247"
49,"spotify:track:48tyRFRqsKTYnViVA1XOk9","Lauana Prado","Kamasutra - Ao Vivo","Universal Music Ltda.",28,56,7,"2030303"
50,"spotify:track:7shkORZD3NNi6waqw7eIqT","Gusttavo Lima","Proibido Terminar - Ao Vivo","Sony Music Entertainment",13,41,11,"2024648"
51,"spotify:track:4eqOz5gdCYww9GB5q3q1pU","DJ Douglinhas, DJ Miller Oficial, MC Torugo","Puta É Só um Detalhe","DJ DOUGLINHAS",13,48,17,"1963332"
52,"spotify:track:6Tp4LCJ5r5IJaEf8lnlPfG","Henrique & Juliano","De Trás Pra Frente (Ao Vivo)","Vida Nova Produções, sob licença exclusiva para Virgin Music Group",17,59,132,"1949601"
53,"spotify:track:7opE9OJaqrvkQspmfJdVsS","Guilherme & Benuto","Filho da Mãe - Ao Vivo","Sony Music Entertainment",53,67,3,"1931334"
54,"spotify:track:6Ap9SM1WkmI4b4Mo2Cpa6f","NATTAN, Léo Foguete","Última Noite","Nattan",8,49,27,"1927884"
55,"spotify:track:5QbtKOsjbEGkx0GMiQGBZt","fhop music, Hamilton Rabelo","Tu és + Águas Purificadoras - Ao Vivo","FHOP Music",48,57,56,"1915934"
56,"spotify:track:2FG6DJRP9URLUHWn8GDYex","Incendiários, Marcelo Markes","Eu Tenho Você (Ao Vivo)","MM Produções",56,78,3,"1898883"
57,"spotify:track:4OrDHBIn0eJqwkzRHYsB0L","Brenno & Matheus","Falou Rodeio","New Music",56,58,7,"1884639"
58,"spotify:track:3aDV90V6vHUSYKKYDLNdQ8","Israel & Rodolffo, Jorge & Mateus","Marca Evidente - Ao Vivo","DAMASCENO MUSIC",58,60,17,"1879811"
59,"spotify:track:3cwVKjzKSTfvacYJF6Tkub","Léo Foguete","Última Noite - Solo","Acertei Produções",5,65,28,"1846960"
60,"spotify:track:5k7JSycp97vL45zSOoUsTE","Henrique & Juliano","Seja Ex (Ao Vivo)","Vida Nova Produções, sob licença exclusiva para Virgin Music Group",20,61,30,"1838124"
61,"spotify:track:0arxXBXzv96Q449DK1SmiX","BK, Kolo, Evinha","Cacos De Vidro (sample: Esperar pra Ver)","Gigantes",23,51,12,"1825296"
62,"spotify:track:5rHhO6SBSzo3E9m3KHyCtt","Murilo Huff, Ana Castela","Peça Íntima","M Show",8,80,28,"1810329"
63,"spotify:track:4f0aDk7HX37SfzerfznYlr","Grupo Menos É Mais, Matheus Fernandes","Lapada Dela - Ao Vivo","Som Livre",4,96,113,"1800545"
64,"spotify:track:4VNRWHoiKHZJIoQHPbmJIv","Felipe e Rodrigo","Gosta De Rua (Ao Vivo)","MK Records",1,73,55,"1785312"
65,"spotify:track:6RzcNTnS02dnqoQMdTkQwi","Brenno & Matheus, DJ Ari SL","Descer Pra BC","New Music",1,84,22,"1781183"
66,"spotify:track:1uYHfa5rjM1oUpKgst7U8F","Dj Aguilar, Dj Tchouzen, MC Marlon PH","Deixa Eu Mandar Meu Passinho","Dj Aguilar",66,193,2,"1763623"
67,"spotify:track:0pGsxpkJC9IwK93fmqEYXn","Grupo Menos É Mais","Aquele Lugar - Ao Vivo","Som Livre",67,79,10,"1762386"
68,"spotify:track:3xkHsmpQCBMytMJNiDf3Ii","Benson Boone","Beautiful Things","Night Street Records, Inc./Warner Records Inc.",40,63,58,"1740820"
69,"spotify:track:1daiWH5HMrDH9I8r3LIhqb","Bruno & Barretto, CountryBeat","Gerente da Sicredi","Bruto Memo New",69,-1,1,"1736414"
70,"spotify:track:7McCAKExE8KsI2q4Y8wx4U","Murilo Huff, Marília Mendonça","Dois Enganados","M Show",49,83,141,"1735057"
71,"spotify:track:1S9fKs0sAdZPlL8ViOARnS","Vitor Santana","João 20 + pra Sempre - Ao Vivo","Vitor Santana",71,158,6,"1734873"
72,"spotify:track:7MnT7msJZg3XBAS0OTfGrB","Legião Urbana","Tempo Perdido","EMI Brazil",72,95,68,"1732127"
73,"spotify:track:06n87WQroP5WFD4aR45T8X","DJ Japa NK, Mc Negão Original, MC Meno K","Comedinha Ficou Bravo","Love Funk",63,69,13,"1729365"
74,"spotify:track:63Vdw2P2cw1Gf8ABQiEjXD","Gusttavo Lima","Sofrimento Simultâneo - Ao Vivo","Sony Music Entertainment",19,35,4,"1724162"
75,"spotify:track:1h0yBDChztCJRTqmI5U6ou","MORADA","É Tudo Sobre Você / Ser Mudado - Ao Vivo","Onimusic",75,93,7,"1716340"
76,"spotify:track:6x6EA3N9xXgptSakS7VZUg","GORDÃO DO PC, Mc Menor DN, Mc Leozin, Ana Laura Lopes","FANTASMA (versão GORDÃO DO PC)","Alt Music",8,50,17,"1712973"
77,"spotify:track:3yCtRV7LMeGBpvSHDR8uMV","Boladin 211, MC Rick, MC Leozinho ZS, CAO$, Dj Lv Mdp, Dj Vitin do Pc","Chapa Máxima","WM Brazil",36,54,20,"1706135"
78,"spotify:track:0lTCXzpd3WL5FsPsrO2W4W","Israel & Rodolffo","Não, Mas Quase - Ao Vivo","Som Livre",78,123,2,"1688545"
79,"spotify:track:3H7eBmcTJyuEMStfmKuLmG","MC Cebezinho, DJ Oreia, MC Tuto, Love Funk, Kako","A Danada Me Ligando","Love Funk",1,68,34,"1679013"
80,"spotify:track:1l0wjEdL5zYutUW8tVFiZO","Mc Negão Original, DJ Japa NK, DJ Guh Mix","Medley de Igaratá 3","Cria Hit BR",10,66,24,"1650157"
81,"spotify:track:456hxgSVUAJVgPV0UncG68","DENNIS, Luísa Sonza","MOTINHA 2.0 (Mete Marcha)","Sony Music Entertainment",6,45,12,"1633245"
82,"spotify:track:2wG1mwTiuvqll9YYLMjSaY","ATLXS","PASSO BEM SOLTO - Slowed","broke",75,75,4,"1633132"
83,"spotify:track:4Nj2zoYULwyYnJTU3AZf6B","Diego & Victor Hugo","Dama do Baralho - Ao Vivo","Sony Music Entertainment",76,76,4,"1631013"
84,"spotify:track:4MF0VMffyxHsy3GZwwUnAs","Matuê","A Morte do Autotune","30PRAUM",52,71,55,"1609484"
85,"spotify:track:0zxWyvrKyz031tFfBnkYLr","Henrique & Juliano","Como É Que A Gente Fica (Ao Vivo)","Vida Nova Produções, sob licença exclusiva para Virgin Music Group",23,91,127,"1609430"
86,"spotify:track:4yEKHiUQA70cjfWnEL2m13","Drops INA, Paulo Vicente","É Ele","Onimusic",73,88,28,"1607248"
87,"spotify:track:6dOtVTDdiauQNBQEDOtlAB","Billie Eilish","BIRDS OF A FEATHER","Darkroom/Interscope Records",33,77,49,"1604377"
88,"spotify:track:3eHeTsX6W9iIEfn8l2xrWO","Henrique & Juliano","Meu Amor (Ao Vivo)","Vida Nova Produções, sob licença exclusiva para Virgin Music Group",65,82,113,"1593282"
89,"spotify:track:4dGx53NJZJyuuLP5ownH1p","Wesley Safadão, Natanzinho Lima","Mentira Estampada","Wesley Safadao",11,99,31,"1583601"
90,"spotify:track:7xcDd2JxnJtO87QQr8uY0O","Natanzinho Lima, Mc Tato, Gabb MC","Me Apaixonei Nessa Morena","Sua Música Digital",90,97,4,"1561589"
91,"spotify:track:7bukHRNgGLRySTJEVvLoIR","Henrique & Juliano","Briga Feia (Ao Vivo)","Vida Nova Produções, sob licença exclusiva para Virgin Music Group",22,104,130,"1558492"
92,"spotify:track:4SZWKdNMIaUUFNmtJAxYdr","Henrique & Juliano","Vidinha De Balada (Ao Vivo)","Vida Nova Produções, sob licença exclusiva para Virgin Music Group",5,156,93,"1553057"
93,"spotify:track:1pjpPXl66t4FeQaFscpG73","Henrique & Juliano","Cidade Vizinha (Ao Vivo)","Vida Nova Produções, sob licença exclusiva para Virgin Music Group",6,85,108,"1549412"
94,"spotify:track:6YdJ2jJOo143KhXT9qvQVe","MC GP, MC Jvila, MC LUUKY, Dj Yuri Pedrada","300 no 7","MC GP & GR6",11,70,41,"1543812"
95,"spotify:track:6h3EEYgtIuOjeqQPIC3H37","Eric Land, Natanzinho Lima","Pilantra e Meio","Eric Land",1,100,24,"1541403"
96,"spotify:track:5wV5dO1GOI4srs4Um5cJXo","J. Eskine, Alef Donk","Resenha de Ex-Love","HITLAB BREGA",7,64,9,"1539044"
97,"spotify:track:6JKkP9ABQzYZUFSKSVDKIc","1Kilo, Baviera, Knust, Pablo Martins","Deixe Me Ir (feat. Pablo Martins) - Acústico 1Kilo","1Kilo Records",1,94,151,"1517954"
98,"spotify:track:6C5EczmaeIUmf1pTYux9f1","Jorge & Mateus","Tem Amor, Tem Volta - Ao Vivo","Som Livre",98,148,6,"1517322"
99,"spotify:track:63BroH3HiwxYD8T5qTZiJn","Gusttavo Lima","A Noite (La Notte) - Ao Vivo","Sony Music Entertainment",3,-1,35,"1517042"
100,"spotify:track:2ZrC9CTs01XkbFPtLbpHzl","Mc Jacaré, DJ JHOW BEATS","Senta e Cala a Boca","Croco Hits",100,145,3,"1488893"
101,"spotify:track:5q0NlM6Pm8Pp3orq7zGiRn","Matheus & Kauan, Jorge & Mateus","Quarta Cadeira - Ao Vivo","Universal Music Ltda.",10,155,88,"1461865"
102,"spotify:track:74LohOvD6SpyKQHPt4WTGC","Ícaro e Gilmar","Voltável - Ao Vivo","MJ Records",102,122,5,"1461443"
103,"spotify:track:7tI8dRuH2Yc6RuoTjxo4dU","Jimin","Who","BIGHIT MUSIC",7,138,40,"1457254"
104,"spotify:track:0rosNwHC9T8YNu3EvXLPfX","Ferrugem","Me Bloqueia (Ao Vivo)","WM Brazil",65,72,36,"1451126"
105,"spotify:track:17phhZDn6oGtzMe56NuWvj","Teddy Swims","Lose Control","Warner Records",69,92,60,"1449649"
106,"spotify:track:2j7IPPMZt5nE5R4r2AbKZ8","Panda, Humberto & Ronaldo, Ícaro e Gilmar, MJ Records","12 Horas / Pra Você Acreditar - Ao Vivo","MJ Records.",106,113,3,"1446540"
107,"spotify:track:6sRLrSetyIwIKhW1eMlUNP","Matheus & Kauan, Marília Mendonça","Vou Ter Que Superar - Ao Vivo","Universal Music Ltda.",2,117,79,"1442006"
108,"spotify:track:7pkpWcko6KEZANj0xKsCsu","Matheus & Kauan","Cronômetro - Ao Vivo","Universal Music Ltda (S&D)",15,144,42,"1427021"
109,"spotify:track:5LCegtYPODbcqbTE5CZVv8","Manu, Simone Mendes","Daqui pra Sempre","manuoficial",3,74,59,"1425487"
110,"spotify:track:1N19UVD4GRBFT6UrDaX6rk","Turma do Pagode, Grupo Menos É Mais","Bebe e Vem Me Procurar / Quem Ama Sente Saudade (Ao Vivo)","Sony Music Entertainment",103,-1,39,"1417832"
111,"spotify:track:4PnYbyk6EA0zcASUc9huHP","Guilherme & Santiago, Jorge & Mateus","Pijama Amarelo - Ao Vivo","Deolli Music",111,180,5,"1414157"
112,"spotify:track:2jpbtp5N679x92uB8s8p9h","Suel, Grupo Menos É Mais","Vitamina C - Ao Vivo","Virgin Music Label And Artist Services (S&D)",83,109,28,"1410698"
113,"spotify:track:3QaPy1KgI7nu9FJEQUgn6h","Billie Eilish","WILDFLOWER","Darkroom/Interscope Records",66,110,37,"1400173"
114,"spotify:track:0KDxhAvKeiVFL1bZccQVJs","Zé Neto & Cristiano","Pulando o Muro - Ao Vivo","Som Livre",62,165,25,"1399718"
115,"spotify:track:4wJ5Qq0jBN4ajy7ouZIV1c","ROSÉ, Bruno Mars","APT.","Atlantic Records",8,105,27,"1389469"
116,"spotify:track:7Cf2Hsy3cPlA4e115tElXv","Henrique & Juliano","Liberdade Provisória (Live - Ibirapuera / 2019)","Vida Nova Produções, sob licença exclusiva para Virgin Music Group",1,149,156,"1379958"
117,"spotify:track:0TA12jLkmAdhkUa9Vz84jq","Aka Rasta","QUASE QUE FALEI TE AMO","Aka Rasta",117,143,2,"1379724"
118,"spotify:track:2kBxNuYFT0J8w9CD4ugLpJ","Marcos & Fernando, Henrique & Juliano","Trocaria Tudo - Ao Vivo","Work Show",75,81,5,"1379519"
119,"spotify:track:2drZGdAOxfE2KoMGTkidmq","MC Marks, MC Ryan SP, MC Jvila, MC Bruno MS, Mc Magal, Aaron Modesto, DJ Dael, MC LUUKY","365 Dias (Vida Mansa)","Legenda Records",9,102,30,"1370733"
120,"spotify:track:5mSprs9Ar10MWtbgJIERhP","PEDRO SAMPAIO, Anitta, Mc Gw","BOTA UM FUNK","WM Brazil",68,86,3,"1369876"
121,"spotify:track:0JPpScEAtvRvWQ38nifwO9","Kyan, Mu540, DJ Mzl Ori","USD, é USD!","EHXIS",89,89,2,"1366294"
122,"spotify:track:0d7oIw2t0f6oCXJUfWYw8E","Veigh, Supernova Ent","Mônaco Freestyle","Supernova Ent",53,98,8,"1359197"
123,"spotify:track:39O9PGzlZnVTOhAYQjyBRG","Natanzinho Lima","Uma e Quinze da Manhã","Sua Música Digital",2,118,21,"1358785"
124,"spotify:track:6ejIcf1OdUmtOJ7fpFcEXo","Mc Negão Original, DJ Guh Mix","Medley de Igaratá 4","Cria Hit BR",11,103,11,"1353774"
125,"spotify:track:2RkZ5LkEzeHGRsmDqKwmaJ","Alex Warren","Ordinary","Atlantic Records",125,181,2,"1352337"
126,"spotify:track:15CoBMXezZjfJuFpvuhYK3","Oruam, Ajaxx, Gigant, Goldgrain","22 Meu Vulgo","Mainstreet",54,90,9,"1352327"
127,"spotify:track:2LHNTC9QZxsL3nWpt8iaSR","Lady Gaga","Abracadabra","Interscope Records",12,136,12,"1345102"
128,"spotify:track:3tA0vALUwrzkTgHcm9j6oJ","Zé Neto & Cristiano","Notificação Preferida - Ao Vivo","Som Livre",2,170,112,"1340907"
129,"spotify:track:6wLTQ0PQAsFaTf4SfBDyYc","Matheus Fernandes, Matheus & Kauan","Triplex - Ao Vivo","Som Livre",4,124,46,"1340486"
130,"spotify:track:1FCvRATk4Wa30LW608ecEN","Natanzinho Lima","Chuva de Arroz","Sua Música Digital",130,186,9,"1338080"
131,"spotify:track:47j8u38wfvxdQeRA7TBJrB","MORADA","É Tudo Sobre Você - Ao Vivo","Onimusic",126,135,13,"1336446"
132,"spotify:track:0cQVqPuHQP4KEwc7ZUQmj6","The Neighbourhood","Sweater Weather","Columbia",79,115,121,"1328335"
133,"spotify:track:2t878JZCl8Ftd2mVzzakYc","Jorge & Mateus, Lauana Prado","Haverá Sinais - Ao Vivo","Som Livre",2,147,58,"1328036"
134,"spotify:track:2o2xhyri4aJUtgMGkf5P0J","ANAVITÓRIA, Lenine","Lisboa","F/SIMAS",83,112,25,"1321582"
135,"spotify:track:6m8AgjfI28ER6odzMxmHtR","Racionais MC's","Vida Loka, Pt. 1","Boogie Naipe",94,106,26,"1320692"
136,"spotify:track:2v6tleWu8HX7YPpF9PMUhS","Mc Lele JP, Mc IG, DJ Hyago, MC Ryan SP, MC LUUKY, MC Cebezinho","Chapa do Chatão","GRINGOS WORLD PRODUTORA",136,-1,1,"1319822"
137,"spotify:track:0hWzBcYtmwsL1TwByzjiUG","MC Joãozinho VT, Mc Negão Original, MC Tuto, Matheuszin DJ, Kako, MC Ryan SP","Boy Besta","Sonar Music",47,111,23,"1315611"
138,"spotify:track:7Elw15XWLpOi4qzHyAwa9e","Gloria Groove","Nosso Primeiro Beijo - Ao Vivo","SB Music",18,151,47,"1305833"
139,"spotify:track:4bDvY5oGtCWTYH5Vi36bc5","Henrique & Juliano","Mais Amor E Menos Drama (Ao Vivo)","Vida Nova Produções, sob licença exclusiva para Virgin Music Group",94,162,110,"1301666"
140,"spotify:track:4IlklRFZUgNQlwwW0PSLm7","Grelo, Henrique & Juliano","Paredões","Henrique & Juliano",23,134,21,"1292005"
141,"spotify:track:6v6MmJlw7elqJUty23mvS4","Dj Tchouzen, Mc Rodrigo do CN","Cada Vez Mais Gostosa","Dj Tchouzen",141,196,2,"1281265"
142,"spotify:track:2655xYZ347fG2N6OjkoMQ8","Jorge & Mateus","Logo Eu","Som Livre",88,127,31,"1280082"
143,"spotify:track:1sWx8hqMdjT3Gc7F9BSbUY","Eric Land, Mc Livinho, DJ TOPO","Na Imaginação","Eric Land",143,-1,1,"1279678"
144,"spotify:track:1JSTJqkT5qHq8MDJnJbRE1","The Police","Every Breath You Take","Polydor Records",136,152,44,"1279668"
145,"spotify:track:7JtJjh9WfxUOpjFhurxVRW","Julliany Souza","Quem É Esse? - Ao Vivo","Julliany Souza",130,130,7,"1278655"
146,"spotify:track:7CyPwkp0oE8Ro9Dd5CUDjW","The Weeknd, JENNIE, Lily-Rose Depp","One Of The Girls (with JENNIE, Lily Rose Depp)","XO / Republic Records",61,132,69,"1260167"
147,"spotify:track:0fK7ie6XwGxQTIkpFoWkd1","JENNIE","like JENNIE","OA Entertainment/Columbia",85,137,7,"1260047"
148,"spotify:track:2Xcc5Rsawh7EkzUwdVFrnn","Henrique & Juliano","Mudando De Assunto (Ao Vivo)","Vida Nova Produções, sob licença exclusiva para Virgin Music Group",120,120,5,"1255674"
149,"spotify:track:6UzGpz33nYXa3gAEJ1mndV","Hugo & Guilherme, Maiara & Maraisa","O Meu Coração Em Suas Mãos (Colgando en tu manos) - Ao Vivo","Som Livre",10,164,38,"1252227"
150,"spotify:track:1Nmcs8zk7LfcvHRgLtTM5J","Orochi, Papatinho","Amor de Fim de Noite","Mainstreet Records",36,119,87,"1251159"
151,"spotify:track:5k21RXqN11N0TIeLLySlDv","Isadora Pompeo","Ovelhinha (Ao Vivo)","Sony Music Entertainment",110,146,42,"1242295"
152,"spotify:track:2wXqRqVGiGB2fyy9eoPJbP","Mc Lele JP, MC Marks, MC Leozinho ZS, MC Joãozinho VT","Eu sou Cantor Não Sou Bandido","A Luz Records",19,108,30,"1236955"
153,"spotify:track:7dKqPh21HpsysZvRWyNeM1","Isadora Pompeo","Bênçãos Que Não Têm Fim (Counting My Blessings)","Sony Music Entertainment",10,166,70,"1233442"
154,"spotify:track:64glhjITyT7oxYSwtPz4Fw","CountryBeat","Os Rodeio Tá Chegando (Pa Pa Pa)","AgroPlay",154,-1,1,"1232515"
155,"spotify:track:1AM8pZn5uY89vkItAH5bm3","Felipe Araújo, Luan Pereira","Body Splash - Ao Vivo","Universal Music Ltda.",26,179,24,"1230284"
156,"spotify:track:1ggAVLO5PbO0I2mWDlsFFQ","Henrique & Juliano","Recaídas (Ao Vivo)","Vida Nova Produções, sob licença exclusiva para Virgin Music Group",137,142,18,"1230144"
157,"spotify:track:7pBPXkaVQaP3Y3Wwfkpvbn","Hugo & Guilherme, Wesley Safadão","Mentirosa - Ao Vivo","Som Livre",6,101,18,"1228459"
158,"spotify:track:1MparvKC8QIDwu06iO3qVr","Henrique & Juliano","Volta Por Baixo (Ao Vivo)","Vida Nova Produções, sob licença exclusiva para Virgin Music Group",3,-1,89,"1226274"
159,"spotify:track:1DLKuppSYytOuxhtI6KBGu","Tribalistas","Aliança","Phonomotor",74,139,33,"1211331"
160,"spotify:track:3zXIfbjxSzPMNP6JDZsQsi","Orochi, Kizzy","Mitsubishi","Mainstreet Records",119,140,20,"1204614"
161,"spotify:track:5mPn4ueXc1oua018FDvknz","MC Joãozinho VT, DJ JR No Beat","Calculista","Sonar Music",47,128,26,"1203020"
162,"spotify:track:4ssHL7bSnOAE7HjiuLx6Co","Matuê","Crack com Mussilon","30PRAUM",1,121,33,"1194881"
163,"spotify:track:7jCgslBhuPF61B6yk90VYb","MC Ryan SP, Mc IG, DJ Japa NK, Nilo, Boladin 211, MC LUUKY, Mc Negão Original","Sexta Feira Hoje Tem","WM Brazil",106,116,14,"1184729"
164,"spotify:track:5CSzt2msdo6pWVxkaKX1FG","Theuzinho","Não Tente Me Impedir","Theuzinho Cantor",146,153,3,"1181027"
165,"spotify:track:25CffgwZg6vlUdCsHJijZo","Panda, Ícaro e Gilmar, MJ Records","Baqueado - Ao Vivo","MJ Records.",165,192,5,"1180158"
166,"spotify:track:18z8Px2zIsaQrtszgWdVZn","BK, Deekapz, Evinha","Só Quero Ver","Gigantes",41,126,13,"1172289"
167,"spotify:track:4SuVkAenxirZckaa3tC4uz","Mari Fernandez, Lauana Prado","Maluca - Ao Vivo","Som Livre",149,-1,2,"1166366"
168,"spotify:track:5XeFesFbtLpXzIVDNQP22n","Arctic Monkeys","I Wanna Be Yours","Domino Recording Co",78,168,129,"1164454"
169,"spotify:track:2HRqTpkrJO5ggZyyK6NPWz","Sabrina Carpenter","Espresso","Island Records",49,133,54,"1163309"
170,"spotify:track:6cFW2FPaUL4YRJfS9zFJaV","Simone Mendes","Dois Tristes - Ao Vivo","UME - Global Clearing House",4,183,54,"1161626"
171,"spotify:track:0GbvYZsvz7bWyijBDESebX","Simone Mendes","Mulher Foda - Ao Vivo","Universal Music Ltda.",10,160,39,"1156958"
172,"spotify:track:3Sa2gVQioE31DcG4nKNDqD","Matuê, Brandão85","Isso é Sério","30PRAUM",14,141,27,"1156226"
173,"spotify:track:06VStvBWfFbepR97LhRo8D","Mc IG, Mc Negão Original, MC Ryan SP, MC Jvila, DJ Guh Mix, Mc Lele JP, Murillo e LT no Beat","Contagem Regressiva","WM Brazil",96,114,4,"1151269"
174,"spotify:track:7izihBeq9rmGYnierSTjv8","Gamadinho","Instinto - Ao Vivo","Gamadinho",151,190,16,"1146383"
175,"spotify:track:344LzkpddPjSAkEtJK83QL","Ana Castela, Léo Foguete, AgroPlay","Sem Você","AgroPlay",40,159,18,"1141961"
176,"spotify:track:3zlU0V45H1FcjZeGEVt8ih","Gustavo Mioto, Jorge & Mateus","Anti Amor - Ao Vivo","Universal Music Ltda.",7,-1,81,"1137482"
177,"spotify:track:371Up3WP7OqJNFPf0BiyUe","Zé Neto & Cristiano","Largado Às Traças - Ao Vivo","Som Livre",1,-1,86,"1131742"
178,"spotify:track:7DWmnmZJicTPIxoZb0m9Go","Casa Worship","Eu Te Vejo Em Tudo","Casa Worship",167,-1,6,"1129880"
179,"spotify:track:2262bWmqomIaJXwCRHr13j","Gigi Perez","Sailor Song","Gigi Perez PS/ Island",156,174,5,"1123315"
180,"spotify:track:5hFh5hsMEmfRYZvh4FRE8Z","Clayton & Romário","Sei Tocar Violão - Ao Vivo","WM Brazil",15,163,29,"1122475"
181,"spotify:track:2jNychTlNots7P3bMt41aa","Isaias Saad","Bondade de Deus","Onimusic",152,172,33,"1121186"
182,"spotify:track:7IFsTX5H1sWcEl8joV0IdD","THE BOX, Mc Brinquedo, MC Cebezinho, MC Tuto, Mc Laranjinha, DJ Oreia","THE BOX MEDLEY FUNK 2","Sony Music Entertainment",1,169,52,"1102116"
183,"spotify:track:5r9CZJMoMmxio2AnJdxuDS","Grupo Menos É Mais, Di Propósito, Vou Zuar","Pot-Pourri: Melhor Eu Ir / Ligando Os Fatos / Sonho de Amor / Deixa Eu Te Querer - Ao Vivo","Som Livre",21,-1,203,"1099709"
184,"spotify:track:6vq7r1Pqd3pyI07u63cPZV","Simone Mendes","Erro Gostoso - Ao Vivo","Universal Music Ltda.",3,-1,106,"1098909"
185,"spotify:track:7snQQk1zcKl8gZ92AnueZW","Guns N' Roses","Sweet Child O' Mine","Guns N Roses P&D",147,-1,6,"1094576"
186,"spotify:track:5Fhr3wqeieN5WDkAsqL1JJ","j-hope","MONA LISA","BIGHIT MUSIC",46,150,5,"1089483"
187,"spotify:track:0AsfpL8bzbmEyJsfbPPYnj","Charlie Brown Jr.","Zóio De Lula","EMI Brazil",168,182,9,"1088234"
188,"spotify:track:6bTdZ7xfKp3NqqADJ8HLyj","Matuê, WIU, Teto","Vampiro","Sony Music Entertainment",1,-1,127,"1084114"
189,"spotify:track:2077eHXxwRgxDhEBtJV0wD","Jorge & Mateus","Amo Noite E Dia - Live In Sao Paulo / 2010","Universal Music Ltda.",161,191,5,"1083545"
190,"spotify:track:0vFVkEDrV58pAPEtKJLvP5","Songs Five Music, José Jr","Yeshua - Ao Vivo","The Bow",182,194,4,"1082088"
191,"spotify:track:7xeqjq45imp3qonWKqfyip","PEDRO SAMPAIO, Mc Gw, Mc Debby, Mc Talibã","SEQUÊNCIA STRIPTEASE","WM Brazil",30,129,16,"1078950"
