rank,uri,artist_names,track_name,source,peak_rank,previous_rank,weeks_on_chart,streams
1,"spotify:track:4G7bbgD2DHORU4frrWoCXp","DJ Japa NK, MC Meno K, MC Ryan SP, Mc Jacaré, DJ DAVI DOGDOG","Posso Até Não Te Dar Flores","BOLOLO REC",1,1,9,"19139140"
2,"spotify:track:38Ps9Kui6qJjpVqdBOfN5M","Grupo Menos É Mais, Simone Mendes","P do Pecado - Ao Vivo","Som Livre",1,2,29,"9454190"
3,"spotify:track:4ukpXdplqDEMk3Fy2i30oI","MC GP, Mc Lele JP, DJ DAVI DOGDOG, Dj Andrabeat","ME POSTOU NO DAILY - FESTA DO BIG G","WM Brazil",3,3,8,"8638504"
4,"spotify:track:6tUdNbB9aYbX0sUDXOzX1u","Diego & Victor Hugo","Tubarões - Ao Vivo","Sony Music Entertainment",1,5,40,"7818438"
5,"spotify:track:1JUmsSEfVwhdJCVBG83XGU","PEDRO SAMPAIO, Mc Gw, Mc Jhey, Mc Rodrigo do CN, MC Nito","SEQUÊNCIA FEITICEIRA","WM Brazil",2,4,12,"7777989"
6,"spotify:track:4SjcIkVc4cvFgURD1EHxDM","Vitinho Imperador","Eu Me Apaixonei","Vitinho Imperador",5,6,13,"7040597"
7,"spotify:track:6B7ot6Wlqf7zt3FCkYl2FJ","Grupo Menos É Mais, NATTAN","Pela Última Vez - Ao Vivo","Som Livre",3,7,13,"6744139"
8,"spotify:track:5Nj2UVsxXAvhfYNpcre3al","Dj Caio Vieira, MC Meno K, Mc Rodrigo do CN","FAMOSINHA","BR MUSIC DIREITOS MUSICAIS LTDA.",1,8,27,"6037406"
9,"spotify:track:2Hw0LzrD6ic8AckKBxJhiO","Murilo Huff","Deixa Eu - Ao Vivo","M Show",8,9,14,"5641746"
10,"spotify:track:4c4tcqYfqiFc527gqNdRE5","Clayton & Romário, Zé Felipe","Se Eu Te Perdoar - Ao Vivo","WM Brazil",6,10,10,"5565350"
11,"spotify:track:17tg01y3RhlfRKMnd333yL","Danilo e Davi","Apaga Apaga Apaga - Ao Vivo","Som Livre",1,12,54,"5396192"
12,"spotify:track:4y93vvzu2h8MITw7YyUTcI","Henrique & Juliano","Última Saudade (Ao Vivo)","Vida Nova Produções, sob licença exclusiva para Virgin Music Group",1,11,60,"5391717"
13,"spotify:track:6Kyl2nFgU0J8WBlbBvDv6g","Grupo Menos É Mais","Coração Partido (Corazón Partío) - Ao Vivo","Som Livre",1,13,64,"5272049"
14,"spotify:track:25CffgwZg6vlUdCsHJijZo","Panda, Ícaro e Gilmar, MJ Records","Baqueado - Ao Vivo","MJ Records.",9,15,35,"5083154"
15,"spotify:track:44CTudFZ0kbaIF9n0jk7oU","Matheus & Kauan, Ana Castela","Ilusão De Ótica - Ao Vivo","Universal Music Ltda (S&D)",11,16,43,"4827321"
16,"spotify:track:2ejSYn4SfoE07mXPlnYVED","Rafa e Junior, Hugo & Guilherme, DJ Ari SL","Ama Um Maloqueiro","WM Brazil",4,14,26,"4708594"
17,"spotify:track:2GylVVMD21R4SqgAt8gGC5","Felipe Amorim, Vitão, BIN, Malibu","Eu Vou na Sua Casa","One Play",2,18,22,"4476383"
18,"spotify:track:4l2Fyw7EYB5XjcKwqcwuHQ","DJ Zigão, MC Roger","Tô na Brasilia com o Zigão","MSTT Records",18,20,8,"4210286"
19,"spotify:track:7tesyGMnAFNI0l2xaxcFKi","Henrique & Juliano","Saudade De Quem Eu Sou (Ao Vivo)","Vida Nova Produções, sob licença exclusiva para Virgin Music Group",11,17,36,"4169149"
20,"spotify:track:2De1EHbIhepIVLHZ16bySE","Veigh, Supernova Ent","Talvez você precise de mim","Supernova Entertainment",17,19,21,"4139709"
21,"spotify:track:4V2rUOmaevK0C1bKAkeFf5","Panda, MJ Records","Eu Te Seguro - Ao Vivo","Sony Music Entertainment",21,22,9,"4100877"
22,"spotify:track:6IFF888dQ0P6ilbj4kL6G8","Grupo Menos É Mais","Aquele Lugar - Ao Vivo","Som Livre",15,25,40,"3773453"
23,"spotify:track:5k7JSycp97vL45zSOoUsTE","Henrique & Juliano","Seja Ex (Ao Vivo)","Vida Nova Produções, sob licença exclusiva para Virgin Music Group",20,24,60,"3695388"
24,"spotify:track:0IBCX7PC9NcfFLuyoHxTNt","Zé Neto & Cristiano","Escondendo o Ouro - Ao Vivo","Som Livre",8,21,26,"3596822"
25,"spotify:track:1N19UVD4GRBFT6UrDaX6rk","Turma do Pagode, Grupo Menos É Mais","Bebe e Vem Me Procurar / Quem Ama Sente Saudade (Ao Vivo)","Sony Music Entertainment",15,27,69,"3548135"
26,"spotify:track:0qZwqMsGSClyrKzbVbRto9","Diego & Arnaldo, Zé Neto & Cristiano","Vai Cair Água - Ao Vivo","Som Livre",21,26,16,"3506041"
27,"spotify:track:4mevJ3Ki58x4cQgWheMAPd","Jorge & Mateus","Sol Nos Olhos","Som Livre",27,78,2,"3315436"
28,"spotify:track:4QZqSqxdcgAbtZle4MS4ph","Gusttavo Lima","Retrovisor","Sony Music Entertainment",13,39,14,"3300850"
29,"spotify:track:6YAK1Sle1Wl7jOurqwWCfh","DJ DUARTE, DJ ORBITAL, Dj Rs","MONTAGEM CAMERA LENTA","Prime Funk",29,48,3,"3250689"
30,"spotify:track:1I6TdHxz61Kf9EFje0dQvg","Luan Santana","OLHO MARROM - Ao Vivo em Lisboa","Sony Music Entertainment",25,36,8,"3249594"
31,"spotify:track:07kLShG3HTeLXTqnFCqNAJ","Henrique & Juliano","Amigo Da Minha Saudade (Ao Vivo)","Vida Nova Produções, sob licença exclusiva para Virgin Music Group",18,28,46,"3244941"
32,"spotify:track:2j7IPPMZt5nE5R4r2AbKZ8","Panda, Humberto & Ronaldo, Ícaro e Gilmar, MJ Records","12 Horas / Pra Você Acreditar - Ao Vivo","MJ Records.",18,35,33,"3231592"
33,"spotify:track:2gLUZtZN1gfercLP9guft3","Léo Santana, Melody","Desliza (""Ólhinho"" No Corpinho)","Universal Music Ltda.",24,29,16,"3218381"
34,"spotify:track:5aMgTcyBPH90hWHhbNKTwR","Diego & Victor Hugo","Entregador de Flor - Ao Vivo em Brasília","Sony Music Entertainment",4,31,62,"3191957"
35,"spotify:track:3M4HJl7D77l86gL1QXGJHG","Lauana Prado, Simone Mendes","Saudade Burra - Ao Vivo","Universal Music Ltda.",11,32,45,"3143054"
36,"spotify:track:473DqaeIno75pBbp0bNrkT","Matheus Vargas, Cleber & Cauan","Desocupa","MV Produções Artisticas",24,40,6,"3103404"
37,"spotify:track:6OPfBo0J6yqzSY9WxNlbA5","MC Willian, DJ Japa NK, DJ DAVI DOGDOG","Valentino","Cria Hit BR",23,38,12,"3076862"
38,"spotify:track:6zxthXT7GUBX83vRmQiN3x","Felipe e Rodrigo","Caos De Alguém (Ao Vivo)","MK Records",6,34,18,"3044029"
39,"spotify:track:53iuhJlwXhSER5J2IYYv1W","Taylor Swift","The Fate of Ophelia","Taylor Swift",4,30,7,"3043208"
40,"spotify:track:5foViOTHRbErvRNf3VQ3rs","CountryBeat, Ana Castela","Ninguém Pode Saber","CountryBeat",22,23,4,"3005724"
41,"spotify:track:1mnMkTvrPi4iTblXaRvOoi","Gusttavo Lima, Luis Fonsi","Vagabundo","Sony Music Entertainment",38,41,6,"2969082"
42,"spotify:track:39KwMv89TaEdaBrvk28AMC","Felipe e Rodrigo","Dois Gumes (Ao Vivo)","MK Records",42,64,2,"2955543"
43,"spotify:track:4j9UHHiN68z5WL0AdYZC6a","Zé Felipe, Ana Castela","Sua Boca Mente (You're Still The One)","Som Livre",8,33,7,"2951712"
44,"spotify:track:6kaWah1Acn1dtNjAy6sm1p","DJ Oreia, Mc Lele JP, MC Meno K, MC Ryan SP, MC Tuto, Mc Negão Original","Diário de um Cafajeste","GRINGOS WORLD PRODUTORA",44,172,2,"2898166"
45,"spotify:track:3p58wJmZqIc9RjsdeZ5Jfq","Mc Negão Original, MC Jvila, MC Willian, DJ Japa NK, MC Meno K, DJ Guh Mix","Vou pela Madrugada","Cria Hit BR",23,37,19,"2893600"
46,"spotify:track:6vGZfODFI1FxMImSUbdJhz","Zé Neto & Cristiano","Resumindo - Ao Vivo","Som Livre",17,42,26,"2837685"
47,"spotify:track:280QfKhmWGn3LbyB39aA7u","Léo Foguete","Cópia Proibida","Acertei Produções",5,43,55,"2709371"
48,"spotify:track:5bPVaf87iW31GGfmk2yqsd","Dj Guuh, Mc Rodrigo do CN","VAI NO CHÃO BANDIDA","Prodok Music Group",48,50,20,"2689794"
49,"spotify:track:4W9nFl732s6NdToGaCfiSl","Guilherme & Benuto, Grupo Menos É Mais, Matheus Fernandes","Grau de Maluca - Ao Vivo","Sony Music Entertainment",11,46,20,"2640437"
50,"spotify:track:5gVw9bogIHeCCTyGbGoUuY","Luan Pereira, Lauana Prado","LENÇOL DE SEDA - Ao Vivo","Som Livre",50,74,2,"2580288"
51,"spotify:track:4dGx53NJZJyuuLP5ownH1p","Wesley Safadão, Natanzinho Lima","Mentira Estampada","Wesley Safadao",11,51,61,"2550766"
52,"spotify:track:3WvQaS0tluzeCN1KR5tiFi","Xand Avião, Henrique & Juliano","Não é o Lugar, é a Pessoa","Universal Music Ltda.",29,44,5,"2513303"
53,"spotify:track:3lKOC96UdjCG47HZDJVyih","Simone Mendes","Saudade Proibida - Ao Vivo","Universal Music Ltda.",1,45,33,"2491855"
54,"spotify:track:020De83tFmcTrgEpzdUCNS","Mc Lele JP, MC Leozinho ZS, MC GH Original, MC Menor ZL, DJ GORDINHO DA VF, MC Meno K, MC PR","Vai Tomando Pock Pock","GRINGOS WORLD PRODUTORA",54,55,7,"2440726"
55,"spotify:track:2W8XL6iRGMmGHpqW2TKcXc","Gusttavo Lima","Pelo Bem da Minha Saudade","Sony Music Entertainment",46,69,14,"2297434"
56,"spotify:track:3cwVKjzKSTfvacYJF6Tkub","Léo Foguete","Última Noite - Solo","Acertei Produções",5,58,58,"2248153"
57,"spotify:track:4bioqBfAE9nhxwecok2cYB","Dj Gustomares, MC Flavinho, Iraqui ZL","Bandido problemático","TREM",45,47,6,"2200544"
58,"spotify:track:0hB6UKgc3iKTphmGuWpNOg","Prod Gomes, DJ Gomes Original, Yuri Redicopa, Bisqui","Faz assim","Rua B Records",52,52,7,"2138582"
59,"spotify:track:1FoV9rUsKIecaQpSap2YLn","Guilherme & Benuto, Luan Santana","Quarto 67 - Ao Vivo","Sony Music Entertainment",59,65,9,"2127928"
60,"spotify:track:708yXS1fLm1gAXFyIQxtX2","Henrique & Juliano","Romântico (Ao Vivo)","Vida Nova Produções, sob licença exclusiva para Virgin Music Group",25,56,55,"2123068"
61,"spotify:track:7MnT7msJZg3XBAS0OTfGrB","Legião Urbana","Tempo Perdido","EMI Brazil",61,66,98,"2107913"
62,"spotify:track:4pOGEJRVOuaa9oyy7qTGf6","Nilo, Mc Paiva ZS, DJ Di Marques, Tropa da W&S, FamousKyo","Fui Mlk","WMD",1,70,52,"2075999"
63,"spotify:track:1gftPqMrQEkdJh2WbVRA1f","Simone Mendes","Me Ama Ou Me Larga - Ao Vivo","Universal Music Ltda.",3,57,42,"2072233"
64,"spotify:track:4SHKz1SM7aikyK9WLAuN1J","Grupo Menos É Mais","Tarde Demais / Mágica / Oh! Chuva - Ao Vivo","Som Livre",52,73,15,"2059025"
65,"spotify:track:1S9fKs0sAdZPlL8ViOARnS","Vitor Santana","João 20 + pra Sempre - Ao Vivo","Vitor Santana",43,53,36,"2006369"
66,"spotify:track:035Q417M83JnP3wvSlyFEK","Julliany Souza","Quem É Esse? - Ao Vivo","Julliany Souza",53,76,36,"1998707"
67,"spotify:track:5oI9blwsXC8AkTWw6wASY8","Matuê","Máquina do Tempo","Sony Music Entertainment",2,72,113,"1993458"
68,"spotify:track:2Z1DmmPWD3Lm0dWAxMfjxG","MC Jvila, Mc Negão Original, DJ Dael, DJ Guh Mix","Pirocada Quente","Legenda Records",11,62,40,"1979730"
69,"spotify:track:0Ao4OLBAduB4y8H80EKqTO","Natanzinho Lima","Sonho de Amor - Ao Vivo","Sua Música Digital",69,99,11,"1961464"
70,"spotify:track:5YG4rxeltvw2KmOy0dW4z9","DJ YUZAK, MC BN, Mc RN Original","Montagem Sarra Sarra","Mandelão Records",70,-1,1,"1960757"
71,"spotify:track:1h0yBDChztCJRTqmI5U6ou","MORADA","É Tudo Sobre Você / Ser Mudado - Ao Vivo","Onimusic",50,54,37,"1941560"
72,"spotify:track:4f0aDk7HX37SfzerfznYlr","Grupo Menos É Mais, Matheus Fernandes","Lapada Dela - Ao Vivo","Som Livre",4,83,143,"1924199"
73,"spotify:track:65vJAh07BdwurqR9SRa6f8","Ferrugem, Sorriso Maroto","Apaguei Pra Todos - Ao Vivo","WM Brazil",17,81,83,"1914743"
74,"spotify:track:6Tp4LCJ5r5IJaEf8lnlPfG","Henrique & Juliano","De Trás Pra Frente (Ao Vivo)","Vida Nova Produções, sob licença exclusiva para Virgin Music Group",17,68,162,"1902458"
75,"spotify:track:2gfn28JSINCJGLrUimmu0l","Jorge & Mateus","Cantada Boba - Ao Vivo","Som Livre",11,80,54,"1898134"
76,"spotify:track:4jUZymsR3lkia9wkP0o9cX","DJ TOPO, Mc Livinho","MTG NA IMAGINAÇÃO - TOPO SESSIONS VOL. 1","DJ TOPO",6,107,59,"1888619"
77,"spotify:track:7CIx2glE3HjBtXRrZzfowf","Hugo & Guilherme, Ana Castela","Todo Mundo Menos Eu - Ao Vivo","Som Livre",20,67,11,"1867088"
78,"spotify:track:5MsjEmVkcxhEcjYHnxDWRi","Murilo Huff","Né - Ao Vivo","M Show",78,88,3,"1850466"
79,"spotify:track:5ntUQs7jxnUH8SukZy4830","Vitor Limma, Yan","Meu Jeito de Amar / Final de Tarde - Ao Vivo","3 Desejos Produções Artísticas",66,98,16,"1821153"
80,"spotify:track:7aOv4uSAmiB9XKnkibqSdo","cjnobeat, Mc Morena, Mc Gw","Até Quebrar a Cama 2.0","cjnobeat",80,82,5,"1816532"
81,"spotify:track:2RkZ5LkEzeHGRsmDqKwmaJ","Alex Warren","Ordinary","Atlantic Records",30,77,32,"1800392"
82,"spotify:track:0zxWyvrKyz031tFfBnkYLr","Henrique & Juliano","Como É Que A Gente Fica (Ao Vivo)","Vida Nova Produções, sob licença exclusiva para Virgin Music Group",23,91,157,"1769065"
83,"spotify:track:1bCaoRRWUoDFuGJsORcV19","Mc Jacaré, DJ JHOW BEATS","Senta e Cala a Boca","Croco Hits",10,93,32,"1767247"
84,"spotify:track:29DLL9iGJZFwtGyubk5g9v","Mc Jacaré, Mc Negão Original, DJ Japa NK","Eu Até Gosto de Você","Croco Hits",68,75,26,"1750968"
85,"spotify:track:6xgf2Nigvj0JuyNFFDAG7t","MC Jvila, G.A, Nagalli, Toledo, Honaiser","Pantera","GR6 Music",55,63,6,"1739104"
86,"spotify:track:7jCgslBhuPF61B6yk90VYb","MC Ryan SP, Mc IG, DJ Japa NK, Nilo, Boladin 211, MC LUUKY, Mc Negão Original","Sexta Feira Hoje Tem","WM Brazil",72,112,41,"1734786"
87,"spotify:track:3R8dmcSyROSR73XsdeSd7g","Clayton & Romário","Opa Cadê Eu - Ao Vivo","WM Brazil",4,87,41,"1727528"
88,"spotify:track:73SqSkZt2yseVL513HyMgA","J. Eskine, Alef Donk, Oruam","AMOR BANDIDO","HITLAB BREGA",38,60,9,"1725150"
89,"spotify:track:2je7f5dovpUabOqTSfyD5V","Grupo Menos É Mais","Jejum de Amor / Caixa Postal / Vida Vazia - Ao Vivo","Som Livre",63,97,18,"1711244"
90,"spotify:track:4HgSxgv95es0rsPRS98nKZ","Marília Mendonça","Segundo Amor da Sua Vida","Som Livre",38,59,4,"1693492"
91,"spotify:track:4gBLQeJrre7DklMZIaPXPd","Bruno Rosa, Jorge & Mateus","A Grama do Vizinho - Ao Vivo","WM Brazil",35,113,19,"1690385"
92,"spotify:track:4wS0KiOv6bmz1f6BkTVOOA","DJ Japa NK, Zago, Mc Lele JP","Hoje Eu Contei 100K No 7","2025 Kondzilla Nova Era",89,89,2,"1674161"
93,"spotify:track:4VNRWHoiKHZJIoQHPbmJIv","Felipe e Rodrigo","Gosta De Rua (Ao Vivo)","MK Records",1,119,85,"1668025"
94,"spotify:track:0VlRvd4TWCFU6qhgfLiAjk","Fernando & Sorocaba, Léo Foguete","Férias em Salvador - Ao Vivo","F&S Producoes Artisticas",94,-1,1,"1660384"
95,"spotify:track:1qyiBNYS01TjMkmoeTLJXN","Matuê","A Morte do Autotune","30PRAUM",33,94,85,"1651286"
96,"spotify:track:5asabafNzfAzjUecDvuNES","Henrique & Juliano","Aquela Pessoa (Ao Vivo)","Vida Nova Produções, sob licença exclusiva para Virgin Music Group",34,95,199,"1650330"
97,"spotify:track:07YFNeWYEuQ4XQfDd8571k","MC Guh SR, Detagaz, Dj Pikeno Mpc, DJ Silvério","MTG Perna Bamba X Piranhas do Helipa","Mandelão Records",93,96,11,"1646198"
98,"spotify:track:10MsXPpQLz5ZrOEZxTtkIm","Ana Castela","Olha Onde Eu Tô","Ana Castela",15,84,25,"1644585"
99,"spotify:track:7pkpWcko6KEZANj0xKsCsu","Matheus & Kauan","Cronômetro - Ao Vivo","Universal Music Ltda (S&D)",15,136,72,"1643127"
100,"spotify:track:7G8V8LiyyqwzSlsQLiaitN","Mc Lele JP, DJ Guh Mix","Toma Gostosona","Cria Hit BR",100,124,3,"1630453"
101,"spotify:track:7yRlmQTjZ5pdtlq7ska9mj","Veigh, Supernova Ent","Artista Genérico","Supernova Entertainment",1,86,21,"1612223"
102,"spotify:track:6k2IgWmtJ0I3CtiKdEqSqe","Ana Castela","Neon - Spotify Sessions","Ana Castela",79,79,2,"1606462"
103,"spotify:track:2ThEetsRrVOEoCNpoFVDjM","Felipe e Rodrigo","Melhor Me Bloquear (Ao Vivo)","MK Records",96,133,16,"1599887"
104,"spotify:track:7lZrRxcqaKvrtY76PLyPBD","Ferrugem","Apagar (Fundo Raso)","Warner Music Group - X5 Music Group",66,137,22,"1595782"
105,"spotify:track:3aDV90V6vHUSYKKYDLNdQ8","Israel & Rodolffo, Jorge & Mateus","Marca Evidente - Ao Vivo","DAMASCENO MUSIC",58,144,47,"1592609"
106,"spotify:track:79Wou8NwYEFzTyDQudjENF","Diego & Victor Hugo","Desbloqueado - Ao Vivo","Sony Music Entertainment",17,102,70,"1591413"
107,"spotify:track:7so0lgd0zP2Sbgs2d7a1SZ","Lady Gaga, Bruno Mars","Die With A Smile","Interscope Records",5,111,66,"1587830"
108,"spotify:track:4JYyktVuU06M2I8sTAVjAw","Dj Luan Gomes, DJ DAVI DOGDOG, DJ Japa NK, MC Meno K, Teko Bolado","SENTA POCA (POSSO ATÉ NÃO TE DAR FLORES)","JNK Records",100,100,2,"1579169"
109,"spotify:track:3nI0piSOxAik2RCpHGloB7","Charlie Brown Jr.","Só Os Loucos Sabem","Best",82,127,31,"1572008"
110,"spotify:track:3nCuLb5HKpHYpUY3u47KG1","Panda, Humberto & Ronaldo, Ícaro e Gilmar, MJ Records","Tem Que Ser Você / O Que Combina Comigo É Você - Ao Vivo","MJ Records.",110,128,11,"1570523"
111,"spotify:track:5QbtKOsjbEGkx0GMiQGBZt","fhop music, Hamilton Rabelo","Tu és + Águas Purificadoras - Ao Vivo","FHOP Music",32,71,86,"1566451"
112,"spotify:track:3ZbetlcfZ0tgVWdvnRzuLB","Talita Mel, Xand Avião","Melzinho","Sua Música Digital",23,118,22,"1560505"
113,"spotify:track:5BI4zdNsBNEBSPzYkO2EXZ","Luan Pereira, Felipe Amorim","DENTRO DA LAND ROVER - Ao Vivo","Som Livre",32,49,9,"1551346"
114,"spotify:track:5q0NlM6Pm8Pp3orq7zGiRn","Matheus & Kauan, Jorge & Mateus","Quarta Cadeira - Ao Vivo","Universal Music Ltda.",10,92,118,"1547486"
115,"spotify:track:2jpbtp5N679x92uB8s8p9h","Suel, Grupo Menos É Mais","Vitamina C - Ao Vivo","Virgin Music Label And Artist Services (S&D)",83,157,58,"1546519"
116,"spotify:track:5dcOxj5o672WzZCc7OOUkX","Felipe Amorim, Carol Biazin","Amor Traumatizado","One Play",18,120,17,"1529213"
117,"spotify:track:7GNbFvEP3uKNASe3oaLl8U","Mc IG, MC Ryan SP, Mc Negão Original, MC GP, DJ DAVI DOGDOG, DJ Japa NK, DU'L, MC Meno K, Mc guizinho niazi, Nickz Beatz, SiarBeats","Ta Rico Os Menino Do Gueto 🍀","WM Brazil",5,145,29,"1502458"
118,"spotify:track:3vpmGewnBcIfbm252E3Xx8","Luccas & Rodrigo, Vitor e Luan","Cara da Serenata - Live","L & R PRODUÇÕES",15,138,29,"1490790"
119,"spotify:track:1VpOT1TfTivUmFjSGSRt1U","MC LUUKY, MC Jvila, DJ Dael","Olha pra Cara de Quem Te...","EDITORA E GRAVADORA A BASE RECORDS",21,108,36,"1486059"
120,"spotify:track:55X6DSZ3CEWeIQrVxMOR9h","DJ KELVINHO DA ZS, Iraqui ZL","Sobe Na Moto Roubadona","TREM / One Seven Music",47,115,13,"1482104"
121,"spotify:track:1butVubqmo2gXoAgZiM7hY","Kaique e Felipe, Luan Pereira","Vacilona - Ao Vivo","Sony Music Entertainment",20,103,21,"1477085"
122,"spotify:track:7w2y5BLMYnzBQbRkAbVyHi","Panda, MJ Records","Bem Querer / Primavera (Vai Chuva) - Ao Vivo","Sony Music Entertainment",122,173,4,"1462928"
123,"spotify:track:2Sm8DwUGV8ve14lpEtt7RT","Diego & Victor Hugo","Dama do Baralho - Ao Vivo","Sony Music Entertainment",28,110,34,"1461299"
124,"spotify:track:2KINhc9Jf5Z6IxdJ3xM07Z","MC Meno K, Fepache, DJ Oreia, DJ Hyago","A Firma Segue Lucrando","BOLOLO REC",124,-1,1,"1459406"
125,"spotify:track:1JSTJqkT5qHq8MDJnJbRE1","The Police","Every Breath You Take","Polydor Records",125,130,72,"1457812"
126,"spotify:track:5Y75hEuJlHvdsB8ArcfK1F","DJ CZ, DJ Katrip, Mc Rodrigo do CN, MC Nito","Construção de Amor","DJ CZ",112,134,11,"1450628"
127,"spotify:track:3eHeTsX6W9iIEfn8l2xrWO","Henrique & Juliano","Meu Amor (Ao Vivo)","Vida Nova Produções, sob licença exclusiva para Virgin Music Group",65,159,143,"1449875"
128,"spotify:track:6EF9PYqEk5SdbCCQJ9q8jT","Yasmin Santos, Maiara & Maraisa","Solteira De Corpo - Ao Vivo","Sony Music Entertainment",128,-1,1,"1447403"
129,"spotify:track:5TOvA5Uhxti7FPh0EIdClV","MC LUUKY, DJ JB Mix","Malvadinho","EDITORA E GRAVADORA A BASE RECORDS",1,162,38,"1445263"
130,"spotify:track:38jMHjnOAJDR4QUdk3IXsw","Murilo Huff, Marília Mendonça","Dois Enganados","M Show",49,125,171,"1440433"
131,"spotify:track:1jweGFaVZxEVrOHKsLpPY4","Grupo Menos É Mais","Adorei - Ao Vivo","Som Livre",52,116,57,"1437341"
132,"spotify:track:69sdOLKjgnwdA2smmct2a9","Gabriel Guedes de Almeida","Santo Pra Sempre - Ao Vivo","Onimusic",93,109,22,"1436709"
133,"spotify:track:2655xYZ347fG2N6OjkoMQ8","Jorge & Mateus","Logo Eu","Som Livre",81,155,57,"1432754"
134,"spotify:track:06n87WQroP5WFD4aR45T8X","DJ Japa NK, Mc Negão Original, MC Meno K","Comedinha Ficou Bravo","Love Funk",58,184,34,"1428004"
135,"spotify:track:2o2xhyri4aJUtgMGkf5P0J","ANAVITÓRIA, Lenine","Lisboa","F/SIMAS",83,132,55,"1427906"
136,"spotify:track:3tA0vALUwrzkTgHcm9j6oJ","Zé Neto & Cristiano","Notificação Preferida - Ao Vivo","Som Livre",2,117,142,"1427356"
137,"spotify:track:6m8AgjfI28ER6odzMxmHtR","Racionais MC's","Vida Loka, Pt. 1","Boogie Naipe",83,121,56,"1423297"
138,"spotify:track:1XX75jl3CKMTnKhq1nyngg","Grupo Menos É Mais","Queria Ser Tu / Interfone - Ao Vivo","Som Livre",108,123,5,"1421957"
139,"spotify:track:6bor3RIvmpmz5c435liCs9","Júnior e Cézar","Cheiro De Culpado - Ao Vivo","Universal Music Ltda.",139,-1,1,"1416654"
140,"spotify:track:6HqkE4XccT7AmAMRSfzOcp","Rey Vaqueiro","Body Splash","Potencia Music",89,171,9,"1411145"
141,"spotify:track:1Nmcs8zk7LfcvHRgLtTM5J","Orochi, Papatinho","Amor de Fim de Noite","Mainstreet Records",36,150,115,"1410574"
142,"spotify:track:64dVFcA71XYsuqTYgIWzqf","DJ Arana, Mc Diguinho, Mc Buret, MC D2 DA BAIXADA","Senta Olhando Pra Mim","JB MUSIC",40,122,20,"1407031"
143,"spotify:track:4IPfYXGn9olWEpuH5ZrqEg","Mc Jacaré, Hungria, akzim","Esquadrilha da Fumaça","Croco Hits",104,104,3,"1403108"
144,"spotify:track:60a0Rd6pjrkxjPbaKzXjfq","Linkin Park","In the End","Warner Records",48,101,58,"1402022"
145,"spotify:track:27xkOIER6uDLKALIelHylZ","Jin","Don’t Say You Love Me","BIGHIT MUSIC",40,114,27,"1399612"
146,"spotify:track:6sRLrSetyIwIKhW1eMlUNP","Matheus & Kauan, Marília Mendonça","Vou Ter Que Superar - Ao Vivo","Universal Music Ltda.",2,178,109,"1392593"
147,"spotify:track:17phhZDn6oGtzMe56NuWvj","Teddy Swims","Lose Control","Warner Records",69,141,90,"1392068"
148,"spotify:track:0cQVqPuHQP4KEwc7ZUQmj6","The Neighbourhood","Sweater Weather","Columbia",79,131,151,"1388530"
149,"spotify:track:2kBxNuYFT0J8w9CD4ugLpJ","Marcos & Fernando, Henrique & Juliano","Trocaria Tudo - Ao Vivo","Work Show",75,158,23,"1381508"
150,"spotify:track:7snQQk1zcKl8gZ92AnueZW","Guns N' Roses","Sweet Child O' Mine","Guns N Roses P&D",106,135,36,"1375843"
151,"spotify:track:6XX6DTK8eugxgZqmlwcvkG","DJ Ryder, Dj Dudu Coupper, Mc Gw, DJ Victor Falcão","Sequência da Botação","DJ Ryder",122,126,7,"1375806"
152,"spotify:track:34qZBae134zVLUgZUeYHIc","MC Meno K, Kadu Martins, DJ Japa NK, DJ DAVI DOGDOG","Senta Poca","JNK Records",54,61,3,"1374549"
153,"spotify:track:7bukHRNgGLRySTJEVvLoIR","Henrique & Juliano","Briga Feia (Ao Vivo)","Vida Nova Produções, sob licença exclusiva para Virgin Music Group",22,156,160,"1372173"
154,"spotify:track:7gqB5ul2pZhMA80pX1orVZ","THEUZZIN, 2L Motta, Mn de Niteroi, DJ MK De Niterói","BOA NOITE (CHEGUEI)","A TROPA RECORDS",76,90,5,"1369641"
155,"spotify:track:6h3EEYgtIuOjeqQPIC3H37","Eric Land, Natanzinho Lima","Pilantra e Meio","Eric Land",1,182,54,"1354536"
156,"spotify:track:19ipNAuJDPuz6ILrT0UFu1","MC Roger, MC Kevin o Chris, MC PG","Trilogia 150","Mc Roger",156,169,4,"1353204"
157,"spotify:track:7fdAc48FnW2P7LGuTMajcn","Natanzinho Lima","Uma e Quinze da Manhã","Sua Música Digital",2,189,42,"1345961"
158,"spotify:track:1CPZ5BxNNd0n0nF4Orb9JS","HUNTR/X, EJAE, AUDREY NUNA, REI AMI, KPop Demon Hunters Cast","Golden","K-Pop Demon Hunters",79,140,20,"1344988"
159,"spotify:track:0EpcobeRNL1KpVP72kQUNG","Felipe Araújo, Simone Mendes","Se É Pra Brigar - Ao Vivo","Universal Music Ltda.",142,142,3,"1334075"
160,"spotify:track:4kCyQwz9pE1fl1DNlftW8i","Henry Freitas, Léo Foguete","Onde Era Flor - Ao Vivo","Sony Music Entertainment",160,192,2,"1325086"
161,"spotify:track:4yEKHiUQA70cjfWnEL2m13","Drops INA, Paulo Vicente","É Ele","Onimusic",73,149,58,"1321758"
162,"spotify:track:4EVIYtNeI4O8h0lmE0wycC","Mc Pedrinho, Teko Bolado, Rizzi Get Busy, Tropa da W&S","Encosta na Parede","WMD",10,160,27,"1313712"
163,"spotify:track:0vFVkEDrV58pAPEtKJLvP5","Songs Five Music, José Jr","Yeshua - Ao Vivo","The Bow",97,106,29,"1313222"
164,"spotify:track:5U4UgyiEsycI7FLwGgsaeE","Diego & Victor Hugo","Dona da Rua - Ao Vivo","Sony Music Entertainment",92,105,5,"1305576"
165,"spotify:track:44pllb9f5QwcrD2kKc0gS0","Matheus & Kauan","Que Sorte A Nossa - Ao Vivo","Universal Music Ltda.",59,153,32,"1287385"
166,"spotify:track:6s1kzj4EbhFLXbuAGJbhbn","MC Tuto, DJ Glenner","Barbie","Sonar Music",1,181,48,"1285012"
167,"spotify:track:58d1Gf3p4FWKNnGuq00wXT","DJ BRIZY, Mc Rodrigo do CN, FreesTyle Sounds","Teu Preferido","FreesTyle Sounds",94,170,13,"1282477"
168,"spotify:track:1NPnoibZZyeILxD4mpvfAy","Panda, MJ Records","Um Dia Te Levo Comigo / Do Brasil à Argentina - Ao Vivo","MJ Records.",147,147,4,"1276177"
169,"spotify:track:2N9miXnewVmUrgl6JSK1FI","LE SSERAFIM, j-hope","SPAGHETTI","SOURCE MUSIC",123,151,4,"1272336"
170,"spotify:track:6fPALIGFkjmlHKuiiZLRl6","Sotam, Rob, Pulim","Foi assim","KZN Records",170,194,2,"1269071"
171,"spotify:track:6ATNNv8tZF61fa7VwDH89j","Alexsander Lucio","O Fogo Arderá - Ao Vivo","ID1736 - Céu Music",87,152,24,"1264223"
172,"spotify:track:18cYWmusHQQPlbmAqiy3CJ","Simone Mendes","Mesmice - Ao Vivo","Universal Music Ltda.",83,85,5,"1264025"
173,"spotify:track:06VStvBWfFbepR97LhRo8D","Mc IG, Mc Negão Original, MC Ryan SP, MC Jvila, DJ Guh Mix, Mc Lele JP, Murillo e LT no Beat","Contagem Regressiva","WM Brazil",96,176,15,"1259718"
174,"spotify:track:6vq7r1Pqd3pyI07u63cPZV","Simone Mendes","Erro Gostoso - Ao Vivo","Universal Music Ltda.",3,-1,135,"1257761"
175,"spotify:track:2jNychTlNots7P3bMt41aa","Isaias Saad","Bondade de Deus","Onimusic",152,154,40,"1255956"
176,"spotify:track:2LzXPUzL9sgeRl9a5miHMA","tarisiix, fire hair, WenHard","OUTRA","NOISQTA",36,168,31,"1252080"
177,"spotify:track:3xkHsmpQCBMytMJNiDf3Ii","Benson Boone","Beautiful Things","Night Street Records, Inc./Warner Records Inc.",40,167,88,"1245541"
178,"spotify:track:6JKkP9ABQzYZUFSKSVDKIc","1Kilo, Baviera, Knust, Pablo Martins","Deixe Me Ir (feat. Pablo Martins) - Acústico 1Kilo","1Kilo Records",1,183,170,"1243721"
179,"spotify:track:0vYrfm0eUQyi6fWbYnBiDc","DJ NATAN 22, Mc Rodrigo do CN, DJ DN do Dick","Meu Carro Nao Tem Porta Luva - Remastered 2024","Snafu Records",21,196,42,"1243419"
180,"spotify:track:2FG6DJRP9URLUHWn8GDYex","Incendiários, Marcelo Markes","Eu Tenho Você (Ao Vivo)","MM Produções",38,139,15,"1236238"
181,"spotify:track:4Hk1gmBr2KVEXr3hHwSgUi","DG e Batidão Stronda, Mc Davi, J. Eskine, MC G15","Mãe Solteira","FORTAL MUSIC",1,186,32,"1235639"
182,"spotify:track:1xOqGUkyxGQRdCvGpvWKmL","KATSEYE","Gabriela","HYBE/Geffen",100,166,21,"1233325"
183,"spotify:track:2yo0j2FctlAjVUP3PLl0i1","Danilo e Davi","Mudou O Texto","Som Livre",68,179,21,"1232873"
184,"spotify:track:4m8kG46clzxMxyrDuFo1Uq","WIU, Oruam","Horas Iguais","Sony Music Entertainment",77,146,54,"1231036"
185,"spotify:track:5XhG8HGyxLrkJAASxLA463","Orochi, PL Quest, BIN, Kizzy, Mainstreet","Champagne","Mainstreet Records",93,161,16,"1230569"
186,"spotify:track:0AsfpL8bzbmEyJsfbPPYnj","Charlie Brown Jr.","Zóio De Lula","EMI Brazil",168,-1,10,"1227209"
187,"spotify:track:4ssHL7bSnOAE7HjiuLx6Co","Matuê","Crack com Mussilon","30PRAUM",1,163,63,"1221616"
188,"spotify:track:7CyPwkp0oE8Ro9Dd5CUDjW","The Weeknd, JENNIE, Lily-Rose Depp","One Of The Girls (with JENNIE, Lily Rose Depp)","XO / Republic Records",61,174,92,"1213416"
