rank,uri,artist_names,track_name,source,peak_rank,previous_rank,weeks_on_chart,streams,duration_ms
1,spotify:track:0i4UV3HjjvsUuV3BajEXoD,"MC Tairon, Mc Vitin Da Igrejinha, Dj Win, life song",Baile no Morro,ID1642 - Life Song Records,1,12,3,5787423,140307
2,spotify:track:5PZAbR6JHYYV9xp5gv0XES,"Zé Felipe, MC Mari",Bandido,Som Livre,1,1,3,5501254,132044
3,spotify:track:5vC8UAOHeG95ehRzZChniB,"L7NNON, DJ Biel do Furduncinho, Bianca",Ai preto,Papatunes Records,3,11,4,5456899,131583
4,spotify:track:2qmG7dokbGpDGD0T5wORWt,"Matheus Fernandes, Xand Avião",Balanço da Rede,Som Livre,1,2,17,4535243,166435
5,spotify:track:4QWumyD2uwiePBBha9XBHI,Felipe Amorim,No Ouvidinho,One Play,1,4,15,4336089,183870
6,spotify:track:6Ulh9GPYz6JKdv04qc3q2U,João Gomes,Dengo,JG Shows,3,3,9,4250214,153958
7,spotify:track:0sjhY8nPIm6cPOQfyUPmJe,"Luan Santana, Henrique & Juliano",ERRO PLANEJADO - Ao Vivo,Sony Music Entertainment,4,5,12,4101679,154868
8,spotify:track:7qD2vjd3btuOgwpQPEY7ci,"Mc Don Juan, MC G15, Mc Davi",EU VOU COM CARINHO ELA QUER COM FORÇA,WM Brazil,4,6,7,4064091,144000
9,spotify:track:7AwVSKaQxpidrtYBerkHKk,"Ana Castela, Melody, Dj Chris No Beat",Pipoco,Ana Castela,9,35,6,4031334,194022
10,spotify:track:1K8AtBJXcdq5mywMnZuARP,Gusttavo Lima,Termina Comigo Antes - Ao Vivo,Sony Music Entertainment,3,7,14,4017978,187381
11,spotify:track:6Zw25LRLP0j0MsezDFIUM4,"Hugo & Guilherme, Marília Mendonça",Mal Feito - Ao Vivo,Som Livre,2,13,25,3711959,177934
12,spotify:track:3ShKPhFkexrwl7WoyTtNND,"Rogerinho, Wesley Safadão",Tchuco Nela,AgitoFunk,5,10,12,3703045,170880
13,spotify:track:3sd2p4kE7xQmFH3lPnFl6h,"Davi Kneip, Mc Frog, Dj Gabriel do Borel, Luísa Sonza",sentaDONA (Remix) s2,Davi Kneip,1,9,16,3682293,125245
14,spotify:track:546dFmvwFGBY7MJOkV5ctq,Jorge & Mateus,Todo Seu - Ao Vivo,Som Livre,12,15,9,3662818,171712
15,spotify:track:6bTdZ7xfKp3NqqADJ8HLyj,"Matuê, WIU, Teto",Vampiro,Sony Music Entertainment,1,14,14,3573731,250434
16,spotify:track:6BF3nZQkAg9qvE0DLVSfyH,"Baco Exu do Blues, Luísa Sonza",Hotel Caro,Baco Exu do Blues,4,8,4,3436534,221857
17,spotify:track:4a0sqvCBo7aRIS4GzBQpnp,"MC Braz, MC Tairon, Dj Win",Kikando e Me Olhando,Duetti,14,16,13,3402423,210461
18,spotify:track:7bhvRvE56NHBvedx0EeALS,"Mari Fernandez, NATTAN",Comunicação Falhou - Ao Vivo,Sony Music Entertainment,17,18,10,3363908,180410
19,spotify:track:6hFwju6M40CKovKBPu5IpY,Jovem Dionisio,ACORDA PEDRINHO,Jovem Dionisio,1,17,8,3128277,173085
20,spotify:track:75FEaRjZTKLhTrFGsfMUXR,Kate Bush,Running Up That Hill (A Deal With God),Fish People,16,38,6,3125865,298933
21,spotify:track:3XF598RmEUF3XW4XKo1lyP,"Hugo & Guilherme, Jorge & Mateus",Meu Número - Ao Vivo,Som Livre,17,23,12,3071569,208007
22,spotify:track:5zNxUkUW9WiV5oyg6gh2wB,"PEDRO SAMPAIO, Mc Pedrinho",DANÇARINA,WM Brazil,1,19,22,3035833,110222
23,spotify:track:53RxHysDJ0cjugMcPymwja,Luan Santana,ABALO EMOCIONAL - Ao Vivo,Sony Music Entertainment,6,21,22,2992917,153225
24,spotify:track:5dFxhpYLOton7aawKsDeiS,"Léo Santana, Mc Don Juan, Mari Fernandez",Áudio Que Te Entrega,Universal Music Ltda.,24,27,15,2973195,171409
25,spotify:track:2LEV3lTRxKqLBfmt5BWkLj,Gusttavo Lima,Não Pega Ninguém Ainda (Ao Vivo),Sony Music Entertainment,19,22,5,2930309,175466
26,spotify:track:3ITkrUvAA6gzxer2UIom3P,Jorge & Mateus,Molhando o Volante,Som Livre,8,20,30,2919008,162538
27,spotify:track:11fqunD6qlOCrRd88kMOk6,Henrique & Juliano,Evento Cancelado (Ao Vivo),"Vida Nova Produções, sob licença exclusiva para Virgin Music Group",22,26,7,2712556,183244
28,spotify:track:7afaZ37wJJL6880z1NRgJS,Teto,Fim de Semana no Rio,Sony Music Entertainment,3,24,14,2628589,165882
29,spotify:track:4Dvkj6JhhA12EX05fT7y2e,Harry Styles,As It Was,Columbia,10,32,14,2619812,167303
30,spotify:track:2ebFBmle5uXcdbrCAOvPcZ,Guilherme & Benuto,Vagabundo Chora - Ao Vivo,Sony Music Entertainment,20,28,21,2609270,161845
31,spotify:track:42nZBOwXNdO24Ml032bLBS,Matheus & Kauan,Gatilho - Ao Vivo,Universal Music Ltda.,29,40,16,2533406,155284
32,spotify:track:2wSCalnGOnXdAJC0Fn8OUY,"George Henrique & Rodrigo, Marília Mendonça",Vai Lá Em Casa Hoje - Ao Vivo,Worldshow Promoções e Eventos,1,33,37,2480910,191523
33,spotify:track:14JKzKrJbPDflw8XyATMey,Henrique & Juliano,A Maior Saudade (Ao Vivo),"Vida Nova Produções, sob licença exclusiva para Virgin Music Group",10,29,44,2465642,190161
34,spotify:track:75fCsUnTiDelE4HMd06t4O,"Mc Pepeu, DJ Swat, Doug Hits",Gostosinho Tu Cai,Doug Filmes,19,30,11,2458330,132922
35,spotify:track:1RgJ4lexKGNBlKnyxB5SRt,"Teto, Mateca",Balazul,Sony Music Entertainment,31,31,5,2451943,202909
36,spotify:track:0NBgyml7T0IvUNbXIkcSpH,"Xamã, Gustah, Neo Beats, Bagua Records",Malvadão 3,Bagua Records,1,25,31,2394239,141769
37,spotify:track:5lCAtKxkZL6tFDyGX9t87j,Wesley Safadão,Eu Já Tava Bem - Ao Vivo,Wesley Safadao,19,34,31,2388673,135200
38,spotify:track:6bwx7pcKJY05D9S6CVa1k6,"Israel & Rodolffo, Maiara & Maraisa",Nem Namorado e Nem Ficante - Ao Vivo | Faixa Bônus,Som Livre,38,41,6,2327670,166600
39,spotify:track:4NJKCE1TBC653P3dCnto0u,"Mc Gabzin, DJ Marcus Vinicius",Simplesmente Ela,Sony Music Entertainment,22,37,16,2316130,161076
40,spotify:track:48LEhRW4gLMCVSYFEZvt8b,"João Bosco e Gabriel, Diego & Victor Hugo",Assume a Gente - Ao Vivo,Som Livre,40,42,15,2281303,171524
41,spotify:track:7gVzhRCrLRUBEGdS7zNTp0,Zé Felipe,Malvada,Som Livre,2,39,23,2256547,145853
42,spotify:track:6Lk3kU7JcQ5dZ7jbmhJzQN,Zé Neto & Cristiano,Melhor Ser uma Saudade,Som Livre,13,43,23,2221612,158716
43,spotify:track:1ih3nbYJ0lugsku6065BC5,"O Tubarão, Treyce",Me Chama de Amor - Arrochadeira Remix,Tops da Arrochadeira,33,44,10,2155883,129194
44,spotify:track:347KmRWwYXcZSUgelz7Cit,"Filipe Ret, L7NNON, Nagalli",Konteiner,Som Livre,36,36,3,2121337,150697
45,spotify:track:4qsOrxBv09HhNSpsgMRXdC,"Marília Mendonça, Maiara & Maraisa",Esqueça-Me Se For Capaz,Som Livre,1,48,38,2095067,169058
46,spotify:track:3JFB72hbbt3zy30puJTc3q,"LUDMILLA, Luísa Sonza",Lud Session #3: Tudo porque você mentiu / penhasco / De rolê / CAFÉ DA MANHÃ ;P / Doutora 3,WM Brazil,46,-1,1,2086602,579562
47,spotify:track:1ELsaYdj2NlxLvkx9g24xZ,"Guilherme & Benuto, Hugo & Guilherme",Haja Colírio (feat. Hugo & Guilherme) - Ao Vivo,Sony Music Entertainment,47,68,2,2015988,173366
48,spotify:track:0E0OENqh3jaZ4VpDFTOLGj,"Mc Delux, DJ ABDO, CLUB DA DZ7",EU BEM QUE TE AVISEI - TU EMPINOU ELE PEI,Club da DZ7,25,47,12,1985364,158769
49,spotify:track:6nkoWsFZeFt5dUdNmlIceh,Gusttavo Lima,Bloqueado - Ao Vivo,Sony Music Entertainment,4,49,32,1971999,168689
50,spotify:track:4SIBZgMomGFnrIWjmq7Np8,"L7NNON, Os Hawaianos, DJ Bel da CDD, DJ Biel do Furduncinho",Desenrola Bate Joga de Ladin - feat. DJ Biel do Furduncinho,Papatunes Records,9,45,13,1944730,115846
51,spotify:track:4IX43MpJlpxzRMLb9QayrJ,Luan Santana,PERIGO NOTURNO - Ao Vivo,Sony Music Entertainment,51,-1,1,1867315,201896
52,spotify:track:0tM4J8aID6qYZOE3e14sCj,Henrique & Juliano,Acordo (Ao Vivo),"Vida Nova Produções, sob licença exclusiva para Virgin Music Group",21,46,37,1867160,169771
53,spotify:track:72g37RoelSnovZakG5MwnF,"Mari Fernandez, Marcynho Sensação",Parada Louca,Sony Music Entertainment,8,50,34,1858382,179031
54,spotify:track:5DhiTYpD599fu3q7fCepgL,"BIN, Major RD, Mainstreet, Ajaxx",Dior,Mainstreet Records,54,60,3,1833956,229894
55,spotify:track:3IMLoeLerS7TMpKjxUgAhx,Henrique & Juliano,Arranhão (Ao Vivo),"Vida Nova Produções, sob licença exclusiva para Virgin Music Group",1,52,48,1812893,153409
56,spotify:track:3jPp5Aukksz9Ir0gZy6lZM,"Paulo e Nathan, Hugo & Guilherme",Acabei de Terminar - Ao Vivo,Sony Music Entertainment,52,58,13,1807839,223489
57,spotify:track:71fwkaKdNrxiZZbkzSqmFJ,"Anitta, Papatinho, MC Kevin o Chris, Mr. Catra, YG",Que Rabão (feat. Mr. Catra e YG),Warner Records,18,53,12,1794445,176193
58,spotify:track:0mBP9X2gPCuapvpZ7TGDk3,"Charlie Puth, Jung Kook, BTS",Left and Right (Feat. Jung Kook of BTS),Atlantic Records,58,61,2,1726937,154486
59,spotify:track:0qYW2jULeN9giEty0ee9Fy,Rogerinho,Botadinha Saliente,MC Rogerinho Oficial,5,51,22,1723737,158000
60,spotify:track:4EVzu5mYyigjyLrryKbZs7,Gloria Groove,VERMELHO,SB Music,9,59,21,1706035,152690
61,spotify:track:5etfNcFAD9M8uibXpYMxfQ,Wesley Safadão,Tu Tava Na Revoada - Ao Vivo,Wesley Safadao,61,65,7,1681175,156000
62,spotify:track:0MKd4uZd8Ag8qyReZBTarP,Murilo Huff,Pino da Granada - Ao Vivo em Rio Preto,M Show,53,56,6,1652679,185407
63,spotify:track:4XKXphKH76W4zNpkgFS5o2,j-hope,MORE,BIGHIT MUSIC,63,-1,1,1578532,180022
64,spotify:track:6KKT8dzP21J4WwBp9swjob,"Filipe Ret, Mc Poze do Rodo, Nagalli",Sonho Dos Cria,Som Livre,48,54,3,1577848,143255
65,spotify:track:0dcHD9QhnWRA41zoLnC83X,"MC Cabelinho, Dallass",X1,MC Cabelinho,65,73,9,1485132,188852
66,spotify:track:0yDMhYTryvQoR634wDgQ1j,"MC Hariel, DJ BOY",O Fim é Triste (feat. DJ BOY),WM Brazil,66,159,2,1462396,158117
67,spotify:track:7fzgTaVhUxmEzjtcd9NdWo,"Tayrone, Marília Mendonça",Cê Tá Preparada - Ao Vivo,Universal Music Ltda.,16,70,51,1435117,213006
68,spotify:track:4aoZBldNDVYmTwmeoI49ud,"Mc Gabzin, DJ TAK VADIÃO, dj sv",O Poder Dessa Garota,Sony Music Entertainment,68,81,10,1420373,136615
69,spotify:track:6xGruZOHLs39ZbVccQTuPZ,Joji,Glimpse of Us,88rising Music,57,57,3,1406641,233456
70,spotify:track:0yL7K9MzC20uBesZTPY81r,"DJ Matt D, Menor MC, MC GP, Vulgo FK",Pandora,GREE CASSUA,6,64,31,1405022,177000
71,spotify:track:3YvE7uo4ffseBoJPh8IhHp,"Marília Mendonça, Maiara & Maraisa",Presepada,Som Livre,3,67,35,1380680,196209
72,spotify:track:3fSxnkjdgPucRCskjmAlgx,"Mc Poze do Rodo, Orochi, Filipe Ret, Mainstreet, Bielzin",A Cara do Crime 3 (Brinde à Liberdade),Mainstreet Records,43,55,6,1346253,300689
73,spotify:track:2MuWTIM3b0YEAskbeeFE1i,Metallica,Master Of Puppets,Blackened Recordings / Universal Music,73,-1,1,1309871,515386
74,spotify:track:4can6ssapSsRCEbZZfYL8K,"Filipe Ret, Caio Luccas, BIN, BUDAH, Borges, Marina Sena, Teto, Luiz Lins, Pineapple StormTv",Poesia Acústica #12 Pra Sempre,Pineapple StormTV,24,69,19,1298485,472173
75,spotify:track:3FkeNbs9Zeiqkr3WkbOiGp,Anitta,Envolver,Warner Records,1,74,34,1295894,193805
76,spotify:track:28m65cMH7QXHzFnZSTtNHY,"Marília Mendonça, Maiara & Maraisa",Não Sei o Que Lá,Som Livre,21,77,40,1279699,169586
77,spotify:track:7HjZD0NPC1hzFpjUjo45GR,"Mc Poze do Rodo, Filipe Ret, Mainstreet, Ajaxx",Me Sinto Abençoado,Mainstreet Records,33,71,30,1270759,214235
78,spotify:track:45VwwcqkVl61khE9JT2OxK,"Braão, LIT UP, Dj Nattan",Baile da Serra,FERA ENTRETENIMENTO SP,41,63,10,1229281,205058
79,spotify:track:3xt7v3bMNnQ8ie8RjhmkX2,Matheus & Kauan,Imagina A Sentada - Ao Vivo,Universal Music Ltda.,18,80,30,1227709,171500
80,spotify:track:4nRa5qkXIfswPbt20rkslI,"Felipe Amorim, João Gomes",Debaixo do Cobertor,One Play,80,90,3,1224600,154285
81,spotify:track:0sPtV4stCHkFJB6GpoaZ1f,"Luísa Sonza, LUDMILLA",CAFÉ DA MANHÃ ;P,Universal Music Ltda.,14,106,22,1221146,181173
82,spotify:track:0OJ8KWhqLMHkfI59yh398v,"L7NNON, DJ Biel do Furduncinho",Sei Que Tu Gosta Muito,Papatunes Records,55,79,14,1220963,133384
83,spotify:track:3QGxgNaqaFSpORp2OVLXHR,"Chefin, Mainstreet",212,Mainstreet Records,2,72,25,1200454,150610
84,spotify:track:6W56j9ijl9n2l76Hs4hgGn,"Léo & Raphael, Jorge",Larga AÍ Pra Ver - Ao Vivo,Léo e Raphael,69,86,13,1188105,159317
85,spotify:track:2AQJRDfQJbfgmTf5e62Czl,"Matuê, L7NNON",Sem Dó,Sony Music Entertainment,25,78,27,1187232,267130
86,spotify:track:5qtQJJqJUjk2zNjRroqgLk,"Filipe Ret, Anitta, Dallass",Tudo Nosso,Som Livre,45,66,3,1183808,168813
87,spotify:track:1M5OUvKG03C0QtzvxRS4Zk,"Dj Guuga, Wesley Safadão, Zé Felipe",Depende,Dj Guuga,8,76,24,1178756,156922
88,spotify:track:5Z4TYur0O9OxmxIo6GC2Gq,"Vulgo FK, AMUSIK, WEY, Wall Hein","Oi, Como Ce Tá?",Elenko Music,13,75,20,1167196,156153
89,spotify:track:30rrBGpna63eIJ2BrXlWDC,Henrique & Juliano,Minha Cópia Atual (Ao Vivo),"Vida Nova Produções, sob licença exclusiva para Virgin Music Group",58,82,14,1134917,183382
90,spotify:track:6EDj1nbl9wo6ivGI1t59G4,Jão,Idiota,Universal Music Ltda.,21,87,29,1134255,181626
91,spotify:track:130HVxaVe9EYcLJmuOR9Rw,Henrique & Juliano,Até A Próxima Vida (Ao Vivo),"Vida Nova Produções, sob licença exclusiva para Virgin Music Group",87,91,19,1108837,194310
92,spotify:track:2kJRlOyrxsy7Ot3c5TZ8Q6,João Gomes,Meu Pedaço de Pecado,JG Shows,1,85,57,1096231,157175
93,spotify:track:053zWWZDziDJd3U94x8RuP,"Marília Mendonça, Maiara & Maraisa",Todo Mundo Menos Você,Som Livre,2,95,41,1095947,206171
94,spotify:track:68qqVn5kHBv4zc45SDGLnh,"Filipe Ret, L7NNON, Chris Beats Zn",Corte Americano,Som Livre,60,83,63,1092325,139534
95,spotify:track:10SRMwb9EuVS1K9rYsBfHQ,BTS,Yet To Come,BIGHIT MUSIC,43,98,4,1089215,193593
96,spotify:track:5VTjBl3ddZEiG2LrH4VzyR,"Zé Felipe, Mc Danny",Toma Toma Vapo Vapo,Som Livre,3,88,34,1075701,156760
97,spotify:track:3HdEOUNuFuoWj06rXpQQ4o,"Kawe, WIU, Original Quality",Jovens do Reggae,Som Livre,97,136,2,1074123,183652
98,spotify:track:5yRgMxdDhdYlbUQNCOlW3o,"Mc Don Juan, Tarcísio do Acordeon, DG e Batidão Stronda",Não Vou Te Bloquear - Ao vivo,WM Brazil,17,84,27,1074101,168312
99,spotify:track:6JIC3hbC28JZKZ8AlAqX8h,"Elton John, Dua Lipa, PNAU",Cold Heart - PNAU Remix,EMI,52,114,43,1069134,202735
100,spotify:track:4grGI2vFnknrfmHT1JOVFU,"George Henrique & Rodrigo, Gusttavo Lima",Tesão Da Madrugada - Ao Vivo,World Show Produções,41,96,21,1068509,173375
101,spotify:track:69xohKu8C1fsflYAiSNbwM,BTS,Run BTS,BIGHIT MUSIC,47,99,4,1061495,204939
102,spotify:track:7aZusA4cWXz3Wv9e9uhavz,Matuê,Quer Voar,Sony Music Entertainment,2,93,48,1050634,187636
103,spotify:track:2KukL7UlQ8TdvpaA7bY3ZJ,Beyoncé,BREAK MY SOUL,Parkwood Entertainment/Columbia,62,62,3,1047863,278281
104,spotify:track:0cHflpV8SSGbE0NKaasEfT,"Filipe Ret, Dallass",F* F* M*,Som Livre,57,94,38,1037463,176000
105,spotify:track:6ve9hbVnSgJ0vrsRpj18OH,Gusttavo Lima,Não Me Arranha - Ao Vivo,Sony Music Entertainment,24,107,39,1029048,159750
106,spotify:track:40fRA3sONEHzt20oKvyhRA,"Mari Fernandez, Zé Vaqueiro",Só de Imaginar - Ao Vivo,Sony Music Entertainment,106,108,4,1027483,202243
107,spotify:track:0roEMqT0P7Z82rJTwcID3Z,Hugo & Guilherme,Felicidade Dela - Ao Vivo,Som Livre,42,102,15,1024532,165558
108,spotify:track:2xebCnKCjYWBhJ4Ai8hO5E,"Mc Davi, Mc Kevin, Mc Don Juan, MC Hariel, MC Marks, MC G15, Mc Phe Cachorrera, Gaab, MC Menor da VG, MC Ryan SP, MC Kapela, Perera DJ, Veiga no Beat",Set dos Casados,GR6 Music,22,101,39,1020064,643200
109,spotify:track:1TyxXIXVVpHwhKaF73z8nw,Henrique & Juliano,Rasteira (Ao Vivo),"Vida Nova Produções, sob licença exclusiva para Virgin Music Group",46,112,42,1018828,189007
110,spotify:track:3qHN7TSBfVQPF9ojUVT9ZT,"Mc Livinho, Dj LK da Escócia, DJ Breno, DJ Pedrin",Pras Novinha (feat. DJ Pedrin),MBB Diamond,110,156,3,1006614,149032
111,spotify:track:1iaPDgTbsKrlznVu13EWIf,"MC Cabelinho, Bielzin, Mc Poze do Rodo, Tz da Coronel, Neo Beats",ESSÊNCIA DE CRIA,MC Cabelinho,64,100,28,1006112,192194
112,spotify:track:2s8kT1fuBVjxept8bH68Sw,"MC Hariel, Mc IG, MC Marks, MC Joãozinho VT, MC Ryan SP, MC Neguinho do Kaxeta, Mc Kanhoto, Mc Don Juan, DJ BOY, Matheuszin DJ",SET MK 2,GR6 Music,96,105,5,1004171,564705
113,spotify:track:0ssgd2ZvDawP0KHGfBYRpv,"Filipe Ret, Caio Luccas, Dallass",Good Vibe,Som Livre,67,89,3,997132,181818
114,spotify:track:7pvrsbBKUQI2QmA74WCJa5,Zé Neto & Cristiano,Ela e Ela,Som Livre,3,113,45,985961,168644
115,spotify:track:5Z9KJZvQzH6PFmb8SNkxuk,"Lil Nas X, Jack Harlow",INDUSTRY BABY (feat. Jack Harlow),Columbia,8,116,50,985249,212352
116,spotify:track:14uWxelOuAUajP8fDvc0Ct,Thiaguinho,Falta Você,Virgin Music Label And Artist Services (S&D),116,121,5,984542,220437
117,spotify:track:04vzhKfl5HtPEgrdZJCZ7L,"Mc Paiva ZS, Kotim",Bagulho Louco,Love Funk,97,103,8,981243,124238
118,spotify:track:2gkKA2pRAsMzbiGPo9gxsc,"Clayton & Romário, Jorge & Mateus",Água Nos Zói - Ao Vivo,Virgin Music Label And Artist Services (S&D),35,115,38,978877,188951
119,spotify:track:0HIhSuAe5lq7ywxqlAt5Nl,"Bruno & Marrone, Henrique & Juliano",Deixa Ela Em Paz,Worldshow Promoções e Eventos,92,92,2,975703,201151
120,spotify:track:2VATVdFqb7QqxfAcQPvNpc,Israel & Rodolffo,Ex Alcoolizado - Ao Vivo,Som Livre,61,140,14,972274,162444
121,spotify:track:5PjdY0CKGZdEuoNab3yDmX,"The Kid LAROI, Justin Bieber",STAY (with Justin Bieber),Columbia,30,118,52,969689,141805
122,spotify:track:1HhNoOuqm1a5MXYEgAFl8o,"Imagine Dragons, JID, Arcane, League of Legends",Enemy (with JID) - from the series Arcane League of Legends,Kid Ina Korner / Interscope,39,133,36,967719,173381
123,spotify:track:5r9CZJMoMmxio2AnJdxuDS,"Grupo Menos É Mais, Di Propósito, Vou Zuar",Pot-Pourri: Melhor Eu Ir / Ligando Os Fatos / Sonho de Amor / Deixa Eu Te Querer - Ao Vivo,Som Livre,21,128,109,961075,521088
124,spotify:track:1gKXrwKn5ub6wyefqMsnZp,"MC Braz, MC Gabluca, DJ 2w",Joga na Cara,Funk Explode Records,98,104,21,958596,109846
125,spotify:track:3gK5ckT0cq3t5enyqzzRgV,"PEDRO SAMPAIO, Mc Danflin",GALOPA,WM Brazil,4,122,42,957445,140500
126,spotify:track:3jrxlhAtoxi83qc76NT9EG,"Filipe Ret, MC Cabelinho, MC Maneirinho",7 Meiota,Som Livre,69,97,3,948656,190000
127,spotify:track:1wdhj1r7aeWVDUl9d18YKu,Matheus & Kauan,Expectativa x Realidade,Universal Music Ltda.,15,155,53,942617,163324
128,spotify:track:3qmdfYpfvKRIXmWaLllHZ3,"MC Teteu, Dj Serpinha, 2Click",Black Lança (Catucando Gostosinho),2click Produções,19,111,24,940544,153230
129,spotify:track:7bh2ybqXcEoIYL8FwiAMou,Mari Fernandez,Intuição - Ao Vivo,Sony Music Entertainment,129,162,3,935033,171429
130,spotify:track:5QQKWOwPjG9vcDBTQ5Hv5Q,"PEDRO SAMPAIO, Anitta, Dadju, Mc Pedrinho, Nicky Jam","DANÇARINA (feat. Nicky Jam, MC Pedrinho) - Remix",WM Brazil,81,147,4,927538,212000
131,spotify:track:2342lPAZ9zddhgAQEiLx4V,"Luísa Sonza, Mariah Angeliq",ANACONDA *o* ~~~,Universal Music Ltda.,27,164,30,915516,183100
132,spotify:track:4AAIAVjSyiq1N7SXKkwXZe,Marília Mendonça,Troca de Calçada,Som Livre,7,129,75,913668,203158
133,spotify:track:28k6fDcRo7iONQhMxt2OFA,Júnior e Cézar,Clone - Ao Vivo,Universal Music Ltda.,95,119,21,908919,171573
134,spotify:track:4lsDFVKOVwPeAVw1hPOn7G,"Simone & Simaria, Zé Felipe",Vontade De Morder,Universal Music Ltda.,19,123,25,905636,154973
135,spotify:track:02MWAaffLxlfxAUY7c5dvx,Glass Animals,Heat Waves,Polydor Records,43,126,37,903234,238805
136,spotify:track:13Rf6RaZT13TW4xLQR3MQr,"MC Cabelinho, Bob do Contra, Azzy, Filipe Ret, Dudu, Xamã, Orochi, Maquiny, Pineapple StormTv",Poesia Acústica #6 Era uma Vez,Pineapple StormTV,18,124,160,900678,577819
137,spotify:track:7LdYiTZzlxsPKi8kvNXeBS,"MC G15, Mc Davi, Mc Pedrinho, MC Ryan SP, Gaab, Mc Don Juan, MC JottaPê, MC Menor da VG, DJ 900, Perera DJ, Dj GBR",Set do G15 - A Revoada Começou,GR6 Music,84,117,8,897549,542000
138,spotify:track:1bWBG6IkMnDr3qvCKSvQT7,"Matheus Fernandes, Dilsinho",Baby Me Atende - Ao Vivo,Som Livre,3,125,67,895869,225671
139,spotify:track:0EMAzKGOFxJgG9vHsm7ciF,"JC NO BEAT, MC Teteu, DJ F7",Eu Vou Machucar Só um Pouquinho X Catucando Gostosinho,Tratto Entretenimentos,63,120,21,890585,173538
140,spotify:track:7qq40cRIYNKZCDt1STfBqt,Niack,"Bruna, Tu Já Parou Pra Pensar",WM Brazil,140,-1,1,876941,162653
141,spotify:track:6UelLqGlWMcVH1E5c4H7lY,Harry Styles,Watermelon Sugar,Columbia,27,143,126,876725,173991
142,spotify:track:46oPxSyS5ZZLg0EbqsKW4x,"Dj Chris No Beat, Luan Pereira, Ana Castela",Juliet E Chapelão (Ao Vivo),AGRO PLAY tm,92,142,17,862558,144138
143,spotify:track:6jxE4XjFVSKF18kfo7FCl9,"Borges, L3OZIN, Mainstreet",Iphone Branco,Mainstreet,65,188,19,862031,137142
144,spotify:track:4OjLi2Ji9UhVsHjqzRGCsM,"Gusttavo Lima, Dendelzinho",Quebrando Protocolo - Ao Vivo,Sony Music Entertainment,45,127,36,860820,175216
145,spotify:track:4fSHADbZbhpZCT9oJpxwbP,"Paulo Pires, Marcynho Sensação, ÉaBest, Mc Danny",Ameaça,Paulo Pires,4,130,38,858713,188096
146,spotify:track:7G2LNG0EDgU5IyeeP6pevW,"Mari Fernandez, Xand Avião",Pode Apostar - Ao Vivo,Sony Music Entertainment,146,148,4,848354,193834
147,spotify:track:7ef4DlsgrMEH11cDZd32M6,"Calvin Harris, Dua Lipa",One Kiss (with Dua Lipa),Sony Music UK,33,167,39,841382,214846
148,spotify:track:4JzCFEc3O2UEdjKzevvFH5,BTS,For Youth,BIGHIT MUSIC,61,160,4,840710,264480
149,spotify:track:2vzp2rXiAZlcnkSlz5dtkR,"Gustavo Mioto, Luan Santana",Envolvidão - Ao Vivo Em Santa Catarina / 2022,Universal Music Ltda.,82,134,6,834359,163752
150,spotify:track:3ua3rqwBNmeGeQfcKnA3bT,"Doode, Teto, Matuê",Groupies,Sony Music Entertainment,10,131,41,832259,164571
151,spotify:track:6Uj1ctrBOjOas8xZXGqKk4,Doja Cat,Woman,Kemosabe Records/RCA Records,48,150,48,832052,172626
152,spotify:track:0VF2XFdgeID7448iU2Vyg9,"MC Josh, DJ 2w",Novinha Malada do Insta,Funk Explode Records,34,132,25,812920,107076
153,spotify:track:6MvaRZ6JZgJuXz9b1CMB1y,Baco Exu do Blues,20 Ligações,Baco Exu Do Blues,84,144,23,810139,193600
154,spotify:track:0pZIBIJ253pH9gJtXE0Ouf,"KayBlack, Marquinho no Beat, Wall Hein",Vestido da Fendi,Elenko Music,153,153,6,810124,164203
155,spotify:track:4kGdnA7FzSVsXC29LPghej,"Zé Felipe, Marcynho Sensação",Revoada No Colchão,Som Livre,3,137,42,805696,153448
156,spotify:track:4HD67byP5AqlOGuoMyUgyA,"Filipe Ret, Dallass, Honaiser, LODONI",Melhor Agora,Som Livre,75,110,3,798771,121463
157,spotify:track:17QN5kFprJqHdHLMj7hz4s,Gusttavo Lima,Ficha Limpa - Ao Vivo,Sony Music Entertainment,3,165,56,797593,194800
158,spotify:track:4PF5eA9ng97UcU5hjaqQnc,João Gomes,Meu Cafofo,JG Shows,106,138,16,797317,146624
159,spotify:track:5F2xRvRFkxDvqdFtUNAEyw,"João Gomes, Vitor Fernandes",Se For Amor,JG Shows,4,141,54,792787,239928
160,spotify:track:6wrkP23fHC8KDHCfs8MpJ9,Henrique & Juliano,Chá De Casa Nova (Ao Vivo),"Vida Nova Produções, sob licença exclusiva para Virgin Music Group",67,157,30,791778,176585
161,spotify:track:1d7AtPeraWVsvI4U1YTHt1,Max e Luan,Vestido Coladinho,Max e Luan,30,154,40,785741,144516
162,spotify:track:452LVnTBjXYW3guqe3xiqI,Zé Neto & Cristiano,Vamo Tomar Uma,Som Livre,38,163,45,772221,139528
163,spotify:track:6m187iACTSAZDYMaV0klqj,"L7NNON, Ajaxx",Freio da Blazer,Papatunes Records,38,161,74,768462,180000
164,spotify:track:6qdJZIjxrPaJjaGqlXFLSs,Gusttavo Lima,Nota de Repúdio - Ao Vivo,Sony Music Entertainment,4,145,44,768174,164949
165,spotify:track:3v6gYFuAXQcm1EO5yW7yfX,Tarcísio do Acordeon,Proteção de Tela,Sua Música,76,151,51,766645,216990
166,spotify:track:0VjIjW4GlUZAMYd2vXMi3b,The Weeknd,Blinding Lights,Republic Records,25,174,131,766367,200040
167,spotify:track:7BwjZ1jy4B0ZyXTY4YQM9A,"Orochi, Chefin, Oruam, TkN, Borges, Mainstreet, Bielzin",Assault (Carro Forte),Mainstreet,78,170,13,763191,304000
168,spotify:track:4GOs8fPjp4M9CBHanTMwsQ,Henrique & Juliano,Seu Perfil (Ao Vivo),"Vida Nova Produções, sob licença exclusiva para Virgin Music Group",67,168,23,761299,183568
169,spotify:track:2ABBlgwXo68orcunvBYYiY,DNASTY,Aulas e Cursos,Labidad Music,64,158,13,760519,213634
170,spotify:track:1IthE5GNiRzFN5CVaCa445,BTS,Born Singer,BIGHIT MUSIC,71,193,4,758981,238628
171,spotify:track:2XymTaHTrQWDEuSyhfZvqF,Matuê,Antes,Sony Music Entertainment,12,146,23,758348,169092
172,spotify:track:4GF7CEf70lzZQwdYaiiCpY,Mari Fernandez,Para de Me Assistir - Ao Vivo,Sony Music Entertainment,172,-1,1,757824,173814
173,spotify:track:3Jf64Ca4Q8mAvhf1greHOg,"Xamã, Pedro Lotto, Bagua Records",Dublê de Marido,Bagua Records,109,109,4,756485,154285
174,spotify:track:6M6QZVBQCkcx1j7f6RpD5Q,"Lucas Lucco, Marília Mendonça",Amava Nada - Ao Vivo,LUCAS LUCCO,54,176,22,751757,185533
175,spotify:track:52iDhg4NHouVVMEsPzvnYi,Gustavo Mioto,Sofrimento Antecipado - Ao Vivo,Universal Music Ltda.,154,178,7,741435,198083
176,spotify:track:1FGRA5pMtBqJLNAaSBia2x,LUDMILLA,Maldivas,WM Brazil,47,-1,20,737793,164141
177,spotify:track:7xVSNhAUQhUIpwfR6lTOwA,Marina Sena,Por Supuesto,Marina Sena,10,-1,36,736921,186698
178,spotify:track:6Vgn3IEUkWs3d6og029Gtm,Teto,Mustang Preto,Sony Music Entertainment,34,171,39,733814,183000
179,spotify:track:1EOvzIhBFxiFvjubeCHn3T,"Douglas & Vinicius, Zé Neto & Cristiano",Estelionato Afetivo - Ao Vivo,Virgin Music Label And Artist Services (S&D),75,-1,37,729486,172000
180,spotify:track:3aOnJBwzo1DVQmIJwgj8Au,"Filipe Ret, Kayuá, Dallass, Honaiser",A Meu Favor,Som Livre,85,135,3,723273,135384
181,spotify:track:7ARoqP7G8UYW8SyYPyPp7k,"Anitta, PEDRO SAMPAIO",NO CHÃO NOVINHA,WM Brazil,11,184,30,721629,136901
182,spotify:track:6m84TzSTM5nbwZxIxkYHz6,Jorge & Mateus,Namorando Com Saudade,Som Livre,39,180,55,720865,174081
183,spotify:track:3QKv1RIrWsLTA63oxscVrZ,João Gomes,Meu Bem,JG Shows,58,172,37,718782,140208
184,spotify:track:3PfIrDoz19wz7qK7tYeu62,Dua Lipa,Don't Start Now,Warner Records,2,198,133,717604,183290
185,spotify:track:2RGIuYTsyyHoOCqW0krvNE,"Avine Vinny, Matheus Fernandes",Coração Cachorro,Sony Music Entertainment,1,177,41,715203,150802
186,spotify:track:3sTNh0MwcpUe4VXEUPyU11,Diego & Victor Hugo,Sinal da Oração (Ao Vivo),Sony Music Entertainment,145,152,3,714841,199655
187,spotify:track:0j8nXyOr5UXWHqy0BBnZ6L,Israel & Rodolffo,Dá Intimidade Pra Ver - Ao Vivo,Som Livre,69,194,24,714373,143219
188,spotify:track:5oI9blwsXC8AkTWw6wASY8,Matuê,Máquina do Tempo,Sony Music Entertainment,2,175,68,708410,230400
189,spotify:track:1TFqH3zKOiTZoVe0OQuJte,Grupo Menos É Mais,Até Que Durou / Tu Mandas No Meu Coração / Adorei / Supera - Ao Vivo,Som Livre,140,-1,3,706959,453018
190,spotify:track:0bvLxd9bUAYGKkpMYdR60F,"DJ JOAO DA INESTAN, Mc J Mito, Dj Tg Da Inestan, MC LORIN DA ZL",Mal Caminho,DjJoaoDaInestan,75,169,15,704901,155076
191,spotify:track:2QjOHCTQ1Jl3zawyYOpxh6,The Neighbourhood,Sweater Weather,Columbia,165,182,24,699397,240400
192,spotify:track:5jYEiTNR3FQXFouTX7Ju0N,"LUDMILLA, Mariah Angeliq, Topo La Maskara, Mr. Vegas",Socadona,WM Brazil,17,-1,26,699291,186000
193,spotify:track:2jIaDVi0tKGjPZxVIxH1Al,Gustavo Moura & Rafael,Cara de Golpe,Astro Produções,187,187,2,697057,185726
194,spotify:track:3jSG8oE8doxDxmpe5GlFee,Mari Fernandez,"Não, Não Vou",Sony Music Entertainment,1,-1,41,696805,173037
