rank,uri,artist_names,track_name,source,peak_rank,previous_rank,weeks_on_chart,streams,duration_ms
192,spotify:track:1W3ohWNGNobBwSrOuVSxel,Henrique & Juliano,Na Hora Da Raiva (Ao Vivo),"Vida Nova Produções, sob licença exclusiva para Virgin Music Group",33,175,54,1208279,174117
193,spotify:track:3u3G8q8xzUv3ujZ59DLKzU,Zezé Di Camargo & Luciano,Sem Medo de Ser Feliz,Columbia,193,-1,1,1202155,275106
194,spotify:track:07jbA8o32bNGipAdIBhcE4,"Yuri Redicopa, wBoy, Mc Britney, Dj Batata",Rebola não para,Rua B Records,117,152,3,1201356,158014
195,spotify:track:10MsXPpQLz5ZrOEZxTtkIm,Ana Castela,Olha Onde Eu Tô,Ana Castela,15,-1,27,1196879,181693
196,spotify:track:6dOtVTDdiauQNBQEDOtlAB,Billie Eilish,BIRDS OF A FEATHER,Darkroom/Interscope Records,33,181,79,1192354,210373
197,spotify:track:5XhG8HGyxLrkJAASxLA463,"Orochi, PL Quest, BIN, Kizzy, Mainstreet",Champagne,Mainstreet Records,93,162,18,1191584,245070
198,spotify:track:1XX75jl3CKMTnKhq1nyngg,Grupo Menos É Mais,Queria Ser Tu / Interfone - Ao Vivo,Som Livre,108,-1,7,1189572,195680
199,spotify:track:5TOvA5Uhxti7FPh0EIdClV,"MC LUUKY, DJ JB Mix",Malvadinho,EDITORA E GRAVADORA A BASE RECORDS,1,159,41,1184567,120115
200,spotify:track:10M1koRXx1iKAR67VW2CxE,Henrique & Juliano,5 Km (Ao Vivo),"Vida Nova Produções, sob licença exclusiva para Virgin Music Group",172,-1,11,1176566,173406
