rank,uri,artist_names,track_name,source,peak_rank,previous_rank,weeks_on_chart,streams,duration_ms
1,spotify:track:0fABszUFNbNq9IW503Gj8v,"DENNIS, MC Kevin o Chris",Tá OK,Sony Music Entertainment,1,1,9,9869176,92093
2,spotify:track:2uhw2oYbugGJbn10wipNX5,"Mc Livinho, DJ Matt D",Novidade na Área,MBB Diamond,2,2,4,9707031,120014
3,spotify:track:0U9CZWq6umZsN432nh3WWT,"Mc Pedrinho, DJ 900","Gol Bolinha, Gol Quadrado 2",GR6 Music,3,4,6,8057040,117293
4,spotify:track:4hKLzFvNwHF6dPosGT30ed,"Veigh, Bvga Beatz, Prod Malax, Supernova Ent",Novo Balanço,Supernova Entertainment Under Exclusive License to UnitedMasters,2,5,9,7967994,140322
5,spotify:track:4uqJelb9THHmJ3OCohg4ZJ,"AgroPlay, Ana Castela",Nosso Quadro,AgroPlay,1,3,24,7726176,173698
6,spotify:track:51pxwIxDVCbFHW8oyJFQXD,Simone Mendes,Erro Gostoso - Ao Vivo,Universal Music Ltda.,3,6,25,7008315,178811
7,spotify:track:4Z2i41GDQyu3KRpBavEnyR,Ana Castela,Solteiro Forçado - Boiadeira Internacional,AgroPlay do Brasil,7,12,2,6954994,194582
8,spotify:track:3PH1nUysW7ybo3Yu8sqlPN,"Israel & Rodolffo, Mari Fernandez",Seu Brilho Sumiu - Ao Vivo,Som Livre,2,7,20,6688218,168840
9,spotify:track:1Vy9Wn5sbiduZKBqBlH3Mc,"Vulgo FK, MC PH, Veigh, Pedro Lotto, Fepache",Ballena,Som Livre,9,-1,1,6626054,200000
10,spotify:track:4pWsXhLUdtBKlw9npIXZAl,Kadu Martins,Halls na Língua,Kadu Martins,10,13,9,6246801,192320
11,spotify:track:4xAGuRRKOgoaZbMGdmTD3N,Zé Neto & Cristiano,Oi Balde - Ao Vivo,Som Livre,3,10,22,6053548,159158
12,spotify:track:4f0aDk7HX37SfzerfznYlr,"Grupo Menos É Mais, Matheus Fernandes",Lapada Dela - Ao Vivo,Som Livre,12,14,21,5925306,159322
13,spotify:track:0bfJWhn3r3UQBF8WYKWT4K,Dyamante DJ,"Vai Novinha Ah, Ah, Ah / Citação: O Chêro Da Carolina",Virgin Music Label And Artist Services (S&D),8,8,5,5728173,123786
14,spotify:track:0redQHBfejmPUhonR5ppGC,"Guilherme & Benuto, Ana Castela, Adriano Rhod",Duas Três,Sony Music Entertainment,8,9,23,5727594,156942
15,spotify:track:1mimc5QiUuwmVYdXkWvgOQ,"Luan Pereira, Gustavo Mioto",MOLETOM,Som Livre,15,17,3,5433801,207343
16,spotify:track:0JIYoXtJfORxI6gRpHv6ZW,Henrique & Juliano,Traumatizei (Ao Vivo Em Brasília),"Vida Nova Produções, sob licença exclusiva para Virgin Music Group",6,11,24,5349297,172005
17,spotify:track:4zUFA8l78k4tCmoVuGtV8z,Luan Santana,MEIO TERMO - Ao Vivo,Sony Music Entertainment,10,15,6,5287135,175468
18,spotify:track:4sqpSDnTrbS8v7RMNCUyqS,"Matheus & Kauan, Mari Fernandez",Não Vitalício (Nunca Mais) - Ao Vivo,Universal Music Ltda.,7,16,24,4906857,169835
19,spotify:track:7x9aauaA9cu6tyfpHnqDLo,"Jung Kook, Latto",Seven (feat. Latto),BIGHIT MUSIC,19,-1,1,4860181,184400
20,spotify:track:12YCtLHGk6tP6RbHDHflCs,"MC Caverinha, KayBlack, Wall Hein",Cartão Black,Som Livre,1,19,10,4578115,159973
21,spotify:track:53PpijFATt35Zxfl6LTxoK,Marília Mendonça,Leão,Som Livre,1,20,32,4514997,166774
22,spotify:track:3P2ubMyuL9NQOVU67TVCXA,"Melody, Naldo Benny, CANETARIA, MATHEUS ALVES","Love, Love",Melody,22,30,5,4484493,133385
23,spotify:track:7DkhndGTKaqkFxxKN7XlAh,"Guilherme & Benuto, Simone Mendes",Manda um Oi - Ao Vivo,Sony Music Entertainment,21,21,10,4371148,166490
24,spotify:track:0SCMVUZ21uYYB8cc0ScfbV,"Israel & Rodolffo, Ana Castela",Bombonzinho - Ao Vivo,Som Livre,1,18,37,4214197,154701
25,spotify:track:1nf1HJdTWXwf9XHQebGlOd,"Gustavo Mioto, Mc Don Juan",Quando Apaga A Luz - Ao Vivo,Universal Music Ltda.,13,23,26,4120409,144298
26,spotify:track:3PqU6gHWUaBTtIZi5oxEJ7,Zé Neto & Cristiano,Um Mês E Pouco - Ao Vivo,Som Livre,26,28,4,4109665,171712
27,spotify:track:39xOREhViooEYFpmnKTdrl,"Veigh, Tz da Coronel, Toledo, Nagalli, Bvga Beatz, Supernova Ent",Engana Dizendo Que Ama,Supernova Entertainment Under Exclusive License to UnitedMasters,11,22,9,4104425,188497
28,spotify:track:4uLzGOlqSanpNS3htaUViY,Zé Neto & Cristiano,Pátio do Posto - Ao Vivo,Som Livre,19,31,17,3942416,178547
29,spotify:track:2LTlykcdu0gwb7zcKneo2a,"KayBlack, Baco Exu do Blues, Marquinho no Beat",Melhor Só,WM Brazil,3,24,16,3920074,229326
30,spotify:track:3o4wcB1Y6xC62eF02n9RSZ,"Luan Pereira, MC Ryan SP",ELA PIROU NA DODGE RAM,Som Livre,14,25,18,3863700,179599
31,spotify:track:3ktTWpYdXrYApH54cBo4Ap,"Matuê, Rich The Kid",Conexões de Máfia (feat. Rich The Kid),Sony Music Entertainment,1,29,12,3764792,221538
32,spotify:track:7IPEkUJsnWYNyBkK2i2FPj,Hugo & Guilherme,Mágica - Ao Vivo,Som Livre,11,27,16,3758922,171730
33,spotify:track:7GScY8oE12cqTiNBzVQpUB,"Gusttavo Lima, Matheus & Kauan",Mala dos Porta-Mala - Ao Vivo,Sony Music Entertainment,33,-1,1,3717306,153237
34,spotify:track:2BlFIe0712LBUtTHxbqjme,"NATTAN, Felipe Amorim",Love Gostosinho - Ao Vivo,Vybbe,12,34,27,3704554,163833
35,spotify:track:3khLpwuyIjEOw8vfJ1oUIT,"MC Kevin o Chris, MC Caja",Papin,MC Kevin o Chris,17,26,14,3656315,122666
36,spotify:track:2pidGuLSSVZPcbzE5QA1Ux,Hugo & Guilherme,Elevador - Ao Vivo,Som Livre,36,44,6,3628770,155767
37,spotify:track:15nTZqWfpXZk9Xh043Ognh,Léo Santana,Posturado E Calmo,Universal Music Ltda.,35,36,6,3534844,187562
38,spotify:track:1gUKbDEyGK4uo8t8MdjKMZ,"Clayton & Romário, Luan Santana",Namorando Ou Não - Ao Vivo,Virgin Music Label And Artist Services (S&D),14,32,19,3309391,168358
39,spotify:track:4ASA1PZyWGbuc4d9N8OAcF,"Gustavo Mioto, Mari Fernandez",Eu Gosto Assim - Ao Vivo,Universal Music Ltda.,1,33,44,3257210,148800
40,spotify:track:7sopDXkuzXtHt8AQpdBxmT,Ana Castela,DONA DE MIM,AgroPlay,13,35,30,3206440,145091
41,spotify:track:7nFvKgVumc9FcU97zGjjei,WIU,Coração de Gelo,Sony Music Entertainment,4,37,33,3183839,168000
42,spotify:track:77BR4gaUAp3p0uA8UL6HT9,"Belle Kaffer, Ana Castela, Charles New",Não Para,WM Brazil,33,39,20,3182983,180923
43,spotify:track:6hu4HvpNzrW2RIEEAZC3vD,"KayBlack, Marquinho no Beat, Wall Hein",Segredo,WM Brazil,19,47,16,3170612,104145
44,spotify:track:5vdQUAFncALEH9EQvyAqIX,"DJ Jeeh FDC, MC LCKaiique, MC Celo BK, DJ Menezes, DJ Arana, Mc Yoshi",Forte Forte de Lacoste - Pra Começar o Final de Semana,24por48,44,50,6,3135074,182769
45,spotify:track:5TtTijiNYtFc6ktQARjY30,"KayBlack, Wall Hein",Preferida,WM Brazil,13,38,16,3093332,130375
46,spotify:track:5aqwwgL4XOv2YJYwLiqKOZ,Maiara & Maraisa,A Culpa É Nossa - Ao Vivo,Som Livre,8,42,31,2997713,165000
47,spotify:track:745VUhm32odbxJI2q1rUMv,"MC Guh SR, MC Pê Original, Dj Pikeno Mpc, Markim WF",Ela Voltou de Perna Bamba,Mandelão Records,21,40,11,2993323,199384
48,spotify:track:6xRDvureEBwHgwAYDufbJL,"Eric Land, Tarcísio do Acordeon",Chorei na Vaquejada,Eric Land,15,48,9,2935117,157170
49,spotify:track:51FFbyL0PjkYtjXJQP0JoP,Gusttavo Lima,Saudade da Minha Vida - Ao Vivo,Sony Music Entertainment,12,45,25,2906069,194850
50,spotify:track:7Ht57bh2FwiQLwRH9zqESG,Rogerinho,085 - Ao Vivo,ONErpm,20,43,23,2905695,163584
51,spotify:track:6dtQM0CXRFJgD7ifUNosZj,"Lauana Prado, Guilherme & Benuto",Desandei - Ao Vivo,Universal Music Ltda.,41,41,12,2835063,143372
52,spotify:track:0KXdSF0Poa57KOepZ3hKrh,"Naiara Azevedo, Ana Castela",Palhaça - Ao Vivo,NA Records,18,46,27,2789326,170191
53,spotify:track:1yxLzhNXgm3SwyjbrBudcu,Juliette,Sai Da Frente,Virgin Music Label And Artist Services (S&D),53,55,3,2784612,167445
54,spotify:track:6L2ule7uWSdh1qjcMO3vUD,"Murilo Huff, Wesley Safadão",Quem tá Pegando,M Show,49,49,9,2773616,162865
55,spotify:track:1L7hWEc3tVjvmbw48ShktM,Gusttavo Lima,Desejo Imortal (It Must Have Been Love) - Ao Vivo,Sony Music Entertainment,26,52,14,2508268,184128
56,spotify:track:22sAwsBH0NoNJXnrBenQuO,"MC Xenon, Os Gemeos da Putaria",Sem Aliança no Dedo,DC MUSIC,3,54,24,2424546,120461
57,spotify:track:7CUQQLRMIeSfa4m2uQcRHp,Henrique & Juliano,Rancorosa (Ao Vivo Em Brasília),"Vida Nova Produções, sob licença exclusiva para Virgin Music Group",17,56,17,2419278,181457
58,spotify:track:156LKAN2oh16qflL5oz4tO,MC PH,Os Bico Tão Se Perguntando (Let’s Go 3),GR6 Music,11,53,15,2403936,177551
59,spotify:track:5yscNPMHmhqHQX9B9GFzMp,Henrique & Juliano,Te Esqueci Sem Querer (Ao Vivo Em Brasília),"Vida Nova Produções, sob licença exclusiva para Virgin Music Group",43,51,13,2371944,151092
60,spotify:track:1Z3QqD45wKKN6fUKBXSvcZ,"Diego & Victor Hugo, Luan Pereira",Pirulito Vermelho,Sony Music Entertainment,59,66,5,2332530,152085
61,spotify:track:5WsM6qhZzRSD3oKbtorxzD,"MC Kevin o Chris, BUARQUE",Aquecimento Senta Senta Suave,MC Kevin o Chris,8,57,19,2286308,152888
62,spotify:track:0yZRkiCSy4ra9EykuYyGo0,"Vulgo FK, Kyan, Bvga Beatz, Toledo",Mandona (Se eu te dissesse),GR6 Music,47,58,11,2282314,127058
63,spotify:track:0Q1oLvAI9QaD3DIlvluTqx,Israel & Rodolffo,Voltou Com Quem Não Voltava - Ao Vivo,Som Livre,52,67,9,2261021,147132
64,spotify:track:1JxrRikYoQjq2hlogQFyv5,"AgroPlay, Luan Pereira, Dj Chris No Beat",Vai Luan - AgroPlay Verão,AgroPlay,54,59,4,2223946,131749
65,spotify:track:0WrM1ON5poAsmKw3x5uPhD,Maiara & Maraisa,Narcisista - Ao Vivo,Som Livre,65,-1,1,2158145,211200
66,spotify:track:42JNab8NPeCADJ9D3Cl5wS,Zé Neto & Cristiano,Barulho Do Foguete - Ao Vivo,Som Livre,66,70,3,2132122,133546
67,spotify:track:3d1im1pw3WLuEty2k9XzTr,"Veigh, Niink, Bvga Beatz, JHXW, Supernova Ent",Clickbait,Supernova Entertainment Under Exclusive License to UnitedMasters,15,61,12,2121697,161344
68,spotify:track:2LJLGfBHKFmNdD4iXRRPXV,Gusttavo Lima,Solteiro Frustrado - Ao Vivo,Sony Music Entertainment,60,60,5,2069745,180293
69,spotify:track:5ffDENIdtByAZxHpuuj9li,"Veigh, Nick Nash, Wylo, Nagalli, Supernova Ent, Kaash Paige",Vida Chique,Supernova Entertainment,38,63,29,2013392,210545
70,spotify:track:6F0ldIcRC6oCcn3hDukg9T,"Thales Lessa, Nadson O Ferinha",Cadê Seu Namorado Moça?,WM Brazil,64,64,8,1983153,226476
71,spotify:track:1M6rclDhYmqRBMFGNJOFKB,"NATTAN, Grandão Vaqueiro",Americana Na Vaquejada,Feeling,37,62,16,1942475,156330
72,spotify:track:6njJR3OIp3oA0Kc4aC9Tzf,"S3BZS, Mc Gw, Mc Menor Do Alvorada",MONTAGEM - PR FUNK,S3BZS,72,97,5,1901649,61634
73,spotify:track:2M4kQD87lKnAS9vFlb4Bez,"Matheus & Kauan, Jorge & Mateus",Pactos - Ao Vivo,Universal Music Ltda.,6,68,40,1893919,183694
74,spotify:track:7CJJ7JC3kj9XdweWTvfVhX,"Zé Felipe, Igow, Wesley Safadão",Vacilão,Som Livre,2,71,18,1887792,130403
75,spotify:track:09pQ3lGyMTpW3rz7a71zwQ,Hugo & Guilherme,Metade De Mim - Ao Vivo,Som Livre,24,65,20,1869101,160836
76,spotify:track:4KUj5wxJuY9Nf7L6guRxrU,Henrique & Juliano,Abre A Mente (Ao Vivo Em Brasília),"Vida Nova Produções, sob licença exclusiva para Virgin Music Group",64,91,6,1867221,190704
77,spotify:track:6p6ohOKSzL4JaIRzSeOmWx,"Felipe Amorim, Gustavo Mioto",Cama Embrasa,One Play,48,75,10,1838812,178000
78,spotify:track:4sfY9Q4rQKVwxQVKo6v04i,"Vulgo FK, MC Ryan SP, Tkd, Bvga Beatz, MATHINVOKER",2023,Som Livre,78,-1,1,1833946,178407
79,spotify:track:3l5VjEAeUTqrlD50iEo8Yn,"KayBlack, CVSTRO, Wall Hein, AMUSIK",Licor 43,Elenko Music,64,77,44,1827405,142470
80,spotify:track:4AKsSRxe6z6woOAsXr5gVA,"Mc Kevin, MC Hariel, DJ Jorgin",Coração na Geladeira 2,WMD,80,-1,1,1814580,144000
81,spotify:track:1aDGzQHWNCMy3pF1Stqjk7,"Vulgo FK, KayBlack, WEY, Pedro Lotto, Wall Hein",Celine,Som Livre,81,-1,1,1812018,162506
82,spotify:track:27ECP9NCzTAoTpxXNePZuS,"Mc Paiva ZS, Love Funk, DJ Ak beats",01 Não É 02,Love Funk,82,98,4,1801097,128503
83,spotify:track:2tFmuYL5D8zqBHvs0nG5Tn,"KayBlack, Marquinho no Beat",Bonjour,GR6 Music,32,82,23,1783806,131927
84,spotify:track:7kJ0aTB5gLMYrJjYft3Vx6,"DJ Katrip, Dj Darge, Mc Th, Mc Delux",Na Contramão,DJ Katrip,59,69,10,1772012,164826
85,spotify:track:0dcHD9QhnWRA41zoLnC83X,"MC Cabelinho, Dallass",X1,MC Cabelinho,30,78,63,1729902,188852
86,spotify:track:7zmS0vPbWg2k6sfL3uqrGD,"Luiza Martins, Matheus & Kauan",Cê Não Me Superou - Ao Vivo,Som Livre,86,155,5,1699610,168380
87,spotify:track:3YQvZNmRc2y1hgdvustkce,"MC Cabelinho, Ajaxx, Galdino",MINHA CURA,Bairro 13,57,92,30,1688600,154694
88,spotify:track:1JQ1ylL2JEjC6Ib7IJgOvS,"Mc Don Juan, DJ Yuri Martins",Coração Amoleceu,WM Brazil,65,80,24,1685386,161365
89,spotify:track:6UHMmTS8TfWK3vKvoEZOQG,"AgroPlay, Ana Castela, Rodolfo Alessi",Me Gusta - AgroPlay Verão,AgroPlay,53,73,8,1682988,152673
90,spotify:track:1YTzCKxoOSZOqcNh6wa15I,"MC Menor MT, DJ DEIVÃO, DJ Gouveia",Galopeira,2023 Portuga Records / Terror Dos Bailes,71,76,13,1676985,177461
91,spotify:track:2hkwwmmLC90T8BQ7t3xufq,"Zé Felipe, Ana Castela, Luan Pereira",Roça Em Mim,Som Livre,5,89,35,1646949,158171
92,spotify:track:3fkLH5wAzni4mcXl4c6cAC,Nadson O Ferinha,Sinal,pidamusic,92,133,9,1645921,233038
93,spotify:track:0tBgLNgCmRTmqrydcFfQjt,"Pedro Paulo & Alex, Ana Castela",Ia Dar Bom,Artinvox,78,90,7,1644975,168673
94,spotify:track:52EYWdjiulHaehpexuowyh,"MC Cabelinho, Cyclope Beatz, Red, meLLo",FOGO E GASOLINA,Bairro 13,30,86,31,1633579,181767
95,spotify:track:5Ubx4DpvVodvsGH9ilxPVi,"Guilherme & Benuto, Hugo & Guilherme",Haja Colírio (feat. Hugo & Guilherme) - Ao Vivo,Sony Music Entertainment,2,74,56,1632711,173366
96,spotify:track:1a5LfJGq0vuCWQ9Mme0Ac7,Maria Marçal,Deserto (Ao Vivo),MK Network,85,96,41,1625985,268000
97,spotify:track:6ELMBm3lZFitAZp03GBBNG,Gabriela Rocha,Me Atraiu - Ao Vivo,Onimusic,75,103,22,1604617,503635
98,spotify:track:6eNRGL6Nkdg7RhJtmbcl0j,"Mc Tato, DJ Ak beats",Luz do Luar,RF PRODUTORA,7,85,30,1598894,184615
99,spotify:track:2orGm2E68ODFYOURjaES62,"WIU, MC Ryan SP",Felina,Sony Music Entertainment,5,94,43,1594907,225882
100,spotify:track:2xs2TwrlfamtW0DQqId0M5,"DJ BOY, Mc Don Juan, MC Joãozinho VT, Kako, MC Hariel, MC Tuto, MC Marks, MC Vine7",Set Dj Boy 3.0,Sonar Music,87,93,10,1591907,409411
101,spotify:track:5y7yYXNSsT89A27DQxbmUL,"Wesley Safadão, Ana Castela",Covardia,Wesley Safadao,17,72,16,1591660,150863
102,spotify:track:1rLahQ58edFplZKDcjJ7cH,"Veigh, Luchinha Jr, Supernova Ent, Baby",Mandraka,Supernova Entertainment,91,111,24,1554443,122177
103,spotify:track:74Le949TrZk4zwDjtWzH23,"Bruno & Denner, Gusttavo Lima",Cavalo de Pau,Balada Music,46,102,40,1542361,164029
104,spotify:track:5pBU3Yihoa4hiwQ2T5fGhH,"Guilherme & Benuto, Matheus & Kauan",Esse B.O é Meu - Ao Vivo,Sony Music Entertainment,15,83,37,1517247,160710
105,spotify:track:1jHgfC8T5KxUyC5Ldw6lk9,Léo Santana,Zona De Perigo,Universal Music Ltda.,1,100,25,1509275,142151
106,spotify:track:5WGTBzRLbjj0Sm3Br8X1rI,"Mc Paiva ZS, Gabb MC, Dj Aladin GDB, Love Funk",Bandido Não Dança,Love Funk,32,99,27,1491817,126461
107,spotify:track:0oB3IBEhbmgTrL7mV0VnFq,Kadu Martins,Novinha do Onlyfans - Tchan Ran Tchan Tchan,Kadu Martins,10,101,38,1487987,137660
108,spotify:track:6tW23l5oRR8XyYJsF5si9G,"US Agroboy, Ana Castela",Eu Minto (Ao Vivo),WM Brazil,47,87,25,1481020,160641
109,spotify:track:4Dvkj6JhhA12EX05fT7y2e,Harry Styles,As It Was,Columbia,10,110,68,1479537,167303
110,spotify:track:6bTdZ7xfKp3NqqADJ8HLyj,"Matuê, WIU, Teto",Vampiro,Sony Music Entertainment,1,109,68,1466290,250434
111,spotify:track:0nVpE03Iv9uioPSomEN5v0,Anitta,Funk Rave,Republic Records,24,79,4,1462054,147201
112,spotify:track:4qDT0BeJ7BjatrN9k8AvB4,"Teto, WIU, Matuê",Flow Espacial,Sony Music Entertainment,6,112,25,1448132,165925
113,spotify:track:7AwVSKaQxpidrtYBerkHKk,"Ana Castela, Melody, Dj Chris No Beat",Pipoco,Ana Castela,1,95,60,1441199,194022
114,spotify:track:52kcarcX0FQ6wPulXm2bMJ,"Vulgo FK, MC Cebezinho, KayBlack, Pedro Lotto, AMUSIK",Meca Cereja,Elenko Music,43,105,37,1430408,234193
115,spotify:track:5geU4byUA1hnQofQPOsPDS,"Orochi, MC Ryan SP, Oruam, Xamã, Neo Beats, Kizzy, Mainstreet",Sereia,Mainstreet Records,8,108,38,1426353,294418
116,spotify:track:0AIA4KsMsyqur8FbTVhGNT,Luan Santana,SOLTEIROU - Ao Vivo,Sony Music Entertainment,26,107,26,1420993,148548
117,spotify:track:3gCWngngUs1uojw33vrE8K,Jorge & Mateus,5 Regras - Ao Vivo,Som Livre,7,104,51,1416758,161469
118,spotify:track:0oZrvoCYEbKGCsU7cQqNnw,"Yago Oproprio, Rô Rosa, Skeeter Beats",Imprevisto,Som Livre,32,125,39,1395364,139703
119,spotify:track:5AdPP30mjJCtBMyYKZUEU7,"Guilherme & Benuto, Xand Avião",Assunto Delicado - Ao Vivo,Sony Music Entertainment,3,88,48,1393017,180504
120,spotify:track:1OZ4uv7OAP24Ix6j3vojLt,"Mc Paiva ZS, MC Ryan SP, Kotim",Casei Com a Putaria,Love Funk,1,116,54,1392800,157500
121,spotify:track:3k79jB4aGmMDUQzEwa46Rz,Olivia Rodrigo,vampire,Olivia Rodrigo PS,46,84,3,1389876,219724
122,spotify:track:7qoIhutxU269Zqo9PG5IOj,"Pineapple StormTv, Chris MC, Salve Malak, Tz da Coronel, MC Cabelinho, Chefin, L7NNON, Luísa Sonza, Oruam, Xamã, N.I.N.A",Poesia Acústica 13,Pineapple StormTV,1,126,44,1381931,628124
123,spotify:track:4DHcnVTT87F0zZhRPYmZ3B,Miley Cyrus,Flowers,Columbia,5,121,27,1379525,200600
124,spotify:track:2kBbHpJTc7MWs8F3XhClBD,Matheus Fernandes,Altas Loucurinhas (Uni Duni Tê) - Ao Vivo,Som Livre,20,122,28,1376842,202411
125,spotify:track:6BsKZXjKIrGWMK1uLWfJYN,"KayBlack, Veigh, Vulgo FK, WEY, Nagalli",Sal e Pimenta,WM Brazil,40,113,16,1375556,206451
126,spotify:track:2EvWcRC0FinZpx1jUfG4NB,Simone Mendes,Você Mereceu - Ao Vivo,Universal Music Ltda.,126,-1,1,1369565,162963
127,spotify:track:7aOBf2xYbux3bo1fwISo6b,"MC Cabelinho, Oruam, Palma",BEM MELHOR,Bairro 13,43,106,11,1364790,317340
128,spotify:track:3Ua0m0YmEjrMi9XErKcNiR,Jimin,Like Crazy,BIGHIT MUSIC,85,185,17,1360632,212241
129,spotify:track:4kRLRWnn5u9wO2wOKAAdEN,"Bibi Babydoll, Dj Brunin XM, KZA Produções",Automotivo Bibi Fogosa,WM Brazil,129,154,2,1338103,129776
130,spotify:track:0pZIBIJ253pH9gJtXE0Ouf,"KayBlack, Marquinho no Beat, Wall Hein",Vestido da Fendi,Elenko Music,100,124,60,1326423,164203
131,spotify:track:2X5o4nRiocnoaaQ2wMwaeC,"DJ Cayoo, DJ ESCOBAR, Nilo, MC Myres",Sorrisin De Puto,Tropa 7lc,45,114,27,1320856,106153
132,spotify:track:4tuFNhM69UakXdPg4RrNvp,"Filipe Ret, Dallass, Hunter",Deus Perdoa,Som Livre,45,140,17,1308685,137142
133,spotify:track:4mD9hjoTckjeL1CrJCx0MT,"DJ Jeeh FDC, MC Menor MT, Yuri Redicopa, Mc Pelé",Puta Mexicana,PMI Records Oficial,4,123,29,1301157,162461
134,spotify:track:3O2wrDL7nnSDZOrdZqxyoY,"Mc IG, MC Pipokinha, DJ Glenner",Noite Fria,GR6 Music,20,117,20,1290536,160975
135,spotify:track:1BxfuPKGuaTgP7aM0Bbdwr,Taylor Swift,Cruel Summer,Taylor Swift,95,130,8,1270951,178426
136,spotify:track:1TgVaCf8D5mXZrK1d7uIZe,"Yuri Redicopa, Dj Bnão",Bebê Tá Solta,Portuga Records & Funk 24por48,46,120,21,1267844,197104
137,spotify:track:2Vl7x4BkNhhJkEmQQMcV0V,Mc Jacaré,Toma Tapa,A Chave,27,81,32,1263254,122994
138,spotify:track:76PSvY34ovx8MVJL9wHAXS,"KayBlack, Wall Hein",Vivências,Elenko Music,128,165,12,1258428,167115
139,spotify:track:5btDKzAsFh975NSWxwBHRc,Felipe Amorim,Coisas Que Eu Sei,One Play,44,134,14,1255711,192240
140,spotify:track:74myq4QbO9E8bTtLQuOWYY,"Anitta, HITMAKER",Nu,WM Brazil,80,139,13,1245397,167076
141,spotify:track:18yZLabAj1liqEUcgxDgeJ,"Israel & Rodolffo, Jorge & Mateus",Perdoou Nada - Ao Vivo,Som Livre,16,127,33,1234237,163120
142,spotify:track:3C99BfGe301JNp7BqTX5Uu,Felipe e Rodrigo,Média Boa (Ao Vivo),MK Records,8,119,40,1228541,148900
143,spotify:track:2jZrMlMuTk1N3LJS8yQM6q,"Ana Castela, PEDRO SAMPAIO",Carinha de Bebê,WM Brazil,50,135,22,1225133,175725
144,spotify:track:1ACALdBWViTpLBC14Ecv8E,"MC Ryan SP, Mc Daniel, Kotim",Namora Aí,WM Brazil,18,143,32,1225079,148615
145,spotify:track:3LxUi6dRPOza6BFcM6xXdW,"MC Cabelinho, Belo, Mousik",MINHA CURA - REMIX,Bairro 13,84,176,7,1220174,154734
146,spotify:track:44FHIA9SyNUMEu6ZFFRDLH,"Matheus Fernandes, Luan Santana",Duas Camas - Ao Vivo,Som Livre,129,129,2,1217843,171850
147,spotify:track:7zKqmAHGY8zm2UA4wT5ant,"Veigh, Toledo, Supernova Ent, Bvga Beatz",Perdoa Por Tudo Vida,Supernova Entertainment,77,141,28,1216822,160000
148,spotify:track:6wf7Yu7cxBSPrRlWeSeK0Q,Billie Eilish,"What Was I Made For? [From The Motion Picture ""Barbie""]",Darkroom/Interscope Records,148,-1,1,1213021,222369
149,spotify:track:5uTVtc2Oc93nBVqPPI8Ijj,"GORDÃO DO PC, DJ LUCAS DE PAULA, Kadu Martins, MC Kevin o Chris",Halls na Língua - Remix,GORDÃO DO PC,149,-1,1,1205302,143999
150,spotify:track:6TYZ8bvIGM0HuSVlsHDhoS,"MC MENOR HR, MC MENOR SG, DJ ESCOBAR",Evoque Prata,GUETTO RECORDS,1,115,38,1204064,107128
151,spotify:track:7bz3kEKKtEONtzxB6jrnb5,"Mc Don Juan, Mc Kako, DJ BOY, Gabb MC, MC Joãozinho VT, MC Marks, MC Vine7, Mc Robs",Banco do Carona,WM Brazil,151,152,6,1201955,450410
152,spotify:track:6a6UEfhgIKfzrZu1hqRYup,"Long beatz, Tz da Coronel, Xamã, Leviano",INEFÁVEL (feat. Leviano),WM Brazil,87,138,21,1201446,245987
153,spotify:track:7oWd2k0fhorqIpXotLNN9F,"Veigh, G.A, Toledo, H4lfmeasures, 6ee, Supernova Ent",Bolsa de Ombro,Supernova Entertainment Under Exclusive License to UnitedMasters,40,150,9,1188888,114321
154,spotify:track:2qn6ZGYxOw5Mi9gfKPWlyM,Guilherme & Benuto,Ex Gaveta - Ao Vivo,Sony Music Entertainment,131,131,2,1188277,161251
155,spotify:track:6a382HNK01vxXOucIrXMZ3,"Mariana Fagundes, Kevi Jonny",Me Usa - Ao Vivo,Mariana Fagundes,155,182,2,1187799,166451
156,spotify:track:7haCn21tCWhVqg87x6tkRS,"Tz da Coronel, Langris",Se Você for Embora,A Cúpula,98,187,17,1182037,130496
157,spotify:track:2slHCHYP7ogpGSsCumJT1a,"Murilo Huff, Matheus & Kauan",Fulano - Ao Vivo,M Show,53,132,16,1177088,169231
158,spotify:track:4sBAoZMcOumSlKTRGaprhQ,Zé Neto & Cristiano,Me Bloqueia - Ao Vivo,Som Livre,113,170,17,1175712,157200
159,spotify:track:6L8aBaqfwMuwhpI9uhbyjp,"PEDRO SAMPAIO, Mc Tato",JOIA RARA,WM Brazil,159,-1,1,1172801,152888
160,spotify:track:4NNZZXHgn9F3cCgC1YGmLl,Jorge & Mateus,Todo Seu - Ao Vivo,Som Livre,9,137,63,1166884,171712
161,spotify:track:0FBV7lozkqCSuV2q24n43x,Teto,Minha Vida é um Filme,Sony Music Entertainment,62,145,16,1160483,186666
162,spotify:track:5XeFesFbtLpXzIVDNQP22n,Arctic Monkeys,I Wanna Be Yours,Domino Recording Co,96,153,45,1160208,183956
163,spotify:track:3xIMkM5LgbVDkpO74O3Np3,Troye Sivan,Rush,EMI Recorded Music Australia Pty Ltd,163,-1,1,1151763,156391
164,spotify:track:1MgO3fAl4ODVQweg5GR0Lk,"Papatinho, Luísa Sonza, DJ Biel do Furduncinho",Posição de Ataque,WM Brazil,104,161,10,1144820,149090
165,spotify:track:0LGGo9eY1aJX6tqgxa87kd,"KayBlack, Wall Hein, Yokame",Freestyle,Bunker Concept,68,128,27,1144446,180172
166,spotify:track:6syoEFGSKDumTu7VTvO44A,"Vulgo FK, Pedro Lotto, Galdino",Porsche Hortelã,Som Livre,166,-1,1,1120817,137374
167,spotify:track:4kAMyuJBbmJrbr6TLOWbEk,"Diego & Victor Hugo, Jorge & Mateus",Beijo de Glicose - Ao Vivo,Sony Music Entertainment,6,142,46,1119679,171007
168,spotify:track:5asabafNzfAzjUecDvuNES,Henrique & Juliano,Aquela Pessoa (Ao Vivo),"Vida Nova Produções, sob licença exclusiva para Virgin Music Group",39,136,77,1114516,166838
169,spotify:track:4VvsTSxSSAu8IRBpt3iDMR,Isaias Saad,Bondade de Deus,Onimusic,164,164,13,1109933,375653
170,spotify:track:4A5NB5ygGvuN10h8bHp4pa,"Mc Kevin, MC Hariel, Dj Nene",Fogo na Pólvora,WMD,170,-1,1,1109764,234000
171,spotify:track:2zDwJnP9n9yCUyfiLIwkDM,"Guilherme & Santiago, Marília Mendonça",Se Ele Soubesse - Ao Vivo,Deolli Music,53,149,24,1096918,170106
172,spotify:track:4aFZiSRqkxC5sIbSDMWBE5,Wesley Safadão,Rua - Ao Vivo em Bahamas,Wesley Safadao,172,-1,1,1093316,168216
173,spotify:track:3IMLoeLerS7TMpKjxUgAhx,Henrique & Juliano,Arranhão (Ao Vivo),"Vida Nova Produções, sob licença exclusiva para Virgin Music Group",1,148,102,1091284,153409
174,spotify:track:13Rf6RaZT13TW4xLQR3MQr,"MC Cabelinho, Bob do Contra, Azzy, Filipe Ret, Dudu, Xamã, Orochi, Maquiny, Pineapple StormTv",Poesia Acústica #6 Era uma Vez,Pineapple StormTV,18,173,214,1085466,577819
175,spotify:track:006pMMCuRo2TFjh8sNGSov,Charlie Brown Jr.,"Dias De Luta, Dias De Gloria",EMI Brazil,153,191,15,1081035,145466
176,spotify:track:4pjznsLeoyimnxGlVpmyJI,"MC Cabelinho, Victor WAO, Bairro 13",NÉ SEGREDO,MC Cabelinho,34,160,43,1078919,155771
177,spotify:track:7qrQs4rPGCXnwNyLn2YVCT,"Veigh, Nagalli, Toledo, Bvga Beatz, Honaiser, Supernova Ent",Devolve as Correntes / Invisível,Supernova Entertainment Under Exclusive License to UnitedMasters,52,157,9,1076165,140860
178,spotify:track:1z9nFMwAjL6IcDlfbDELIO,"Mc Kevin, Mc Don Juan, Djay W",Cavalinho 2,WMD,178,-1,1,1074906,128000
179,spotify:track:5GbvrjiAu6tt9qweHNSban,"AgroPlay, Ana Castela, Luan Pereira",Vaqueiro Apaixonado,AgroPlay,99,146,15,1074097,139413
180,spotify:track:7aZnuwpivaj4N7XFhhqBiO,"Mari Fernandez, MC Ryan SP, Mc Daniel",Love Absurdo,Sony Music Entertainment,46,166,23,1069629,184153
181,spotify:track:5r9CZJMoMmxio2AnJdxuDS,"Grupo Menos É Mais, Di Propósito, Vou Zuar",Pot-Pourri: Melhor Eu Ir / Ligando Os Fatos / Sonho de Amor / Deixa Eu Te Querer - Ao Vivo,Som Livre,21,175,162,1068582,521088
182,spotify:track:2ZWxngKhr90tiStZ2LUWQ8,Ferrugem,Interessante,WM Brazil,179,-1,3,1067001,172693
183,spotify:track:0ssgd2ZvDawP0KHGfBYRpv,"Filipe Ret, Caio Luccas, Dallass",Good Vibe,Som Livre,67,158,56,1058390,181818
184,spotify:track:5RHOhXxMVhpEaBcG6hIydA,"KayBlack, Wall Hein, AMUSIK",Maturidade,Elenko Music,112,168,30,1055839,142026
185,spotify:track:0wSFsliBwxevwTEXXag2ro,"Mc Don Juan, DJ Boy",A Semana Inteira,WM Brazil,185,-1,1,1053232,172235
186,spotify:track:4uUG5RXrOk84mYEfFvj3cK,"David Guetta, Bebe Rexha",I'm Good (Blue),Parlophone UK,51,177,45,1046630,175238
187,spotify:track:4TvKjqrk0Hp6k0vsbxyXjK,"Nagalli, Vulgo FK, Borges, Veigh, Supernova Ent, Kyan","MAL INTENCIONADA (JÁ FOI, JÁ ERA)",Supernova Entertainment,146,183,3,1044502,228571
188,spotify:track:7vXSNnRZm6DfQsmqM7MWYn,"Mc Kevin, MC Ryan SP, DJ Jorgin",Amassa a Placa 3,WMD,188,-1,1,1043326,158500
189,spotify:track:1vYXt7VSjH9JIM5oRRo7vA,Dua Lipa,Dance The Night - From Barbie The Album,Atlantic Records,189,-1,1,1026184,176579
190,spotify:track:6YYCK0t9NAz1p7cXLe4xqL,"Mc Jacaré, MC Kevin o Chris",Terror da Cidade,A Chave,190,192,2,1020748,186427
191,spotify:track:6kNZdlmjH4BQnSUfHeJIuc,"Dj GBR, Mc IG, MC Ryan SP, MC Marks, Mc Don Juan, MC PH, Mc Luki, Mc Paiva ZS, MC GP, Makalo","Let's Go 3 (feat. MC Marks, Mc Don Juan, MC PH, Mc Luki, Mc Paiva ZS, MC GP & Makalo)",Sony Music Entertainment,81,167,38,1014328,508586
192,spotify:track:6qylu0VNKUfKiVi88WL3Ci,"Puterrier, Borges, Mainstreet, Heavy Baile, Leo Justi, Pedro Bala",Marolento,Mainstreet Records,113,162,12,1011100,161379
193,spotify:track:44BxyVXPdLMW4dIPicL9jM,"Kyan, Mu540",Fantástico Mundo da Oakley - Bonus Track,UM Quebrada Inteligente,193,-1,1,1008814,200000
