rank,uri,artist_names,track_name,source,peak_rank,previous_rank,weeks_on_chart,streams
1,"spotify:track:6RjSXi9cPGroetXeNsWFGL","DJ TOPO, Seu Jorge, Mc Leozin, MC G15","MTG QUEM NÃO QUER SOU EU","DJ TOPO",1,1,8,"7012950"
2,"spotify:track:7ldcYtMOjtX1eFVEYzj2kJ","Luísa Sonza, KayBlack","Sagrado Profano","Sony Music Entertainment",2,5,6,"6775537"
3,"spotify:track:7IFsTX5H1sWcEl8joV0IdD","THE BOX, Mc Brinquedo, MC Cebezinho, MC Tuto, Mc Laranjinha, DJ Oreia","THE BOX MEDLEY FUNK 2","Sony Music Entertainment",2,4,10,"6658266"
4,"spotify:track:106SKHXoytRADjpxHBkJpV","dj sv, Doug Hits, Manim Vaqueiro","Mtg Forró e Desmantelo","Doug Filmes",1,2,11,"6581459"
5,"spotify:track:6W196uVRkmQFHbc1XV8DNk","CountryBeat, Félix, Léo Souzza","Sonho Dela (Cowboy)","CountryBeat",5,8,8,"6347691"
6,"spotify:track:3kBYuWrGtx1tSHjzr0vlZh","Mc IG, Murillo e LT no Beat, DJ Glenner","Sorriso no Rosto","WM Brazil",3,3,5,"5931770"
7,"spotify:track:3w392XWJ5bXzjcCR2Dmvqn","Zé Neto & Cristiano, Ana Castela","Foi Intenso - Ao Vivo","Som Livre",5,9,9,"5931703"
8,"spotify:track:13KLZ8VI9P7H7bxs0vtsXC","Dj Luan Gomes, Tropa da W&S","MTG QUERO VER SE VOCÊ TEM ATITUDE","PDF Records / W&S Music",4,6,7,"5777914"
9,"spotify:track:0HDMisLsuGNml98Xq7atpm","Luan Santana, Luan Pereira","EU SOU SENTIMENTO","Sony Music Entertainment",5,10,4,"5607645"
10,"spotify:track:4VNRWHoiKHZJIoQHPbmJIv","Felipe e Rodrigo","Gosta De Rua (Ao Vivo)","MK Records",1,7,13,"5552589"
11,"spotify:track:5GV7OpSEb8MPTryL0Q5i6c","DJ JZ, Humberto & Ronaldo, Mc Mininin, DJ LG PROD, Silvanno Salles","Mtg Quero Te Encontrar","Tropa do Serrão",1,12,17,"5140441"
12,"spotify:track:6hNREzgHbVM5AkGwP4SPmU","Luan Pereira, Murilo Huff","FALTA DE QUÊ?","Som Livre",4,11,7,"4958743"
13,"spotify:track:7eoRm37Ta1jvGMiMRfOQoa","Dj VN Maestro, MC G DS","Eu So Comi Ela uma Vez","Love Funk Records",13,13,3,"4822920"
14,"spotify:track:1NcqLEg2r2LXqMVbam2BJD","Matheus Fernandes, Matheus & Kauan","Triplex - Ao Vivo","Som Livre",14,45,4,"4610814"
15,"spotify:track:6mTpK40yIRk1xGGNvRMHGg","Murilo Huff, Gustavo Mioto","Me Caiu Tão Bem - Ao Vivo","M Show",14,14,4,"4449689"
16,"spotify:track:5Qqpplbu8ROd71c0brQxyy","Mc IG, MC Ryan SP, DJ Glenner, Mc Poze do Rodo, Oruam","Filha do Deputado","WM Brazil",16,-1,1,"4373477"
17,"spotify:track:0WiJIa3V9GdcJfcy1FhLjp","Zé Neto & Cristiano","Deu Moral - Ao Vivo","Som Livre",5,16,12,"4359780"
18,"spotify:track:6cFW2FPaUL4YRJfS9zFJaV","Simone Mendes","Dois Tristes - Ao Vivo","UME - Global Clearing House",4,15,18,"4114185"
19,"spotify:track:6X6jKoyw1OjogRghMEQAZV","Jorge & Mateus, Lauana Prado","Haverá Sinais - Ao Vivo","Som Livre",2,18,19,"3948641"
20,"spotify:track:5496lks6V3fh1mZAB6IAap","Sevdaliza, Pabllo Vittar, Yseult","Alibi (with Pabllo Vittar & Yseult)","Twisted Elegance",20,-1,1,"3899976"
21,"spotify:track:1CpneInvFvGYcDVU4CCDgI","Ana Castela","Minha Herança - Ao Vivo","AgroPlay",17,17,5,"3857131"
22,"spotify:track:2kFaWbpzQzpaJ0H6PskR6k","Mari Fernandez","Página De Ex - Ao Vivo","Som Livre",22,23,9,"3747927"
23,"spotify:track:7Elw15XWLpOi4qzHyAwa9e","Gloria Groove","Nosso Primeiro Beijo - Ao Vivo","SB Music",18,19,5,"3621578"
24,"spotify:track:3QpDKVHmf9RDQkJbAUNWzI","Gustavo Moura & Rafael","Digitando","Astro Produções",1,50,19,"3520530"
25,"spotify:track:1WHDOr19zyyqu6XXIvdgfX","Hugo & Guilherme, Maiara & Maraisa","Morena De Goiânia - Ao Vivo","Som Livre",11,21,15,"3468728"
26,"spotify:track:5QpcLTQjh0qO7OIuR9q8IR","Gusttavo Lima","Morar Nesse Motel","Sony Music Entertainment",26,-1,1,"3456807"
27,"spotify:track:2o4hr5HCAKShrbFtmxm7Dg","Manu, Guilherme & Benuto","Torre Eiffel - Ao Vivo","manuoficial",17,36,18,"3454921"
28,"spotify:track:4W87Hv4pBFsE0JEi7enRBQ","TrapLaudo, Mc IG, MC PH, MC Ryan SP, Mc Don Juan, Murillo e LT no Beat","Malvada","4M RECORDS",28,42,3,"3375290"
29,"spotify:track:5r0JHIjcY7dLWHkljNeQbj","Murilo Huff","Anestesiado - Ao Vivo","M Show",4,22,33,"3313364"
30,"spotify:track:60wgnlVBEsyswrTB6pYiTi","amblu","Como Um Beijo","amblu",19,24,5,"3291191"
31,"spotify:track:2SFcDfkE1MRXZfl4LIwscm","Flozimbar","Hysteria","Robin",26,26,5,"3216832"
32,"spotify:track:3iam4WkRoqMoBBCwDFZNgd","Henrique & Juliano","Quase Algo (Ao Vivo Em Nova Iorque) (2022)","Vida Nova Produções, sob licença exclusiva para Virgin Music Group",17,28,42,"3155271"
33,"spotify:track:5jrQZnYInM6YUjr2yFSa3E","MC PH, Vulgo FK, Veigh, Pedro Lotto, prodbyeros","Vem Desestressar","GR6 Music",22,31,13,"3135569"
34,"spotify:track:6FllOXq1UDCFDt1V4YvN3K","Mc Daniel, DJ WN, Dj GM","Vamo de Pagodin","Lyons Produções",30,30,7,"3103637"
35,"spotify:track:2RX89Di479sc53wkaNgt9E","Hugo & Guilherme","Vazou Na Braquiara - Ao Vivo","Som Livre",15,25,24,"3073640"
36,"spotify:track:24R0oyjvhV4HIFFvoK3XkP","Tropa do Bruxo, SMU, Dj Vitin do Pc, MC JF, MC NAHARA","TUMBÁTUM","Tropa Do Bruxo",11,27,21,"2951416"
37,"spotify:track:3FB06ULqN0WNUSQ3UaMZnF","blicko","Amor Na Praia","blicko",7,49,17,"2933140"
38,"spotify:track:65vJAh07BdwurqR9SRa6f8","Ferrugem, Sorriso Maroto","Apaguei Pra Todos - Ao Vivo","WM Brazil",38,44,11,"2883813"
39,"spotify:track:5G0kKNRYFCoORvJ2VzwvrY","Mc Livinho, DJ TOPO","MTG PASSA PASSA PRA EU SARRAR","Mc Livinho",39,77,3,"2863044"
40,"spotify:track:42JNab8NPeCADJ9D3Cl5wS","Zé Neto & Cristiano","Barulho Do Foguete - Ao Vivo","Som Livre",4,33,53,"2862509"
41,"spotify:track:5asabafNzfAzjUecDvuNES","Henrique & Juliano","Aquela Pessoa (Ao Vivo)","Vida Nova Produções, sob licença exclusiva para Virgin Music Group",38,38,127,"2840868"
42,"spotify:track:0Q1ySdDoHDiotYn4nbMXNm","Nagalli, KayBlack, Veigh, Supernova Ent","CONFISSÕES PT2","Supernova Ent",8,34,10,"2824597"
43,"spotify:track:3hfCle1QRfbwIpQ1B746lV","MC Saci, Complexo dos Hits, DJ Sammer, Mc Pretchako","Aquariano Nato","eumcsaci",2,37,40,"2797448"
44,"spotify:track:6Tp4LCJ5r5IJaEf8lnlPfG","Henrique & Juliano","De Trás Pra Frente (Ao Vivo)","Vida Nova Produções, sob licença exclusiva para Virgin Music Group",17,41,90,"2774008"
45,"spotify:track:0cvVetonbe66pOOPMtuSOC","L7NNON, MC Cabelinho, Palma, HHR","Vamo Marolar","HHR Records",12,29,12,"2720759"
46,"spotify:track:2ORC76autQ7QTfBCkZl4Wo","Murilo Huff","Dedo do Meio - Ao Vivo","M Show",20,32,14,"2671075"
47,"spotify:track:5brVlCCt8gp4pP0iJOOctj","MC Ryan SP, Filipe Ret, Caio Luccas, Chefin, Dallass, Rocco","Melhor Vibe","WM Brazil",22,53,15,"2615046"
48,"spotify:track:368hYqtNCKCAeUduMoSHhh","Clayton & Romário","Aproveita - Ao Vivo","Virgin Music Label And Artist Services (S&D)",48,55,3,"2610391"
49,"spotify:track:7BRD7x5pt8Lqa1eGYC4dzj","Billie Eilish","CHIHIRO","Darkroom/Interscope Records",17,39,7,"2590853"
50,"spotify:track:6Gn8SHd3RIWjOermcidCJk","Dj Lc, DJ JOAO DA INESTAN, Mc Pretchako, MC Saci, Complexo dos Hits","A Internet É Toxica","Complexo dos Hits",7,35,35,"2483754"
51,"spotify:track:5mJcnekfy4DEpAZ6uAHM7Y","Thullio Milionário","Casca de Bala","Thullio Milionário",10,40,13,"2467283"
52,"spotify:track:0VybBobSYSzliyEJ1VqwGR","WIU, Teto","Problemas de um Milionário","30PRAUM",17,52,12,"2425945"
53,"spotify:track:6dOtVTDdiauQNBQEDOtlAB","Billie Eilish","BIRDS OF A FEATHER","Darkroom/Interscope Records",42,51,7,"2416437"
54,"spotify:track:7pnqm6UEb7SzpDxb53wULT","Mc IG, MC Ryan SP, Oruam, MC PH, Mc Poze do Rodo, MC GP, TrapLaudo, Mc Luki, MC GH do 7, MC Nego Micha, Murillo e LT no Beat","Diz Aí Qual é o Plano?","WM Brazil",1,47,17,"2371128"
55,"spotify:track:2IvsDK2p7Kq3aDrVtESDIg","Ana Castela, Gustavo Mioto","Fronteira - Ao Vivo","AgroPlay",7,57,33,"2314152"
56,"spotify:track:5u7Xi0QhfkYy3qETJJ5lae","MC Paulin da Capital, Love Funk, Mc Piedro, Dj GM, DJ WN, MC Ryan SP, Mc Daniel","Samba de Malandro","Love Funk",22,48,16,"2309043"
57,"spotify:track:3l5VjEAeUTqrlD50iEo8Yn","KayBlack, CVSTRO, Wall Hein, AMUSIK","Licor 43","Elenko Music",52,68,94,"2290414"
58,"spotify:track:2VUUzKS50OxWyTRu1J0YKH","Matheus & Kauan","Não Recomendo - Ao Vivo","Universal Music Ltda (S&D)",11,46,31,"2262218"
59,"spotify:track:1kPhV0KQui1phEpjnWIqUN","Jimin, Loco","Smeraldo Garden Marching Band (feat. Loco)","BIGHIT MUSIC",59,-1,1,"2236355"
60,"spotify:track:2sYFUcurlISdHlAsnYCEgD","Lauana Prado","Me Leva Pra Casa / Escrito Nas Estrelas / Saudade - Ao Vivo","Universal Music Ltda.",1,56,31,"2235404"
61,"spotify:track:2BPZCE8hyWgaURPxQNA7pq","Jefferson Moraes","Péssima Hora - Ao Vivo","Astro Produções",4,118,15,"2230320"
62,"spotify:track:1i2kguziI3ZbUZnZMKNhQ2","Mc IG, DJ Jorgin","400K","GR6 Music",45,61,30,"2222752"
63,"spotify:track:2qSkIjg1o9h3YT9RAgYN75","Sabrina Carpenter","Espresso","Island Records",49,58,12,"2178372"
64,"spotify:track:4jbTB2Kj4CrZCjngkQUQS2","Murilo Huff","A Cerveja Abre Sozinha - Ao Vivo","M Show",16,54,25,"2165492"
65,"spotify:track:6GmyQws2xpUFIN5dXBNTrl","AgroPlay, Ana Castela, LUDMILLA","Dia de Fluxo","AgroPlay",4,63,28,"2144845"
66,"spotify:track:4v7UrPWZL4FJWeL5ZWQ62E","Henrique & Juliano","Seu Erro (Ao Vivo Em Nova Iorque) (2022)","Vida Nova Produções, sob licença exclusiva para Virgin Music Group",43,66,37,"2092975"
67,"spotify:track:2InS5VWKJQbsFBKOsf1cJB","Dj GBR, Mc IG, MC Ryan SP, MC PH, Mc Davi, Mc Luki, Mc Don Juan, Mc Kadu, TrapLaudo, MC GP, MC GH do 7","Let's Go 4","GR6 Music",1,64,43,"2029767"
68,"spotify:track:6r6wTVl7sBndpdlzBSEYnF","Ana Castela, Hungria, Alok","Lua","AgroPlay",6,59,20,"2025408"
69,"spotify:track:7j0N4df9g0jECdfSR07elf","Eric Land, MC PH","Vem Desestressar","Eric Land",27,60,9,"2003156"
70,"spotify:track:0aXHnXG1twZEc7AUGTK4Fo","Marcos Baroni, WIU, MC Hariel, Tuzão, Mc IG, Kako, Vulgo FK","Melhor Dia 13 - Era Uma Vez","Melhor dia",70,126,3,"1994982"
71,"spotify:track:4sAoshwHCmh4IHMQxZHwRD","TR, Mc Menor RV, Tropa da W&S","Baby Eu Tava na Rua da Água","WMD",1,69,24,"1965556"
72,"spotify:track:6mJCx80Wc91GPi9ew9bkmD","DENNIS, Ana Castela, Mc Gw","RAM TCHUM","Sony Music Entertainment",3,65,18,"1962160"
73,"spotify:track:3EuPKX0FLhAxfL5hZBlfJe","DJ Zigão, DJ Lafon Do Md, Mc Rodrigo do CN, Mc Rf","Te Maceto Depois Do Baile","Dj Zigão",20,20,5,"1935023"
74,"spotify:track:6gjsnEQxLqVkieeloQTozN","Lou Garcia, Dj Luan Gomes","Não Fosse Tão Tarde - MTG Remix","Universal Music Ltda.",74,-1,1,"1913616"
75,"spotify:track:0zxWyvrKyz031tFfBnkYLr","Henrique & Juliano","Como É Que A Gente Fica (Ao Vivo)","Vida Nova Produções, sob licença exclusiva para Virgin Music Group",23,96,85,"1902287"
76,"spotify:track:6P1mkNAmgihFwFRBhpaev3","Luan Pereira, Mc Daniel","ENTRA NA DEFENDER","Som Livre",3,67,15,"1890715"
77,"spotify:track:7dKqPh21HpsysZvRWyNeM1","Isadora Pompeo","Bênçãos Que Não Têm Fim (Counting My Blessings)","Sony Music Entertainment",10,80,34,"1874813"
78,"spotify:track:5N3hjp1WNayUPZrA8kJmJP","Sabrina Carpenter","Please Please Please","Island Records",52,70,4,"1865823"
79,"spotify:track:2QjOHCTQ1Jl3zawyYOpxh6","The Neighbourhood","Sweater Weather","Columbia",79,88,81,"1846795"
80,"spotify:track:0gg3QtCcPZn4aJ0D7dRNul","Manim Vaqueiro","Forró e Desmantelo","Feeling",75,75,4,"1845139"
81,"spotify:track:5QbtKOsjbEGkx0GMiQGBZt","fhop music, Hamilton Rabelo","Tu és + Águas Purificadoras - Ao Vivo","FHOP Music",71,79,16,"1843525"
82,"spotify:track:4D25RP3yiJWfW9utK9dMyv","Rayane & Rafaela, Henrique & Juliano","Ali Te Ama - Ao Vivo","Henrique e Juliano oficial",64,85,36,"1833427"
83,"spotify:track:60JOVAVMWEl4JgYHwaVx8l","Márcia Fellipe","A Mulher Mais Foda do Brasil - Ao Vivo","Marcia Fellipe",50,152,7,"1821854"
84,"spotify:track:5mmxylfcIlTaTftZwIIj3W","Henrique & Juliano","Você Vai Ser Fiel (Ao Vivo Em Nova Iorque) (2022)","Vida Nova Produções, sob licença exclusiva para Virgin Music Group",84,92,31,"1805257"
85,"spotify:track:3pLyNmLlw6uRrKaNwMnXOR","Josué Bom de Faixa","Não Precisa Negar","PAX MUSIC",74,82,25,"1801694"
86,"spotify:track:5RTMpECEVHy3H9jtn7HKi5","Tz da Coronel, Ryu, The Runner, Nagalli","Qual é seu desejo?","Cúpula",1,91,18,"1800542"
87,"spotify:track:0bor3AJ8QV6RRbyV64ZsOO","Fiduma & Jeca, Fernando & Sorocaba","Cortando as BR (F&J 10 Anos) - Ao Vivo","Fiduma & Jeca",87,103,5,"1793001"
88,"spotify:track:3xkHsmpQCBMytMJNiDf3Ii","Benson Boone","Beautiful Things","Night Street Records, Inc./Warner Records Inc.",40,81,21,"1784367"
89,"spotify:track:1b4OldCIxTO7DcqYdvdlOM","Marília Tavares","Palavras de Perdão - Ao Vivo","Marilia Tavares",78,78,3,"1758149"
90,"spotify:track:0ODlZu2uJ13I29NfFJJVir","Luan Santana, MC Kevin o Chris","PEGA ESCANDALOSO","Sony Music Entertainment",21,43,14,"1752721"
91,"spotify:track:5Z0UnEtpLDQyYlWwgi8m9C","Hozier","Too Sweet","Rubyworks / Universal-Island Records Ltd",45,76,13,"1719273"
92,"spotify:track:1BSsJm88q13n15TgJqvqBp","João Gomes, Iguinho e Lulinha, Tarcísio do Acordeon","Coração de Vaqueiro","JG Shows",47,87,8,"1710130"
93,"spotify:track:6RqEGo7zvc8g31ZyG1Mm6Q","Mc Jacaré, MC Kevin o Chris","A Culpa Não É Minha","Croco Hits",83,115,4,"1678358"
94,"spotify:track:5DcysyjaPrLzXgDauvzvn6","George Henrique & Rodrigo, Guilherme & Benuto","Beijo Equivocado","Worldshow Promoções e Eventos",44,93,41,"1660505"
95,"spotify:track:53PpijFATt35Zxfl6LTxoK","Marília Mendonça","Leão","Som Livre",1,101,82,"1653076"
96,"spotify:track:761whSngDfj7n3AZAom5IK","Maria Clara, Heitor Costa","Fala Que Não Ama","Maria Clara Cantora",96,149,2,"1646414"
97,"spotify:track:73SIgqXr3oRzzWbX1muX3I","Rionegro & Solimões","Fivela Com Fivela - Ao Vivo","Rionegro e Solimões",97,109,4,"1636991"
98,"spotify:track:3PXJxUzZ6dn9ykFBFMmOnL","LUDMILLA, IZA","Lud Session #4: Morrer de Viver / Saudade Daquilo / Tô Querendo Mais / Sem Filtro / Embrasa","SEM QUERER MUSIC",98,-1,1,"1633201"
99,"spotify:track:1m5nbZiPpCIi9J2irLNoxh","Oruam, Didi, Dj Lc da Roça, MC K9, MC Smith, Mainstreet","Rolé na Favela de Nave","Mainstreet Records",9,89,22,"1631277"
100,"spotify:track:7CyPwkp0oE8Ro9Dd5CUDjW","The Weeknd, JENNIE, Lily-Rose Depp","One Of The Girls (with JENNIE, Lily Rose Depp)","XO / Republic Records",61,111,30,"1626239"
101,"spotify:track:00Nh5jZl5ilpe6aCrhvZTb","Diego & Victor Hugo","Bem Mais Que Eu (Você Quer Caçar Seu Rumo) - Ao Vivo","Sony Music Entertainment",73,73,8,"1595723"
102,"spotify:track:4Dvkj6JhhA12EX05fT7y2e","Harry Styles","As It Was","Columbia",10,110,115,"1591571"
103,"spotify:track:6vq7r1Pqd3pyI07u63cPZV","Simone Mendes","Erro Gostoso - Ao Vivo","Universal Music Ltda.",3,94,75,"1579683"
104,"spotify:track:6BWWgcNJWXQ4qRuzY5LzBP","Felipe Amorim, MC PH, WIU, DG e Batidão Stronda","Tenho que Me Decidir","One Play",84,84,17,"1575489"
105,"spotify:track:4G0CNdwFI4oeHFVZDcqLvK","Henrique Casttro, Marília Mendonça","Experiência - Ao Vivo","Sony Music Entertainment",105,-1,1,"1573164"
106,"spotify:track:4bDvY5oGtCWTYH5Vi36bc5","Henrique & Juliano","Mais Amor E Menos Drama (Ao Vivo)","Vida Nova Produções, sob licença exclusiva para Virgin Music Group",106,131,82,"1569375"
107,"spotify:track:5RHOhXxMVhpEaBcG6hIydA","KayBlack, Wall Hein, AMUSIK","Maturidade","Elenko Music",62,62,40,"1566571"
108,"spotify:track:2hloKDkwGLjtYvAoqn39gV","Mc Jacaré, Luan Pereira","Senta Pro Bruto","Croco Hits",50,105,16,"1557087"
109,"spotify:track:1jN0ysNJ2d9VZwVdlgspjr","MC Saci, MC Fahah, DJ Sammer, Dj Lc","De 10 Mulher 11 É Maluca","eumcsaci",6,74,19,"1555442"
110,"spotify:track:4OMSfAavn8k6HxZ0HwVtV1","Nagalli, Menor MC, Dfideliz, CJota, Leviano, Supernova Ent","CONFISSÕES PT1","Supernova Ent",84,104,10,"1554263"
111,"spotify:track:7McCAKExE8KsI2q4Y8wx4U","Murilo Huff, Marília Mendonça","Dois Enganados","M Show",49,106,101,"1552919"
112,"spotify:track:4f0aDk7HX37SfzerfznYlr","Grupo Menos É Mais, Matheus Fernandes","Lapada Dela - Ao Vivo","Som Livre",4,112,71,"1551341"
113,"spotify:track:5AJ9hqTS2wcFQCELCFRO7A","Tommy Richman","MILLION DOLLAR BABY","PULSE Records",53,99,9,"1549789"
114,"spotify:track:6QxaJjXCxZSGKq98arP8Nw","Julliany Souza","Lindo Momento - Ao Vivo","PART",114,114,11,"1546043"
115,"spotify:track:5LCegtYPODbcqbTE5CZVv8","Manu, Simone Mendes","Daqui pra Sempre","manuoficial",3,72,40,"1540550"
116,"spotify:track:5XeFesFbtLpXzIVDNQP22n","Arctic Monkeys","I Wanna Be Yours","Domino Recording Co",78,123,95,"1536116"
117,"spotify:track:4YKujFSyakVjLdH1sDllVc","Simone Mendes","Dois Fugitivos - Ao Vivo","Universal Music Ltda.",5,95,42,"1530112"
118,"spotify:track:7Cf2Hsy3cPlA4e115tElXv","Henrique & Juliano","Liberdade Provisória (Live - Ibirapuera / 2019)","Vida Nova Produções, sob licença exclusiva para Virgin Music Group",1,102,119,"1502244"
119,"spotify:track:3eHeTsX6W9iIEfn8l2xrWO","Henrique & Juliano","Meu Amor (Ao Vivo)","Vida Nova Produções, sob licença exclusiva para Virgin Music Group",76,130,71,"1500617"
120,"spotify:track:2k4zMz55ILi91iGYCWHpVO","Jonas Esticado, Mari Fernandez","Se Você Tivesse Cuidado - Ao Vivo","Som Livre",120,-1,1,"1493927"
121,"spotify:track:17phhZDn6oGtzMe56NuWvj","Teddy Swims","Lose Control","Warner Records",82,122,20,"1483271"
122,"spotify:track:7uPInsxTeMbyrJkDQaRwPh","DJ THG, Mc Arizinho, Tavin","É Que Eu Te Sarrei","A2M Produtora",95,100,7,"1477677"
123,"spotify:track:3Ua0m0YmEjrMi9XErKcNiR","Jimin","Like Crazy","BIGHIT MUSIC",85,178,26,"1476195"
124,"spotify:track:6vvPecFTmWxDfEJ6cYT1wa","LISA","Rockstar","Lloud Co./RCA Records",124,-1,1,"1471683"
125,"spotify:track:7sopDXkuzXtHt8AQpdBxmT","Ana Castela","DONA DE MIM","AgroPlay",13,137,80,"1471643"
126,"spotify:track:697gwO5YoSGVAnlfREIZll","MC PH, Borges, WIU, Pedro Lotto, WEY","Tenho Que Me Decidir","GR6 Music",4,133,31,"1459524"
127,"spotify:track:6mIAta8vOaOhCM4yh8P2FJ","George Henrique & Rodrigo, Henrique & Juliano","Seu Oposto","World Show Produções",127,132,11,"1458832"
128,"spotify:track:40IXmplKTcyWPr9HNCik7e","Matuê, MC Ryan SP","Filho da Noite","Sony Music Entertainment",14,116,10,"1451114"
129,"spotify:track:629DixmZGHc7ILtEntuiWE","Billie Eilish","LUNCH","Darkroom/Interscope Records",16,108,7,"1447517"
130,"spotify:track:7r8yMaSOy4XmuhRz7iv1gi","Henrique & Juliano","Traumatizei (Ao Vivo Em Brasília)","Vida Nova Produções, sob licença exclusiva para Virgin Music Group",6,121,74,"1444137"
131,"spotify:track:4ksSf8cL3VlUvQSkFcRHy3","Henrique & Juliano","Até Você Voltar - Ao Vivo","Som Livre",131,135,18,"1437540"
132,"spotify:track:3lHV3YbZNltXHyZaDDpios","Mc Laranjinha, Dj Lv Mdp","Ligou na Madruga","DC MUSIC",108,146,12,"1436448"
133,"spotify:track:2LQ67PtoEgJSaRSqoh4k2E","Israel & Rodolffo","Greve De Beijo - Ao Vivo","Som Livre",83,83,14,"1433970"
134,"spotify:track:0oQCRjrWGvkqkdf82UlXI3","PEDRO SAMPAIO","POCPOC","WM Brazil",1,124,31,"1433004"
135,"spotify:track:73QH4n9Y23W7bBIwWe2Y3V","Edu Chociay","Como É Que Fica","Astro Produções",111,-1,2,"1431820"
136,"spotify:track:5g7sDjBhZ4I3gcFIpkrLuI","Bruno Mars","Locked out of Heaven","Atlantic Records",67,90,31,"1426835"
137,"spotify:track:7z2hqtAyf6FR39ZZmVkvcO","DJ RENAN DA BL, Dj Jl Do Tp, Mc Pretchako, Mc Menor Thalis","Eu Vou Cair na Noite","Belo Music Produtora",51,107,36,"1410413"
138,"spotify:track:4xAGuRRKOgoaZbMGdmTD3N","Zé Neto & Cristiano","Oi Balde - Ao Vivo","Som Livre",3,140,72,"1409299"
139,"spotify:track:5F6xDGrQJMDg2sFEZimwGl","Henry Freitas, Mc Gw, PEDRO SAMPAIO","Barulho do Prazer - Ao Vivo","Sony Music Entertainment",66,98,11,"1405486"
140,"spotify:track:4hKLzFvNwHF6dPosGT30ed","Veigh, Bvga Beatz, Prod Malax, Supernova Ent","Novo Balanço","Supernova Entertainment Under Exclusive License to UnitedMasters",2,143,59,"1398971"
141,"spotify:track:1OwoPY7wYgKQIyl9maWmSM","Gusttavo Lima, Ana Castela","Canudinho - Ao Vivo","Sony Music Entertainment",2,127,44,"1378406"
142,"spotify:track:0BXgEu3thuTAUPo7LmzwJw","Priscila Senna","Te Beijo Chorando - Ao Vivo","Feeling",100,-1,2,"1369617"
143,"spotify:track:3fYzMA9OWy0lgOUv79alde","DJ BIEL PRADO, Mc KF, C.Z, VORTEX, VYRUS","Last Night (Versão BH)","DJ BIEL PRADO",107,117,13,"1369352"
144,"spotify:track:4ZrKyfCV1UcHuZjbLp03fM","Mãolee, Filipe Ret, Vulgo FK","Nós Combina","WM Brazil",144,156,4,"1366682"
145,"spotify:track:2lKiWWoeqOHhXwyZT8flw6","Isadora Pompeo","Ovelhinha (Ao Vivo)","Sony Music Entertainment",145,199,2,"1363998"
146,"spotify:track:6GS4LfVknh458V4z6llLRa","Mc guizinho niazi, Dj Luizinho MPC","Machuquei","4M RECORDS",86,97,8,"1363916"
147,"spotify:track:45czXKyGyd9g060ogyRjx3","Wesley Safadão","Ninguém Sabe","Wesley Safadao",22,154,13,"1359738"
148,"spotify:track:2l6YkP5Rj1w3GsrhE7cDqx","DJ GUIZIN DA SERRA, MC Marlon PH","MTG - BARRACO DELA LÁ","DJ GUIZIN DA SERRA",120,120,13,"1352650"
149,"spotify:track:54u86CmMqGI1rRuULlTqaB","Felipe Amorim","Toca o Trompete","One Play",2,148,40,"1345303"
150,"spotify:track:31ruhXo3xWYJUfGk1uU77y","MC PH, WEY, Pedro Lotto, Gustah","Me Chama Pelo Meu Vulgo","GR6 Music",119,145,5,"1343572"
151,"spotify:track:6zFpImDYig0CQhLL2NIfyN","AgroPlay, Ana Castela","Nosso Quadro","AgroPlay",1,141,74,"1337791"
152,"spotify:track:6xW61JP2f3hcsbOwn7dzi5","Mc IG, MC Ryan SP, MC PH, DJ Glenner","É Isso Bebê, Tá Certa!","WM Brazil",6,162,15,"1329806"
153,"spotify:track:6zdL0aLZs6g61SPGrlMvrM","DJ JOÃO PEREIRA, MC Koringa","DANÇA PRA ME PROVOCAR","DJ JOÃO PEREIRA x MC Koringa",18,119,30,"1329217"
154,"spotify:track:006pMMCuRo2TFjh8sNGSov","Charlie Brown Jr.","Dias De Luta, Dias De Gloria","EMI Brazil",110,163,51,"1312363"
155,"spotify:track:3Na9gwLmFdEJH2l54AYwpk","Lauana Prado, Zé Neto & Cristiano","Sombra Desconhecida - Ao Vivo","Universal Music Ltda.",134,134,2,"1312082"
156,"spotify:track:0aGBJDgysbTnnE27oYkx0N","Ícaro e Gilmar","Trauma - Ao Vivo","MJ Records",156,-1,1,"1302175"
157,"spotify:track:3DNwrOexgGtykcPU8bEs2e","Dj Luan Gomes, Rastapé","MTG COLO DE MENINA","PDF Records / W&S Music",139,139,2,"1292090"
158,"spotify:track:4BW3EWKB6wg9jyQb32tcv1","Léo & Raphael, Luan Pereira, AgroPlay","Tipo Yellowstone","AgroPlay",78,136,10,"1283111"
159,"spotify:track:1Vy9Wn5sbiduZKBqBlH3Mc","Vulgo FK, MC PH, Veigh, Pedro Lotto, Fepache","Ballena","Som Livre",3,164,51,"1276649"
160,"spotify:track:2LTlykcdu0gwb7zcKneo2a","KayBlack, Baco Exu do Blues, Marquinho no Beat","Melhor Só","WM Brazil",3,153,64,"1274378"
161,"spotify:track:4fgnNikmEUvXze89h3X47m","NATTAN","Morena","Nattan",31,189,26,"1262440"
162,"spotify:track:3tGiBHrLSYXuUtaDZ4jmXt","MC PH, Teto, Pedro Lotto, WEY","Dentro Da Mala","GR6 Music",162,197,2,"1259330"
163,"spotify:track:2d2gzh9YHgJBl7usdvKqgR","Gusttavo Lima, Matheus & Kauan","Mala dos Porta-Mala - Ao Vivo","Sony Music Entertainment",8,158,51,"1253164"
164,"spotify:track:4QCwvUs4ob87Tq9VP07Uo3","Borges, MC Cabelinho, Veigh, RUXN, Palma, Kizzy","Loucura","Mainstreet Records",11,138,30,"1252199"
165,"spotify:track:0QcKkN8b4iVkmVsbaze8OS","Henrique & Juliano","Devia Ser Proibido (Ao Vivo Em Brasília)","Vida Nova Produções, sob licença exclusiva para Virgin Music Group",23,128,49,"1250853"
166,"spotify:track:7CutNxjzAKbs7EhBAlnRJt","Simone Mendes","Meu Pra Sempre Não Era Meu - Ao Vivo","Universal Music Ltda.",166,-1,1,"1246088"
167,"spotify:track:5TtTijiNYtFc6ktQARjY30","KayBlack, Wall Hein","Preferida","WM Brazil",13,192,63,"1245207"
168,"spotify:track:1tAls12jSoUZPoj9cv7OAh","Guilherme & Benuto","Chorosa - Ao Vivo","Sony Music Entertainment",70,86,4,"1234794"
169,"spotify:track:3PGg3V56krasXrPKNvVLQU","Filipe Ret","Amor Livre - Ao Vivo","Som Livre",29,150,29,"1233412"
170,"spotify:track:3V4qHihe2fn7CXirSGe2k6","Dilsinho, Ana Castela","Passada de Mão - Ao Vivo","Sony Music Entertainment",9,144,22,"1226210"
171,"spotify:track:1kWcd9h9HoeXsKaDVhSOtj","Sorriso Maroto, Ferrugem","Ela - Ao Vivo","Sony Music Entertainment",44,169,42,"1226063"
172,"spotify:track:0ReK3QrsiVIyjcFpHyEEsA","Diego & Victor Hugo, Guilherme & Benuto","Vestido Curto - Ao Vivo","Sony Music Entertainment",37,157,28,"1210044"
173,"spotify:track:0pK0Vd1MCWy7AmsyFfIJb8","Matheus & Kauan","Quem Tá Fora - Ao Vivo","Universal Music Ltda (S&D)",159,159,2,"1197327"
174,"spotify:track:3maK7XfMybZF8gO2bltuDG","Mc Monik do pix, DJ Fabricio Satisfaction, DJ Luan Indiscutível","Ei Moto Táxi","Deu Hit",167,167,3,"1186040"
175,"spotify:track:7umgf0NrHZgIAI0ep64sLc","Mc IG, Veigh, Toledo, Bvga Beatz, Galdino, Honaiser","Olá, Moça","WM Brazil",29,155,15,"1185769"
176,"spotify:track:6nvbXA95vgyThzj2Tbhank","Mc Ws da leste, MC Cothiê, Dj Chadin do C","Tipo Hollywood","Fera Entretenimento",2,147,33,"1185357"
177,"spotify:track:7bukHRNgGLRySTJEVvLoIR","Henrique & Juliano","Briga Feia (Ao Vivo)","Vida Nova Produções, sob licença exclusiva para Virgin Music Group",22,180,103,"1182883"
178,"spotify:track:6hu4HvpNzrW2RIEEAZC3vD","KayBlack, Marquinho no Beat, Wall Hein","Segredo","WM Brazil",19,165,66,"1180465"
179,"spotify:track:0redQHBfejmPUhonR5ppGC","Guilherme & Benuto, Ana Castela, Adriano Rhod","Duas Três","Sony Music Entertainment",8,182,71,"1177444"
180,"spotify:track:0h7m2GwOZFptFrg7e7tiTn","Mc Kelvinho, MC Hariel, MC Ryan SP, MC Neguinho do Kaxeta, Mc Daniel, Kyan","Avisa Lá, Pt. 4","GR6 Music",101,161,8,"1174301"
181,"spotify:track:6bTdZ7xfKp3NqqADJ8HLyj","Matuê, WIU, Teto","Vampiro","Sony Music Entertainment",1,177,114,"1173195"
182,"spotify:track:3jg5UkJ21wzgZj2LwupkUj","Gusttavo Lima, Hugo & Guilherme","Torce o Olho - Ao Vivo","Sony Music Entertainment",18,176,32,"1172575"
183,"spotify:track:6MvaRZ6JZgJuXz9b1CMB1y","Baco Exu do Blues","20 Ligações","Baco Exu Do Blues",84,-1,45,"1170882"
184,"spotify:track:1ZgsY3WkkS9p1BjHOGeKKh","L7NNON, Veigh, Nagalli","Foto da Unha","HHR Records",70,191,21,"1169608"
185,"spotify:track:4tuFNhM69UakXdPg4RrNvp","Filipe Ret, Dallass, Hunter","Deus Perdoa","Som Livre",45,179,33,"1169303"
186,"spotify:track:1dx7F1j3W2wlgyxwvkFksY","Ana Castela","Solteiro Forçado - Ao Vivo","AgroPlay",3,190,52,"1168598"
187,"spotify:track:6u9tu5yRDTHpWlY86J1GDa","Yasmin Santos, Simone Mendes","Nem a Pau (feat. Simone Mendes) - Ao Vivo","Sony Music Entertainment",187,-1,1,"1164444"
188,"spotify:track:2IGh6DnMiX408xwoJP9Lmb","LUDMILLA, Mari Fernandez","Falta de Mim - Ao Vivo","SEM QUERER MUSIC",51,-1,20,"1161186"
189,"spotify:track:1GOS5OIo4KywJF7Fw9QR4E","NATTAN","A Gente Se Entrega","Feeling",78,160,23,"1160966"
