rank,uri,artist_names,track_name,source,peak_rank,previous_rank,weeks_on_chart,streams,duration_ms
1,spotify:track:7IFsTX5H1sWcEl8joV0IdD,"THE BOX, Mc Brinquedo, MC Cebezinho, MC Tuto, Mc Laranjinha, DJ Oreia",THE BOX MEDLEY FUNK 2,Sony Music Entertainment,1,1,14,6813511,266666
2,spotify:track:6W196uVRkmQFHbc1XV8DNk,"CountryBeat, Félix, Léo Souzza",Sonho Dela (Cowboy),CountryBeat,1,2,12,6285407,113233
3,spotify:track:2o4hr5HCAKShrbFtmxm7Dg,"Manu, Guilherme & Benuto",Torre Eiffel - Ao Vivo,manuoficial,3,26,22,6124855,202678
4,spotify:track:0HDMisLsuGNml98Xq7atpm,"Luan Santana, Luan Pereira",EU SOU SENTIMENTO,Sony Music Entertainment,3,3,8,5910624,186107
5,spotify:track:1NcqLEg2r2LXqMVbam2BJD,"Matheus Fernandes, Matheus & Kauan",Triplex - Ao Vivo,Som Livre,4,4,8,5730805,178170
6,spotify:track:5QpcLTQjh0qO7OIuR9q8IR,Gusttavo Lima,Morar Nesse Motel,Sony Music Entertainment,6,6,5,5670222,187037
7,spotify:track:7tI8dRuH2Yc6RuoTjxo4dU,Jimin,Who,BIGHIT MUSIC,7,18,2,5258803,170887
8,spotify:track:4VNRWHoiKHZJIoQHPbmJIv,Felipe e Rodrigo,Gosta De Rua (Ao Vivo),MK Records,1,8,17,5243557,171335
9,spotify:track:6mTpK40yIRk1xGGNvRMHGg,"Murilo Huff, Gustavo Mioto",Me Caiu Tão Bem - Ao Vivo,M Show,9,12,8,5141804,156146
10,spotify:track:6RjSXi9cPGroetXeNsWFGL,"DJ TOPO, Seu Jorge, Mc Leozin, MC G15",MTG QUEM NÃO QUER SOU EU,DJ TOPO,1,5,12,5042076,123692
11,spotify:track:0S7o4sti5I5CAbbotTUzTM,"Traia Véia, Luan Pereira",Wi-Fi - Ao Vivo,Show Mix.,11,33,2,4846998,161312
12,spotify:track:0agjQg7eWrwFtqBQRKu1CX,"Zé Neto & Cristiano, Ana Castela",Foi Intenso - Ao Vivo,Som Livre,5,9,13,4838747,132057
13,spotify:track:368hYqtNCKCAeUduMoSHhh,Clayton & Romário,Aproveita - Ao Vivo,Virgin Music Label And Artist Services (S&D),13,14,7,4754267,147860
14,spotify:track:1K14aw84e0i5IHFHkq7aNn,"KayBlack, Murillo e LT no Beat",Mistérios,WM Brazil,14,54,2,4494536,136695
15,spotify:track:7ldcYtMOjtX1eFVEYzj2kJ,"Luísa Sonza, KayBlack",Sagrado Profano,Sony Music Entertainment,2,10,10,4461177,196601
16,spotify:track:106SKHXoytRADjpxHBkJpV,"dj sv, Doug Hits, Manim Vaqueiro",Mtg Forró e Desmantelo,Doug Filmes,1,11,15,4452533,149538
17,spotify:track:0GbvYZsvz7bWyijBDESebX,Simone Mendes,Mulher Foda - Ao Vivo,Universal Music Ltda.,17,45,3,4450156,162190
18,spotify:track:6gjsnEQxLqVkieeloQTozN,"Lou Garcia, Dj Luan Gomes",Não Fosse Tão Tarde - MTG Remix,Universal Music Ltda.,15,15,5,4332143,117230
19,spotify:track:4XaLEsmrRGSDkgd7qpn4Nl,"MC LUUKY, MC Ryan SP, Dj Victor, Boladin 211, MC Vine7",Sempre na Simplicidade,EDITORA E GRAVADORA A BASE RECORDS,19,51,2,4324189,300000
20,spotify:track:5496lks6V3fh1mZAB6IAap,"Sevdaliza, Pabllo Vittar, Yseult",Alibi (with Pabllo Vittar & Yseult),Twisted Elegance,7,7,5,4259080,161655
21,spotify:track:1CpneInvFvGYcDVU4CCDgI,Ana Castela,Minha Herança - Ao Vivo,AgroPlay,17,20,9,3910269,222277
22,spotify:track:2ZI7HOZoBqrV3lFlHKJshI,"Zé Neto & Cristiano, Luan Santana",Melação - Ao Vivo,Som Livre,22,29,3,3840907,177567
23,spotify:track:5GV7OpSEb8MPTryL0Q5i6c,"DJ JZ, Humberto & Ronaldo, Mc Mininin, DJ LG PROD, Silvanno Salles",Mtg Quero Te Encontrar,Tropa do Serrão,1,16,21,3739713,177230
24,spotify:track:5Qqpplbu8ROd71c0brQxyy,"Mc IG, MC Ryan SP, DJ Glenner, Mc Poze do Rodo, Oruam",Filha do Deputado,WM Brazil,12,13,5,3700269,371852
25,spotify:track:7Elw15XWLpOi4qzHyAwa9e,Gloria Groove,Nosso Primeiro Beijo - Ao Vivo,SB Music,18,23,9,3688710,168805
26,spotify:track:0w7vodPWFEcuEYvWpbNbOu,WIU,Rainha da Finesse,30PRAUM,25,25,4,3630315,166153
27,spotify:track:3kBYuWrGtx1tSHjzr0vlZh,"Mc IG, Murillo e LT no Beat, DJ Glenner",Sorriso no Rosto,WM Brazil,3,17,9,3616741,148000
28,spotify:track:6cFW2FPaUL4YRJfS9zFJaV,Simone Mendes,Dois Tristes - Ao Vivo,UME - Global Clearing House,4,28,22,3585836,189440
29,spotify:track:6X6jKoyw1OjogRghMEQAZV,"Jorge & Mateus, Lauana Prado",Haverá Sinais - Ao Vivo,Som Livre,2,21,23,3545877,191365
30,spotify:track:3Na9gwLmFdEJH2l54AYwpk,"Lauana Prado, Zé Neto & Cristiano",Sombra Desconhecida - Ao Vivo,Universal Music Ltda.,23,27,6,3514744,160885
31,spotify:track:6hNREzgHbVM5AkGwP4SPmU,"Luan Pereira, Murilo Huff",FALTA DE QUÊ?,Som Livre,4,22,11,3501215,152245
32,spotify:track:7JMtl41kGPDlzxsH3FkkqD,"Dj Luan Gomes, Tropa da W&S",MTG QUERO VER SE VOCÊ TEM ATITUDE,PDF Records / W&S Music,4,24,11,3386930,117576
33,spotify:track:1WHDOr19zyyqu6XXIvdgfX,"Hugo & Guilherme, Maiara & Maraisa",Morena De Goiânia - Ao Vivo,Som Livre,11,30,19,3280156,166804
34,spotify:track:6FllOXq1UDCFDt1V4YvN3K,"Mc Daniel, DJ WN, Dj GM",Vamo de Pagodin,Lyons Produções,16,19,11,3237581,160864
35,spotify:track:5r0JHIjcY7dLWHkljNeQbj,Murilo Huff,Anestesiado - Ao Vivo,M Show,4,36,37,3188696,172548
36,spotify:track:4VZNgofGpFZ8FrQM3VYosB,Zé Neto & Cristiano,Deu Moral - Ao Vivo,Som Livre,5,32,16,3117429,122169
37,spotify:track:1tAls12jSoUZPoj9cv7OAh,Guilherme & Benuto,Chorosa - Ao Vivo,Sony Music Entertainment,37,74,8,3034255,155488
38,spotify:track:2ORC76autQ7QTfBCkZl4Wo,Murilo Huff,Dedo do Meio - Ao Vivo,M Show,20,40,18,3021872,167391
39,spotify:track:6Tp4LCJ5r5IJaEf8lnlPfG,Henrique & Juliano,De Trás Pra Frente (Ao Vivo),"Vida Nova Produções, sob licença exclusiva para Virgin Music Group",17,41,94,2992286,163089
40,spotify:track:2RX89Di479sc53wkaNgt9E,Hugo & Guilherme,Vazou Na Braquiara - Ao Vivo,Som Livre,15,39,28,2980167,164240
41,spotify:track:60wgnlVBEsyswrTB6pYiTi,amblu,Como Um Beijo,amblu,19,57,9,2971747,205973
42,spotify:track:5asabafNzfAzjUecDvuNES,Henrique & Juliano,Aquela Pessoa (Ao Vivo),"Vida Nova Produções, sob licença exclusiva para Virgin Music Group",34,44,131,2951866,166838
43,spotify:track:7eoRm37Ta1jvGMiMRfOQoa,"Dj VN Maestro, MC G DS",Eu So Comi Ela uma Vez,Love Funk Records,13,31,7,2910704,107102
44,spotify:track:3FB06ULqN0WNUSQ3UaMZnF,blicko,Amor Na Praia,blicko,7,35,21,2903433,156150
45,spotify:track:6u9tu5yRDTHpWlY86J1GDa,"Yasmin Santos, Simone Mendes",Nem a Pau (feat. Simone Mendes) - Ao Vivo,Sony Music Entertainment,37,37,5,2877598,161920
46,spotify:track:7sAyqOe0BHySvFjSI5tnBA,"Ícaro e Gilmar, Luan Pereira",Diferentona,MJ Records,46,53,3,2873922,178290
47,spotify:track:42JNab8NPeCADJ9D3Cl5wS,Zé Neto & Cristiano,Barulho Do Foguete - Ao Vivo,Som Livre,4,38,57,2807599,133546
48,spotify:track:4G0CNdwFI4oeHFVZDcqLvK,"Henrique Casttro, Marília Mendonça",Experiência - Ao Vivo,Sony Music Entertainment,48,84,4,2716724,174640
49,spotify:track:5brVlCCt8gp4pP0iJOOctj,"MC Ryan SP, Filipe Ret, Caio Luccas, Chefin, Dallass, Rocco",Melhor Vibe,WM Brazil,22,47,19,2653753,341408
50,spotify:track:6IFMz6Buh3dKoUjULWE26n,Mari Fernandez,Página De Ex - Ao Vivo,Som Livre,22,34,13,2601034,161610
51,spotify:track:5G0kKNRYFCoORvJ2VzwvrY,"Mc Livinho, DJ TOPO",MTG PASSA PASSA PRA EU SARRAR,Mc Livinho,29,42,7,2569312,141230
52,spotify:track:4xEYeY9OSYP7c8dSwlpBFD,"Mc Daniel, MC Ryan SP, Kotim, Blakbone",Só Vou Namorar,Lyons Produções,52,99,3,2567443,164307
53,spotify:track:3l5VjEAeUTqrlD50iEo8Yn,"KayBlack, CVSTRO, Wall Hein, AMUSIK",Licor 43,Elenko Music,52,52,98,2542589,142470
54,spotify:track:3iam4WkRoqMoBBCwDFZNgd,Henrique & Juliano,Quase Algo (Ao Vivo Em Nova Iorque) (2022),"Vida Nova Produções, sob licença exclusiva para Virgin Music Group",17,50,46,2470408,178251
55,spotify:track:4W87Hv4pBFsE0JEi7enRBQ,"TrapLaudo, Mc IG, MC PH, MC Ryan SP, Mc Don Juan, Murillo e LT no Beat",Malvada,4M RECORDS,28,43,7,2457620,300487
56,spotify:track:6dOtVTDdiauQNBQEDOtlAB,Billie Eilish,BIRDS OF A FEATHER,Darkroom/Interscope Records,42,56,11,2454240,210373
57,spotify:track:65vJAh07BdwurqR9SRa6f8,"Ferrugem, Sorriso Maroto",Apaguei Pra Todos - Ao Vivo,WM Brazil,35,49,15,2434317,198678
58,spotify:track:24R0oyjvhV4HIFFvoK3XkP,"Tropa do Bruxo, SMU, Dj Vitin do Pc, MC JF, MC NAHARA",TUMBÁTUM,Tropa Do Bruxo,11,46,25,2433318,121384
59,spotify:track:0zxWyvrKyz031tFfBnkYLr,Henrique & Juliano,Como É Que A Gente Fica (Ao Vivo),"Vida Nova Produções, sob licença exclusiva para Virgin Music Group",23,61,89,2385494,163913
60,spotify:track:5jrQZnYInM6YUjr2yFSa3E,"MC PH, Vulgo FK, Veigh, Pedro Lotto, prodbyeros",Vem Desestressar,GR6 Music,22,55,17,2279680,243870
61,spotify:track:7pkpWcko6KEZANj0xKsCsu,Matheus & Kauan,Cronômetro - Ao Vivo,Universal Music Ltda (S&D),61,83,4,2148428,165301
62,spotify:track:4A59ygOlOd3V0GbyEmUxKs,"NATTAN, Ana Castela",Pega Cabuloso - Ao Vivo em São Paulo,Nattan,62,75,3,2129493,137066
63,spotify:track:1i2kguziI3ZbUZnZMKNhQ2,"Mc IG, DJ Jorgin",400K,GR6 Music,45,70,34,2122560,163500
64,spotify:track:3IjUrdmAjmjiSY7LUbYXVd,"Dj Victor, MC Tuto, MC LUUKY, Mc Kadu",Mó Fita,Nova Era Produtora,64,72,6,2101531,256000
65,spotify:track:3hfCle1QRfbwIpQ1B746lV,"MC Saci, Complexo dos Hits, DJ Sammer, Mc Pretchako",Aquariano Nato,eumcsaci,2,58,44,2097160,116307
66,spotify:track:00hbGsdy4tMD2R0Y5n5E0C,Flozimbar,Hysteria,Robin,26,60,9,2053316,153466
67,spotify:track:0Q1ySdDoHDiotYn4nbMXNm,"Nagalli, KayBlack, Veigh, Supernova Ent",CONFISSÕES PT2,Supernova Ent,8,62,14,2050084,145812
68,spotify:track:2IvsDK2p7Kq3aDrVtESDIg,"Ana Castela, Gustavo Mioto",Fronteira - Ao Vivo,AgroPlay,7,63,37,1997956,166189
69,spotify:track:7pnqm6UEb7SzpDxb53wULT,"Mc IG, MC Ryan SP, Oruam, MC PH, Mc Poze do Rodo, MC GP, TrapLaudo, Mc Luki, MC GH do 7, MC Nego Micha, Murillo e LT no Beat",Diz Aí Qual é o Plano?,WM Brazil,1,68,21,1979827,703157
70,spotify:track:5QbtKOsjbEGkx0GMiQGBZt,"fhop music, Hamilton Rabelo",Tu és + Águas Purificadoras - Ao Vivo,FHOP Music,65,78,20,1938178,476736
71,spotify:track:6RqEGo7zvc8g31ZyG1Mm6Q,"Mc Jacaré, MC Kevin o Chris",A Culpa Não É Minha,Croco Hits,69,69,8,1934649,137966
72,spotify:track:0bor3AJ8QV6RRbyV64ZsOO,"Fiduma & Jeca, Fernando & Sorocaba",Cortando as BR (F&J 10 Anos) - Ao Vivo,Fiduma & Jeca,66,66,9,1912101,175338
73,spotify:track:2InS5VWKJQbsFBKOsf1cJB,"Dj GBR, Mc IG, MC Ryan SP, MC PH, Mc Davi, Mc Luki, Mc Don Juan, Mc Kadu, TrapLaudo, MC GP, MC GH do 7",Let's Go 4,GR6 Music,1,80,47,1870184,641941
74,spotify:track:0cvVetonbe66pOOPMtuSOC,"L7NNON, MC Cabelinho, Palma, HHR",Vamo Marolar,HHR Records,12,79,16,1866587,181512
75,spotify:track:3eHeTsX6W9iIEfn8l2xrWO,Henrique & Juliano,Meu Amor (Ao Vivo),"Vida Nova Produções, sob licença exclusiva para Virgin Music Group",75,95,75,1861872,174134
76,spotify:track:5u7Xi0QhfkYy3qETJJ5lae,"MC Paulin da Capital, Love Funk, Mc Piedro, Dj GM, DJ WN, MC Ryan SP, Mc Daniel",Samba de Malandro,Love Funk,22,73,20,1861426,300842
77,spotify:track:7dKqPh21HpsysZvRWyNeM1,Isadora Pompeo,Bênçãos Que Não Têm Fim (Counting My Blessings),Sony Music Entertainment,10,93,38,1861354,209520
78,spotify:track:6Gn8SHd3RIWjOermcidCJk,"Dj Lc, DJ JOAO DA INESTAN, Mc Pretchako, MC Saci, Complexo dos Hits",A Internet É Toxica,Complexo dos Hits,7,71,39,1858804,161884
79,spotify:track:7l9Tq5phzkLnhWUyfp702G,"Kaique e Felipe, Luan Pereira",Saveiro,Sony Music Entertainment,79,-1,1,1834165,144665
80,spotify:track:448158cOtdLyR59DJnzpON,"DJ Zigão, DJ Lafon Do Md, Mc Rodrigo do CN, Mc Rf",Te Maceto Depois Do Baile,Dj Zigão,20,67,8,1809757,229153
81,spotify:track:6GmyQws2xpUFIN5dXBNTrl,"AgroPlay, Ana Castela, LUDMILLA",Dia de Fluxo,AgroPlay,4,64,32,1804519,133610
82,spotify:track:7BRD7x5pt8Lqa1eGYC4dzj,Billie Eilish,CHIHIRO,Darkroom/Interscope Records,17,76,11,1804317,303440
83,spotify:track:5DrDpWyvharQkhsloNTN9W,"Mc J Mito, DJ Borest",Clack Bum,Som Livre,83,87,2,1801474,141230
84,spotify:track:0VybBobSYSzliyEJ1VqwGR,"WIU, Teto",Problemas de um Milionário,30PRAUM,17,88,16,1786427,144360
85,spotify:track:6mIAta8vOaOhCM4yh8P2FJ,"George Henrique & Rodrigo, Henrique & Juliano",Seu Oposto,World Show Produções,85,105,15,1764161,150693
86,spotify:track:5qMyN3dzXKb5P1MiKyqupZ,"Fred & Fabrício, Traia Véia",Poder de Mentir - Ao Vivo,Som Livre,31,48,4,1761700,167936
87,spotify:track:2QjOHCTQ1Jl3zawyYOpxh6,The Neighbourhood,Sweater Weather,Columbia,79,102,85,1735717,240400
88,spotify:track:1VbunACv3Z4cGfBenC7oTx,Felipe e Rodrigo,Saudade Butequeira (Ao Vivo),MK Records,88,113,6,1731813,149432
89,spotify:track:73SIgqXr3oRzzWbX1muX3I,Rionegro & Solimões,Fivela Com Fivela - Ao Vivo,Rionegro e Solimões,84,92,8,1717651,158713
90,spotify:track:7McCAKExE8KsI2q4Y8wx4U,"Murilo Huff, Marília Mendonça",Dois Enganados,M Show,49,106,105,1714903,172751
91,spotify:track:7Cf2Hsy3cPlA4e115tElXv,Henrique & Juliano,Liberdade Provisória (Live - Ibirapuera / 2019),"Vida Nova Produções, sob licença exclusiva para Virgin Music Group",1,90,123,1702796,186379
92,spotify:track:4v7UrPWZL4FJWeL5ZWQ62E,Henrique & Juliano,Seu Erro (Ao Vivo Em Nova Iorque) (2022),"Vida Nova Produções, sob licença exclusiva para Virgin Music Group",43,91,41,1696664,192437
93,spotify:track:7CyPwkp0oE8Ro9Dd5CUDjW,"The Weeknd, JENNIE, Lily-Rose Depp","One Of The Girls (with JENNIE, Lily Rose Depp)",XO / Republic Records,61,103,34,1695744,244684
94,spotify:track:3xkHsmpQCBMytMJNiDf3Ii,Benson Boone,Beautiful Things,"Night Street Records, Inc./Warner Records Inc.",40,96,25,1691629,180304
95,spotify:track:2sYFUcurlISdHlAsnYCEgD,Lauana Prado,Me Leva Pra Casa / Escrito Nas Estrelas / Saudade - Ao Vivo,Universal Music Ltda.,1,86,35,1681272,265450
96,spotify:track:4jbTB2Kj4CrZCjngkQUQS2,Murilo Huff,A Cerveja Abre Sozinha - Ao Vivo,M Show,16,77,29,1675649,147988
97,spotify:track:3ODUgIaqdpkMXXlsH1kDLh,"MC GP, MC Jvila, MC LUUKY, Dj Yuri Pedrada",300 no 7,MC GP NOVA ERA,97,161,3,1673538,195572
98,spotify:track:4sAoshwHCmh4IHMQxZHwRD,"TR, Mc Menor RV, Tropa da W&S",Baby Eu Tava na Rua da Água,WMD,1,94,28,1661811,115846
99,spotify:track:2qSkIjg1o9h3YT9RAgYN75,Sabrina Carpenter,Espresso,Island Records,49,85,16,1655591,175459
100,spotify:track:2GcK73z8rjy5IKc4cjV7oG,"CountryBeat, Luan Pereira",Filho do Fazendeiro,CountryBeat,59,59,4,1653711,131076
101,spotify:track:6QxaJjXCxZSGKq98arP8Nw,Julliany Souza,Lindo Momento - Ao Vivo,PART,99,112,15,1633277,893787
102,spotify:track:17phhZDn6oGtzMe56NuWvj,Teddy Swims,Lose Control,Warner Records,82,104,24,1625162,210688
103,spotify:track:53PpijFATt35Zxfl6LTxoK,Marília Mendonça,Leão,Som Livre,1,101,86,1623940,166774
104,spotify:track:7sopDXkuzXtHt8AQpdBxmT,Ana Castela,DONA DE MIM,AgroPlay,13,98,84,1619192,145091
105,spotify:track:5DcysyjaPrLzXgDauvzvn6,"George Henrique & Rodrigo, Guilherme & Benuto",Beijo Equivocado,Worldshow Promoções e Eventos,44,81,45,1614455,156377
106,spotify:track:5mJcnekfy4DEpAZ6uAHM7Y,Thullio Milionário,Casca de Bala,Thullio Milionário,10,65,17,1608120,133360
107,spotify:track:4f0aDk7HX37SfzerfznYlr,"Grupo Menos É Mais, Matheus Fernandes",Lapada Dela - Ao Vivo,Som Livre,4,97,75,1599542,159322
108,spotify:track:6r6wTVl7sBndpdlzBSEYnF,"Ana Castela, Hungria, Alok",Lua,AgroPlay,6,89,24,1575708,206538
109,spotify:track:1V2RBDA7cvLniTAt3fQZoC,"Wesley Safadão, Felipe Amorim",Novinha Não Chora,Wesley Safadao,109,178,2,1573392,180000
110,spotify:track:4D25RP3yiJWfW9utK9dMyv,"Rayane & Rafaela, Henrique & Juliano",Ali Te Ama - Ao Vivo,Henrique e Juliano oficial,64,108,40,1560616,168792
111,spotify:track:0gg3QtCcPZn4aJ0D7dRNul,Manim Vaqueiro,Forró e Desmantelo,Feeling,75,100,8,1547431,162646
112,spotify:track:6vq7r1Pqd3pyI07u63cPZV,Simone Mendes,Erro Gostoso - Ao Vivo,Universal Music Ltda.,3,110,79,1535877,178811
113,spotify:track:7xjV9rXbAUDCreKgx2pkGY,"Mari Fernandez, Zé Felipe","Louco, Louco - Ao Vivo",Som Livre,113,153,2,1514305,143060
114,spotify:track:3mBsIJP7qmGeJMfKllBMeZ,Marília Tavares,Palavras de Perdão - Ao Vivo,Marilia Tavares,78,109,7,1510417,186069
115,spotify:track:5XeFesFbtLpXzIVDNQP22n,Arctic Monkeys,I Wanna Be Yours,Domino Recording Co,78,122,99,1502220,183956
116,spotify:track:7r8yMaSOy4XmuhRz7iv1gi,Henrique & Juliano,Traumatizei (Ao Vivo Em Brasília),"Vida Nova Produções, sob licença exclusiva para Virgin Music Group",6,129,78,1493269,172005
117,spotify:track:2yrBejsWFNxY5ICWwmx9ae,Iguinho e Lulinha,Fora do Comum,IL SHOWS,106,135,4,1487040,161194
118,spotify:track:5N3hjp1WNayUPZrA8kJmJP,Sabrina Carpenter,Please Please Please,Island Records,52,111,8,1463740,186365
119,spotify:track:2lKiWWoeqOHhXwyZT8flw6,Isadora Pompeo,Ovelhinha (Ao Vivo),Sony Music Entertainment,119,136,6,1453578,276453
120,spotify:track:5mmxylfcIlTaTftZwIIj3W,Henrique & Juliano,Você Vai Ser Fiel (Ao Vivo Em Nova Iorque) (2022),"Vida Nova Produções, sob licença exclusiva para Virgin Music Group",84,118,35,1444565,164201
121,spotify:track:5Z0UnEtpLDQyYlWwgi8m9C,Hozier,Too Sweet,Rubyworks / Universal-Island Records Ltd,45,114,17,1441921,251424
122,spotify:track:4Dvkj6JhhA12EX05fT7y2e,Harry Styles,As It Was,Columbia,10,107,119,1439298,167303
123,spotify:track:4xAGuRRKOgoaZbMGdmTD3N,Zé Neto & Cristiano,Oi Balde - Ao Vivo,Som Livre,3,132,76,1433789,159158
124,spotify:track:1ovpVYLiuIQpLB8F0PrJ4N,Simone Mendes,Meu Pra Sempre Não Era Meu - Ao Vivo,Universal Music Ltda.,124,134,5,1414407,163307
125,spotify:track:1IHYVMeFy76X0Xl2DkLkDh,"Ryu, The Runner, Veigh, 6ee",MVP,Som Livre,125,-1,1,1404558,169571
126,spotify:track:3tGiBHrLSYXuUtaDZ4jmXt,"MC PH, Teto, Pedro Lotto, WEY",Dentro Da Mala,GR6 Music,126,140,6,1403376,243200
127,spotify:track:5LCegtYPODbcqbTE5CZVv8,"Manu, Simone Mendes",Daqui pra Sempre,manuoficial,3,121,44,1395696,202644
128,spotify:track:4YKujFSyakVjLdH1sDllVc,Simone Mendes,Dois Fugitivos - Ao Vivo,Universal Music Ltda.,5,127,46,1387308,173370
129,spotify:track:6BWWgcNJWXQ4qRuzY5LzBP,"Felipe Amorim, MC PH, WIU, DG e Batidão Stronda",Tenho que Me Decidir,One Play,84,125,21,1384802,183960
130,spotify:track:6hZGsChumRhWG24OEh698c,"Mc Pogba, DJ Guih Da ZO",Ela Joga na Hora,SUNDAY,130,-1,1,1384434,132922
131,spotify:track:5kw1m0cJIaCSefWaMTSAy4,"Day e Lara, Gustavo Mioto",Premonição,Brabíssimos,131,-1,2,1382902,170229
132,spotify:track:4ksSf8cL3VlUvQSkFcRHy3,Henrique & Juliano,Até Você Voltar - Ao Vivo,Som Livre,116,152,22,1381968,204080
133,spotify:track:6mJCx80Wc91GPi9ew9bkmD,"DENNIS, Ana Castela, Mc Gw",RAM TCHUM,Sony Music Entertainment,3,117,22,1380427,129418
134,spotify:track:2VUUzKS50OxWyTRu1J0YKH,Matheus & Kauan,Não Recomendo - Ao Vivo,Universal Music Ltda (S&D),11,124,35,1375390,141216
135,spotify:track:5RTMpECEVHy3H9jtn7HKi5,"Tz da Coronel, Ryu, The Runner, Nagalli",Qual é seu desejo?,Cúpula,1,123,22,1369451,153429
136,spotify:track:1agDCV4zQqaFwJQNsTgmL1,"Jimin, Loco",Smeraldo Garden Marching Band (feat. Loco),BIGHIT MUSIC,59,82,5,1353127,182840
137,spotify:track:5TtTijiNYtFc6ktQARjY30,"KayBlack, Wall Hein",Preferida,WM Brazil,13,166,67,1344287,130375
138,spotify:track:4ZrKyfCV1UcHuZjbLp03fM,"Mãolee, Filipe Ret, Vulgo FK",Nós Combina,WM Brazil,131,133,8,1340823,204813
139,spotify:track:2hloKDkwGLjtYvAoqn39gV,"Mc Jacaré, Luan Pereira",Senta Pro Bruto,Croco Hits,50,120,20,1340543,148639
140,spotify:track:3lHV3YbZNltXHyZaDDpios,"Mc Laranjinha, Dj Lv Mdp",Ligou na Madruga,DC MUSIC,104,160,16,1330767,92307
141,spotify:track:4hKLzFvNwHF6dPosGT30ed,"Veigh, Bvga Beatz, Prod Malax, Supernova Ent",Novo Balanço,Supernova Entertainment Under Exclusive License to UnitedMasters,2,138,63,1324029,140322
142,spotify:track:1Vy9Wn5sbiduZKBqBlH3Mc,"Vulgo FK, MC PH, Veigh, Pedro Lotto, Fepache",Ballena,Som Livre,3,170,55,1318940,200000
143,spotify:track:7uPInsxTeMbyrJkDQaRwPh,"DJ THG, Mc Arizinho, Tavin",É Que Eu Te Sarrei,A2M Produtora,95,131,11,1318461,140528
144,spotify:track:1m5nbZiPpCIi9J2irLNoxh,"Oruam, Didi, Dj Lc da Roça, MC K9, MC Smith, Mainstreet",Rolé na Favela de Nave,Mainstreet Records,9,115,26,1314841,192000
145,spotify:track:62bOmKYxYg7dhrC6gH9vFn,*NSYNC,Bye Bye Bye,Jive,145,-1,1,1313789,200400
146,spotify:track:0ykxvtsLEbkY1Y81Teextc,"Lu & Rayane, Solange Almeida",Nada Colabora (Tu Tu Tu),Lu & Rayane,146,-1,1,1311528,150782
147,spotify:track:6P1mkNAmgihFwFRBhpaev3,"Luan Pereira, Mc Daniel",ENTRA NA DEFENDER,Som Livre,3,141,19,1310421,174727
148,spotify:track:0OBv4CEP5FKS19ZQGHAUM6,"Mc Paiva ZS, DJ Ak beats, Love Funk",Fala na Cara,Love Funk,85,158,29,1304277,171707
149,spotify:track:4dSDTAZ7ohybHBonbtMBpP,"Bruno & Marrone, Zé Felipe, Mc Jacaré, Loirin prod",Desilusão (MTG) (feat. Loirin Prod),Sony Music Entertainment,14,143,4,1300149,161538
150,spotify:track:40IXmplKTcyWPr9HNCik7e,"Matuê, MC Ryan SP",Filho da Noite,Sony Music Entertainment,14,148,14,1299882,236666
151,spotify:track:0oQCRjrWGvkqkdf82UlXI3,PEDRO SAMPAIO,POCPOC,WM Brazil,1,128,35,1296475,127384
152,spotify:track:2jPCbFrFlyGbKgblxub8Lm,The Outfield,Your Love,Columbia/Legacy,142,142,7,1287248,216466
153,spotify:track:2LTlykcdu0gwb7zcKneo2a,"KayBlack, Baco Exu do Blues, Marquinho no Beat",Melhor Só,WM Brazil,3,154,68,1284778,229326
154,spotify:track:42XLOKRo2bv2Ne9lTOGSQA,WIU,Vidigal,30PRAUM,154,199,2,1282134,197903
155,spotify:track:4bDvY5oGtCWTYH5Vi36bc5,Henrique & Juliano,Mais Amor E Menos Drama (Ao Vivo),"Vida Nova Produções, sob licença exclusiva para Virgin Music Group",106,139,86,1280729,172179
156,spotify:track:6zFpImDYig0CQhLL2NIfyN,"AgroPlay, Ana Castela",Nosso Quadro,AgroPlay,1,126,78,1273792,173698
157,spotify:track:1OwoPY7wYgKQIyl9maWmSM,"Gusttavo Lima, Ana Castela",Canudinho - Ao Vivo,Sony Music Entertainment,2,119,48,1269745,124511
158,spotify:track:0GtGtRY3SB3tlfLYiFtrEw,"Mulú, DUDA BEAT",CHIHIRO,Universal Music Ltda.,158,175,2,1256405,151384
159,spotify:track:4tuFNhM69UakXdPg4RrNvp,"Filipe Ret, Dallass, Hunter",Deus Perdoa,Som Livre,45,189,37,1255452,137142
160,spotify:track:1iYZYlUzDHrfxKqgC99cRZ,"CountryBeat, Brenno & Matheus, Félix, Léo Souzza",Xona no Peão,CountryBeat,160,184,3,1247758,128608
161,spotify:track:4OMSfAavn8k6HxZ0HwVtV1,"Nagalli, Menor MC, Dfideliz, CJota, Leviano, Supernova Ent",CONFISSÕES PT1,Supernova Ent,84,146,14,1244731,213357
162,spotify:track:0redQHBfejmPUhonR5ppGC,"Guilherme & Benuto, Ana Castela, Adriano Rhod",Duas Três,Sony Music Entertainment,8,147,75,1241074,156942
163,spotify:track:2BlFIe0712LBUtTHxbqjme,"NATTAN, Felipe Amorim",Love Gostosinho - Ao Vivo,Vybbe,12,157,68,1240441,163833
164,spotify:track:4IdM33qInoQEbAp5q2sg8L,João Gomes,Me Ama Sem Pausa - Aquelas Paradas,JG Shows,159,159,2,1238165,136544
165,spotify:track:5HFvMPiNjclAq8DbEAPWMw,Gilsons,Várias Queixas,Xirê,146,162,44,1222375,170109
166,spotify:track:3tA0vALUwrzkTgHcm9j6oJ,Zé Neto & Cristiano,Notificação Preferida - Ao Vivo,Som Livre,2,-1,108,1217742,182340
167,spotify:track:1kWcd9h9HoeXsKaDVhSOtj,"Sorriso Maroto, Ferrugem",Ela - Ao Vivo,Sony Music Entertainment,44,171,46,1214689,196988
168,spotify:track:6xW61JP2f3hcsbOwn7dzi5,"Mc IG, MC Ryan SP, MC PH, DJ Glenner","É Isso Bebê, Tá Certa!",WM Brazil,6,137,19,1213891,271058
169,spotify:track:006pMMCuRo2TFjh8sNGSov,Charlie Brown Jr.,"Dias De Luta, Dias De Gloria",EMI Brazil,110,116,55,1213823,145466
170,spotify:track:3PqU6gHWUaBTtIZi5oxEJ7,Zé Neto & Cristiano,Um Mês E Pouco - Ao Vivo,Som Livre,11,174,58,1203366,171712
171,spotify:track:697gwO5YoSGVAnlfREIZll,"MC PH, Borges, WIU, Pedro Lotto, WEY",Tenho Que Me Decidir,GR6 Music,4,145,35,1189830,232258
172,spotify:track:1M35NDVCYIGoyHimP6VV2W,"Sorriso Maroto, Thiaguinho",Promessas - Ao Vivo,Sony Music Entertainment,172,181,2,1185825,204938
173,spotify:track:3hRV0jL3vUpRrcy398teAU,Lord Huron,The Night We Met,Lord Huron,86,173,12,1177566,208211
174,spotify:track:6zdL0aLZs6g61SPGrlMvrM,"DJ JOÃO PEREIRA, MC Koringa",DANÇA PRA ME PROVOCAR,DJ JOÃO PEREIRA x MC Koringa,18,169,34,1177049,
175,spotify:track:3PGg3V56krasXrPKNvVLQU,Filipe Ret,Amor Livre - Ao Vivo,Som Livre,29,151,33,1174414,136800
176,spotify:track:6bTdZ7xfKp3NqqADJ8HLyj,"Matuê, WIU, Teto",Vampiro,Sony Music Entertainment,1,194,118,1173757,250434
177,spotify:track:5h2umbNHTvGiT1gE4tTFCr,"KayBlack, Murillo e LT no Beat",Tempo,WM Brazil,177,-1,1,1168072,173333
178,spotify:track:1lflD04lIdgV10sCMwFYOu,"Mc Leozin, MC Rick, Boladin 211, Deliverymusic, Dj L Martins",Sorriso no Rosto,Delivery Music LTDA,178,-1,1,1164405,155132
179,spotify:track:6ZnVSNNryDmF0w1j73Fndd,"Pineapple StormTv, MC Cabelinho, Bob do Contra, Azzy, Filipe Ret, Dudu, Xamã, Orochi, Maquiny, Salve Malak",Poesia Acústica #6 Era uma Vez,Pineapple StormTV,18,180,226,1162076,577819
180,spotify:track:6622KNu2dncVoEzJt1SGse,"Mc Magal, Aaron Modesto, DJ Tafarel",Ilhabela 2,GR6 Music,180,-1,1,1156025,153000
181,spotify:track:60a0Rd6pjrkxjPbaKzXjfq,Linkin Park,In the End,Warner Records,48,167,14,1152429,216880
182,spotify:track:1WwJveqGQoABRF22Nmwv88,Tz da Coronel,Acordado eu Sonho,Cúpula,124,130,3,1147525,168789
183,spotify:track:5AJ9hqTS2wcFQCELCFRO7A,Tommy Richman,MILLION DOLLAR BABY,PULSE Records,53,144,13,1147113,155151
184,spotify:track:3CJiho39iutZrDxQG5Vubl,LUDMILLA,Maliciosa - Ao Vivo,SEM QUERER MUSIC,13,182,20,1145722,167027
185,spotify:track:0WbMK4wrZ1wFSty9F7FCgu,Chappell Roan,"Good Luck, Babe!",Chappell Roan PS/ Island,167,179,3,1143682,218423
186,spotify:track:0EMf4CzvPd1z50iqRbmLfl,Maria Marçal,Deixa,MK Music,136,-1,40,1143026,248811
187,spotify:track:6Qyc6fS4DsZjB2mRW9DsQs,The Goo Goo Dolls,Iris,Warner Records,187,-1,1,1141967,289533
188,spotify:track:3pLyNmLlw6uRrKaNwMnXOR,Josué Bom de Faixa,Não Precisa Negar,PAX MUSIC,74,149,29,1136608,146309
189,spotify:track:6m8AgjfI28ER6odzMxmHtR,Racionais MC's,"Vida Loka, Pt. 1",Boogie Naipe,176,176,7,1132339,303560
190,spotify:track:4WXVqLSRHF4ypdiBngbcqU,"Dj GM, Mc Paiva ZS, Triz, MC Paulin da Capital, Mc Lipi, Mc Lele JP, MC Ryan SP, Gabb MC, Mc Daniel, MC Cebezinho, MC GH do 7, MC Marks, Mc Negão Original, GREGO",Set Dj Gm 6.0,Love Funk,90,-1,29,1130792,624000
191,spotify:track:5rRlZJz8A17nqeKLdjDvsx,Tz da Coronel,Não Temos Medo,Cúpula,191,192,2,1128841,135165
192,spotify:track:1ZgsY3WkkS9p1BjHOGeKKh,"L7NNON, Veigh, Nagalli",Foto da Unha,HHR Records,70,-1,22,1120830,199680
193,spotify:track:2l6YkP5Rj1w3GsrhE7cDqx,"DJ GUIZIN DA SERRA, MC Marlon PH",MTG - BARRACO DELA LÁ,DJ GUIZIN DA SERRA,120,163,17,1118393,149999
194,spotify:track:0LGGo9eY1aJX6tqgxa87kd,"KayBlack, Wall Hein, Yokame",Freestyle,Bunker Concept,68,186,33,1118267,180172
195,spotify:track:0ODlZu2uJ13I29NfFJJVir,"Luan Santana, MC Kevin o Chris",PEGA ESCANDALOSO,Sony Music Entertainment,21,177,18,1112074,157244
