rank,uri,artist_names,track_name,source,peak_rank,previous_rank,weeks_on_chart,streams
192,"spotify:track:5ME83xsz5O9u3A0qhMtKyj","Mc IG, Murillo e LT no Beat","Jogo do Corinthians","WM Brazil",96,195,14,"1087090"
193,"spotify:track:3vkCueOmm7xQDoJ17W1Pm3","Mitski","My Love Mine All Mine","Dead Oceans",165,199,4,"1082598"
194,"spotify:track:1M6rclDhYmqRBMFGNJOFKB","NATTAN, Grandão Vaqueiro","Americana Na Vaquejada","Feeling",37,-1,34,"1077457"
195,"spotify:track:0OBv4CEP5FKS19ZQGHAUM6","Mc Paiva ZS, DJ Ak beats, Love Funk","Fala na Cara","Love Funk",195,-1,1,"1075468"
196,"spotify:track:2FjCfytqRpicOTtX2lqcBo","Ana Castela, Simone Mendes","Não Vai Ver Nunca","AgroPlay",96,-1,11,"1070126"
197,"spotify:track:7qoIhutxU269Zqo9PG5IOj","Pineapple StormTv, Chris MC, Salve Malak, Tz da Coronel, MC Cabelinho, Chefin, L7NNON, Luísa Sonza, Oruam, Xamã, N.I.N.A","Poesia Acústica 13","Pineapple StormTV",1,-1,60,"1068778"
198,"spotify:track:6a35UETcJteB4oVCSFoAqr","MC Ryan SP, Orochi, MC Hariel, DJ BOY, Oruam","Perfeita","WM Brazil",81,189,13,"1056401"
199,"spotify:track:5HFvMPiNjclAq8DbEAPWMw","Gilsons","Várias Queixas","Xirê",146,179,34,"1055409"
200,"spotify:track:1MeaXiIiI0MCIirQhkxQR6","Michel Teló, Thiaguinho","Meu Hobby - Ao Vivo","Virgin Music Label And Artist Services (S&D)",104,148,3,"1051398"
