rank,uri,artist_names,track_name,source,peak_rank,previous_rank,weeks_on_chart,streams
1,"spotify:track:6Emsu0BaMpG0ilZCRT8KHZ","Diego & Victor Hugo","Tubarões - Ao Vivo","Sony Music Entertainment",1,1,9,"7910210"
2,"spotify:track:4Hk1gmBr2KVEXr3hHwSgUi","DG e Batidão Stronda, Mc Davi, J. Eskine, MC G15","Mãe Solteira","FORTAL MUSIC",1,2,7,"6371683"
3,"spotify:track:2TSYxcrcrtLpdbsLY9NmzL","Simone Mendes","Me Ama Ou Me Larga - Ao Vivo","Universal Music Ltda.",3,6,11,"4882099"
4,"spotify:track:17tg01y3RhlfRKMnd333yL","Danilo e Davi","Apaga Apaga Apaga - Ao Vivo","Som Livre",4,11,23,"4820885"
5,"spotify:track:4pOGEJRVOuaa9oyy7qTGf6","Nilo, Mc Paiva ZS, DJ Di Marques, Tropa da W&S, FamousKyo","Fui Mlk","WMD",1,4,21,"4800186"
6,"spotify:track:2OMkXPz6pHdKJSkzxG0MwZ","Kew, Dj LK da Escócia","Descer","Legenda Records",3,3,8,"4800038"
7,"spotify:track:4swtnATsndB7VJVq0n4EQE","DJ CZ, MC Nito, DJ TS, Mc Pogba, Prime Funk","Rabetão De Terremoto","Prime Funk",7,8,3,"4783058"
8,"spotify:track:6Kyl2nFgU0J8WBlbBvDv6g","Grupo Menos É Mais","Coração Partido (Corazón Partío) - Ao Vivo","Som Livre",1,5,33,"4572340"
9,"spotify:track:2tUIRX4wK0COoKEorOdEpZ","Murilo Huff, Zé Neto & Cristiano","Veneno - Ao Vivo","M Show",9,10,5,"4250780"
10,"spotify:track:4y93vvzu2h8MITw7YyUTcI","Henrique & Juliano","Última Saudade (Ao Vivo)","Vida Nova Produções, sob licença exclusiva para Virgin Music Group",1,7,29,"4213487"
11,"spotify:track:7BGhllQfISbfkwYSkp5nRC","Teto","YES OR NO","30PRAUM",11,73,3,"4100098"
12,"spotify:track:0BUkQGUXgcvf3gdCWYbtnJ","Oruam, Zé Felipe, MC Tuto, Dj Lc da Roça, Mc Rodrigo do CN, MC K9, mc pl alves","Oh Garota Eu Quero Você Só Pra Mim.","Mainstreet Records",1,9,17,"3770988"
13,"spotify:track:44CTudFZ0kbaIF9n0jk7oU","Matheus & Kauan, Ana Castela","Ilusão De Ótica - Ao Vivo","Universal Music Ltda (S&D)",13,16,12,"3685611"
14,"spotify:track:6s1kzj4EbhFLXbuAGJbhbn","MC Tuto, DJ Glenner","Barbie","Sonar Music",1,14,26,"3647718"
15,"spotify:track:3M4HJl7D77l86gL1QXGJHG","Lauana Prado, Simone Mendes","Saudade Burra - Ao Vivo","Universal Music Ltda.",11,15,14,"3553081"
16,"spotify:track:3CvpnVAV75lKCcaTtUTpgW","Chefin, LB Único","Se Essa Bunda For Uma Empresa","Chefin Distribuição",16,22,6,"3402380"
17,"spotify:track:3iDZj9V0RSElRwVgtmMYgJ","Oruam, Maurin, Victor WAO","Lei Anti O.R.U.A.M","Mainstreet",10,12,8,"3394766"
18,"spotify:track:3R8dmcSyROSR73XsdeSd7g","Clayton & Romário","Opa Cadê Eu - Ao Vivo","WM Brazil",18,33,10,"3343872"
19,"spotify:track:6lrQgEPTuOKyvn4bQJuaRU","Luan Pereira, MC Tuto, Grelo","NÃO ERA LOVE","Som Livre",19,40,2,"3340642"
20,"spotify:track:37QloSdzrjx2xCH0m65800","Gustavo Mioto, Grupo Menos É Mais","Nada Com Nada - Ao Vivo","Universal Music Ltda.",16,17,19,"3290139"
21,"spotify:track:0vYrfm0eUQyi6fWbYnBiDc","DJ NATAN 22, Mc Rodrigo do CN, DJ DN do Dick","Meu Carro Nao Tem Porta Luva - Remastered 2024","Snafu Records",21,30,15,"3259921"
22,"spotify:track:0NQyryTVbjGMtWMA1eSqIn","J. Eskine, Alef Donk","Resenha do Arrocha","Latin Brega by HITLAB Records",1,13,19,"3241628"
23,"spotify:track:5AoOD6SAzOOE6jwxvRIBPq","Nego Trufa, Dj TC, DJ Japa NK","Baile do Panta","GRINGOS WORLD PRODUTORA",23,-1,1,"3170807"
24,"spotify:track:2Z1DmmPWD3Lm0dWAxMfjxG","MC Jvila, Mc Negão Original, DJ Dael, DJ Guh Mix","Pirocada Quente","Legenda Records",24,34,9,"3154396"
25,"spotify:track:40WZQRA3T6WZFIgskIAAz7","Simone Mendes","Saudade Proibida - Ao Vivo","Universal Music Ltda.",25,71,2,"3128016"
26,"spotify:track:65vJAh07BdwurqR9SRa6f8","Ferrugem, Sorriso Maroto","Apaguei Pra Todos - Ao Vivo","WM Brazil",18,18,52,"3094726"
27,"spotify:track:7so0lgd0zP2Sbgs2d7a1SZ","Lady Gaga, Bruno Mars","Die With A Smile","Interscope Records",5,21,35,"3060347"
28,"spotify:track:07kLShG3HTeLXTqnFCqNAJ","Henrique & Juliano","Amigo Da Minha Saudade (Ao Vivo)","Vida Nova Produções, sob licença exclusiva para Virgin Music Group",26,26,15,"3032713"
29,"spotify:track:096gZM7wp5GKHBwtWY3d0z","Link do Zap, pluglip","a última dança","Link do Zap",29,49,8,"2974269"
30,"spotify:track:3WxetTBTlpfyknxJfPQ7eQ","MC Cebezinho, Dj Yuri Pedrada, Love Funk","Observando Essa Salada","Love Funk",8,20,12,"2968210"
31,"spotify:track:6XXqPj8USz1oebSmMPCBLC","DJ Gouveia, DJ Dozabri, Mc Rodrigo do CN","Tipo Nino Abravanel","Mandela Music",31,48,6,"2839242"
32,"spotify:track:0UGGLKM970ymsBBN5TKjsD","MC Tuto, DJ Oreia","2025","Sonar Produtora",11,24,16,"2738825"
33,"spotify:track:6id4TFeHJgvVtCzrJEysl0","Henrique & Juliano","Saudade De Quem Eu Sou (Ao Vivo)","Vida Nova Produções, sob licença exclusiva para Virgin Music Group",23,23,5,"2736608"
34,"spotify:track:2gfn28JSINCJGLrUimmu0l","Jorge & Mateus","Cantada Boba - Ao Vivo","Som Livre",11,35,23,"2721650"
35,"spotify:track:63Vdw2P2cw1Gf8ABQiEjXD","Gusttavo Lima","Sofrimento Simultâneo - Ao Vivo","Sony Music Entertainment",19,19,3,"2709492"
36,"spotify:track:3bpNcH1SCEMn6zuynZGY5e","Orochi, TkN, RUXN, Kizzy, ProdSmile","Fashion","Mainstreet Records",36,41,6,"2708402"
37,"spotify:track:280QfKhmWGn3LbyB39aA7u","Léo Foguete","Cópia Proibida","Acertei Produções",5,31,24,"2704857"
38,"spotify:track:77HhVmRv7IxDqkyMxElSrK","Anitta, Mc Danny, HITMAKER","Sei Que Tu Me Odeia","Universal Music Ltda.",3,25,13,"2701391"
39,"spotify:track:6VH6SBNNL2RVWwImq046ce","Boladin 211, Dejinha, MC Rick, DJ AL4DDIN","Penélope Charmosa 2","Kave",5,27,14,"2662011"
40,"spotify:track:4jUZymsR3lkia9wkP0o9cX","DJ TOPO, Mc Livinho","MTG NA IMAGINAÇÃO - TOPO SESSIONS VOL. 1","DJ TOPO",6,29,28,"2656881"
41,"spotify:track:7shkORZD3NNi6waqw7eIqT","Gusttavo Lima","Proibido Terminar - Ao Vivo","Sony Music Entertainment",13,32,10,"2583638"
42,"spotify:track:5aMgTcyBPH90hWHhbNKTwR","Diego & Victor Hugo","Entregador de Flor - Ao Vivo em Brasília","Sony Music Entertainment",22,43,31,"2574220"
43,"spotify:track:5TOvA5Uhxti7FPh0EIdClV","MC LUUKY, DJ JB Mix","Malvadinho","EDITORA E GRAVADORA A BASE RECORDS",1,38,24,"2467965"
44,"spotify:track:6ukVCqH77f6cwRHyJBhGgy","Israel & Rodolffo","Arruma Um Bão","Som Livre",13,46,28,"2414214"
45,"spotify:track:456hxgSVUAJVgPV0UncG68","DENNIS, Luísa Sonza","MOTINHA 2.0 (Mete Marcha)","Sony Music Entertainment",6,37,11,"2340934"
46,"spotify:track:3TnSAp3TfGMYptOqv234uK","MC Tuto, Grelo","Do Job","Sonar Music",9,45,22,"2335296"
47,"spotify:track:1VpOT1TfTivUmFjSGSRt1U","MC LUUKY, MC Jvila, DJ Dael","Olha pra Cara de Quem Te...","EDITORA E GRAVADORA A BASE RECORDS",34,74,5,"2318803"
48,"spotify:track:4eqOz5gdCYww9GB5q3q1pU","DJ Douglinhas, DJ Miller Oficial, MC Torugo","Puta É Só um Detalhe","DJ DOUGLINHAS",13,44,16,"2309231"
49,"spotify:track:6Ap9SM1WkmI4b4Mo2Cpa6f","NATTAN, Léo Foguete","Última Noite","Nattan",8,42,26,"2262156"
50,"spotify:track:6x6EA3N9xXgptSakS7VZUg","GORDÃO DO PC, Mc Menor DN, Mc Leozin, Ana Laura Lopes","FANTASMA (versão GORDÃO DO PC)","Alt Music",8,39,16,"2228792"
51,"spotify:track:0arxXBXzv96Q449DK1SmiX","BK, Kolo, Evinha","Cacos De Vidro (sample: Esperar pra Ver)","Gigantes",23,47,11,"2207698"
52,"spotify:track:708yXS1fLm1gAXFyIQxtX2","Henrique & Juliano","Romântico (Ao Vivo)","Vida Nova Produções, sob licença exclusiva para Virgin Music Group",52,58,24,"2184842"
53,"spotify:track:5asabafNzfAzjUecDvuNES","Henrique & Juliano","Aquela Pessoa (Ao Vivo)","Vida Nova Produções, sob licença exclusiva para Virgin Music Group",34,61,168,"2156547"
54,"spotify:track:3yCtRV7LMeGBpvSHDR8uMV","Boladin 211, MC Rick, MC Leozinho ZS, CAO$, Dj Lv Mdp, Dj Vitin do Pc","Chapa Máxima","WM Brazil",36,57,19,"2144421"
55,"spotify:track:2xTM0m9HD3gIqNSutA0LNJ","Jorge & Mateus, Henrique & Juliano","Xonei","Som Livre",3,59,35,"2142801"
56,"spotify:track:48tyRFRqsKTYnViVA1XOk9","Lauana Prado","Kamasutra - Ao Vivo","Universal Music Ltda.",29,53,6,"2127844"
57,"spotify:track:5QbtKOsjbEGkx0GMiQGBZt","fhop music, Hamilton Rabelo","Tu és + Águas Purificadoras - Ao Vivo","FHOP Music",49,54,55,"2120481"
58,"spotify:track:4OrDHBIn0eJqwkzRHYsB0L","Brenno & Matheus","Falou Rodeio","New Music",56,56,6,"2107274"
59,"spotify:track:6Tp4LCJ5r5IJaEf8lnlPfG","Henrique & Juliano","De Trás Pra Frente (Ao Vivo)","Vida Nova Produções, sob licença exclusiva para Virgin Music Group",17,52,131,"2083330"
60,"spotify:track:3aDV90V6vHUSYKKYDLNdQ8","Israel & Rodolffo, Jorge & Mateus","Marca Evidente - Ao Vivo","DAMASCENO MUSIC",60,66,16,"2064851"
61,"spotify:track:5k7JSycp97vL45zSOoUsTE","Henrique & Juliano","Seja Ex (Ao Vivo)","Vida Nova Produções, sob licença exclusiva para Virgin Music Group",20,62,29,"2018457"
62,"spotify:track:7l9Tq5phzkLnhWUyfp702G","Kaique e Felipe, Luan Pereira","Saveiro","Sony Music Entertainment",1,112,38,"1974643"
63,"spotify:track:3xkHsmpQCBMytMJNiDf3Ii","Benson Boone","Beautiful Things","Night Street Records, Inc./Warner Records Inc.",40,65,57,"1956966"
64,"spotify:track:5wV5dO1GOI4srs4Um5cJXo","J. Eskine, Alef Donk","Resenha de Ex-Love","HITLAB BREGA",7,50,8,"1955739"
65,"spotify:track:3cwVKjzKSTfvacYJF6Tkub","Léo Foguete","Última Noite - Solo","Acertei Produções",5,60,27,"1947967"
66,"spotify:track:1l0wjEdL5zYutUW8tVFiZO","Mc Negão Original, DJ Japa NK, DJ Guh Mix","Medley de Igaratá 3","Cria Hit BR",10,69,23,"1898712"
67,"spotify:track:7opE9OJaqrvkQspmfJdVsS","Guilherme & Benuto","Filho da Mãe - Ao Vivo","Sony Music Entertainment",67,87,2,"1885106"
68,"spotify:track:3H7eBmcTJyuEMStfmKuLmG","MC Cebezinho, DJ Oreia, MC Tuto, Love Funk, Kako","A Danada Me Ligando","Love Funk",1,79,33,"1874226"
69,"spotify:track:06n87WQroP5WFD4aR45T8X","DJ Japa NK, Mc Negão Original, MC Meno K","Comedinha Ficou Bravo","Love Funk",64,70,12,"1863704"
70,"spotify:track:6YdJ2jJOo143KhXT9qvQVe","MC GP, MC Jvila, MC LUUKY, Dj Yuri Pedrada","300 no 7","MC GP & GR6",11,67,40,"1855353"
71,"spotify:track:4MF0VMffyxHsy3GZwwUnAs","Matuê","A Morte do Autotune","30PRAUM",52,78,54,"1852424"
72,"spotify:track:0rosNwHC9T8YNu3EvXLPfX","Ferrugem","Me Bloqueia (Ao Vivo)","WM Brazil",66,72,35,"1827587"
73,"spotify:track:4VNRWHoiKHZJIoQHPbmJIv","Felipe e Rodrigo","Gosta De Rua (Ao Vivo)","MK Records",1,88,54,"1817615"
74,"spotify:track:5LCegtYPODbcqbTE5CZVv8","Manu, Simone Mendes","Daqui pra Sempre","manuoficial",3,-1,58,"1808517"
75,"spotify:track:4sTlQPMyoFMPdhAJvErBN3","ATLXS","PASSO BEM SOLTO - Slowed","broke",75,107,3,"1801070"
76,"spotify:track:4Nj2zoYULwyYnJTU3AZf6B","Diego & Victor Hugo","Dama do Baralho - Ao Vivo","Sony Music Entertainment",76,101,3,"1796689"
77,"spotify:track:6dOtVTDdiauQNBQEDOtlAB","Billie Eilish","BIRDS OF A FEATHER","Darkroom/Interscope Records",33,76,48,"1786742"
78,"spotify:track:2FG6DJRP9URLUHWn8GDYex","Incendiários, Marcelo Markes","Eu Tenho Você (Ao Vivo)","MM Produções",78,196,2,"1785035"
79,"spotify:track:0pGsxpkJC9IwK93fmqEYXn","Grupo Menos É Mais","Aquele Lugar - Ao Vivo","Som Livre",79,116,9,"1784261"
80,"spotify:track:5rHhO6SBSzo3E9m3KHyCtt","Murilo Huff, Ana Castela","Peça Íntima","M Show",8,91,27,"1774252"
81,"spotify:track:2kBxNuYFT0J8w9CD4ugLpJ","Marcos & Fernando, Henrique & Juliano","Trocaria Tudo - Ao Vivo","Work Show",75,75,4,"1766151"
82,"spotify:track:3eHeTsX6W9iIEfn8l2xrWO","Henrique & Juliano","Meu Amor (Ao Vivo)","Vida Nova Produções, sob licença exclusiva para Virgin Music Group",65,83,112,"1765097"
83,"spotify:track:7McCAKExE8KsI2q4Y8wx4U","Murilo Huff, Marília Mendonça","Dois Enganados","M Show",49,86,140,"1761111"
84,"spotify:track:6RzcNTnS02dnqoQMdTkQwi","Brenno & Matheus, DJ Ari SL","Descer Pra BC","New Music",1,63,21,"1755181"
85,"spotify:track:1pjpPXl66t4FeQaFscpG73","Henrique & Juliano","Cidade Vizinha (Ao Vivo)","Vida Nova Produções, sob licença exclusiva para Virgin Music Group",6,95,107,"1730011"
86,"spotify:track:5mSprs9Ar10MWtbgJIERhP","PEDRO SAMPAIO, Anitta, Mc Gw","BOTA UM FUNK","WM Brazil",68,68,2,"1724569"
87,"spotify:track:2tojoGnvHLNuMuGncpnjAC","KayBlack, Wall Hein","Discreto","WM Brazil",55,55,2,"1701516"
88,"spotify:track:4yEKHiUQA70cjfWnEL2m13","Drops INA, Paulo Vicente","É Ele","Onimusic",74,77,27,"1690296"
89,"spotify:track:0JPpScEAtvRvWQ38nifwO9","Kyan, Mu540, DJ Mzl Ori","USD, é USD!","EHXIS",89,-1,1,"1685415"
90,"spotify:track:15CoBMXezZjfJuFpvuhYK3","Oruam, Ajaxx, Gigant, Goldgrain","22 Meu Vulgo","Mainstreet",54,84,8,"1683208"
91,"spotify:track:0zxWyvrKyz031tFfBnkYLr","Henrique & Juliano","Como É Que A Gente Fica (Ao Vivo)","Vida Nova Produções, sob licença exclusiva para Virgin Music Group",23,90,126,"1666324"
92,"spotify:track:17phhZDn6oGtzMe56NuWvj","Teddy Swims","Lose Control","Warner Records",70,81,59,"1661706"
93,"spotify:track:1h0yBDChztCJRTqmI5U6ou","MORADA","É Tudo Sobre Você / Ser Mudado - Ao Vivo","Onimusic",93,94,6,"1658071"
94,"spotify:track:6JKkP9ABQzYZUFSKSVDKIc","1Kilo, Baviera, Knust, Pablo Martins","Deixe Me Ir (feat. Pablo Martins) - Acústico 1Kilo","1Kilo Records",1,97,150,"1652009"
95,"spotify:track:7MnT7msJZg3XBAS0OTfGrB","Legião Urbana","Tempo Perdido","EMI Brazil",95,102,67,"1646241"
96,"spotify:track:4f0aDk7HX37SfzerfznYlr","Grupo Menos É Mais, Matheus Fernandes","Lapada Dela - Ao Vivo","Som Livre",4,109,112,"1644403"
97,"spotify:track:7xcDd2JxnJtO87QQr8uY0O","Natanzinho Lima, Mc Tato, Gabb MC","Me Apaixonei Nessa Morena","Sua Música Digital",97,104,3,"1635703"
98,"spotify:track:0d7oIw2t0f6oCXJUfWYw8E","Veigh, Supernova Ent","Mônaco Freestyle","Supernova Ent",53,99,7,"1616110"
99,"spotify:track:4dGx53NJZJyuuLP5ownH1p","Wesley Safadão, Natanzinho Lima","Mentira Estampada","Wesley Safadao",11,110,30,"1605526"
100,"spotify:track:6h3EEYgtIuOjeqQPIC3H37","Eric Land, Natanzinho Lima","Pilantra e Meio","Eric Land",1,103,23,"1593500"
101,"spotify:track:7pBPXkaVQaP3Y3Wwfkpvbn","Hugo & Guilherme, Wesley Safadão","Mentirosa - Ao Vivo","Som Livre",6,51,17,"1591997"
102,"spotify:track:2drZGdAOxfE2KoMGTkidmq","MC Marks, MC Ryan SP, MC Jvila, MC Bruno MS, Mc Magal, Aaron Modesto, DJ Dael, MC LUUKY","365 Dias (Vida Mansa)","Legenda Records",9,85,29,"1588396"
103,"spotify:track:6ejIcf1OdUmtOJ7fpFcEXo","Mc Negão Original, DJ Guh Mix","Medley de Igaratá 4","Cria Hit BR",11,80,10,"1586129"
104,"spotify:track:7bukHRNgGLRySTJEVvLoIR","Henrique & Juliano","Briga Feia (Ao Vivo)","Vida Nova Produções, sob licença exclusiva para Virgin Music Group",22,140,129,"1561398"
105,"spotify:track:4wJ5Qq0jBN4ajy7ouZIV1c","ROSÉ, Bruno Mars","APT.","Atlantic Records",8,98,26,"1540040"
106,"spotify:track:6m8AgjfI28ER6odzMxmHtR","Racionais MC's","Vida Loka, Pt. 1","Boogie Naipe",94,117,25,"1537442"
107,"spotify:track:3PLdcrfVesYKyTpS1EXsxO","Dilsinho","Diferentão - Ao Vivo","Sony Music Entertainment",77,100,60,"1534468"
108,"spotify:track:2wXqRqVGiGB2fyy9eoPJbP","Mc Lele JP, MC Marks, MC Leozinho ZS, MC Joãozinho VT","Eu sou Cantor Não Sou Bandido","A Luz Records",19,93,29,"1529832"
109,"spotify:track:2jpbtp5N679x92uB8s8p9h","Suel, Grupo Menos É Mais","Vitamina C - Ao Vivo","Virgin Music Label And Artist Services (S&D)",83,119,27,"1528968"
110,"spotify:track:3QaPy1KgI7nu9FJEQUgn6h","Billie Eilish","WILDFLOWER","Darkroom/Interscope Records",66,89,36,"1523504"
111,"spotify:track:0hWzBcYtmwsL1TwByzjiUG","MC Joãozinho VT, Mc Negão Original, MC Tuto, Matheuszin DJ, Kako, MC Ryan SP","Boy Besta","Sonar Music",47,108,22,"1515574"
112,"spotify:track:2o2xhyri4aJUtgMGkf5P0J","ANAVITÓRIA, Lenine","Lisboa","F/SIMAS",83,106,24,"1497777"
113,"spotify:track:2j7IPPMZt5nE5R4r2AbKZ8","Panda, Humberto & Ronaldo, Ícaro e Gilmar, MJ Records","12 Horas / Pra Você Acreditar - Ao Vivo","MJ Records.",113,164,2,"1485656"
114,"spotify:track:06VStvBWfFbepR97LhRo8D","Mc IG, Mc Negão Original, MC Ryan SP, MC Jvila, DJ Guh Mix, Mc Lele JP, Murillo e LT no Beat","Contagem Regressiva","WM Brazil",96,96,3,"1475823"
115,"spotify:track:0cQVqPuHQP4KEwc7ZUQmj6","The Neighbourhood","Sweater Weather","Columbia",79,113,120,"1462433"
116,"spotify:track:7jCgslBhuPF61B6yk90VYb","MC Ryan SP, Mc IG, DJ Japa NK, Nilo, Boladin 211, MC LUUKY, Mc Negão Original","Sexta Feira Hoje Tem","WM Brazil",106,131,13,"1408824"
117,"spotify:track:6sRLrSetyIwIKhW1eMlUNP","Matheus & Kauan, Marília Mendonça","Vou Ter Que Superar - Ao Vivo","Universal Music Ltda.",2,175,78,"1404881"
118,"spotify:track:39O9PGzlZnVTOhAYQjyBRG","Natanzinho Lima","Uma e Quinze da Manhã","Sua Música Digital",2,124,20,"1404252"
119,"spotify:track:1Nmcs8zk7LfcvHRgLtTM5J","Orochi, Papatinho","Amor de Fim de Noite","Mainstreet Records",36,114,86,"1404006"
120,"spotify:track:2Xcc5Rsawh7EkzUwdVFrnn","Henrique & Juliano","Mudando De Assunto (Ao Vivo)","Vida Nova Produções, sob licença exclusiva para Virgin Music Group",120,145,4,"1403194"
121,"spotify:track:4ssHL7bSnOAE7HjiuLx6Co","Matuê","Crack com Mussilon","30PRAUM",1,133,32,"1402778"
122,"spotify:track:74LohOvD6SpyKQHPt4WTGC","Ícaro e Gilmar","Voltável - Ao Vivo","MJ Records",122,143,4,"1401862"
123,"spotify:track:0lTCXzpd3WL5FsPsrO2W4W","Israel & Rodolffo","Não, Mas Quase - Ao Vivo","Som Livre",123,-1,1,"1398855"
124,"spotify:track:6wLTQ0PQAsFaTf4SfBDyYc","Matheus Fernandes, Matheus & Kauan","Triplex - Ao Vivo","Som Livre",4,135,45,"1390587"
125,"spotify:track:1rIjWQlGJXjDtOKl8CzToC","Manu, Mari Fernandez","Abismo","manuoficial",104,-1,18,"1389666"
126,"spotify:track:18z8Px2zIsaQrtszgWdVZn","BK, Deekapz, Evinha","Só Quero Ver","Gigantes",41,127,12,"1383469"
127,"spotify:track:2655xYZ347fG2N6OjkoMQ8","Jorge & Mateus","Logo Eu","Som Livre",88,115,30,"1381003"
128,"spotify:track:5mPn4ueXc1oua018FDvknz","MC Joãozinho VT, DJ JR No Beat","Calculista","Sonar Music",47,123,25,"1380052"
129,"spotify:track:7xeqjq45imp3qonWKqfyip","PEDRO SAMPAIO, Mc Gw, Mc Debby, Mc Talibã","SEQUÊNCIA STRIPTEASE","WM Brazil",30,92,15,"1378858"
130,"spotify:track:7JtJjh9WfxUOpjFhurxVRW","Julliany Souza","Quem É Esse? - Ao Vivo","Julliany Souza",130,176,6,"1378694"
131,"spotify:track:6xLka4rZhf5O0IWf0qLk4A","Léo Foguete","Quem de Nós Dois - Ao Vivo","Acertei Produções",101,152,5,"1373011"
132,"spotify:track:7CyPwkp0oE8Ro9Dd5CUDjW","The Weeknd, JENNIE, Lily-Rose Depp","One Of The Girls (with JENNIE, Lily Rose Depp)","XO / Republic Records",61,130,68,"1372980"
133,"spotify:track:2HRqTpkrJO5ggZyyK6NPWz","Sabrina Carpenter","Espresso","Island Records",49,150,53,"1366818"
134,"spotify:track:4IlklRFZUgNQlwwW0PSLm7","Grelo, Henrique & Juliano","Paredões","Henrique & Juliano",23,120,20,"1361399"
135,"spotify:track:47j8u38wfvxdQeRA7TBJrB","MORADA","É Tudo Sobre Você - Ao Vivo","Onimusic",127,128,12,"1356568"
136,"spotify:track:2LHNTC9QZxsL3nWpt8iaSR","Lady Gaga","Abracadabra","Interscope Records",12,193,11,"1348875"
137,"spotify:track:0fK7ie6XwGxQTIkpFoWkd1","JENNIE","like JENNIE","OA Entertainment/Columbia",85,167,6,"1346803"
138,"spotify:track:7tI8dRuH2Yc6RuoTjxo4dU","Jimin","Who","BIGHIT MUSIC",7,111,39,"1341674"
139,"spotify:track:1DLKuppSYytOuxhtI6KBGu","Tribalistas","Aliança","Phonomotor",74,125,32,"1340196"
140,"spotify:track:3zXIfbjxSzPMNP6JDZsQsi","Orochi, Kizzy","Mitsubishi","Mainstreet Records",120,142,19,"1339830"
141,"spotify:track:3Sa2gVQioE31DcG4nKNDqD","Matuê, Brandão85","Isso é Sério","30PRAUM",14,141,26,"1338247"
142,"spotify:track:1ggAVLO5PbO0I2mWDlsFFQ","Henrique & Juliano","Recaídas (Ao Vivo)","Vida Nova Produções, sob licença exclusiva para Virgin Music Group",137,166,17,"1333510"
143,"spotify:track:0TA12jLkmAdhkUa9Vz84jq","Aka Rasta","QUASE QUE FALEI TE AMO","Aka Rasta",143,-1,1,"1330102"
144,"spotify:track:7pkpWcko6KEZANj0xKsCsu","Matheus & Kauan","Cronômetro - Ao Vivo","Universal Music Ltda (S&D)",15,151,41,"1328838"
145,"spotify:track:2ZrC9CTs01XkbFPtLbpHzl","Mc Jacaré, DJ JHOW BEATS","Senta e Cala a Boca","Croco Hits",139,139,2,"1325385"
146,"spotify:track:5k21RXqN11N0TIeLLySlDv","Isadora Pompeo","Ovelhinha (Ao Vivo)","Sony Music Entertainment",111,129,41,"1324562"
147,"spotify:track:2t878JZCl8Ftd2mVzzakYc","Jorge & Mateus, Lauana Prado","Haverá Sinais - Ao Vivo","Som Livre",2,148,57,"1320418"
148,"spotify:track:6C5EczmaeIUmf1pTYux9f1","Jorge & Mateus","Tem Amor, Tem Volta - Ao Vivo","Som Livre",102,192,5,"1318622"
149,"spotify:track:7Cf2Hsy3cPlA4e115tElXv","Henrique & Juliano","Liberdade Provisória (Live - Ibirapuera / 2019)","Vida Nova Produções, sob licença exclusiva para Virgin Music Group",1,163,155,"1309459"
150,"spotify:track:5Fhr3wqeieN5WDkAsqL1JJ","j-hope","MONA LISA","BIGHIT MUSIC",47,105,4,"1309145"
151,"spotify:track:7Elw15XWLpOi4qzHyAwa9e","Gloria Groove","Nosso Primeiro Beijo - Ao Vivo","SB Music",18,177,46,"1306980"
152,"spotify:track:1JSTJqkT5qHq8MDJnJbRE1","The Police","Every Breath You Take","Polydor Records",136,136,43,"1299952"
153,"spotify:track:5CSzt2msdo6pWVxkaKX1FG","Theuzinho","Não Tente Me Impedir","Theuzinho Cantor",146,146,2,"1286353"
154,"spotify:track:207HLdUVIdZEUMRX15BIwD","DJ OLIVEIRA ORIGINAL, MC Nito","Médio Versalico","DJ oliveira original",76,118,11,"1282583"
155,"spotify:track:5q0NlM6Pm8Pp3orq7zGiRn","Matheus & Kauan, Jorge & Mateus","Quarta Cadeira - Ao Vivo","Universal Music Ltda.",10,-1,87,"1281559"
156,"spotify:track:4SZWKdNMIaUUFNmtJAxYdr","Henrique & Juliano","Vidinha De Balada (Ao Vivo)","Vida Nova Produções, sob licença exclusiva para Virgin Music Group",5,-1,92,"1281525"
157,"spotify:track:1MnUXXQEuzlJFNF5xMH1XQ","Matheus & Kauan","Nessas Horas - Ao Vivo","Universal Music Ltda.",54,138,47,"1279656"
158,"spotify:track:1S9fKs0sAdZPlL8ViOARnS","Vitor Santana","João 20 + pra Sempre - Ao Vivo","Vitor Santana",158,180,5,"1271586"
159,"spotify:track:344LzkpddPjSAkEtJK83QL","Ana Castela, Léo Foguete, AgroPlay","Sem Você","AgroPlay",40,134,17,"1267723"
160,"spotify:track:0GbvYZsvz7bWyijBDESebX","Simone Mendes","Mulher Foda - Ao Vivo","Universal Music Ltda.",10,195,38,"1264592"
161,"spotify:track:6dBNHXIJLpsgPlLroF4tf1","MC Dricka, DJ S2K","Vou Raspar Seu Bigodin","Som Livre",27,126,12,"1259250"
162,"spotify:track:4bDvY5oGtCWTYH5Vi36bc5","Henrique & Juliano","Mais Amor E Menos Drama (Ao Vivo)","Vida Nova Produções, sob licença exclusiva para Virgin Music Group",94,-1,109,"1254944"
163,"spotify:track:5hFh5hsMEmfRYZvh4FRE8Z","Clayton & Romário","Sei Tocar Violão - Ao Vivo","WM Brazil",15,154,28,"1254593"
164,"spotify:track:6UzGpz33nYXa3gAEJ1mndV","Hugo & Guilherme, Maiara & Maraisa","O Meu Coração Em Suas Mãos (Colgando en tu manos) - Ao Vivo","Som Livre",10,159,37,"1247893"
165,"spotify:track:0KDxhAvKeiVFL1bZccQVJs","Zé Neto & Cristiano","Pulando o Muro - Ao Vivo","Som Livre",62,132,24,"1247603"
166,"spotify:track:7dKqPh21HpsysZvRWyNeM1","Isadora Pompeo","Bênçãos Que Não Têm Fim (Counting My Blessings)","Sony Music Entertainment",10,144,69,"1245827"
167,"spotify:track:5g7sDjBhZ4I3gcFIpkrLuI","Bruno Mars","Locked out of Heaven","Atlantic Records",45,155,65,"1231485"
168,"spotify:track:5XeFesFbtLpXzIVDNQP22n","Arctic Monkeys","I Wanna Be Yours","Domino Recording Co",78,157,128,"1224928"
169,"spotify:track:7IFsTX5H1sWcEl8joV0IdD","THE BOX, Mc Brinquedo, MC Cebezinho, MC Tuto, Mc Laranjinha, DJ Oreia","THE BOX MEDLEY FUNK 2","Sony Music Entertainment",1,172,51,"1221426"
170,"spotify:track:3tA0vALUwrzkTgHcm9j6oJ","Zé Neto & Cristiano","Notificação Preferida - Ao Vivo","Som Livre",2,-1,111,"1212192"
171,"spotify:track:5UBCGftdDXdaxomn1eloLC","Teto, WIU","PRETTY LET GIRL","30PRAUM",169,-1,2,"1205341"
172,"spotify:track:2jNychTlNots7P3bMt41aa","Isaias Saad","Bondade de Deus","Onimusic",152,-1,32,"1203912"
173,"spotify:track:2bjUb6brYmvOXkMboRENLa","Humberto & Ronaldo, Jorge e Mateus","Romance - Ao Vivo","Humberto e Ronaldo",173,173,2,"1200598"
174,"spotify:track:2262bWmqomIaJXwCRHr13j","Gigi Perez","Sailor Song","Gigi Perez PS/ Island",156,156,4,"1199705"
175,"spotify:track:2MHQdlPaIcD49dJXHd6MYI","MC Marks, GringoBeats808","Hoje o Dia Tá Bonito","WM Brazil",39,-1,21,"1198480"
176,"spotify:track:6QSYz3Nlcxwv1x0RWIgMoj","Major RD, Borges, MC Cabelinho, Young Ganni, Rock Danger, meLLo","Só Rock 3","Rock Danger",68,153,7,"1194825"
177,"spotify:track:1pK2Tr5zwOkkuBrrDAkLbb","MC Jvila, TrapLaudo, Mc IG, Murillo e LT no Beat","Quem Tem Transa","GR6 Music",177,179,2,"1194745"
178,"spotify:track:0rqn9g0GZtn5y4ogm5U3NF","Mc Negão Original, MC Cebezinho, Dj Yuri Pedrada, Mc Fidelis, MC GP, MC Jvila, MC Ryan SP","Toma Que Toma","Cria Hit BR",46,162,14,"1192011"
179,"spotify:track:1AM8pZn5uY89vkItAH5bm3","Felipe Araújo, Luan Pereira","Body Splash - Ao Vivo","Universal Music Ltda.",26,168,23,"1190076"
180,"spotify:track:4PnYbyk6EA0zcASUc9huHP","Guilherme & Santiago, Jorge & Mateus","Pijama Amarelo - Ao Vivo","Deolli Music",180,187,4,"1189147"
181,"spotify:track:2RkZ5LkEzeHGRsmDqKwmaJ","Alex Warren","Ordinary","Atlantic Records",181,-1,1,"1188655"
182,"spotify:track:0AsfpL8bzbmEyJsfbPPYnj","Charlie Brown Jr.","Zóio De Lula","EMI Brazil",168,178,8,"1187911"
183,"spotify:track:6cFW2FPaUL4YRJfS9zFJaV","Simone Mendes","Dois Tristes - Ao Vivo","UME - Global Clearing House",4,200,53,"1185061"
184,"spotify:track:361DsT1rBpJKIYVJNSP0pk","MC Ryan SP, Mc IG, Mc Don Juan, Boladin 211, MC LUUKY, MC Neguinho do Kaxeta, Oldilla","Não Bebo Não Fumo Mais","WM Brazil",148,-1,5,"1184348"
185,"spotify:track:4seW5sDVICaZw34NzrHPm0","Nuzio Medeiros, Henry Freitas, Kadu Martins","Tando","Nuzio Medeiros",1,122,18,"1183912"
186,"spotify:track:1FCvRATk4Wa30LW608ecEN","Natanzinho Lima","Chuva de Arroz","Sua Música Digital",140,194,8,"1180829"
187,"spotify:track:2nLtzopw4rPReszdYBJU6h","Linkin Park","Numb","Warner Records",58,165,22,"1176224"
188,"spotify:track:7IrWDPYP9rwNq1N4aUF3nG","Teto, Matuê, WIU","MULHER SECRETA","30PRAUM",188,190,2,"1175364"
189,"spotify:track:4ksSf8cL3VlUvQSkFcRHy3","Henrique & Juliano","Até Você Voltar - Ao Vivo","Som Livre",107,-1,47,"1172356"
190,"spotify:track:7izihBeq9rmGYnierSTjv8","Gamadinho","Instinto - Ao Vivo","Gamadinho",151,198,15,"1170690"
191,"spotify:track:2077eHXxwRgxDhEBtJV0wD","Jorge & Mateus","Amo Noite E Dia - Live In Sao Paulo / 2010","Universal Music Ltda.",161,161,4,"1165464"
192,"spotify:track:25CffgwZg6vlUdCsHJijZo","Panda, Ícaro e Gilmar, MJ Records","Baqueado - Ao Vivo","MJ Records.",171,183,4,"1165389"
