rank,uri,artist_names,track_name,source,peak_rank,previous_rank,weeks_on_chart,streams,duration_ms
196,spotify:track:34eKejr8wd69fFpL38IIfv,"Valesca Mayssa, Todah Music",Eu Sou Teu Pai - Ao Vivo,Todah Music,142,-1,40,1149429,376035
197,spotify:track:6gFQhcUOhNXaq965kYEdsH,"Delacruz, Maria, Ducon, Luiz Lins, Diomedes Chinaski, BK, Kayuá, Pineapple StormTv",Poesia Acústica #2: Sobre Nós,Pineapple StormTV,91,198,89,1149377,471767
198,spotify:track:6ATNNv8tZF61fa7VwDH89j,Alexsander Lucio,O Fogo Arderá - Ao Vivo,ID1736 - Céu Music,145,172,4,1149299,624000
199,spotify:track:6Qyc6fS4DsZjB2mRW9DsQs,The Goo Goo Dolls,Iris,Warner Records,187,-1,2,1145838,289533
200,spotify:track:69sdOLKjgnwdA2smmct2a9,Gabriel Guedes de Almeida,Santo Pra Sempre - Ao Vivo,Onimusic,195,195,2,1140369,312219
