rank,uri,artist_names,track_name,source,peak_rank,previous_rank,weeks_on_chart,streams,duration_ms
192,spotify:track:6bTdZ7xfKp3NqqADJ8HLyj,"Matuê, WIU, Teto",Vampiro,Sony Music Entertainment,1,-1,135,1205990,250434
193,spotify:track:3SxpDTeNT6JubnWoDs1IWG,"Luan Pereira, Mc Daniel",VOCÊ E SUA AMIGUINHA - Ao Vivo,Som Livre,47,119,10,1201542,145962
194,spotify:track:1W3ohWNGNobBwSrOuVSxel,Henrique & Juliano,Na Hora Da Raiva (Ao Vivo),"Vida Nova Produções, sob licença exclusiva para Virgin Music Group",33,173,46,1191538,174117
195,spotify:track:5r9CZJMoMmxio2AnJdxuDS,"Grupo Menos É Mais, Di Propósito, Vou Zuar",Pot-Pourri: Melhor Eu Ir / Ligando Os Fatos / Sonho de Amor / Deixa Eu Te Querer - Ao Vivo,Som Livre,21,-1,204,1189853,521088
196,spotify:track:58d1Gf3p4FWKNnGuq00wXT,"DJ BRIZY, Mc Rodrigo do CN, FreesTyle Sounds",Teu Preferido,FreesTyle Sounds,94,-1,8,1185838,136153
197,spotify:track:3zXIfbjxSzPMNP6JDZsQsi,"Orochi, Kizzy",Mitsubishi,Mainstreet Records,119,195,45,1183241,182181
198,spotify:track:7jCgslBhuPF61B6yk90VYb,"MC Ryan SP, Mc IG, DJ Japa NK, Nilo, Boladin 211, MC LUUKY, Mc Negão Original",Sexta Feira Hoje Tem,WM Brazil,72,-1,37,1183167,387711
199,spotify:track:2jNychTlNots7P3bMt41aa,Isaias Saad,Bondade de Deus,Onimusic,152,-1,35,1180097,375653
200,spotify:track:6dOtVTDdiauQNBQEDOtlAB,Billie Eilish,BIRDS OF A FEATHER,Darkroom/Interscope Records,33,-1,71,1176950,210373
