rank,uri,artist_names,track_name,source,peak_rank,previous_rank,weeks_on_chart,streams,duration_ms
1,spotify:track:0fABszUFNbNq9IW503Gj8v,"DENNIS, MC Kevin o Chris",Tá OK,Sony Music Entertainment,1,1,5,11936562,92093
2,spotify:track:4hKLzFvNwHF6dPosGT30ed,"Veigh, Bvga Beatz, Prod Malax, Supernova Ent",Novo Balanço,Supernova Entertainment Under Exclusive License to UnitedMasters,2,2,5,8331823,140322
3,spotify:track:4uqJelb9THHmJ3OCohg4ZJ,"AgroPlay, Ana Castela",Nosso Quadro,AgroPlay,1,3,20,8257953,173698
4,spotify:track:3PH1nUysW7ybo3Yu8sqlPN,"Israel & Rodolffo, Mari Fernandez",Seu Brilho Sumiu - Ao Vivo,Som Livre,2,4,16,7403782,168840
5,spotify:track:51pxwIxDVCbFHW8oyJFQXD,Simone Mendes,Erro Gostoso - Ao Vivo,Universal Music Ltda.,3,5,21,7033719,178811
6,spotify:track:3mzbab4H0iZYkHggSEj0UX,Zé Neto & Cristiano,Oi Balde - Ao Vivo,Som Livre,3,6,18,6401028,159158
7,spotify:track:12YCtLHGk6tP6RbHDHflCs,"MC Caverinha, KayBlack, Wall Hein",Cartão Black,Som Livre,1,7,6,5983066,159973
8,spotify:track:0redQHBfejmPUhonR5ppGC,"Guilherme & Benuto, Ana Castela, Adriano Rhod",Duas Três,Sony Music Entertainment,8,8,19,5551346,156942
9,spotify:track:0JIYoXtJfORxI6gRpHv6ZW,Henrique & Juliano,Traumatizei (Ao Vivo Em Brasília),"Vida Nova Produções, sob licença exclusiva para Virgin Music Group",6,9,20,5236215,172005
10,spotify:track:4sqpSDnTrbS8v7RMNCUyqS,"Matheus & Kauan, Mari Fernandez",Não Vitalício (Nunca Mais) - Ao Vivo,Universal Music Ltda.,7,10,20,5195974,169835
11,spotify:track:53PpijFATt35Zxfl6LTxoK,Marília Mendonça,Leão,Som Livre,1,12,28,5094013,166774
12,spotify:track:4f0aDk7HX37SfzerfznYlr,"Grupo Menos É Mais, Matheus Fernandes",Lapada Dela - Ao Vivo,Som Livre,12,14,17,4929622,159322
13,spotify:track:0SCMVUZ21uYYB8cc0ScfbV,"Israel & Rodolffo, Ana Castela",Bombonzinho - Ao Vivo,Som Livre,1,13,33,4757030,154701
14,spotify:track:39xOREhViooEYFpmnKTdrl,"Veigh, Tz da Coronel, Toledo, Nagalli, Bvga Beatz, Supernova Ent",Engana Dizendo Que Ama,Supernova Entertainment Under Exclusive License to UnitedMasters,11,11,5,4738396,188497
15,spotify:track:2LTlykcdu0gwb7zcKneo2a,"KayBlack, Baco Exu do Blues, Marquinho no Beat",Melhor Só,WM Brazil,3,15,12,4723768,229326
16,spotify:track:1nf1HJdTWXwf9XHQebGlOd,"Gustavo Mioto, Mc Don Juan",Quando Apaga A Luz - Ao Vivo,Universal Music Ltda.,13,23,22,4496345,144298
17,spotify:track:0ZAL7RbP2FsM3rObV60o7T,"Clayton & Romário, Luan Santana",Namorando Ou Não - Ao Vivo,Virgin Music Label And Artist Services (S&D),14,20,15,4472800,168358
18,spotify:track:4zUFA8l78k4tCmoVuGtV8z,Luan Santana,MEIO TERMO - Ao Vivo,Sony Music Entertainment,18,35,2,4418236,175468
19,spotify:track:3ktTWpYdXrYApH54cBo4Ap,"Matuê, Rich The Kid",Conexões de Máfia (feat. Rich The Kid),Sony Music Entertainment,1,16,8,4379246,221538
20,spotify:track:4t6eam3rC9JoNFVkfOHK4s,Zé Neto & Cristiano,Pátio do Posto - Ao Vivo,Som Livre,20,25,13,4313819,178547
21,spotify:track:745VUhm32odbxJI2q1rUMv,"MC Guh SR, MC Pê Original, Dj Pikeno Mpc, Markim WF",Ela Voltou de Perna Bamba,Mandelão Records,21,21,7,4272308,199384
22,spotify:track:3o4wcB1Y6xC62eF02n9RSZ,"Luan Pereira, MC Ryan SP",ELA PIROU NA DODGE RAM,Som Livre,14,19,14,4086910,179599
23,spotify:track:7IPEkUJsnWYNyBkK2i2FPj,Hugo & Guilherme,Mágica - Ao Vivo,Som Livre,11,22,12,4079058,171730
24,spotify:track:3khLpwuyIjEOw8vfJ1oUIT,"MC Kevin o Chris, MC Caja",Papin,MC Kevin o Chris,17,18,10,4020648,122666
25,spotify:track:5TtTijiNYtFc6ktQARjY30,"KayBlack, Wall Hein",Preferida,WM Brazil,13,24,12,3933061,130375
26,spotify:track:5y7yYXNSsT89A27DQxbmUL,"Wesley Safadão, Ana Castela",Covardia,Wesley Safadao,17,17,12,3790328,150863
27,spotify:track:4ASA1PZyWGbuc4d9N8OAcF,"Gustavo Mioto, Mari Fernandez",Eu Gosto Assim - Ao Vivo,Universal Music Ltda.,1,27,40,3774471,148800
28,spotify:track:7CUQQLRMIeSfa4m2uQcRHp,Henrique & Juliano,Rancorosa (Ao Vivo Em Brasília),"Vida Nova Produções, sob licença exclusiva para Virgin Music Group",17,26,13,3735230,181457
29,spotify:track:7DkhndGTKaqkFxxKN7XlAh,"Guilherme & Benuto, Simone Mendes",Manda um Oi - Ao Vivo,Sony Music Entertainment,23,31,6,3713777,166490
30,spotify:track:7nFvKgVumc9FcU97zGjjei,WIU,Coração de Gelo,Sony Music Entertainment,4,28,29,3616619,168000
31,spotify:track:6hu4HvpNzrW2RIEEAZC3vD,"KayBlack, Marquinho no Beat, Wall Hein",Segredo,WM Brazil,19,29,12,3614723,104145
32,spotify:track:6xRDvureEBwHgwAYDufbJL,"Eric Land, Tarcísio do Acordeon",Chorei na Vaquejada,Eric Land,30,30,5,3562319,157170
33,spotify:track:2BlFIe0712LBUtTHxbqjme,"NATTAN, Felipe Amorim",Love Gostosinho - Ao Vivo,Vybbe,12,32,23,3448337,163833
34,spotify:track:7Ht57bh2FwiQLwRH9zqESG,Rogerinho,085 - Ao Vivo,ONErpm,20,38,19,3189575,163584
35,spotify:track:0KXdSF0Poa57KOepZ3hKrh,"Naiara Azevedo, Ana Castela",Palhaça - Ao Vivo,NA Records,18,37,23,3169182,170191
36,spotify:track:77BR4gaUAp3p0uA8UL6HT9,"Belle Kaffer, Ana Castela, Charles New",Não Para,WM Brazil,33,40,16,3152578,180923
37,spotify:track:7sopDXkuzXtHt8AQpdBxmT,Ana Castela,DONA DE MIM,AgroPlay,13,39,26,3108818,145091
38,spotify:track:5aqwwgL4XOv2YJYwLiqKOZ,Maiara & Maraisa,A Culpa É Nossa - Ao Vivo,Som Livre,8,36,27,3106937,165000
39,spotify:track:51FFbyL0PjkYtjXJQP0JoP,Gusttavo Lima,Saudade da Minha Vida - Ao Vivo,Sony Music Entertainment,12,34,21,3047106,194850
40,spotify:track:1L7hWEc3tVjvmbw48ShktM,Gusttavo Lima,Desejo Imortal (It Must Have Been Love) - Ao Vivo,Sony Music Entertainment,26,33,10,2979536,184128
41,spotify:track:3d1im1pw3WLuEty2k9XzTr,"Veigh, Niink, Bvga Beatz, JHXW, Supernova Ent",Clickbait,Supernova Entertainment Under Exclusive License to UnitedMasters,15,47,8,2869037,161344
42,spotify:track:2M4kQD87lKnAS9vFlb4Bez,"Matheus & Kauan, Jorge & Mateus",Pactos - Ao Vivo,Universal Music Ltda.,6,42,36,2761750,183694
43,spotify:track:2pidGuLSSVZPcbzE5QA1Ux,Hugo & Guilherme,Elevador - Ao Vivo,Som Livre,43,62,2,2734109,155767
44,spotify:track:5WsM6qhZzRSD3oKbtorxzD,"MC Kevin o Chris, BUARQUE",Aquecimento Senta Senta Suave,MC Kevin o Chris,8,46,15,2712451,152888
45,spotify:track:5yscNPMHmhqHQX9B9GFzMp,Henrique & Juliano,Te Esqueci Sem Querer (Ao Vivo Em Brasília),"Vida Nova Produções, sob licença exclusiva para Virgin Music Group",43,43,9,2683415,151092
46,spotify:track:156LKAN2oh16qflL5oz4tO,MC PH,Os Bico Tão Se Perguntando (Let’s Go 3),GR6 Music,11,44,11,2655146,177551
47,spotify:track:0yZRkiCSy4ra9EykuYyGo0,"Vulgo FK, Kyan, Bvga Beatz, Toledo",Mandona (Se eu te dissesse),GR6 Music,47,68,7,2462028,127058
48,spotify:track:22sAwsBH0NoNJXnrBenQuO,"MC Xenon, Os Gemeos da Putaria",Sem Aliança no Dedo,DC MUSIC,3,50,20,2438050,120461
49,spotify:track:6dtQM0CXRFJgD7ifUNosZj,"Lauana Prado, Guilherme & Benuto",Desandei - Ao Vivo,Universal Music Ltda.,45,53,8,2431663,143372
50,spotify:track:0U9CZWq6umZsN432nh3WWT,"Mc Pedrinho, DJ 900","Gol Bolinha, Gol Quadrado 2",GR6 Music,50,199,2,2333701,117293
51,spotify:track:4pWsXhLUdtBKlw9npIXZAl,Kadu Martins,Halls na Língua,Kadu Martins,51,78,5,2332341,192320
52,spotify:track:6p6ohOKSzL4JaIRzSeOmWx,"Felipe Amorim, Gustavo Mioto",Cama Embrasa,One Play,48,54,6,2330720,178000
53,spotify:track:6UHMmTS8TfWK3vKvoEZOQG,"AgroPlay, Ana Castela, Rodolfo Alessi",Me Gusta - AgroPlay Verão,AgroPlay,53,58,4,2286991,152673
54,spotify:track:5ffDENIdtByAZxHpuuj9li,"Veigh, Nick Nash, Wylo, Nagalli, Supernova Ent, Kaash Paige",Vida Chique,Supernova Entertainment,38,56,25,2264690,210545
55,spotify:track:7CJJ7JC3kj9XdweWTvfVhX,"Zé Felipe, Igow, Wesley Safadão",Vacilão,Som Livre,2,48,14,2205068,130403
56,spotify:track:09pQ3lGyMTpW3rz7a71zwQ,Hugo & Guilherme,Metade De Mim - Ao Vivo,Som Livre,24,51,16,2192770,160836
57,spotify:track:3P2ubMyuL9NQOVU67TVCXA,"Melody, Naldo Benny, CANETARIA, MATHEUS ALVES","Love, Love",Melody,57,-1,1,2130377,133385
58,spotify:track:0AIA4KsMsyqur8FbTVhGNT,Luan Santana,SOLTEIROU - Ao Vivo,Sony Music Entertainment,26,55,22,2058277,148548
59,spotify:track:2kBbHpJTc7MWs8F3XhClBD,Matheus Fernandes,Altas Loucurinhas (Uni Duni Tê) - Ao Vivo,Som Livre,20,59,24,1966473,202411
60,spotify:track:2tFmuYL5D8zqBHvs0nG5Tn,"KayBlack, Marquinho no Beat",Bonjour,GR6 Music,32,61,19,1958664,131927
61,spotify:track:7aOBf2xYbux3bo1fwISo6b,"MC Cabelinho, Oruam, Palma",BEM MELHOR,Bairro 13,43,49,7,1943897,317340
62,spotify:track:152WIAB8132LWxC8Eftmym,Juliette,Doce,Virgin Music Label And Artist Services (S&D),54,-1,2,1938883,160218
63,spotify:track:0dcHD9QhnWRA41zoLnC83X,"MC Cabelinho, Dallass",X1,MC Cabelinho,30,60,59,1917520,188852
64,spotify:track:7kJ0aTB5gLMYrJjYft3Vx6,"DJ Katrip, Dj Darge, Mc Th, Mc Delux",Na Contramão,DJ Katrip,59,66,6,1904515,164826
65,spotify:track:6MpYP4LUSb1MWfpsdToKyH,Nadson O Ferinha,Duas,FPS Music Digital,60,67,8,1887847,137848
66,spotify:track:3YQvZNmRc2y1hgdvustkce,"MC Cabelinho, Ajaxx, Galdino",MINHA CURA,Bairro 13,57,57,26,1869615,154694
67,spotify:track:18yZLabAj1liqEUcgxDgeJ,"Israel & Rodolffo, Jorge & Mateus",Perdoou Nada - Ao Vivo,Som Livre,16,41,29,1867239,163120
68,spotify:track:0Q1oLvAI9QaD3DIlvluTqx,Israel & Rodolffo,Voltou Com Quem Não Voltava - Ao Vivo,Som Livre,52,52,5,1853769,147132
69,spotify:track:5Ubx4DpvVodvsGH9ilxPVi,"Guilherme & Benuto, Hugo & Guilherme",Haja Colírio (feat. Hugo & Guilherme) - Ao Vivo,Sony Music Entertainment,2,63,52,1846900,173366
70,spotify:track:15nTZqWfpXZk9Xh043Ognh,Léo Santana,Posturado E Calmo,Universal Music Ltda.,70,193,2,1842421,187562
71,spotify:track:3l5VjEAeUTqrlD50iEo8Yn,"KayBlack, CVSTRO, Wall Hein, AMUSIK",Licor 43,Elenko Music,64,64,40,1839128,142470
72,spotify:track:6F0ldIcRC6oCcn3hDukg9T,"Thales Lessa, Nadson O Ferinha",Cadê Seu Namorado Moça?,WM Brazil,72,102,4,1836419,226476
73,spotify:track:1M6rclDhYmqRBMFGNJOFKB,"NATTAN, Grandão Vaqueiro",Americana Na Vaquejada,Feeling,37,73,12,1795009,156330
74,spotify:track:0LGGo9eY1aJX6tqgxa87kd,"KayBlack, Wall Hein, Yokame",Freestyle,Bunker Concept,68,74,23,1778670,180172
75,spotify:track:52EYWdjiulHaehpexuowyh,"MC Cabelinho, Cyclope Beatz, Red, meLLo",FOGO E GASOLINA,Bairro 13,30,65,27,1778318,181767
76,spotify:track:4KUj5wxJuY9Nf7L6guRxrU,Henrique & Juliano,Abre A Mente (Ao Vivo Em Brasília),"Vida Nova Produções, sob licença exclusiva para Virgin Music Group",71,71,2,1765653,190704
77,spotify:track:2orGm2E68ODFYOURjaES62,"WIU, MC Ryan SP",Felina,Sony Music Entertainment,5,69,39,1764211,225882
78,spotify:track:0tBgLNgCmRTmqrydcFfQjt,"Pedro Paulo & Alex, Ana Castela",Ia Dar Bom,Artinvox,78,89,3,1749090,168673
79,spotify:track:5pBU3Yihoa4hiwQ2T5fGhH,"Guilherme & Benuto, Matheus & Kauan",Esse B.O é Meu - Ao Vivo,Sony Music Entertainment,15,72,33,1727212,160710
80,spotify:track:5AdPP30mjJCtBMyYKZUEU7,"Guilherme & Benuto, Xand Avião",Assunto Delicado - Ao Vivo,Sony Music Entertainment,3,76,44,1691079,180504
81,spotify:track:6BsKZXjKIrGWMK1uLWfJYN,"KayBlack, Veigh, Vulgo FK, WEY, Nagalli",Sal e Pimenta,WM Brazil,40,82,12,1682175,206451
82,spotify:track:2X5o4nRiocnoaaQ2wMwaeC,"DJ Cayoo, DJ ESCOBAR, Nilo, MC Myres",Sorrisin De Puto,Tropa 7lc,45,81,23,1677704,106153
83,spotify:track:74Le949TrZk4zwDjtWzH23,"Bruno & Denner, Gusttavo Lima",Cavalo de Pau,Balada Music,46,79,36,1671395,164029
84,spotify:track:2Vl7x4BkNhhJkEmQQMcV0V,Mc Jacaré,Toma Tapa,A Chave,27,80,28,1666178,122994
85,spotify:track:52kcarcX0FQ6wPulXm2bMJ,"Vulgo FK, MC Cebezinho, KayBlack, Pedro Lotto, AMUSIK",Meca Cereja,Elenko Music,43,84,33,1655528,234193
86,spotify:track:74myq4QbO9E8bTtLQuOWYY,"Anitta, HITMAKER",Nu,WM Brazil,80,91,9,1648212,167076
87,spotify:track:3gCWngngUs1uojw33vrE8K,Jorge & Mateus,5 Regras - Ao Vivo,Som Livre,7,75,47,1639444,161469
88,spotify:track:1jHgfC8T5KxUyC5Ldw6lk9,Léo Santana,Zona De Perigo,Universal Music Ltda.,1,88,21,1638947,142151
89,spotify:track:6ELMBm3lZFitAZp03GBBNG,Gabriela Rocha,Me Atraiu - Ao Vivo,Onimusic,75,93,18,1636122,503635
90,spotify:track:1JQ1ylL2JEjC6Ib7IJgOvS,"Mc Don Juan, DJ Yuri Martins",Coração Amoleceu,WM Brazil,65,92,20,1615971,161365
91,spotify:track:5WGTBzRLbjj0Sm3Br8X1rI,"Mc Paiva ZS, Gabb MC, Dj Aladin GDB, Love Funk",Bandido Não Dança,Love Funk,32,85,23,1604829,126461
92,spotify:track:57wQe0K35gscKa1VlZh1VZ,Luan Santana,DEUS É MUITO BOM - Ao Vivo,Sony Music Entertainment,35,45,8,1600295,174317
93,spotify:track:6eNRGL6Nkdg7RhJtmbcl0j,"Mc Tato, DJ Ak beats",Luz do Luar,RF PRODUTORA,7,83,26,1590753,184615
94,spotify:track:2xs2TwrlfamtW0DQqId0M5,"DJ BOY, Mc Don Juan, MC Joãozinho VT, Kako, MC Hariel, MC Tuto, MC Marks, MC Vine7",Set Dj Boy 3.0,Sonar Music,94,101,6,1585553,409411
95,spotify:track:1a5LfJGq0vuCWQ9Mme0Ac7,Maria Marçal,Deserto (Ao Vivo),MK Network,85,104,37,1578467,268000
96,spotify:track:1YTzCKxoOSZOqcNh6wa15I,"MC Menor MT, DJ DEIVÃO, DJ Gouveia",Galopeira,2023 Portuga Records / Terror Dos Bailes,78,96,9,1571940,177461
97,spotify:track:6L2ule7uWSdh1qjcMO3vUD,"Murilo Huff, Wesley Safadão",Quem tá Pegando,M Show,97,145,5,1571916,162865
98,spotify:track:5vdQUAFncALEH9EQvyAqIX,"DJ Jeeh FDC, MC LCKaiique, MC Celo BK, DJ Menezes, DJ Arana, Mc Yoshi",Forte Forte de Lacoste - Pra Começar o Final de Semana,24por48,98,169,2,1564494,182769
99,spotify:track:4Dvkj6JhhA12EX05fT7y2e,Harry Styles,As It Was,Columbia,10,98,64,1561491,167303
100,spotify:track:1rLahQ58edFplZKDcjJ7cH,"Veigh, Luchinha Jr, Supernova Ent, Baby",Mandraka,Supernova Entertainment,91,107,20,1545871,122177
101,spotify:track:5geU4byUA1hnQofQPOsPDS,"Orochi, MC Ryan SP, Oruam, Xamã, Neo Beats, Kizzy, Mainstreet",Sereia,Mainstreet Records,8,97,34,1539688,294418
102,spotify:track:4qDT0BeJ7BjatrN9k8AvB4,"Teto, WIU, Matuê",Flow Espacial,Sony Music Entertainment,6,99,21,1533024,165925
103,spotify:track:0pZIBIJ253pH9gJtXE0Ouf,"KayBlack, Marquinho no Beat, Wall Hein",Vestido da Fendi,Elenko Music,100,100,56,1528927,164203
104,spotify:track:2hkwwmmLC90T8BQ7t3xufq,"Zé Felipe, Ana Castela, Luan Pereira",Roça Em Mim,Som Livre,5,90,31,1525333,158171
105,spotify:track:6bTdZ7xfKp3NqqADJ8HLyj,"Matuê, WIU, Teto",Vampiro,Sony Music Entertainment,1,94,64,1519992,250434
106,spotify:track:7AwVSKaQxpidrtYBerkHKk,"Ana Castela, Melody, Dj Chris No Beat",Pipoco,Ana Castela,1,112,56,1508380,194022
107,spotify:track:4DHcnVTT87F0zZhRPYmZ3B,Miley Cyrus,Flowers,Columbia,5,105,23,1497733,200600
108,spotify:track:3O2wrDL7nnSDZOrdZqxyoY,"Mc IG, MC Pipokinha, DJ Glenner",Noite Fria,GR6 Music,20,106,16,1495876,160975
109,spotify:track:2slHCHYP7ogpGSsCumJT1a,"Murilo Huff, Matheus & Kauan",Fulano - Ao Vivo,M Show,53,121,12,1455815,169231
110,spotify:track:1Z3QqD45wKKN6fUKBXSvcZ,"Diego & Victor Hugo, Luan Pereira",Pirulito Vermelho,Sony Music Entertainment,110,-1,1,1443886,152085
111,spotify:track:1OZ4uv7OAP24Ix6j3vojLt,"Mc Paiva ZS, MC Ryan SP, Kotim",Casei Com a Putaria,Love Funk,1,95,50,1441722,157500
112,spotify:track:4YfdCJR5uKLYkcGdZQap35,"DJ ESCOBAR, MC Flavinho, MC Theuzyn, MC Bob Anne",Mec Life,iMusics,71,111,11,1430862,86307
113,spotify:track:7qoIhutxU269Zqo9PG5IOj,"Pineapple StormTv, Chris MC, Salve Malak, Tz da Coronel, MC Cabelinho, Chefin, L7NNON, Luísa Sonza, Oruam, Xamã, N.I.N.A",Poesia Acústica 13,Pineapple StormTV,1,108,40,1408983,628124
114,spotify:track:0bBwi6ddYeTv5fXgHAdfiH,"MC MENOR HR, MC MENOR SG, DJ ESCOBAR",Evoque Prata,GUETTO RECORDS,1,110,34,1407945,107076
115,spotify:track:2LJLGfBHKFmNdD4iXRRPXV,Gusttavo Lima,Solteiro Frustrado - Ao Vivo,Sony Music Entertainment,115,-1,1,1402163,180293
116,spotify:track:0oB3IBEhbmgTrL7mV0VnFq,Kadu Martins,Novinha do Onlyfans - Tchan Ran Tchan Tchan,Kadu Martins,10,116,34,1384028,137660
117,spotify:track:4tuFNhM69UakXdPg4RrNvp,"Filipe Ret, Dallass, Hunter",Deus Perdoa,Som Livre,45,114,13,1382924,137142
118,spotify:track:0oZrvoCYEbKGCsU7cQqNnw,"Yago Oproprio, Rô Rosa, Skeeter Beats",Imprevisto,Som Livre,32,109,35,1382712,139703
119,spotify:track:7zKqmAHGY8zm2UA4wT5ant,"Veigh, Toledo, Supernova Ent, Bvga Beatz",Perdoa Por Tudo Vida,Supernova Entertainment,77,124,24,1357036,160000
120,spotify:track:3C99BfGe301JNp7BqTX5Uu,Felipe e Rodrigo,Média Boa (Ao Vivo),MK Records,8,118,36,1346435,148900
121,spotify:track:1MgO3fAl4ODVQweg5GR0Lk,"Papatinho, Luísa Sonza, DJ Biel do Furduncinho",Posição de Ataque,WM Brazil,104,126,6,1345489,149090
122,spotify:track:4hSaYBtwDfbIS4pZtyE040,Henrique & Juliano,Tinta De Amor / Realidade Ou Fantasia / Duas Vidas (Ao Vivo Em Brasília),"Vida Nova Produções, sob licença exclusiva para Virgin Music Group",122,182,2,1345154,299956
123,spotify:track:36msBnH60GyWof23sMdQSL,Zé Neto & Cristiano,Me Bloqueia - Ao Vivo,Som Livre,113,117,13,1338990,157200
124,spotify:track:4mD9hjoTckjeL1CrJCx0MT,"DJ Jeeh FDC, MC Menor MT, Yuri Redicopa, Mc Pelé",Puta Mexicana,PMI Records Oficial,4,119,25,1335504,162461
125,spotify:track:1TgVaCf8D5mXZrK1d7uIZe,"Yuri Redicopa, Dj Bnão",Bebê Tá Solta,Portuga Records & Funk 24por48,46,115,17,1333921,197104
126,spotify:track:5btDKzAsFh975NSWxwBHRc,Felipe Amorim,Coisas Que Eu Sei,One Play,44,122,10,1307046,192240
127,spotify:track:7qrQs4rPGCXnwNyLn2YVCT,"Veigh, Nagalli, Toledo, Bvga Beatz, Honaiser, Supernova Ent",Devolve as Correntes / Invisível,Supernova Entertainment Under Exclusive License to UnitedMasters,52,120,5,1293676,140860
128,spotify:track:76PSvY34ovx8MVJL9wHAXS,"KayBlack, Wall Hein",Vivências,Elenko Music,128,141,8,1281432,167115
129,spotify:track:0FBV7lozkqCSuV2q24n43x,Teto,Minha Vida é um Filme,Sony Music Entertainment,62,129,12,1279981,186666
130,spotify:track:7oWd2k0fhorqIpXotLNN9F,"Veigh, G.A, Toledo, H4lfmeasures, 6ee, Supernova Ent",Bolsa de Ombro,Supernova Entertainment Under Exclusive License to UnitedMasters,40,113,5,1262458,114321
131,spotify:track:3YNDiA83UVhb5hpi4WM5dk,"Taty Girl, Tarcísio do Acordeon",Você Não Tem Saudade - Ao Vivo,TG MUSIC,86,86,2,1260644,162474
132,spotify:track:39hP55BAhJ0MLiWsWmDyx7,"Matheus & Kauan, Xand Avião",Meia-Volta - Ao Vivo,Universal Music Ltda.,131,150,4,1255925,202246
133,spotify:track:1ACALdBWViTpLBC14Ecv8E,"MC Ryan SP, Mc Daniel, Kotim",Namora Aí,WM Brazil,18,127,28,1249426,148615
134,spotify:track:6l1U4fX41XmzZfi67q9i8X,"Mc Lzyn, DJ DuBom",Capricorniana,MR10 e Portuga Records,104,136,10,1246099,170181
135,spotify:track:4kAMyuJBbmJrbr6TLOWbEk,"Diego & Victor Hugo, Jorge & Mateus",Beijo de Glicose - Ao Vivo,Sony Music Entertainment,6,128,42,1241234,171007
136,spotify:track:2jZrMlMuTk1N3LJS8yQM6q,"Ana Castela, PEDRO SAMPAIO",Carinha de Bebê,WM Brazil,50,142,18,1237339,175725
137,spotify:track:4v6TGGmgoJC3P2gqToqJLr,"Caio Luccas, NADAMAL, L7NNON, Teto, Rocco, Viper, A$IX",Close Friends,NadamalRecords,137,-1,1,1234457,232195
138,spotify:track:4NNZZXHgn9F3cCgC1YGmLl,Jorge & Mateus,Todo Seu - Ao Vivo,Som Livre,9,123,59,1227702,171712
139,spotify:track:3hLoH18k4pP6eXEljzNHHr,"Veigh, Derek, Nagalli, Honaiser, Toledo, Supernova Ent",Tendenciosa,Supernova Entertainment Under Exclusive License to UnitedMasters,37,125,5,1224070,195073
140,spotify:track:42nZBOwXNdO24Ml032bLBS,Matheus & Kauan,Gatilho - Ao Vivo,Universal Music Ltda.,13,134,66,1216352,155284
141,spotify:track:6WSVS6WEjVm4GWGsH2hHQz,"unxbected, Ayparia, Chappo",Montagem - Fr Punk,Avrupa Müzik,141,-1,1,1212597,61673
142,spotify:track:0ssgd2ZvDawP0KHGfBYRpv,"Filipe Ret, Caio Luccas, Dallass",Good Vibe,Som Livre,67,140,52,1200734,181818
143,spotify:track:3fkLH5wAzni4mcXl4c6cAC,Nadson O Ferinha,Sinal,pidamusic,143,146,5,1197620,233038
144,spotify:track:4pjznsLeoyimnxGlVpmyJI,"MC Cabelinho, Victor WAO, Bairro 13",NÉ SEGREDO,MC Cabelinho,34,131,39,1185640,155771
145,spotify:track:5XeFesFbtLpXzIVDNQP22n,Arctic Monkeys,I Wanna Be Yours,Domino Recording Co,96,137,41,1184047,183956
146,spotify:track:2D1YgoOgqGfEENCtsZNXMi,"Anitta, MC Ryan SP",Vai Vendo,WM Brazil,56,144,8,1174780,162222
147,spotify:track:2zDwJnP9n9yCUyfiLIwkDM,"Guilherme & Santiago, Marília Mendonça",Se Ele Soubesse - Ao Vivo,Deolli Music,53,147,20,1169704,170106
148,spotify:track:6Zw25LRLP0j0MsezDFIUM4,"Hugo & Guilherme, Marília Mendonça",Mal Feito - Ao Vivo,Som Livre,2,87,75,1150320,177934
149,spotify:track:5RHOhXxMVhpEaBcG6hIydA,"KayBlack, Wall Hein, AMUSIK",Maturidade,Elenko Music,112,143,26,1144535,142026
150,spotify:track:1odExI7RdWc4BT515LTAwj,David Kushner,Daylight,Miserable Music Group,123,153,9,1143141,212953
151,spotify:track:7aZnuwpivaj4N7XFhhqBiO,"Mari Fernandez, MC Ryan SP, Mc Daniel",Love Absurdo,Sony Music Entertainment,46,138,19,1137622,184153
152,spotify:track:6qylu0VNKUfKiVi88WL3Ci,"Puterrier, Borges, Mainstreet, Heavy Baile, Leo Justi, Pedro Bala",Marolento,Mainstreet Records,113,132,8,1132042,161379
153,spotify:track:6tW23l5oRR8XyYJsF5si9G,"US Agroboy, Ana Castela",Eu Minto (Ao Vivo),WM Brazil,47,149,21,1116631,160641
154,spotify:track:3IMLoeLerS7TMpKjxUgAhx,Henrique & Juliano,Arranhão (Ao Vivo),"Vida Nova Produções, sob licença exclusiva para Virgin Music Group",1,152,98,1104277,153409
155,spotify:track:1BxfuPKGuaTgP7aM0Bbdwr,Taylor Swift,Cruel Summer,Taylor Swift,95,154,4,1102298,178426
156,spotify:track:5asabafNzfAzjUecDvuNES,Henrique & Juliano,Aquela Pessoa (Ao Vivo),"Vida Nova Produções, sob licença exclusiva para Virgin Music Group",39,130,73,1099393,166838
157,spotify:track:21XQbePSeOSvfuLRaZbZ7a,"Cryzin, Kaio Viana, Noemi Leal",Mas Existe um Lugar - speed,Dkproduções,26,156,12,1097288,141615
158,spotify:track:04vzhKfl5HtPEgrdZJCZ7L,"Mc Paiva ZS, Kotim",Bagulho Louco,Love Funk,27,139,58,1088343,124238
159,spotify:track:5GbvrjiAu6tt9qweHNSban,"AgroPlay, Ana Castela, Luan Pereira",Vaqueiro Apaixonado,AgroPlay,99,151,11,1085311,139413
160,spotify:track:1s7oOCT8vauUh01PbJD6ps,"Rema, Selena Gomez",Calm Down (with Selena Gomez),Mavin Records / Jonzing World,65,178,37,1082065,239317
161,spotify:track:7BM9PAFxTqYEYGmT23VuBV,"Caio Luccas, Ayo Th, NADAMAL",WAR,NadamalRecords,118,163,10,1063987,158533
162,spotify:track:2HMbGPbGiqGaHXzFkQAmZI,Matheus & Kauan,Basiquinho - Ao Vivo,Universal Music Ltda.,16,165,46,1063315,164383
163,spotify:track:0RiRZpuVRbi7oqRdSMwhQY,"Post Malone, Swae Lee",Sunflower - Spider-Man: Into the Spider-Verse,Republic Records,56,-1,68,1061315,157560
164,spotify:track:4uUG5RXrOk84mYEfFvj3cK,"David Guetta, Bebe Rexha",I'm Good (Blue),Parlophone UK,51,181,41,1058619,175238
165,spotify:track:4VvsTSxSSAu8IRBpt3iDMR,Isaias Saad,Bondade de Deus,Onimusic,165,194,9,1054126,375653
166,spotify:track:579sk87MxQszhpGdqoHxnc,Marília Mendonça,Hackearam-me,Som Livre,58,158,14,1053458,201262
167,spotify:track:1u8c2t2Cy7UBoG4ArRcF5g,Taylor Swift,Blank Space,Taylor Swift,155,155,3,1051849,231826
168,spotify:track:3Ua0m0YmEjrMi9XErKcNiR,Jimin,Like Crazy,BIGHIT MUSIC,85,133,13,1048896,212241
169,spotify:track:7bhvRvE56NHBvedx0EeALS,"Mari Fernandez, NATTAN",Comunicação Falhou - Ao Vivo,Sony Music Entertainment,12,171,60,1044473,180410
170,spotify:track:3Nvzs0cJbLwhXPPlI8xzpC,Dyamante DJ,Vai Novinha Ah Ah Ah,wla music,170,-1,1,1043085,123820
171,spotify:track:13Rf6RaZT13TW4xLQR3MQr,"MC Cabelinho, Bob do Contra, Azzy, Filipe Ret, Dudu, Xamã, Orochi, Maquiny, Pineapple StormTv",Poesia Acústica #6 Era uma Vez,Pineapple StormTV,18,168,210,1039357,577819
172,spotify:track:6kNZdlmjH4BQnSUfHeJIuc,"Dj GBR, Mc IG, MC Ryan SP, MC Marks, Mc Don Juan, MC PH, Mc Luki, Mc Paiva ZS, MC GP, Makalo","Let's Go 3 (feat. MC Marks, Mc Don Juan, MC PH, Mc Luki, Mc Paiva ZS, MC GP & Makalo)",Sony Music Entertainment,81,161,34,1038325,508586
173,spotify:track:11jGPID89nljt5OdP1hoxQ,"Sotam, Matheus Muniz",3AM (PXT4 RASA),KZN Records,89,170,11,1034322,122048
174,spotify:track:4MF0VMffyxHsy3GZwwUnAs,Matuê,A Morte do Autotune,30PRAUM,94,177,25,1033697,216710
175,spotify:track:3omgUq6LcYmKRJ0FGswWkm,"KayBlack, Marquinho no Beat, Wall Hein",Desejos,WM Brazil,83,167,12,1031359,128000
176,spotify:track:3tdILSeFJLx3Op5tEjkQtq,"Zé Vaqueiro, Felipe Amorim",Jorge & Mateus,Sony Music Entertainment,176,-1,1,1025376,222089
177,spotify:track:6a6UEfhgIKfzrZu1hqRYup,"Long beatz, Tz da Coronel, Xamã, Leviano",INEFÁVEL (feat. Leviano),WM Brazil,87,179,17,1021110,245987
178,spotify:track:7tgGpFp1FtgLtqrFB7LNeo,Hugo & Guilherme,Nem Que Seja Chorando - Ao Vivo,Som Livre,54,103,6,1020225,191496
179,spotify:track:6EOLDQz2rjwpZ2M5rApgH4,"KayBlack, Marquinho no Beat, Wall Hein, Yokame",Superficial,WM Brazil,73,159,12,1006618,136464
180,spotify:track:1Qrg8KqiBpW07V7PNxwwwL,SZA,Kill Bill,Top Dawg Entertainment/RCA Records,52,200,27,992268,153946
181,spotify:track:7afaZ37wJJL6880z1NRgJS,Teto,Fim de Semana no Rio,Sony Music Entertainment,3,-1,60,986720,165882
182,spotify:track:0BWEkqsmPe3qOzrRVztHU3,"Paulo e Nathan, Hugo & Guilherme",Acabei de Terminar - Ao Vivo,Sony Music Entertainment,22,185,63,984699,223489
183,spotify:track:7zmS0vPbWg2k6sfL3uqrGD,"Luiza Martins, Matheus & Kauan",Cê Não Me Superou - Ao Vivo,Som Livre,183,-1,1,984107,168380
184,spotify:track:5vC8UAOHeG95ehRzZChniB,"L7NNON, DJ Biel do Furduncinho, Bianca",Ai preto,Papatunes Records,1,174,54,983188,131583
185,spotify:track:0P0k5KoLcxi0kf1jik4v8X,"Mari Fernandez, Luísa Sonza",Deixa Eu Viver - Ao Vivo,Sony Music Entertainment,75,-1,8,981993,201856
186,spotify:track:5oI9blwsXC8AkTWw6wASY8,Matuê,Máquina do Tempo,Sony Music Entertainment,2,192,78,976535,230400
187,spotify:track:0Ej7efSLeTKrUW1LfdAJBY,"GDM, KayBlack, Mc Paiva ZS, Wall Hein",VAI POR MIM,Goma do Mago,145,166,14,971392,147645
188,spotify:track:6JKkP9ABQzYZUFSKSVDKIc,"1Kilo, Baviera, Knust, Pablo Martins",Deixe Me Ir (feat. Pablo Martins) - Acústico 1Kilo,1Kilo Records,1,184,137,969030,213191
189,spotify:track:1JzMOnuyabzpRuSudDD4Cq,"WIU, Matuê, Teto",Brinca Demais,Sony Music Entertainment,69,191,29,968507,194400
190,spotify:track:7haCn21tCWhVqg87x6tkRS,"Tz da Coronel, Langris",Se Você for Embora,A Cúpula,98,-1,14,965410,130496
191,spotify:track:11xC6P3iKYpFThT6Ce1KdG,Doja Cat,Attention,Kemosabe Records/RCA Records,191,-1,1,963392,277043
192,spotify:track:4m8kG46clzxMxyrDuFo1Uq,"WIU, Oruam",Horas Iguais,Sony Music Entertainment,77,188,36,960528,246942
193,spotify:track:1xw0BToTM3XnVnqXSPRByZ,"MC Ryan SP, Mc Don Juan, Mc IG, Kotim, MC Joãozinho VT, MC Tuto, Kako, Vulgo FK",Sereia Me Perdoa,WM Brazil,156,172,4,959616,457411
