rank,uri,artist_names,track_name,source,peak_rank,previous_rank,weeks_on_chart,streams
189,"spotify:track:2orGm2E68ODFYOURjaES62","WIU, MC Ryan SP","Felina","Sony Music Entertainment",5,164,66,"1238909"
190,"spotify:track:1bjvTcHiftBtqeK6Y2Mh8H","Oruam, WIU, Chris MC, Mainstreet","Para de Mentir","Mainstreet Records",91,156,6,"1237951"
191,"spotify:track:0oB3IBEhbmgTrL7mV0VnFq","Kadu Martins","Novinha do Onlyfans - Tchan Ran Tchan Tchan","Kadu Martins",10,-1,58,"1236794"
192,"spotify:track:7qoIhutxU269Zqo9PG5IOj","Pineapple StormTv, Chris MC, Salve Malak, Tz da Coronel, MC Cabelinho, Chefin, L7NNON, Luísa Sonza, Oruam, Xamã, N.I.N.A","Poesia Acústica 13","Pineapple StormTV",1,175,62,"1233569"
193,"spotify:track:5XeFesFbtLpXzIVDNQP22n","Arctic Monkeys","I Wanna Be Yours","Domino Recording Co",96,138,68,"1233160"
194,"spotify:track:3pLyNmLlw6uRrKaNwMnXOR","Josué Bom de Faixa","Não Precisa Negar","PAX MUSIC",194,-1,1,"1232737"
195,"spotify:track:06qMRF18gwbOYYbnP2du6i","Wham!","Last Christmas - Single Version","Sony Music CG",195,-1,1,"1224484"
196,"spotify:track:22sAwsBH0NoNJXnrBenQuO","MC Xenon, Os Gemeos da Putaria","Sem Aliança no Dedo","DC MUSIC",3,172,47,"1222036"
197,"spotify:track:5TtTijiNYtFc6ktQARjY30","KayBlack, Wall Hein","Preferida","WM Brazil",13,140,39,"1217329"
198,"spotify:track:1N19UVD4GRBFT6UrDaX6rk","Turma do Pagode, Grupo Menos É Mais","Bebe e Vem Me Procurar / Quem Ama Sente Saudade (Ao Vivo)","Sony Music Entertainment",125,-1,22,"1214154"
199,"spotify:track:0ETiCpxwkGMJWjup7dtxO0","Gusttavo Lima","Todo Mundo Me Ama - Ao Vivo","Sony Music Entertainment",130,183,4,"1209046"
200,"spotify:track:3P2ubMyuL9NQOVU67TVCXA","Melody, Naldo Benny, CANETARIA, MATHEUS ALVES","Love, Love","Melody",19,-1,27,"1207556"
