rank,uri,artist_names,track_name,source,peak_rank,previous_rank,weeks_on_chart,streams,duration_ms
1,spotify:track:4o6v3Oooyt7HF20idztRD4,"Israel & Rodolffo, Ana Castela",Bombonzinho - Ao Vivo,Som Livre,1,2,8,9366655,154701
2,spotify:track:1597vvneWf0zoQrg2D8yH6,"MC MENOR HR, MC MENOR SG, DJ ESCOBAR",Evoque Prata,GUETTO RECORDS,1,1,9,9160037,107076
3,spotify:track:4ASA1PZyWGbuc4d9N8OAcF,"Gustavo Mioto, Mari Fernandez",Eu Gosto Assim - Ao Vivo,Universal Music Ltda.,1,3,15,8685821,148800
4,spotify:track:1ELsaYdj2NlxLvkx9g24xZ,"Guilherme & Benuto, Hugo & Guilherme",Haja Colírio (feat. Hugo & Guilherme) - Ao Vivo,Sony Music Entertainment,2,4,27,6986593,173366
5,spotify:track:2hkwwmmLC90T8BQ7t3xufq,"Zé Felipe, Ana Castela, Luan Pereira",Roça Em Mim,Som Livre,5,5,6,6519172,158171
6,spotify:track:2M4kQD87lKnAS9vFlb4Bez,"Matheus & Kauan, Jorge & Mateus",Pactos - Ao Vivo,Universal Music Ltda.,6,6,11,6054572,183694
7,spotify:track:3yHXEidSu4gYVRqKoI653O,"Guilherme & Benuto, Xand Avião",Assunto Delicado - Ao Vivo,Sony Music Entertainment,3,7,19,5831952,180504
8,spotify:track:1dMyIigB6MDsfD3xuG6TbO,Felipe e Rodrigo,Média Boa (Ao Vivo),MK Records,8,10,11,5415369,148900
9,spotify:track:6Hio4nlyWL2WBL8nYlbuGt,"MC K.K, Dj TG Beats, Dj Aurélio, MC Lipivox, Authentic Records",Agudo Mágico 3,Authentic Records OFC,9,32,3,5204869,174008
10,spotify:track:77UrDaIQq6JZIJWeLgJaRf,"Orochi, MC Ryan SP, Oruam, Xamã, Neo Beats, Kizzy, Mainstreet",Sereia,Mainstreet Records,9,11,9,5124883,294418
11,spotify:track:0oB3IBEhbmgTrL7mV0VnFq,Kadu Martins,Novinha do Onlyfans - Tchan Ran Tchan Tchan,Kadu Martins,11,16,9,5101300,137660
12,spotify:track:6gyhp7IcNhTYzwlk8utsgP,"Diego & Victor Hugo, Jorge & Mateus",Beijo de Glicose - Ao Vivo,Sony Music Entertainment,6,12,17,5088539,171007
13,spotify:track:1OZ4uv7OAP24Ix6j3vojLt,"Mc Paiva ZS, MC Ryan SP, Kotim",Casei Com a Putaria,Love Funk,1,9,25,5050957,157500
14,spotify:track:2orGm2E68ODFYOURjaES62,"WIU, MC Ryan SP",Felina,Sony Music Entertainment,5,8,14,5038418,225882
15,spotify:track:3gCWngngUs1uojw33vrE8K,Jorge & Mateus,5 Regras - Ao Vivo,Som Livre,7,15,22,4783158,161469
16,spotify:track:4r2O8NHomHiJnFKqhYnqy1,"Israel & Rodolffo, Jorge & Mateus",Perdoou Nada - Ao Vivo,Som Livre,16,17,4,4748956,163120
17,spotify:track:2YAOJkRWy382bRMXaj48FP,"Guilherme & Benuto, Matheus & Kauan",Esse B.O é Meu - Ao Vivo,Sony Music Entertainment,17,18,8,4638160,160710
18,spotify:track:2K9kZpwD2CzTa6iiSYYOoO,Marília Mendonça,Leão,Som Livre,18,33,3,4535163,166774
19,spotify:track:4UldILPVpnZO69ffK4B9aA,"Dj LK da Escócia, Tchakabum, MC Ryan SP, mc jhenny, Mc RF",Tubarão Te Amo,Nas Nuvens Music Group,11,13,12,4442780,149076
20,spotify:track:5DoYLtsVnNMcrgpMdEPOsI,"DJ Dozabri, DJ Arana, Silva Mc, MC Luiggi, Meno Saaint",É Só Um Lance Lero Lero,Barulho Das Favelas,14,14,6,4315671,116307
21,spotify:track:7LUZT12r4xmwR1Kh8TJgjv,Gusttavo Lima,Ex dos Meus Sonhos - Ao Vivo,Sony Music Entertainment,7,19,12,4289323,182805
22,spotify:track:6Zw25LRLP0j0MsezDFIUM4,"Hugo & Guilherme, Marília Mendonça",Mal Feito - Ao Vivo,Som Livre,2,20,50,4243464,177934
23,spotify:track:7nwHsYxiuHo98dLI7UVkyn,Maiara & Maraisa,A Culpa É Nossa - Ao Vivo,Som Livre,23,50,2,4179455,165000
24,spotify:track:7bhvRvE56NHBvedx0EeALS,"Mari Fernandez, NATTAN",Comunicação Falhou - Ao Vivo,Sony Music Entertainment,12,23,35,3705970,180410
25,spotify:track:7nFvKgVumc9FcU97zGjjei,WIU,Coração de Gelo,Sony Music Entertainment,21,21,4,3683999,168000
26,spotify:track:4NNZZXHgn9F3cCgC1YGmLl,Jorge & Mateus,Todo Seu - Ao Vivo,Som Livre,9,24,34,3607451,171712
27,spotify:track:4cxQWmXmmbFoWvV8qipQTe,"Murilo Huff, Maiara & Maraisa",Perfeito Pra Ficar Sozinho - Ao Vivo,M Show,22,22,21,3578904,170568
28,spotify:track:2HMbGPbGiqGaHXzFkQAmZI,Matheus & Kauan,Basiquinho - Ao Vivo,Universal Music Ltda.,16,27,21,3481390,164383
29,spotify:track:7AwVSKaQxpidrtYBerkHKk,"Ana Castela, Melody, Dj Chris No Beat",Pipoco,Ana Castela,1,25,31,3462417,194022
30,spotify:track:1ACALdBWViTpLBC14Ecv8E,"MC Ryan SP, Mc Daniel, Kotim",Namora Aí,WM Brazil,30,30,3,3431741,148615
31,spotify:track:2m6ZDDrTvDQtKbwNFyI3r5,"Luísa Sonza, Xamã",MAMA.CITA (hasta la vista),Sony Music Entertainment,31,-1,1,3352247,152358
32,spotify:track:4xxeEWGQNFQ6qehlnev5LS,Marília Mendonça,Te Amo Demais,Som Livre,4,31,23,3324681,205685
33,spotify:track:2bWVxK5GlPtS4D3FcLjGgQ,Gusttavo Lima,Cara da Derrota - Ao Vivo,Sony Music Entertainment,33,39,12,3194048,161685
34,spotify:track:6bwx7pcKJY05D9S6CVa1k6,"Israel & Rodolffo, Maiara & Maraisa",Nem Namorado e Nem Ficante - Ao Vivo | Faixa Bônus,Som Livre,22,26,31,3153143,166600
35,spotify:track:5vC8UAOHeG95ehRzZChniB,"L7NNON, DJ Biel do Furduncinho, Bianca",Ai preto,Papatunes Records,1,28,29,3148867,131583
36,spotify:track:42nZBOwXNdO24Ml032bLBS,Matheus & Kauan,Gatilho - Ao Vivo,Universal Music Ltda.,13,36,41,3065486,155284
37,spotify:track:2qmG7dokbGpDGD0T5wORWt,"Matheus Fernandes, Xand Avião",Balanço da Rede,Som Livre,1,40,42,3028415,166435
38,spotify:track:0XyPPyGes0omXppV5YE8gy,Felipe Amorim,Gostosinha é Ela,One Play,24,38,22,2989781,138000
39,spotify:track:7qoIhutxU269Zqo9PG5IOj,"Pineapple StormTv, Chris MC, Salve Malak, Tz da Coronel, MC Cabelinho, Chefin, L7NNON, Luísa Sonza, Oruam, Xamã, N.I.N.A",Poesia Acústica 13,Pineapple StormTV,1,29,15,2838312,628124
40,spotify:track:5t7E1z1kVtHyPxWNmUtXN4,Kevi Jonny,Te Love - Ao Vivo,Kevi Jonny,26,41,16,2774707,169002
41,spotify:track:6gEOM9IEBzvTdbwNrSkBdC,Gusttavo Lima,Fala Mal de Mim - Ao Vivo,Sony Music Entertainment,6,51,25,2694216,204937
42,spotify:track:3IMLoeLerS7TMpKjxUgAhx,Henrique & Juliano,Arranhão (Ao Vivo),"Vida Nova Produções, sob licença exclusiva para Virgin Music Group",1,47,73,2545123,153409
43,spotify:track:4QWumyD2uwiePBBha9XBHI,Felipe Amorim,No Ouvidinho,One Play,1,52,40,2528279,183870
44,spotify:track:0oZrvoCYEbKGCsU7cQqNnw,"Yago Oproprio, Rô Rosa, Skeeter Beats",Imprevisto,Som Livre,32,34,10,2511684,139703
45,spotify:track:2wSCalnGOnXdAJC0Fn8OUY,"George Henrique & Rodrigo, Marília Mendonça",Vai Lá Em Casa Hoje - Ao Vivo,Worldshow Promoções e Eventos,1,57,62,2484711,191523
46,spotify:track:0dcHD9QhnWRA41zoLnC83X,"MC Cabelinho, Dallass",X1,MC Cabelinho,30,42,34,2476707,188852
47,spotify:track:4Dvkj6JhhA12EX05fT7y2e,Harry Styles,As It Was,Columbia,10,35,39,2457814,167303
48,spotify:track:0i4UV3HjjvsUuV3BajEXoD,"MC Tairon, Mc Vitin Da Igrejinha, Dj Win, life song",Baile no Morro,ID1642 - Life Song Records,1,44,28,2445668,140307
49,spotify:track:2Vl7x4BkNhhJkEmQQMcV0V,Mc Jacaré,Toma Tapa,A Chave,49,95,3,2429474,122994
50,spotify:track:11fqunD6qlOCrRd88kMOk6,Henrique & Juliano,Evento Cancelado (Ao Vivo),"Vida Nova Produções, sob licença exclusiva para Virgin Music Group",22,49,32,2410349,183244
51,spotify:track:74Le949TrZk4zwDjtWzH23,"Bruno & Denner, Gusttavo Lima",Cavalo de Pau,Balada Music,51,78,11,2397042,164029
52,spotify:track:0tM4J8aID6qYZOE3e14sCj,Henrique & Juliano,Acordo (Ao Vivo),"Vida Nova Produções, sob licença exclusiva para Virgin Music Group",21,55,62,2375928,169771
53,spotify:track:6Ulh9GPYz6JKdv04qc3q2U,João Gomes,Dengo,JG Shows,3,59,34,2327131,153958
54,spotify:track:4pjznsLeoyimnxGlVpmyJI,"MC Cabelinho, Victor WAO, Bairro 13",NÉ SEGREDO,MC Cabelinho,34,43,14,2311698,155771
55,spotify:track:3nqQXoyQOWXiESFLlDF1hG,"Sam Smith, Kim Petras",Unholy (feat. Kim Petras),Capitol Records UK / EMI,5,37,14,2281654,156943
56,spotify:track:2ykYxd8UGHOsdjP3Z5jSHh,"Hugo & Guilherme, Gusttavo Lima",Cheiro de Balada - Ao Vivo,Som Livre,11,54,21,2273414,171077
57,spotify:track:4qsOrxBv09HhNSpsgMRXdC,"Marília Mendonça, Maiara & Maraisa",Esqueça-Me Se For Capaz,Som Livre,1,60,63,2252270,169058
58,spotify:track:4x5q5T5mhE1xvoCVXY6qrN,"DJ AK BR, Dj Darge, Niack",Melodia Alucinógena,DJ AK BR,7,45,22,2239316,183716
59,spotify:track:0BWEkqsmPe3qOzrRVztHU3,"Paulo e Nathan, Hugo & Guilherme",Acabei de Terminar - Ao Vivo,Sony Music Entertainment,22,56,38,2186278,223489
60,spotify:track:2ryeIBjDGoVmvK45BmFXpM,"Mari Fernandez, Murilo Huff",Respeita Seu Ex,Sony Music Entertainment,60,64,2,2148462,191815
61,spotify:track:2TdOWHAolNaQx8gyRDVS1N,"Luan Santana, Henrique & Juliano",ERRO PLANEJADO - Ao Vivo,Sony Music Entertainment,4,61,37,2139818,154868
62,spotify:track:3XF598RmEUF3XW4XKo1lyP,"Hugo & Guilherme, Jorge & Mateus",Meu Número - Ao Vivo,Som Livre,17,58,37,2124096,208007
63,spotify:track:52EYWdjiulHaehpexuowyh,"MC Cabelinho, Cyclope Beatz, Red, meLLo",FOGO E GASOLINA,Bairro 13,63,123,2,2038702,181767
64,spotify:track:2PtpfX7sX870xeOfdTMyx2,Guilherme & Benuto,Meus Vícios - Ao Vivo,Sony Music Entertainment,52,62,14,2024734,151091
65,spotify:track:3ITkrUvAA6gzxer2UIom3P,Jorge & Mateus,Molhando o Volante,Som Livre,8,66,55,1996701,162538
66,spotify:track:4vWh6tEfcLzdvYWp2IlOJS,"Luan Santana, Luísa Sonza",CORAÇÃO CIGANO - Ao Vivo,Sony Music Entertainment,3,67,21,1987231,209928
67,spotify:track:4pzRxLzkLjnqnrOL0VMV5w,"Wesley Safadão, Lucas Aboiador",Não Fosse Tão Tarde - Ao Vivo,Wesley Safadao,67,70,7,1965704,142500
68,spotify:track:2XaEn8iznBz9ZE9YJqJdQ6,"MC Ryan SP, MC Hariel, Mc Don Juan, MC Joãozinho VT, MD Chefe, Mc Daniel, Mc Davi, Mc IG, Mc Kevin, Mc Paiva ZS, POCAH",Revoada do Tubarão 3,WM Brazil,30,53,6,1924838,669157
69,spotify:track:4PQ5AInr4YoBauth9YPduL,"Anitta, Mc Danny, HITMAKER",Ai Papai,WM Brazil,69,75,4,1904774,148048
70,spotify:track:5mJFh4iRzgmWuEVPG8257V,"MC Marks, DJ BOY, Dj GM",Quem Não Conhece Tá Sem Internet,GR6 Music,40,63,16,1895077,146823
71,spotify:track:7sopDXkuzXtHt8AQpdBxmT,Ana Castela,DONA DE MIM,AgroPlay,71,-1,1,1891306,145091
72,spotify:track:3ShKPhFkexrwl7WoyTtNND,"Rogerinho, Wesley Safadão",Tchuco Nela,AgitoFunk,5,72,37,1867153,170880
73,spotify:track:04vzhKfl5HtPEgrdZJCZ7L,"Mc Paiva ZS, Kotim",Bagulho Louco,Love Funk,27,46,33,1852720,124238
74,spotify:track:1t5dhHyXMwdbAcI3EQRqFV,Diego & Victor Hugo,Meio Fio - Ao Vivo,Sony Music Entertainment,60,81,21,1845443,153055
75,spotify:track:5PSkF3QpVMlAx8U5Inxj39,"Mc Jacaré, Dj Tk",Vento Forte,A Chave,3,48,24,1833597,123711
76,spotify:track:2ebFBmle5uXcdbrCAOvPcZ,Guilherme & Benuto,Vagabundo Chora - Ao Vivo,Sony Music Entertainment,20,83,46,1796558,161845
77,spotify:track:75vGTHuhbJDrZ0oPb3FXQ9,"Os Quebradeiras, Machadez, Mousik",Pagodão do Birimbola (Tchubirabirom),Mousik,77,96,4,1793885,125333
78,spotify:track:5A35xC90Nk6tXmcOAOOavi,Luan Santana,ABALO EMOCIONAL - Ao Vivo,Sony Music Entertainment,6,87,47,1779817,153225
79,spotify:track:7fzgTaVhUxmEzjtcd9NdWo,"Tayrone, Marília Mendonça",Cê Tá Preparada - Ao Vivo,Universal Music Ltda.,16,84,76,1767894,213006
80,spotify:track:3o5LmE0gNsEBwz7VCmc3bV,"Hugo & Vitor, Clayton & Romário",Problemão - Ao Vivo,Universal Music Ltda.,80,93,9,1743402,137957
81,spotify:track:3DNhR7P04alm9S4JA6Llvg,"Felipe Amorim, Teto",Mó Viagem,One Play,75,82,4,1704892,197647
82,spotify:track:3gx9a8ea1nI0Wym9hJpdbJ,"BIN, Orochi, Mc Daniel, Caio Passos, Mainstreet",Hino dos Mlks,Mainstreet Records,45,68,10,1700113,209032
83,spotify:track:1K8AtBJXcdq5mywMnZuARP,Gusttavo Lima,Termina Comigo Antes - Ao Vivo,Sony Music Entertainment,3,94,39,1693172,187381
84,spotify:track:5TGkZGCUoV1zvFxQOIQM5O,"HITMAKER, Ana Castela",Reverse,Universal Music Ltda.,56,80,12,1685147,120405
85,spotify:track:5IcPYzR2bkS4W3MabMpi4Z,Zé Neto & Cristiano,Melhor Ser uma Saudade,Som Livre,13,97,48,1651961,158716
86,spotify:track:6bTdZ7xfKp3NqqADJ8HLyj,"Matuê, WIU, Teto",Vampiro,Sony Music Entertainment,1,65,39,1637072,250434
87,spotify:track:4aoZBldNDVYmTwmeoI49ud,"Mc Gabzin, DJ TAK VADIÃO, dj sv",O Poder Dessa Garota,Sony Music Entertainment,56,71,35,1633418,136615
88,spotify:track:3sd2p4kE7xQmFH3lPnFl6h,"Davi Kneip, Mc Frog, Dj Gabriel do Borel, Luísa Sonza",sentaDONA (Remix) s2,Davi Kneip,1,88,41,1615405,125245
89,spotify:track:5cCwZJUf8QiCQGnyakhpmF,"Oruam, Mainstreet",Papo de Agustinho,Mainstreet Records,59,69,11,1614825,173333
90,spotify:track:5TPXcKSOlPaz2pkYbWiWHU,Clayton & Romário,Ai Eu Chorei - Ao Vivo,Virgin Music Label And Artist Services (S&D),45,103,26,1603081,176491
91,spotify:track:1JIKO27MqvSpjrnUCT6fLC,"DJ Patrick Muniz, Mc L3, MC DOM LP",A Caminho do Bega,Tratto Entretenimentos,56,74,13,1577426,119304
92,spotify:track:5r9CZJMoMmxio2AnJdxuDS,"Grupo Menos É Mais, Di Propósito, Vou Zuar",Pot-Pourri: Melhor Eu Ir / Ligando Os Fatos / Sonho de Amor / Deixa Eu Te Querer - Ao Vivo,Som Livre,21,108,134,1574180,521088
93,spotify:track:0MKd4uZd8Ag8qyReZBTarP,Murilo Huff,Pino da Granada - Ao Vivo em Rio Preto,M Show,35,98,31,1569986,185407
94,spotify:track:0bYg9bo50gSsH3LtXe2SQn,Mariah Carey,All I Want for Christmas Is You,Columbia,94,-1,5,1567343,241562
95,spotify:track:4uUG5RXrOk84mYEfFvj3cK,"David Guetta, Bebe Rexha",I'm Good (Blue),Parlophone UK,51,73,16,1554855,175238
96,spotify:track:44U6wTQDkos958gqTbilSw,"Mc Daniel, Caio Passos, OGBEATZZ",Balmain,Lyons Produções,78,85,10,1536421,197500
97,spotify:track:28m65cMH7QXHzFnZSTtNHY,"Marília Mendonça, Maiara & Maraisa",Não Sei o Que Lá,Som Livre,21,109,65,1529163,169586
98,spotify:track:0jAAnWNbcHf6X1EXOtvOT7,MC Kevin o Chris,Incendeia,MC Kevin o Chris,14,76,25,1522671,239999
99,spotify:track:0WtM2NBVQNNJLh6scP13H8,"Rema, Selena Gomez",Calm Down (with Selena Gomez),Mavin Records / Jonzing World,89,89,12,1520330,239317
100,spotify:track:52kcarcX0FQ6wPulXm2bMJ,"Vulgo FK, MC Cebezinho, KayBlack, Pedro Lotto, AMUSIK",Meca Cereja,Elenko Music,91,91,8,1490120,234193
101,spotify:track:5FNdfRpHs4u5vto9YdY3ft,Wesley Safadão,Eu Já Tava Bem - Ao Vivo,Wesley Safadao,19,117,56,1480401,135325
102,spotify:track:7woVi4HBuv0rsO98Ox2Fcq,"Mc Paiva ZS, Love Funk, Kotim",Doce Veneno,Love Funk,60,86,15,1475009,208941
103,spotify:track:30rrBGpna63eIJ2BrXlWDC,Henrique & Juliano,Minha Cópia Atual (Ao Vivo),"Vida Nova Produções, sob licença exclusiva para Virgin Music Group",58,111,39,1471228,183382
104,spotify:track:18XOY618zQH4bFw3TgVT9L,"MC Cabelinho, Vinicin, Amorim, A.R, Palma, Felipe Rosa, Brutos, Bairro 13",VALHO NADA,Bairro 13,99,99,2,1471210,217539
105,spotify:track:14JKzKrJbPDflw8XyATMey,Henrique & Juliano,A Maior Saudade (Ao Vivo),"Vida Nova Produções, sob licença exclusiva para Virgin Music Group",10,105,69,1458041,190161
106,spotify:track:6E8KBuOUM9e23f9fyHsDU1,"MC Cabelinho, Ariel Donato",QUEM SOU EU?,Bairro 13,106,143,2,1456800,125534
107,spotify:track:2SOeAhvJfh7HsGYPVtGG8H,"DJ CIRILO DE CAXIAS, Kaeny Mc",Aqui Na Parma Tu Vem Pra Fuder,Gufo Records,48,79,10,1456025,171428
108,spotify:track:14uWxelOuAUajP8fDvc0Ct,Thiaguinho,Falta Você,Virgin Music Label And Artist Services (S&D),87,114,30,1452015,220437
109,spotify:track:4AAIAVjSyiq1N7SXKkwXZe,Marília Mendonça,Troca de Calçada,Som Livre,7,112,100,1440339,203158
110,spotify:track:0ReqDOp3nbS49HRy4BrmkY,"MC Cabelinho, meLLo, MATHINVOKER",SEXY,Bairro 13,110,171,2,1425305,176795
111,spotify:track:4QQTPEwqE4Aq7LXSyIgSci,"Mc Kitinho, Mc guizinho niazi, DJ DEIVÃO, Silva Mc",Primeiro Beck Ela Me Mamou,Fluxos Records,28,90,16,1418223,139153
112,spotify:track:6nkoWsFZeFt5dUdNmlIceh,Gusttavo Lima,Bloqueado - Ao Vivo,Sony Music Entertainment,4,126,57,1409613,168689
113,spotify:track:48LEhRW4gLMCVSYFEZvt8b,"João Bosco e Gabriel, Diego & Victor Hugo",Assume a Gente - Ao Vivo,Som Livre,40,113,40,1400268,171524
114,spotify:track:3EM71GPnUGJ75uDhkH77pq,"LUDMILLA, Marília Mendonça",Insônia - Ao Vivo,WM Brazil,46,107,18,1389803,181157
115,spotify:track:58VUikMywNpRelwEx8khdh,"Dj JL O Único, MC LENADRO ABUSADA, Funk Maia",Aqui no Baile do Egito,Funk Maia,90,106,12,1380270,111500
116,spotify:track:71VNsncPcTfQiklVO9uXfB,"Felipe & Murillo, Ana Castela",Ô Lá na Roça - Ao Vivo,Felipe & Murillo,97,119,18,1371215,160000
117,spotify:track:3l5VjEAeUTqrlD50iEo8Yn,"KayBlack, CVSTRO, Wall Hein, AMUSIK",Licor 43,Elenko Music,86,102,15,1350528,142470
118,spotify:track:25rz3D4oroFC0GXm3xFXnG,"Nivaldo Marques, NATTAN",Tem Cabaré Essa Noite,SUA Musica/ WK Records,12,160,24,1337335,202562
119,spotify:track:1Q1d5yjdXpcedKFJR3p7Ir,"MC Cabelinho, Gloria Groove, Dallass",NOSSA MÚSICA,Bairro 13,119,-1,1,1322395,202955
120,spotify:track:7HdWqZjUmIHK5B8zwPCRds,"Léo Santana, Mc Don Juan, Mari Fernandez",Áudio Que Te Entrega - Faixa Bônus,Universal Music Ltda.,19,121,40,1317926,171409
121,spotify:track:7G2LNG0EDgU5IyeeP6pevW,"Mari Fernandez, Xand Avião",Pode Apostar - Ao Vivo,Sony Music Entertainment,121,127,19,1304427,193834
122,spotify:track:1JzMOnuyabzpRuSudDD4Cq,"WIU, Matuê, Teto",Brinca Demais,Sony Music Entertainment,69,77,4,1303919,194400
123,spotify:track:3YQvZNmRc2y1hgdvustkce,"MC Cabelinho, Ajaxx, Galdino",MINHA CURA,Bairro 13,123,-1,1,1295805,154694
124,spotify:track:0NBgyml7T0IvUNbXIkcSpH,"Xamã, Gustah, Neo Beats, Bagua Records",Malvadão 3,Bagua Records,1,116,56,1283202,141769
125,spotify:track:11BKm0j4eYoCPPpCONAVwA,Lady Gaga,Bloody Mary,Interscope,86,92,4,1274244,244760
126,spotify:track:1xzi1Jcr7mEi9K2RfzLOqS,Beyoncé,CUFF IT,Parkwood Entertainment/Columbia,50,100,17,1272650,225388
127,spotify:track:3BSrkgc0HEM0dod45jmqyN,"MC Cabelinho, Baco Exu do Blues, Delacruz, Dj Juninho da Espanha, Ariel Donato",INTENÇÃO,Bairro 13,127,-1,1,1248830,226784
128,spotify:track:3xt7v3bMNnQ8ie8RjhmkX2,Matheus & Kauan,Imagina A Sentada - Ao Vivo,Universal Music Ltda.,18,138,55,1237129,171500
129,spotify:track:5PZAbR6JHYYV9xp5gv0XES,"Zé Felipe, MC Mari",Bandido,Som Livre,1,145,28,1233586,132044
130,spotify:track:7LRjGCQdXzkBJj03e1kHkq,Paulo e Nathan,Fala Alguma Coisa - Ao Vivo,Sony Music Entertainment,74,135,17,1230321,161802
131,spotify:track:7KWKWJnbGJ3Soag6Oopion,Luísa Sonza,CACHORRINHAS,Sony Music Entertainment,2,122,24,1204651,134936
132,spotify:track:1Qrg8KqiBpW07V7PNxwwwL,SZA,Kill Bill,Top Dawg Entertainment/RCA Records,101,101,3,1198186,153946
133,spotify:track:72g37RoelSnovZakG5MwnF,"Mari Fernandez, Marcynho Sensação",Parada Louca,Sony Music Entertainment,8,174,59,1193879,179031
134,spotify:track:5IgjP7X4th6nMNDh4akUHb,Chris Brown,Under The Influence,Chris Brown Entertainment/RCA Records,48,104,22,1190864,184203
135,spotify:track:7qD2vjd3btuOgwpQPEY7ci,"Mc Don Juan, MC G15, Mc Davi",EU VOU COM CARINHO ELA QUER COM FORÇA,WM Brazil,4,115,32,1187264,144000
136,spotify:track:4grGI2vFnknrfmHT1JOVFU,"George Henrique & Rodrigo, Gusttavo Lima",Tesão Da Madrugada - Ao Vivo,World Show Produções,41,156,46,1184340,173375
137,spotify:track:7afaZ37wJJL6880z1NRgJS,Teto,Fim de Semana no Rio,Sony Music Entertainment,3,110,39,1183038,165882
138,spotify:track:57AFq4IQx7NRSsxmhb8YZz,"NATTAN, Mari Fernandez",Conduta - Ao Vivo,Vybbe,138,162,2,1181321,164675
139,spotify:track:6eNRGL6Nkdg7RhJtmbcl0j,"Mc Tato, DJ Ak beats",Luz do Luar,RF PRODUTORA,139,-1,1,1180810,184615
140,spotify:track:2rtsT3CefzKc05JdAm8aQ5,"João Gomes, L7NNON",Digo ou Não Digo - Ao Vivo,JG Shows,140,157,10,1180807,189800
141,spotify:track:0roEMqT0P7Z82rJTwcID3Z,Hugo & Guilherme,Felicidade Dela - Ao Vivo,Som Livre,42,154,40,1174995,165558
142,spotify:track:3xdEjqUOiLBkRmTrSst1GX,"Mc Don Juan, Mc Paiva ZS, DJ Yuri Martins",Final do Ano,WM Brazil,142,153,5,1161050,199384
143,spotify:track:3lQnTQFBxk1HMsj8aa4syY,Kadu Martins,Virando o Olhinho,Kadu Martins,57,134,25,1160061,142694
144,spotify:track:4GOs8fPjp4M9CBHanTMwsQ,Henrique & Juliano,Seu Perfil (Ao Vivo),"Vida Nova Produções, sob licença exclusiva para Virgin Music Group",67,141,46,1153415,183568
145,spotify:track:4EVzu5mYyigjyLrryKbZs7,Gloria Groove,VERMELHO,SB Music,9,146,46,1151585,152690
146,spotify:track:6kNZdlmjH4BQnSUfHeJIuc,"Dj GBR, Mc IG, MC Ryan SP, MC Marks, Mc Don Juan, MC PH, Mc Luki, Mc Paiva ZS, MC GP, Makalo","Let's Go 3 (feat. MC Marks, Mc Don Juan, MC PH, Mc Luki, Mc Paiva ZS, MC GP & Makalo)",Sony Music Entertainment,96,128,9,1116142,508586
147,spotify:track:4nRa5qkXIfswPbt20rkslI,"Felipe Amorim, João Gomes",Debaixo do Cobertor,One Play,69,165,24,1111663,154285
148,spotify:track:0yDMhYTryvQoR634wDgQ1j,"MC Hariel, DJ BOY",O Fim é Triste (feat. DJ BOY),WM Brazil,62,131,27,1085541,158117
149,spotify:track:0pZIBIJ253pH9gJtXE0Ouf,"KayBlack, Marquinho no Beat, Wall Hein",Vestido da Fendi,Elenko Music,107,132,31,1084618,164203
150,spotify:track:5fstoJBdyj9Yvhe4W5hmEP,"Dj GM, Mc Lipi, Oldilla, Mc Piedro, MC Paulin da Capital, MC Lemos, Mc Lele JP, MC Ryan SP, Gabb MC, Mc Paiva ZS, Love Funk",Set Wesley Alemão,Love Funk,55,130,17,1075764,578666
151,spotify:track:4m8kG46clzxMxyrDuFo1Uq,"WIU, Oruam",Horas Iguais,Sony Music Entertainment,77,129,12,1073398,246942
152,spotify:track:7vQbuQcyTflfCIOu3Uzzya,Bobby Helms,Jingle Bell Rock,Geffen,152,-1,1,1066968,130973
153,spotify:track:57nvtO3EJuh6zuB67R3QeF,"Mc Poze do Rodo, João Gomes, jess beats, DiCastro",Frio e Calculista,Mainstreet Records,83,133,7,1064397,223689
154,spotify:track:5o4VK4Qe5QwXHrvUPoaGHy,"DJ Patrick Muniz, Mc L3, MC DOM LP, Dj Mizzontti",A Caminho do Bega [Piseiro Remix] - Piseiro Remix,Tratto Entretenimentos,154,-1,1,1058595,136220
155,spotify:track:6JIC3hbC28JZKZ8AlAqX8h,"Elton John, Dua Lipa, PNAU",Cold Heart - PNAU Remix,EMI,52,137,68,1056829,202735
156,spotify:track:7gVzhRCrLRUBEGdS7zNTp0,Zé Felipe,Malvada,Som Livre,2,199,40,1055481,145853
157,spotify:track:0V3wPSX9ygBnCm8psDIegu,Taylor Swift,Anti-Hero,Taylor Swift,10,118,10,1048172,200690
158,spotify:track:130HVxaVe9EYcLJmuOR9Rw,Henrique & Juliano,Até A Próxima Vida (Ao Vivo),"Vida Nova Produções, sob licença exclusiva para Virgin Music Group",87,176,44,1038472,194310
159,spotify:track:2zpiccjPSl315SqthyDf9j,"Mc Livinho, Theus Costa, MC Bruna Alves, Faixa Rosa",Na Movimentação (feat. Faixa Rosa),MBB Diamond,80,147,18,1032287,116307
160,spotify:track:2kJRlOyrxsy7Ot3c5TZ8Q6,João Gomes,Meu Pedaço de Pecado,JG Shows,1,-1,76,1029694,157175
161,spotify:track:1TFqH3zKOiTZoVe0OQuJte,Grupo Menos É Mais,Até Que Durou / Tu Mandas No Meu Coração / Adorei / Supera - Ao Vivo,Som Livre,131,189,28,1028949,453018
162,spotify:track:4a0sqvCBo7aRIS4GzBQpnp,"MC Braz, MC Tairon, Dj Win",Kikando e Me Olhando,Duetti,14,139,38,1022845,210461
163,spotify:track:4h9wh7iOZ0GGn8QVp4RAOB,OneRepublic,I Ain't Worried,Interscope Records,103,155,17,1018695,148485
164,spotify:track:6UelLqGlWMcVH1E5c4H7lY,Harry Styles,Watermelon Sugar,Columbia,27,124,151,1018234,173991
165,spotify:track:3ZtHHGpAPSWC7Gnios4lmK,sxmmerx,Metflix,sxmmerx,31,140,23,1018080,133333
166,spotify:track:13Rf6RaZT13TW4xLQR3MQr,"MC Cabelinho, Bob do Contra, Azzy, Filipe Ret, Dudu, Xamã, Orochi, Maquiny, Pineapple StormTv",Poesia Acústica #6 Era uma Vez,Pineapple StormTV,18,150,185,1015408,577819
167,spotify:track:2jIaDVi0tKGjPZxVIxH1Al,Gustavo Moura & Rafael,Cara de Golpe,Astro Produções,164,-1,10,1015063,185726
168,spotify:track:5cDqPZ79hO8LujICezKQm0,"MC Cabelinho, Dallass, Honaiser",UM ERRO,Bairro 13,168,-1,1,1011333,183196
169,spotify:track:0yL7K9MzC20uBesZTPY81r,"DJ Matt D, Menor MC, MC GP, Vulgo FK",Pandora,GREE CASSUA,6,152,56,1010957,177000
170,spotify:track:3YvE7uo4ffseBoJPh8IhHp,"Marília Mendonça, Maiara & Maraisa",Presepada,Som Livre,3,191,57,1001378,196209
171,spotify:track:6BF3nZQkAg9qvE0DLVSfyH,"Baco Exu do Blues, Luísa Sonza",Hotel Caro,Baco Exu do Blues,4,142,29,1000267,221857
172,spotify:track:6QP9bF0ZypxoyQotcgl25J,Gusttavo Lima,Saudade Fudida - Ao Vivo,Sony Music Entertainment,83,198,11,996724,157845
173,spotify:track:5zNxUkUW9WiV5oyg6gh2wB,"PEDRO SAMPAIO, Mc Pedrinho",DANÇARINA,WM Brazil,1,185,43,991070,110222
174,spotify:track:2VATVdFqb7QqxfAcQPvNpc,Israel & Rodolffo,Ex Alcoolizado - Ao Vivo,Som Livre,61,-1,28,986314,162444
175,spotify:track:4b5rbmik2mSrGo8IvjDUUp,"PEDRO SAMPAIO, Pabllo Vittar",SAL,WM Brazil,101,179,7,985212,120000
176,spotify:track:1XcmAgREOuJQb91sr68AAD,"Dyamante DJ, Mc Gw",Sentadinha Diferente,NWS,51,164,25,976956,123230
177,spotify:track:6Aw11M9NT2tBeEj3mPKrjy,"Diego & Victor Hugo, Bruno & Marrone",Facas - Ao Vivo,Sony Music Entertainment,3,-1,82,975287,196379
178,spotify:track:3xCkNUiap7EBjqnRldHSSh,Zé Vaqueiro,Coladin (Minha Deusa),Sony Music Entertainment,178,-1,1,971625,228301
179,spotify:track:5PjdY0CKGZdEuoNab3yDmX,"The Kid LAROI, Justin Bieber",STAY (with Justin Bieber),Columbia,30,144,77,971535,141805
180,spotify:track:0in6Rc29qdyOkhKyYw4A84,Di Propósito,Manda Áudio,Sony Music Entertainment,53,-1,73,969929,162056
181,spotify:track:04XCCgpMnd4QLitSXNBrfI,"MC Cabelinho, meLLo, Honaiser, Ajaxx",CAOS,Bairro 13,181,-1,1,963019,160756
182,spotify:track:0kIhdc2rN4TCBzvZ1MtVmz,Turma do Pagode,Só um Pagode - Ao Vivo,Sony Music Entertainment,182,-1,1,962092,141388
183,spotify:track:5ghSPv2tPkGZN8DESSvKZl,dreko,Ultimamente Speed,FUNDO REC,80,125,13,961767,130254
184,spotify:track:2VbKpQWIMRelKmEy8rSCAf,"Kako, MC Erik, MC GP, MC Ryan SP, MC Marks, MC Joãozinho VT, DJ BOY, Dj GM",Set Tatuapé Conceito 2,Sonar Music,63,169,25,958576,406588
185,spotify:track:7HjZD0NPC1hzFpjUjo45GR,"Mc Poze do Rodo, Filipe Ret, Mainstreet, Ajaxx",Me Sinto Abençoado,Mainstreet Records,33,161,55,958449,214235
186,spotify:track:1N19UVD4GRBFT6UrDaX6rk,"Turma do Pagode, Grupo Menos É Mais",Bebe e Vem Me Procurar / Quem Ama Sente Saudade (Ao Vivo),Sony Music Entertainment,125,-1,20,956730,216818
187,spotify:track:1JGhLlRZiHqoJPcCx76luE,"MC Cabelinho, Ajaxx, Darez",NA TUA MENTE,Bairro 13,187,-1,1,956452,152408
188,spotify:track:6zJejIfVYLgjud3lTk4DLB,Rosa Linn,SNAP,Nvak Collective,91,151,22,953828,179551
189,spotify:track:5XeFesFbtLpXzIVDNQP22n,Arctic Monkeys,I Wanna Be Yours,Domino Recording Co,96,136,16,946466,183956
190,spotify:track:4kpj0mNvse4mclBHpluw4g,Clayton & Romário,O Grau Bateu - Ao Vivo,Virgin Music Label And Artist Services (S&D),107,149,7,944939,166015
191,spotify:track:5bGZGnXzwVM4yLoZ6udW0U,"MC Cabelinho, EREN, No Cutty, Ariel Donato",GRIFINÓRIA,Bairro 13,191,-1,1,944417,183707
192,spotify:track:5HFvMPiNjclAq8DbEAPWMw,Gilsons,Várias Queixas,Xirê,162,181,16,940217,170109
193,spotify:track:31cQX1WeqiCHQSysz9KaVb,"MC Cabelinho, LUDMILLA, Palma, Ajaxx",TANTO FAZ,Bairro 13,193,-1,1,938390,164373
194,spotify:track:3i9lb6mvUzFcdrTA1oB103,"César Menotti & Fabiano, Ana Castela",Eu Sem Você Não Dá,Som Livre,194,-1,1,931864,162828
