rank,uri,artist_names,track_name,source,peak_rank,previous_rank,weeks_on_chart,streams,duration_ms
195,spotify:track:4cOvirEduQ56JOQVMdWz5A,Biu do Piseiro,Rave e Bagaceira,FPS Music Digital,119,190,10,693467,175290
196,spotify:track:2fmeSswdyVq4wcqhY41UHk,"Pineapple StormTv, L7NNON, Chris MC, Xamã, Lourena, Cesar Mc, Djonga, Filipe Ret, Salve Malak",Poesia Acústica #9 Melhor Forma,Pineapple StormTV,3,181,88,692708,611076
197,spotify:track:2QGYWAcAiXFrZE8zCWQchU,Mari Fernandez,Vai Doer Mais - Ao Vivo,Sony Music Entertainment,197,-1,1,692603,168682
198,spotify:track:2R9IrE42Mw4zdUXAEFNiZL,"Zé Felipe, Os Barões Da Pisadinha",Senta Danada,Som Livre,14,185,51,688108,172621
199,spotify:track:4BfppnNi6ZQTI8Ezo97zX6,"Chefin, Mainstreet",Deus É o Meu Guia,Mainstreet,50,191,19,688018,166956
200,spotify:track:0wRn3ggAY1fIupTaVigdza,"Mc Poze do Rodo, Bielzin, Mainstreet, MC Cabelinho, PL Quest, Neo Beats",A Cara do Crime (Nós Incomoda),Mainstreet Records,17,186,58,686891,302117
