rank,uri,artist_names,track_name,source,peak_rank,previous_rank,weeks_on_chart,streams
1,"spotify:track:5GV7OpSEb8MPTryL0Q5i6c","DJ JZ, Humberto & Ronaldo, Mc Mininin, DJ LG PROD, Silvanno Salles","Mtg Quero Te Encontrar","Tropa do Serrão",1,1,6,"8583486"
2,"spotify:track:1cIS13bqNfZcTs8LSK8r0a","Felipe e Rodrigo","Gosta De Rua (Ao Vivo)","MK Records",2,59,2,"6753886"
3,"spotify:track:3hfCle1QRfbwIpQ1B746lV","MC Saci, Complexo dos Hits, DJ Sammer, Mc Pretchako","Aquariano Nato","eumcsaci",2,2,29,"6385482"
4,"spotify:track:6P1mkNAmgihFwFRBhpaev3","Luan Pereira, Mc Daniel","ENTRA NA DEFENDER","Som Livre",4,5,4,"6300390"
5,"spotify:track:6X6jKoyw1OjogRghMEQAZV","Jorge & Mateus, Lauana Prado","Haverá Sinais - Ao Vivo","Som Livre",2,4,8,"5751844"
6,"spotify:track:7pnqm6UEb7SzpDxb53wULT","Mc IG, MC Ryan SP, Oruam, MC PH, Mc Poze do Rodo, MC GP, TrapLaudo, Mc Luki, MC GH do 7, MC Nego Micha, Murillo e LT no Beat","Diz Aí Qual é o Plano?","WM Brazil",1,3,6,"5525828"
7,"spotify:track:6Gn8SHd3RIWjOermcidCJk","Dj Lc, DJ JOAO DA INESTAN, Mc Pretchako, MC Saci, Complexo dos Hits","A Internet É Toxica","Complexo dos Hits",7,9,24,"4977151"
8,"spotify:track:6mJCx80Wc91GPi9ew9bkmD","DENNIS, Ana Castela, Mc Gw","RAM TCHUM","Sony Music Entertainment",3,8,7,"4861909"
9,"spotify:track:42JNab8NPeCADJ9D3Cl5wS","Zé Neto & Cristiano","Barulho Do Foguete - Ao Vivo","Som Livre",4,14,42,"4843498"
10,"spotify:track:1jN0ysNJ2d9VZwVdlgspjr","MC Saci, MC Fahah, DJ Sammer, Dj Lc","De 10 Mulher 11 É Maluca","eumcsaci",6,6,8,"4687443"
11,"spotify:track:027ielmg4mNR1p1Ds3Mvgh","DJ Ws da Igrejinha, DJ JOÃO PEREIRA, Mc Dudu Sk, MC TH DA SERRA, DALÃMA","Não Vou Namorar","Dalama Records",11,26,4,"4682937"
12,"spotify:track:1WHDOr19zyyqu6XXIvdgfX","Hugo & Guilherme, Maiara & Maraisa","Morena De Goiânia - Ao Vivo","Som Livre",12,27,4,"4600799"
13,"spotify:track:6cFW2FPaUL4YRJfS9zFJaV","Simone Mendes","Dois Tristes - Ao Vivo","UME - Global Clearing House",10,17,7,"4307457"
14,"spotify:track:4ssTFuVeNJG8py5dr2P2pV","Matheus & Kauan","Não Recomendo - Ao Vivo","Universal Music Ltda (S&D)",11,12,20,"4295110"
15,"spotify:track:6xW61JP2f3hcsbOwn7dzi5","Mc IG, MC Ryan SP, MC PH, DJ Glenner","É Isso Bebê, Tá Certa!","WM Brazil",6,10,4,"4275315"
16,"spotify:track:2HzLEPWKXcfpwfmEIUURHo","Tz da Coronel, Ryu, The Runner, Nagalli, Cúpula","Qual é seu desejo?","Cúpula",1,11,7,"4220428"
17,"spotify:track:24R0oyjvhV4HIFFvoK3XkP","Tropa do Bruxo, SMU, Dj Vitin do Pc, MC JF, MC NAHARA","TUMBÁTUM","Tropa Do Bruxo",11,15,10,"4057051"
18,"spotify:track:5r0JHIjcY7dLWHkljNeQbj","Murilo Huff","Anestesiado - Ao Vivo","M Show",4,13,22,"3998993"
19,"spotify:track:0oQCRjrWGvkqkdf82UlXI3","PEDRO SAMPAIO","POCPOC","WM Brazil",1,22,20,"3766698"
20,"spotify:track:4sAoshwHCmh4IHMQxZHwRD","TR, Mc Menor RV, Tropa da W&S","Baby Eu Tava na Rua da Água","WMD",1,16,13,"3737553"
21,"spotify:track:6GmyQws2xpUFIN5dXBNTrl","AgroPlay, Ana Castela, LUDMILLA","Dia de Fluxo","AgroPlay",4,23,17,"3736807"
22,"spotify:track:6r6wTVl7sBndpdlzBSEYnF","Ana Castela, Hungria, Alok","Lua","AgroPlay",6,18,9,"3697346"
23,"spotify:track:1m5nbZiPpCIi9J2irLNoxh","Oruam, Didi, Dj Lc da Roça, MC K9, MC Smith, Mainstreet","Rolé na Favela de Nave","Mainstreet Records",9,20,11,"3563862"
24,"spotify:track:2RX89Di479sc53wkaNgt9E","Hugo & Guilherme","Vazou Na Braquiara - Ao Vivo","Som Livre",15,19,13,"3562160"
25,"spotify:track:2InS5VWKJQbsFBKOsf1cJB","Dj GBR, Mc IG, MC Ryan SP, MC PH, Mc Davi, Mc Luki, Mc Don Juan, Mc Kadu, TrapLaudo, MC GP, MC GH do 7","Let's Go 4","GR6 Music",1,21,32,"3472577"
26,"spotify:track:3FB06ULqN0WNUSQ3UaMZnF","blicko","Amor Na Praia","blicko",7,7,6,"3466204"
27,"spotify:track:5brVlCCt8gp4pP0iJOOctj","MC Ryan SP, Filipe Ret, Caio Luccas, Chefin, Dallass, Rocco","Melhor Vibe","WM Brazil",27,45,4,"3334687"
28,"spotify:track:54UGdW621lBINbfMWJmmSO","Manu, Guilherme & Benuto","Torre Eiffel - Ao Vivo","manuoficial",28,32,7,"3334553"
29,"spotify:track:2sYFUcurlISdHlAsnYCEgD","Lauana Prado","Me Leva Pra Casa / Escrito Nas Estrelas / Saudade - Ao Vivo","Universal Music Ltda.",1,28,20,"3315879"
30,"spotify:track:35D06z7kmwMmYYbyJ0BkSm","Manu, Simone Mendes","Daqui pra Sempre","manuoficial",3,30,29,"3240148"
31,"spotify:track:3QpDKVHmf9RDQkJbAUNWzI","Gustavo Moura & Rafael","Digitando","Astro Produções",31,36,8,"3186216"
32,"spotify:track:0ODlZu2uJ13I29NfFJJVir","Luan Santana, MC Kevin o Chris","PEGA ESCANDALOSO","Sony Music Entertainment",29,29,3,"3117547"
33,"spotify:track:4jbTB2Kj4CrZCjngkQUQS2","Murilo Huff","A Cerveja Abre Sozinha - Ao Vivo","M Show",16,24,14,"3056991"
34,"spotify:track:4YKujFSyakVjLdH1sDllVc","Simone Mendes","Dois Fugitivos - Ao Vivo","Universal Music Ltda.",5,35,31,"2881415"
35,"spotify:track:2AZAvTFeYKJAIojPagTGin","Dilsinho, Ana Castela","Passada de Mão - Ao Vivo","Sony Music Entertainment",9,25,11,"2862058"
36,"spotify:track:3iam4WkRoqMoBBCwDFZNgd","Henrique & Juliano","Quase Algo (Ao Vivo Em Nova Iorque) (2022)","Vida Nova Produções, sob licença exclusiva para Virgin Music Group",17,37,31,"2813640"
37,"spotify:track:476o0POREG1XMArNtHRAy2","Gusttavo Lima, Ana Castela","Canudinho - Ao Vivo","Sony Music Entertainment",2,38,33,"2810339"
38,"spotify:track:5jrQZnYInM6YUjr2yFSa3E","MC PH, Vulgo FK, Veigh, Pedro Lotto, prodbyeros","Vem Desestressar","GR6 Music",31,31,2,"2796331"
39,"spotify:track:7umgf0NrHZgIAI0ep64sLc","Mc IG, Veigh, Toledo, Bvga Beatz, Galdino, Honaiser","Olá, Moça","WM Brazil",29,33,4,"2778263"
40,"spotify:track:5u7Xi0QhfkYy3qETJJ5lae","MC Paulin da Capital, Love Funk, Mc Piedro, Dj GM, DJ WN, MC Ryan SP, Mc Daniel","Samba de Malandro","Love Funk",40,43,5,"2657852"
41,"spotify:track:697gwO5YoSGVAnlfREIZll","MC PH, Borges, WIU, Pedro Lotto, WEY","Tenho Que Me Decidir","GR6 Music",4,34,20,"2636381"
42,"spotify:track:2IvsDK2p7Kq3aDrVtESDIg","Ana Castela, Gustavo Mioto","Fronteira - Ao Vivo","AgroPlay",7,39,22,"2593230"
43,"spotify:track:5mJcnekfy4DEpAZ6uAHM7Y","Thullio Milionário","Casca de Bala","Thullio Milionário",43,150,2,"2546721"
44,"spotify:track:0VybBobSYSzliyEJ1VqwGR","WIU, Teto","Problemas de um Milionário","30PRAUM",44,-1,1,"2508449"
45,"spotify:track:0AjmK0Eai4zGrLaJwPvrDp","Hozier","Too Sweet","Rubyworks / Universal-Island Records Ltd",45,69,2,"2468089"
46,"spotify:track:6zdL0aLZs6g61SPGrlMvrM","DJ JOÃO PEREIRA, MC Koringa","DANÇA PRA ME PROVOCAR","DJ JOÃO PEREIRA x MC Koringa",18,47,19,"2422123"
47,"spotify:track:7dKqPh21HpsysZvRWyNeM1","Isadora Pompeo","Bênçãos Que Não Têm Fim (Counting My Blessings)","Sony Music Entertainment",10,53,23,"2387452"
48,"spotify:track:0WiJIa3V9GdcJfcy1FhLjp","Zé Neto & Cristiano","Deu Moral - Ao Vivo","Som Livre",48,-1,1,"2368125"
49,"spotify:track:2329XxRFYoAPdQSb4DmjXQ","Mc IG, Mc Kevin, DJ WN, MC PH","Deus, Por favor","WM Brazil",16,42,4,"2328357"
50,"spotify:track:3ZNjlT5zR0jkEVzSSZCQeJ","DJ WN, MC Hariel, MC Ryan SP, MC Paulin da Capital, Mc Lipi, MC Vinny, Gabb MC, Mc Kadu, Mc Daniel, MC GH do 7, NOG, Love Funk","Ritmista 1.0","Love Funk",14,41,15,"2283691"
51,"spotify:track:2IGh6DnMiX408xwoJP9Lmb","LUDMILLA, Mari Fernandez","Falta de Mim - Ao Vivo","SEM QUERER MUSIC",51,57,10,"2278415"
52,"spotify:track:4f0aDk7HX37SfzerfznYlr","Grupo Menos É Mais, Matheus Fernandes","Lapada Dela - Ao Vivo","Som Livre",4,49,60,"2266454"
53,"spotify:track:3xkHsmpQCBMytMJNiDf3Ii","Benson Boone","Beautiful Things","Night Street Records, Inc./Warner Records Inc.",40,40,10,"2229571"
54,"spotify:track:2GxrNKugF82CnoRFbQfzPf","Artemas","i like the way you kiss me","Artemas",54,79,3,"2217227"
55,"spotify:track:6XvFnICxXsVc8OK4eh1E9b","Henry Freitas, Andrezin Araújo, Dj Kevin Oficial","Tem Café","Henry Freitas",10,51,18,"2196632"
56,"spotify:track:2hloKDkwGLjtYvAoqn39gV","Mc Jacaré, Luan Pereira","Senta Pro Bruto","Croco Hits",50,50,5,"2169343"
57,"spotify:track:3PqU6gHWUaBTtIZi5oxEJ7","Zé Neto & Cristiano","Um Mês E Pouco - Ao Vivo","Som Livre",11,58,43,"2141209"
58,"spotify:track:5asabafNzfAzjUecDvuNES","Henrique & Juliano","Aquela Pessoa (Ao Vivo)","Vida Nova Produções, sob licença exclusiva para Virgin Music Group",39,65,116,"2081158"
59,"spotify:track:4v7UrPWZL4FJWeL5ZWQ62E","Henrique & Juliano","Seu Erro (Ao Vivo Em Nova Iorque) (2022)","Vida Nova Produções, sob licença exclusiva para Virgin Music Group",43,66,26,"2077636"
60,"spotify:track:6fcQIY5VSFNrK4YzDoljPQ","Parangolé, Léo Santana","Perna Bamba","Penta Entretenimento / Salvador Produções",1,46,12,"2062406"
61,"spotify:track:0QcKkN8b4iVkmVsbaze8OS","Henrique & Juliano","Devia Ser Proibido (Ao Vivo Em Brasília)","Vida Nova Produções, sob licença exclusiva para Virgin Music Group",23,68,38,"2049372"
62,"spotify:track:3PGg3V56krasXrPKNvVLQU","Filipe Ret","Amor Livre - Ao Vivo","Som Livre",29,60,18,"2015725"
63,"spotify:track:5t2RXNtjGIzKPGiNYSU6FG","Orochi, Mainstreet, MC Cabelinho, RUXN, Palma","Vida Rasa","Mainstreet Records",55,61,7,"1995719"
64,"spotify:track:26l5FAEVr9cfaILS0szvvt","AgroPlay, Luan Pereira","Silverado (AgroPlay Verão)","AgroPlay",17,62,13,"1968698"
65,"spotify:track:7CyPwkp0oE8Ro9Dd5CUDjW","The Weeknd, JENNIE, Lily-Rose Depp","One Of The Girls (with JENNIE, Lily Rose Depp)","XO / Republic Records",61,73,19,"1967233"
66,"spotify:track:3CJiho39iutZrDxQG5Vubl","LUDMILLA","Maliciosa - Ao Vivo","SEM QUERER MUSIC",13,54,13,"1964105"
67,"spotify:track:1Jhkk1FIV7tMH9CZATjxrf","Traia Véia, Gusttavo Lima","Equivocada - Ao Vivo","Show Mix.",67,114,3,"1963216"
68,"spotify:track:6nvbXA95vgyThzj2Tbhank","Mc Ws da leste, MC Cothiê, Dj Chadin do C","Tipo Hollywood","Fera Entretenimento",2,48,22,"1961348"
69,"spotify:track:0KqVaOxvmYJMz10w3SbiaV","Clayton & Romário","Morena - Ao Vivo","Virgin Music Label And Artist Services (S&D)",24,96,12,"1955722"
70,"spotify:track:1mH3uSZus9IiMagMCJa4vB","TrapLaudo, MC PH, Murillo e LT no Beat","Tropa Do Pisa","GR6 Music",21,44,11,"1952669"
71,"spotify:track:5DcysyjaPrLzXgDauvzvn6","George Henrique & Rodrigo, Guilherme & Benuto","Beijo Equivocado","Worldshow Promoções e Eventos",44,52,30,"1949543"
72,"spotify:track:2QxL3wAJnwOOmygY4VX0My","Diego & Victor Hugo, Guilherme & Benuto","Vestido Curto - Ao Vivo","Sony Music Entertainment",37,70,17,"1900069"
73,"spotify:track:00ZKeP47bZtswtANkvxz2j","Tropa do Bruxo, DJ Ws da Igrejinha, SMU, Triz, Mc Menor Thalis","Baile do Bruxo","Tropa Do Bruxo",2,56,27,"1889925"
74,"spotify:track:53PpijFATt35Zxfl6LTxoK","Marília Mendonça","Leão","Som Livre",1,75,71,"1879786"
75,"spotify:track:0HlioiDYWAqP6p73XFUOP7","Guilherme & Benuto, Simone Mendes","Manda um Oi - Ao Vivo","Sony Music Entertainment",5,82,49,"1871031"
76,"spotify:track:7z2hqtAyf6FR39ZZmVkvcO","DJ RENAN DA BL, Dj Jl Do Tp, Mc Pretchako, Mc Menor Thalis","Eu Vou Cair na Noite","Belo Music Produtora",51,67,25,"1869698"
77,"spotify:track:4D25RP3yiJWfW9utK9dMyv","Rayane & Rafaela, Henrique & Juliano","Ali Te Ama - Ao Vivo","Henrique e Juliano oficial",64,64,25,"1864485"
78,"spotify:track:5XeFesFbtLpXzIVDNQP22n","Arctic Monkeys","I Wanna Be Yours","Domino Recording Co",78,90,84,"1835128"
79,"spotify:track:6vq7r1Pqd3pyI07u63cPZV","Simone Mendes","Erro Gostoso - Ao Vivo","Universal Music Ltda.",3,77,64,"1823392"
80,"spotify:track:3l5VjEAeUTqrlD50iEo8Yn","KayBlack, CVSTRO, Wall Hein, AMUSIK","Licor 43","Elenko Music",64,78,83,"1819319"
81,"spotify:track:2ORC76autQ7QTfBCkZl4Wo","Murilo Huff","Dedo do Meio - Ao Vivo","M Show",81,92,3,"1807528"
82,"spotify:track:51ZQ1vr10ffzbwIjDCwqm4","Ariana Grande","we can't be friends (wait for your love)","Republic Records",20,63,6,"1775759"
83,"spotify:track:54FV2rMVwLusAVnzROB0c1","Orochi, Caio Luccas, Pedro Lotto, Mainstreet, Galdino, Ribb","Mesma História","Mainstreet Records",56,80,27,"1763512"
84,"spotify:track:7sopDXkuzXtHt8AQpdBxmT","Ana Castela","DONA DE MIM","AgroPlay",13,125,69,"1762055"
85,"spotify:track:0OBv4CEP5FKS19ZQGHAUM6","Mc Paiva ZS, DJ Ak beats, Love Funk","Fala na Cara","Love Funk",85,87,16,"1760673"
86,"spotify:track:3qhlB30KknSejmIvZZLjOD","Djo","End of Beginning","Djo",66,76,6,"1720599"
87,"spotify:track:2LQ67PtoEgJSaRSqoh4k2E","Israel & Rodolffo","Greve De Beijo - Ao Vivo","Som Livre",86,113,7,"1717487"
88,"spotify:track:4O4zPFoJ5HWnqbGYlCA2qc","MC Menor MT, Mc Pelourinho, DJ Kennedy OBraboo","Lembra Aquele Cara","Resumo Produtora",45,81,11,"1712032"
89,"spotify:track:3syxcxgRLd25yPYfG8qsot","DJ Arana, DJ Jeeh FDC, Mc Livinho","Amor É Mentira","Love Funk Records",54,85,11,"1705756"
90,"spotify:track:17phhZDn6oGtzMe56NuWvj","Teddy Swims","Lose Control","Warner Records",90,98,9,"1700252"
91,"spotify:track:1fzaUKQv7sgGW0udQVghSW","MC LUUKY, Mc Don Juan, MC Ryan SP, Mc Davi, TrapLaudo, Mc Kadu, MC Gui Da Norte","Desacato","EDITORA E GRAVADORA A BASE RECORDS",55,74,12,"1696456"
92,"spotify:track:7McCAKExE8KsI2q4Y8wx4U","Murilo Huff, Marília Mendonça","Dois Enganados","M Show",49,115,90,"1681126"
93,"spotify:track:6Tp4LCJ5r5IJaEf8lnlPfG","Henrique & Juliano","De Trás Pra Frente (Ao Vivo)","Vida Nova Produções, sob licença exclusiva para Virgin Music Group",17,94,79,"1675902"
94,"spotify:track:4uLzGOlqSanpNS3htaUViY","Zé Neto & Cristiano","Pátio do Posto - Ao Vivo","Som Livre",19,108,56,"1672537"
95,"spotify:track:4QCwvUs4ob87Tq9VP07Uo3","Borges, MC Cabelinho, Veigh, RUXN, Palma, Kizzy","Loucura","Mainstreet Records",11,99,19,"1669979"
96,"spotify:track:1kWcd9h9HoeXsKaDVhSOtj","Sorriso Maroto, Ferrugem","Ela - Ao Vivo","Sony Music Entertainment",44,84,31,"1661489"
97,"spotify:track:2qSkIjg1o9h3YT9RAgYN75","Sabrina Carpenter","Espresso","Island Records",97,-1,1,"1660670"
98,"spotify:track:3knAG9kd3jNNuJlZZUAOoQ","Gusttavo Lima, Murilo Huff","Cep Novo - Ao Vivo","Sony Music Entertainment",98,-1,1,"1649792"
99,"spotify:track:7MLX5VV97CcXIpH2QUIy13","GREGO, Paulo Pires, ÉaBest","Pane no Sistema","ÉaBest",8,72,27,"1648802"
100,"spotify:track:2twZl1jsRbJRTNCE6VB6eW","Chefin, Mainstreet, LB Único","10 Carros","Mainstreet Records",8,100,21,"1643849"
101,"spotify:track:0zxWyvrKyz031tFfBnkYLr","Henrique & Juliano","Como É Que A Gente Fica (Ao Vivo)","Vida Nova Produções, sob licença exclusiva para Virgin Music Group",23,118,74,"1640467"
102,"spotify:track:5LBcIMfXPmVren1azfYw88","Guilherme & Benuto, Maiara & Maraisa","Corpo Sexy - Ao Vivo","Sony Music Entertainment",75,91,11,"1634425"
103,"spotify:track:3jTyFoGeD3DTu9cnnctMWN","Luan Pereira, Mc Daniel, MC Ryan SP","DENTRO DA HILUX","Som Livre",2,88,34,"1631372"
104,"spotify:track:1i2kguziI3ZbUZnZMKNhQ2","Mc IG, DJ Jorgin","400K","GR6 Music",45,71,19,"1616250"
105,"spotify:track:1Vy9Wn5sbiduZKBqBlH3Mc","Vulgo FK, MC PH, Veigh, Pedro Lotto, Fepache","Ballena","Som Livre",3,105,40,"1615841"
106,"spotify:track:3rUGC1vUpkDG9CZFHMur1t","Tate McRae","greedy","RCA Records Label",48,95,29,"1615638"
107,"spotify:track:4WXVqLSRHF4ypdiBngbcqU","Dj GM, Mc Paiva ZS, Triz, MC Paulin da Capital, Mc Lipi, Mc Lele JP, MC Ryan SP, Gabb MC, Mc Daniel, MC Cebezinho, MC GH do 7, MC Marks, Mc Negão Original, GREGO","Set Dj Gm 6.0","Love Funk",90,122,15,"1614186"
108,"spotify:track:07BRm4ATW5VXnpUagfVJhs","Ferrugem","Me Bloqueia (Ao Vivo)","WM Brazil",84,101,7,"1607724"
109,"spotify:track:6zFpImDYig0CQhLL2NIfyN","AgroPlay, Ana Castela","Nosso Quadro","AgroPlay",1,86,63,"1604816"
110,"spotify:track:4VI4yOAb7fWrFCnuGBIaeG","MC Cabelinho","carta aberta","Bairro 13",46,107,20,"1600233"
111,"spotify:track:5mmxylfcIlTaTftZwIIj3W","Henrique & Juliano","Você Vai Ser Fiel (Ao Vivo Em Nova Iorque) (2022)","Vida Nova Produções, sob licença exclusiva para Virgin Music Group",85,103,20,"1591931"
112,"spotify:track:0croxrAHihVLdCAG2OooQg","Zé Vaqueiro","Maravilhosa - Ao Vivo","Sony Music Entertainment",97,97,2,"1591082"
113,"spotify:track:0wuj2T6IZtotux1Jjluo7m","Léo Santana, Zé Felipe","Cama Repetida","Universal Music Ltda.",15,83,22,"1587762"
114,"spotify:track:4eOZLlPpkrnvm8EmU20IqM","DJ JOAO DA INESTAN, Mc Pretchako, MC NAHARA, Dj Caio Vieira, Dj Lc","Conselho da Minha Ex","Dream Records BH",114,129,7,"1586937"
115,"spotify:track:2xVe3wMbesHcOhqW8OoyS8","fhop music, Hamilton Rabelo","Tu és + Águas Purificadoras - Ao Vivo","FHOP Music",115,117,5,"1579173"
116,"spotify:track:4ML8zKHATI6s31xmdQD0Qa","Tz da Coronel, MC Ryan SP, KayBlack, Dj Murillo e LT no Beat, Cúpula","Ela joga no 7","Cúpula",92,119,21,"1563233"
117,"spotify:track:7r8yMaSOy4XmuhRz7iv1gi","Henrique & Juliano","Traumatizei (Ao Vivo Em Brasília)","Vida Nova Produções, sob licença exclusiva para Virgin Music Group",6,104,63,"1535238"
118,"spotify:track:2cpVTiwTPN1FTUeQkVoxTS","Ana Castela","Tô Voltando - Ao Vivo","AgroPlay",14,109,34,"1527795"
119,"spotify:track:4xAGuRRKOgoaZbMGdmTD3N","Zé Neto & Cristiano","Oi Balde - Ao Vivo","Som Livre",3,138,61,"1527293"
120,"spotify:track:6fPrHPV507dPlPaV1AkpfG","Maneva, Juliette","Péssimo Negócio - Ao Vivo","Universal Music Ltda.",83,110,4,"1526624"
121,"spotify:track:0MHA5BjCqtYL3T0yZ138mz","Israel & Rodolffo, Mc Don Juan, João Gomes","Eu Não Dou Conta - Ao Vivo","Som Livre",23,124,30,"1508791"
122,"spotify:track:45czXKyGyd9g060ogyRjx3","Wesley Safadão","Ninguém Sabe","Wesley Safadao",106,106,2,"1491658"
123,"spotify:track:64CovjRwInpOJW4PiGMprY","MC Kevin o Chris, Dj Nk Da Serra, Mc Magrinho","Faz um Vuk Vuk (Teto Espelhado)","MC Kevin o Chris",1,134,39,"1491009"
124,"spotify:track:0oZrvoCYEbKGCsU7cQqNnw","Yago Oproprio, Rô Rosa, Skeeter Beats","Imprevisto","Som Livre",32,112,72,"1487920"
125,"spotify:track:54i0jo51RjnUqhSut1fFFh","Gusttavo Lima, Matheus & Kauan","Mala dos Porta-Mala - Ao Vivo","Sony Music Entertainment",8,130,40,"1485760"
126,"spotify:track:1sTGINNEM4sT3H2hDdQiPe","Fred & Fabrício, Clayton & Romário","Gotejou No Celular - Ao Vivo","Som Livre",126,151,3,"1478614"
127,"spotify:track:6eJUG282cUKuIoa72sEsqO","Ivete Sangalo, LUDMILLA","Macetando","IM Music",1,93,15,"1464040"
128,"spotify:track:7bEr5WRLPVKM6pdpZFiheb","Xand Avião, Simone Mendes","Primeiro Passo / Ânsia / Volta Vai - Ao Vivo","Som Livre",128,147,5,"1449689"
129,"spotify:track:4hKLzFvNwHF6dPosGT30ed","Veigh, Bvga Beatz, Prod Malax, Supernova Ent","Novo Balanço","Supernova Entertainment Under Exclusive License to UnitedMasters",2,136,48,"1449305"
130,"spotify:track:0redQHBfejmPUhonR5ppGC","Guilherme & Benuto, Ana Castela, Adriano Rhod","Duas Três","Sony Music Entertainment",8,140,62,"1449051"
131,"spotify:track:3pLyNmLlw6uRrKaNwMnXOR","Josué Bom de Faixa","Não Precisa Negar","PAX MUSIC",101,111,14,"1445008"
132,"spotify:track:1snE820RBNNYwpqZO8ItYf","Luísa Sonza, MC Kevin o Chris","recadin no espelho","Sony Music Entertainment",28,131,11,"1433492"
133,"spotify:track:0fABszUFNbNq9IW503Gj8v","DENNIS, MC Kevin o Chris","Tá OK","Sony Music Entertainment",1,143,48,"1413775"
134,"spotify:track:7Cf2Hsy3cPlA4e115tElXv","Henrique & Juliano","Liberdade Provisória (Live - Ibirapuera / 2019)","Vida Nova Produções, sob licença exclusiva para Virgin Music Group",1,171,108,"1408773"
135,"spotify:track:3S8M3mZGIc10IdtmNTsrjQ","Traia Véia, Murilo Huff","Eu Não Previ - Ao Vivo em Goiânia","Show Mix.",9,137,37,"1406875"
136,"spotify:track:2cZ62VBKsdZ7u1kKKJdFOc","Marshmello, Luísa Sonza","Sou Musa do Verão","Sony Music Latin",12,120,24,"1404984"
137,"spotify:track:1MAveYqPQN88vAvsrHCCCw","PEDRO SAMPAIO, Gasparzinho, MC Meno K","CAVALINHO","WM Brazil",58,145,10,"1404774"
138,"spotify:track:6hu4HvpNzrW2RIEEAZC3vD","KayBlack, Marquinho no Beat, Wall Hein","Segredo","WM Brazil",19,133,55,"1394675"
139,"spotify:track:6BWWgcNJWXQ4qRuzY5LzBP","Felipe Amorim, MC PH, WIU, DG e Batidão Stronda","Tenho que Me Decidir","One Play",110,121,10,"1391564"
140,"spotify:track:2M21J0K1loziNizJzs2gmB","Gusttavo Lima, Hugo & Guilherme","Torce o Olho - Ao Vivo","Sony Music Entertainment",18,135,22,"1387289"
141,"spotify:track:2IDf0IZ9dfw0uDYV2n1bJc","Luan Santana, Ana Castela","DEJA VU","Sony Music Entertainment",1,139,19,"1377081"
142,"spotify:track:2pidGuLSSVZPcbzE5QA1Ux","Hugo & Guilherme","Elevador - Ao Vivo","Som Livre",35,160,45,"1351291"
143,"spotify:track:2BYQzRnQvFvLwfJSLYQjfn","Pabllo Vittar","São Amores","Sony Music Entertainment",143,-1,1,"1349227"
144,"spotify:track:0cpCu3J0Xg1did5lnzDCJs","Mc IG, Murillo e LT no Beat","Só Mais Um Copo","WM Brazil",35,89,5,"1346502"
145,"spotify:track:5XHlXhyvkzl9rEJxKZKQlH","Luan Pereira, Gustavo Mioto","MOLETOM","Som Livre",9,149,42,"1343077"
146,"spotify:track:4zDaVEHAvqPiIQN7jKtmhM","PEDRO SAMPAIO, Mc Gw, MC Meno K, Delano","SEQUÊNCIA COLOCADÃO","WM Brazil",146,-1,1,"1333401"
147,"spotify:track:1bjvTcHiftBtqeK6Y2Mh8H","Oruam, WIU, Chris MC, Mainstreet","Para de Mentir","Mainstreet Records",82,144,22,"1322739"
148,"spotify:track:1dx7F1j3W2wlgyxwvkFksY","Ana Castela","Solteiro Forçado - Ao Vivo","AgroPlay",3,141,41,"1309404"
149,"spotify:track:1CtcgU1q0BgJN4Aottdscu","Anitta, DENNIS, PEDRO SAMPAIO","Joga Pra Lua","Republic Records",21,102,18,"1261129"
150,"spotify:track:6lVO4RRaF6PZCo9ClhXy0A","MC Ryan SP, Mc Davi, Mc Livinho, Gaab, Dj Yuri Pedrada, Turma do Pagode, Mc Kadu, MC Paulin da Capital, Mc Kanhoto, DJ WN","Pagodeiro, Pt. 2","GR6 Music",62,142,5,"1254405"
151,"spotify:track:6xRDvureEBwHgwAYDufbJL","Eric Land, Tarcísio do Acordeon","Chorei na Vaquejada","Eric Land",15,158,39,"1252509"
152,"spotify:track:5EU5tSDTddhhaBMLAmHgHT","MC Paulin da Capital, Mc Lipi, Mc Paiva ZS, MC Lemos, Djonga, Mc Lele JP, Gabb MC, Mc Piedro, MC Ryan SP, MC Marks, Mc Kadu, MC Joãozinho VT, Hungria, Dj GM, Oldilla","Set Wesley Alemão 2","Love Funk",146,146,2,"1252189"
153,"spotify:track:2l6YkP5Rj1w3GsrhE7cDqx","DJ GUIZIN DA SERRA, MC Marlon PH","MTG - BARRACO DELA LÁ","DJ GUIZIN DA SERRA",153,173,2,"1245843"
154,"spotify:track:7AaXqLqmrZtRmOr5tIjn8D","Matheus & Kauan, Maiara & Maraisa","Não Sei Se Tô Solteiro - Ao Vivo","Universal Music Ltda (S&D)",154,-1,1,"1242850"
155,"spotify:track:6XSTDJMW7yUr4Zuzyr4Ht6","Borges, Filipe Ret, TkN, Mindu","Lenda","Mainstreet Records",110,172,12,"1242058"
156,"spotify:track:2HWogzHGTVaCYoj3ZRVwRa","Mc IG, DJ Glenner","Goodnight Menina 3","WM Brazil",52,126,4,"1236271"
157,"spotify:track:60cnRRDftZPrzn2iFutTkV","Nilson Neto","Lua","Roça Music",157,-1,1,"1231067"
158,"spotify:track:6mIAta8vOaOhCM4yh8P2FJ","George Henrique & Rodrigo, Henrique & Juliano","Seu Oposto","World Show Produções",158,162,4,"1225636"
159,"spotify:track:3PH1nUysW7ybo3Yu8sqlPN","Israel & Rodolffo, Mari Fernandez","Seu Brilho Sumiu - Ao Vivo","Som Livre",2,193,59,"1225608"
160,"spotify:track:0EMf4CzvPd1z50iqRbmLfl","Maria Marçal","Deixa","MK Music",136,181,28,"1223617"
161,"spotify:track:0cvVetonbe66pOOPMtuSOC","L7NNON, MC Cabelinho, Palma, HHR","Vamo Marolar","HHR Records",161,-1,1,"1210553"
162,"spotify:track:1BxfuPKGuaTgP7aM0Bbdwr","Taylor Swift","Cruel Summer","Taylor Swift",55,159,47,"1207817"
163,"spotify:track:3fYzMA9OWy0lgOUv79alde","DJ BIEL PRADO, Mc KF, C.Z, VORTEX, VYRUS","Last Night (Versão BH)","DJ BIEL PRADO",148,148,2,"1199823"
164,"spotify:track:5TtTijiNYtFc6ktQARjY30","KayBlack, Wall Hein","Preferida","WM Brazil",13,190,53,"1199373"
165,"spotify:track:6bTdZ7xfKp3NqqADJ8HLyj","Matuê, WIU, Teto","Vampiro","Sony Music Entertainment",1,175,104,"1191348"
166,"spotify:track:1GOS5OIo4KywJF7Fw9QR4E","NATTAN","A Gente Se Entrega","Feeling",78,196,20,"1190787"
167,"spotify:track:4eAv4K2XuhL2e2kZyOFBrS","Kadu Martins","Americana em Fortal","Kadu Martins",167,-1,1,"1189034"
168,"spotify:track:5HFvMPiNjclAq8DbEAPWMw","Gilsons","Várias Queixas","Xirê",146,170,37,"1182437"
169,"spotify:track:3qmhtqI0Il8gjt6YeMIGH6","Bruno & Marrone","Fantasma da Saudade - Ao Vivo","Worldshow Promoções e Eventos",100,127,8,"1181076"
170,"spotify:track:2LTlykcdu0gwb7zcKneo2a","KayBlack, Baco Exu do Blues, Marquinho no Beat","Melhor Só","WM Brazil",3,164,55,"1175855"
171,"spotify:track:5l3oyyQTWZc5htAE4F7kAQ","pumapjl, SonoTWS","Intro","Tired Of People",154,154,2,"1174384"
172,"spotify:track:7wthqJFd8mVZQ8Cns645AZ","Gusttavo Lima, Bruno & Marrone","Relação Errada - Ao Vivo","Sony Music Entertainment",100,153,8,"1173208"
173,"spotify:track:4iRAUEDRCAGGAp7GAi4BYV","DJ PK O Único, MC RESTRITO ORIGINAL","Tu Sabe Amo Seus Peitos","DJ PK O Único65t",173,-1,1,"1163723"
174,"spotify:track:6ELMBm3lZFitAZp03GBBNG","Gabriela Rocha","Me Atraiu - Ao Vivo","Onimusic",75,169,61,"1157674"
175,"spotify:track:34eKejr8wd69fFpL38IIfv","Valesca Mayssa, Todah Music","Eu Sou Teu Pai - Ao Vivo","Todah Music",161,161,15,"1154354"
176,"spotify:track:4dHMuSjpkUcWW3zZehOFj7","Maiara & Maraisa","Narcisista - Ao Vivo","Som Livre",27,155,40,"1153176"
177,"spotify:track:5Ih7yhSHs3F0NY10Pvr7Xq","Pabllo Vittar, Will Love","Rubi","Sony Music Entertainment",177,-1,1,"1148368"
178,"spotify:track:4aFZiSRqkxC5sIbSDMWBE5","Wesley Safadão","Rua - Ao Vivo em Bahamas","Wesley Safadao",94,123,20,"1146446"
179,"spotify:track:0EhGgIoOPjsqfB2ktrGgJd","Felipe e Rodrigo, Simone Mendes","Oceano (Ao Vivo)","MK Records",45,-1,13,"1143316"
180,"spotify:track:6qYTjIEgne0leltNnvpSIM","Luan Pereira, Hugo & Guilherme","CHEIRO NA CAMISETA","Som Livre",27,192,23,"1142689"
181,"spotify:track:7hTcWFvAtNShxBUxAmsPMI","Henry Freitas","Novinha Bandida","Henry Freitas",176,-1,2,"1139019"
182,"spotify:track:7bukHRNgGLRySTJEVvLoIR","Henrique & Juliano","Briga Feia (Ao Vivo)","Vida Nova Produções, sob licença exclusiva para Virgin Music Group",22,185,100,"1135019"
183,"spotify:track:7IIDB25xKfPbw595U53Ose","George Henrique & Rodrigo, Marília Mendonça","Vai Lá Em Casa Hoje - Ao Vivo","Worldshow Promoções e Eventos",1,157,81,"1133533"
184,"spotify:track:3wGCPlQ2wuOldRAyikdyWh","Clayton & Romário, Simone Mendes","Traindo No Escuro - Ao Vivo","Virgin Music Label And Artist Services (S&D)",184,-1,2,"1130084"
185,"spotify:track:1ggAVLO5PbO0I2mWDlsFFQ","Henrique & Juliano","Recaídas (Ao Vivo)","Vida Nova Produções, sob licença exclusiva para Virgin Music Group",185,189,2,"1126088"
186,"spotify:track:4tuFNhM69UakXdPg4RrNvp","Filipe Ret, Dallass, Hunter","Deus Perdoa","Som Livre",45,-1,26,"1118158"
187,"spotify:track:3PLdcrfVesYKyTpS1EXsxO","Dilsinho","Diferentão - Ao Vivo","Sony Music Entertainment",77,163,41,"1117876"
