rank,uri,artist_names,track_name,source,peak_rank,previous_rank,weeks_on_chart,streams
1,"spotify:track:6RjSXi9cPGroetXeNsWFGL","DJ TOPO, Seu Jorge, Mc Leozin, MC G15","MTG QUEM NÃO QUER SOU EU","DJ TOPO",1,1,5,"10567602"
2,"spotify:track:106SKHXoytRADjpxHBkJpV","dj sv, Doug Hits, Manim Vaqueiro","Mtg Forró e Desmantelo","Doug Filmes",2,7,8,"8773781"
3,"spotify:track:7IFsTX5H1sWcEl8joV0IdD","THE BOX, Mc Brinquedo, MC Cebezinho, MC Tuto, Mc Laranjinha, DJ Oreia","THE BOX MEDLEY FUNK 2","Sony Music Entertainment",2,3,7,"8644286"
4,"spotify:track:13KLZ8VI9P7H7bxs0vtsXC","Dj Luan Gomes, Tropa da W&S","MTG QUERO VER SE VOCÊ TEM ATITUDE","PDF Records / W&S Music",4,16,4,"7878740"
5,"spotify:track:6hNREzgHbVM5AkGwP4SPmU","Luan Pereira, Murilo Huff","FALTA DE QUÊ?","Som Livre",4,4,4,"7327925"
6,"spotify:track:027ielmg4mNR1p1Ds3Mvgh","DJ Ws da Igrejinha, DJ JOÃO PEREIRA, Mc Dudu Sk, MC TH DA SERRA, DALÃMA","Não Vou Namorar","Dalama Records",4,5,12,"7118915"
7,"spotify:track:3kBYuWrGtx1tSHjzr0vlZh","Mc IG, Murillo e LT no Beat, DJ Glenner","Sorriso no Rosto","WM Brazil",7,15,2,"7005842"
8,"spotify:track:7ldcYtMOjtX1eFVEYzj2kJ","Luísa Sonza, KayBlack","Sagrado Profano","Sony Music Entertainment",8,22,3,"6858215"
9,"spotify:track:6W196uVRkmQFHbc1XV8DNk","CountryBeat, Félix, Léo Souzza","Sonho Dela (Cowboy)","CountryBeat",9,11,5,"6835731"
10,"spotify:track:5GV7OpSEb8MPTryL0Q5i6c","DJ JZ, Humberto & Ronaldo, Mc Mininin, DJ LG PROD, Silvanno Salles","Mtg Quero Te Encontrar","Tropa do Serrão",1,10,14,"6817252"
11,"spotify:track:3w392XWJ5bXzjcCR2Dmvqn","Zé Neto & Cristiano, Ana Castela","Foi Intenso - Ao Vivo","Som Livre",5,8,6,"6539179"
12,"spotify:track:4VNRWHoiKHZJIoQHPbmJIv","Felipe e Rodrigo","Gosta De Rua (Ao Vivo)","MK Records",1,9,10,"6350566"
13,"spotify:track:6cFW2FPaUL4YRJfS9zFJaV","Simone Mendes","Dois Tristes - Ao Vivo","UME - Global Clearing House",4,6,15,"6215611"
14,"spotify:track:0WiJIa3V9GdcJfcy1FhLjp","Zé Neto & Cristiano","Deu Moral - Ao Vivo","Som Livre",5,13,9,"5273902"
15,"spotify:track:6X6jKoyw1OjogRghMEQAZV","Jorge & Mateus, Lauana Prado","Haverá Sinais - Ao Vivo","Som Livre",2,12,16,"4809452"
16,"spotify:track:0cvVetonbe66pOOPMtuSOC","L7NNON, MC Cabelinho, Palma, HHR","Vamo Marolar","HHR Records",12,14,9,"4563481"
17,"spotify:track:0HDMisLsuGNml98Xq7atpm","Luan Santana, Luan Pereira","EU SOU SENTIMENTO","Sony Music Entertainment",17,-1,1,"4433613"
18,"spotify:track:24R0oyjvhV4HIFFvoK3XkP","Tropa do Bruxo, SMU, Dj Vitin do Pc, MC JF, MC NAHARA","TUMBÁTUM","Tropa Do Bruxo",11,21,18,"3993651"
19,"spotify:track:5r0JHIjcY7dLWHkljNeQbj","Murilo Huff","Anestesiado - Ao Vivo","M Show",4,20,30,"3980539"
20,"spotify:track:0Q1ySdDoHDiotYn4nbMXNm","Nagalli, KayBlack, Veigh, Supernova Ent","CONFISSÕES PT2","Supernova Ent",8,18,7,"3943785"
21,"spotify:track:3iam4WkRoqMoBBCwDFZNgd","Henrique & Juliano","Quase Algo (Ao Vivo Em Nova Iorque) (2022)","Vida Nova Produções, sob licença exclusiva para Virgin Music Group",17,33,39,"3807657"
22,"spotify:track:5jrQZnYInM6YUjr2yFSa3E","MC PH, Vulgo FK, Veigh, Pedro Lotto, prodbyeros","Vem Desestressar","GR6 Music",22,26,10,"3671751"
23,"spotify:track:42JNab8NPeCADJ9D3Cl5wS","Zé Neto & Cristiano","Barulho Do Foguete - Ao Vivo","Som Livre",4,29,50,"3659059"
24,"spotify:track:60wgnlVBEsyswrTB6pYiTi","amblu","Como Um Beijo","amblu",24,69,2,"3644260"
25,"spotify:track:1WHDOr19zyyqu6XXIvdgfX","Hugo & Guilherme, Maiara & Maraisa","Morena De Goiânia - Ao Vivo","Som Livre",11,28,12,"3555322"
26,"spotify:track:3hfCle1QRfbwIpQ1B746lV","MC Saci, Complexo dos Hits, DJ Sammer, Mc Pretchako","Aquariano Nato","eumcsaci",2,25,37,"3488466"
27,"spotify:track:6P1mkNAmgihFwFRBhpaev3","Luan Pereira, Mc Daniel","ENTRA NA DEFENDER","Som Livre",3,32,12,"3437523"
28,"spotify:track:5mJcnekfy4DEpAZ6uAHM7Y","Thullio Milionário","Casca de Bala","Thullio Milionário",10,38,10,"3415431"
29,"spotify:track:3QpDKVHmf9RDQkJbAUNWzI","Gustavo Moura & Rafael","Digitando","Astro Produções",1,2,16,"3382425"
30,"spotify:track:5brVlCCt8gp4pP0iJOOctj","MC Ryan SP, Filipe Ret, Caio Luccas, Chefin, Dallass, Rocco","Melhor Vibe","WM Brazil",22,36,12,"3355698"
31,"spotify:track:35D06z7kmwMmYYbyJ0BkSm","Manu, Simone Mendes","Daqui pra Sempre","manuoficial",3,17,37,"3348133"
32,"spotify:track:0VybBobSYSzliyEJ1VqwGR","WIU, Teto","Problemas de um Milionário","30PRAUM",17,40,9,"3315729"
33,"spotify:track:6Gn8SHd3RIWjOermcidCJk","Dj Lc, DJ JOAO DA INESTAN, Mc Pretchako, MC Saci, Complexo dos Hits","A Internet É Toxica","Complexo dos Hits",7,23,32,"3301995"
34,"spotify:track:7BRD7x5pt8Lqa1eGYC4dzj","Billie Eilish","CHIHIRO","Darkroom/Interscope Records",17,46,4,"3282791"
35,"spotify:track:2IvsDK2p7Kq3aDrVtESDIg","Ana Castela, Gustavo Mioto","Fronteira - Ao Vivo","AgroPlay",7,43,30,"3232492"
36,"spotify:track:54UGdW621lBINbfMWJmmSO","Manu, Guilherme & Benuto","Torre Eiffel - Ao Vivo","manuoficial",26,67,15,"3231482"
37,"spotify:track:6r6wTVl7sBndpdlzBSEYnF","Ana Castela, Hungria, Alok","Lua","AgroPlay",6,41,17,"3175630"
38,"spotify:track:2RX89Di479sc53wkaNgt9E","Hugo & Guilherme","Vazou Na Braquiara - Ao Vivo","Som Livre",15,35,21,"3160566"
39,"spotify:track:7pnqm6UEb7SzpDxb53wULT","Mc IG, MC Ryan SP, Oruam, MC PH, Mc Poze do Rodo, MC GP, TrapLaudo, Mc Luki, MC GH do 7, MC Nego Micha, Murillo e LT no Beat","Diz Aí Qual é o Plano?","WM Brazil",1,39,14,"3140841"
40,"spotify:track:2ORC76autQ7QTfBCkZl4Wo","Murilo Huff","Dedo do Meio - Ao Vivo","M Show",20,31,11,"3126978"
41,"spotify:track:5asabafNzfAzjUecDvuNES","Henrique & Juliano","Aquela Pessoa (Ao Vivo)","Vida Nova Produções, sob licença exclusiva para Virgin Music Group",39,45,124,"3106525"
42,"spotify:track:5u7Xi0QhfkYy3qETJJ5lae","MC Paulin da Capital, Love Funk, Mc Piedro, Dj GM, DJ WN, MC Ryan SP, Mc Daniel","Samba de Malandro","Love Funk",22,37,13,"3104338"
43,"spotify:track:6fPrHPV507dPlPaV1AkpfG","Maneva, Juliette","Péssimo Negócio - Ao Vivo","Universal Music Ltda.",43,53,12,"3075272"
44,"spotify:track:2sYFUcurlISdHlAsnYCEgD","Lauana Prado","Me Leva Pra Casa / Escrito Nas Estrelas / Saudade - Ao Vivo","Universal Music Ltda.",1,42,28,"3040387"
45,"spotify:track:6dOtVTDdiauQNBQEDOtlAB","Billie Eilish","BIRDS OF A FEATHER","Darkroom/Interscope Records",43,60,4,"2968827"
46,"spotify:track:4YKujFSyakVjLdH1sDllVc","Simone Mendes","Dois Fugitivos - Ao Vivo","Universal Music Ltda.",5,19,39,"2954760"
47,"spotify:track:6Tp4LCJ5r5IJaEf8lnlPfG","Henrique & Juliano","De Trás Pra Frente (Ao Vivo)","Vida Nova Produções, sob licença exclusiva para Virgin Music Group",17,54,87,"2865239"
48,"spotify:track:6mTpK40yIRk1xGGNvRMHGg","Murilo Huff, Gustavo Mioto","Me Caiu Tão Bem - Ao Vivo","M Show",48,-1,1,"2826821"
49,"spotify:track:2qSkIjg1o9h3YT9RAgYN75","Sabrina Carpenter","Espresso","Island Records",49,68,9,"2822036"
50,"spotify:track:1jN0ysNJ2d9VZwVdlgspjr","MC Saci, MC Fahah, DJ Sammer, Dj Lc","De 10 Mulher 11 É Maluca","eumcsaci",6,55,16,"2756441"
51,"spotify:track:0ODlZu2uJ13I29NfFJJVir","Luan Santana, MC Kevin o Chris","PEGA ESCANDALOSO","Sony Music Entertainment",21,48,11,"2752585"
52,"spotify:track:3FB06ULqN0WNUSQ3UaMZnF","blicko","Amor Na Praia","blicko",7,51,14,"2664264"
53,"spotify:track:629DixmZGHc7ILtEntuiWE","Billie Eilish","LUNCH","Darkroom/Interscope Records",16,49,4,"2661564"
54,"spotify:track:2kFaWbpzQzpaJ0H6PskR6k","Mari Fernandez","Página De Ex - Ao Vivo","Som Livre",54,72,6,"2636984"
55,"spotify:track:6GmyQws2xpUFIN5dXBNTrl","AgroPlay, Ana Castela, LUDMILLA","Dia de Fluxo","AgroPlay",4,61,25,"2633550"
56,"spotify:track:3l5VjEAeUTqrlD50iEo8Yn","KayBlack, CVSTRO, Wall Hein, AMUSIK","Licor 43","Elenko Music",52,52,91,"2557197"
57,"spotify:track:3EuPKX0FLhAxfL5hZBlfJe","DJ Zigão, DJ Lafon Do Md, Mc Rodrigo do CN, Mc Rf","Te Maceto Depois Do Baile","Dj Zigão",57,86,2,"2553057"
58,"spotify:track:1CpneInvFvGYcDVU4CCDgI","Ana Castela","Minha Herança - Ao Vivo","AgroPlay",58,125,2,"2525713"
59,"spotify:track:4sAoshwHCmh4IHMQxZHwRD","TR, Mc Menor RV, Tropa da W&S","Baby Eu Tava na Rua da Água","WMD",1,64,21,"2498178"
60,"spotify:track:4jbTB2Kj4CrZCjngkQUQS2","Murilo Huff","A Cerveja Abre Sozinha - Ao Vivo","M Show",16,63,22,"2487829"
61,"spotify:track:6mJCx80Wc91GPi9ew9bkmD","DENNIS, Ana Castela, Mc Gw","RAM TCHUM","Sony Music Entertainment",3,62,15,"2452290"
62,"spotify:track:7j0N4df9g0jECdfSR07elf","Eric Land, MC PH","Vem Desestressar","Eric Land",27,27,6,"2448776"
63,"spotify:track:5Z0UnEtpLDQyYlWwgi8m9C","Hozier","Too Sweet","Rubyworks / Universal-Island Records Ltd",45,65,10,"2413668"
64,"spotify:track:2InS5VWKJQbsFBKOsf1cJB","Dj GBR, Mc IG, MC Ryan SP, MC PH, Mc Davi, Mc Luki, Mc Don Juan, Mc Kadu, TrapLaudo, MC GP, MC GH do 7","Let's Go 4","GR6 Music",1,71,40,"2364932"
65,"spotify:track:5RHOhXxMVhpEaBcG6hIydA","KayBlack, Wall Hein, AMUSIK","Maturidade","Elenko Music",65,81,37,"2318220"
66,"spotify:track:1i2kguziI3ZbUZnZMKNhQ2","Mc IG, DJ Jorgin","400K","GR6 Music",45,73,27,"2311513"
67,"spotify:track:2VUUzKS50OxWyTRu1J0YKH","Matheus & Kauan","Não Recomendo - Ao Vivo","Universal Music Ltda (S&D)",11,58,28,"2309823"
68,"spotify:track:65vJAh07BdwurqR9SRa6f8","Ferrugem, Sorriso Maroto","Apaguei Pra Todos - Ao Vivo","WM Brazil",59,66,8,"2263108"
69,"spotify:track:1m5nbZiPpCIi9J2irLNoxh","Oruam, Didi, Dj Lc da Roça, MC K9, MC Smith, Mainstreet","Rolé na Favela de Nave","Mainstreet Records",9,74,19,"2250860"
70,"spotify:track:4v7UrPWZL4FJWeL5ZWQ62E","Henrique & Juliano","Seu Erro (Ao Vivo Em Nova Iorque) (2022)","Vida Nova Produções, sob licença exclusiva para Virgin Music Group",43,80,34,"2228904"
71,"spotify:track:5N3hjp1WNayUPZrA8kJmJP","Sabrina Carpenter","Please Please Please","Island Records",71,-1,1,"2220158"
72,"spotify:track:6FllOXq1UDCFDt1V4YvN3K","Mc Daniel, DJ WN, Dj GM","Vamo de Pagodin","Lyons Produções",72,147,4,"2189260"
73,"spotify:track:6Szybvvxu3Hd0PfTR1EzwS","Zé Felipe","MINHA EX","Som Livre",25,34,6,"2182780"
74,"spotify:track:2SFcDfkE1MRXZfl4LIwscm","Flozimbar","Hysteria","Robin",74,130,2,"2162967"
75,"spotify:track:1BSsJm88q13n15TgJqvqBp","João Gomes, Iguinho e Lulinha, Tarcísio do Acordeon","Coração de Vaqueiro","JG Shows",47,47,5,"2116389"
76,"spotify:track:3GpIX415jZqsGDzbiZeBAS","Dilsinho, Ana Castela","Passada de Mão - Ao Vivo","Sony Music Entertainment",9,88,19,"2082035"
77,"spotify:track:3xkHsmpQCBMytMJNiDf3Ii","Benson Boone","Beautiful Things","Night Street Records, Inc./Warner Records Inc.",40,82,18,"2077461"
78,"spotify:track:7Elw15XWLpOi4qzHyAwa9e","Gloria Groove","Nosso Primeiro Beijo - Ao Vivo","SB Music",78,184,2,"2061264"
79,"spotify:track:40IXmplKTcyWPr9HNCik7e","Matuê, MC Ryan SP","Filho da Noite","Sony Music Entertainment",14,85,7,"2057726"
80,"spotify:track:2HzLEPWKXcfpwfmEIUURHo","Tz da Coronel, Ryu, The Runner, Nagalli, Cúpula","Qual é seu desejo?","Cúpula",1,79,15,"2057668"
81,"spotify:track:7dKqPh21HpsysZvRWyNeM1","Isadora Pompeo","Bênçãos Que Não Têm Fim (Counting My Blessings)","Sony Music Entertainment",10,89,31,"1969181"
82,"spotify:track:2BPZCE8hyWgaURPxQNA7pq","Jefferson Moraes","Péssima Hora - Ao Vivo","Astro Produções",4,24,12,"1949127"
83,"spotify:track:5AJ9hqTS2wcFQCELCFRO7A","Tommy Richman","MILLION DOLLAR BABY","PULSE Records",53,94,6,"1911271"
84,"spotify:track:4OMSfAavn8k6HxZ0HwVtV1","Nagalli, Menor MC, Dfideliz, CJota, Leviano, Supernova Ent","CONFISSÕES PT1","Supernova Ent",84,106,7,"1910939"
85,"spotify:track:6vq7r1Pqd3pyI07u63cPZV","Simone Mendes","Erro Gostoso - Ao Vivo","Universal Music Ltda.",3,56,72,"1896868"
86,"spotify:track:6GS4LfVknh458V4z6llLRa","Mc guizinho niazi, Dj Luizinho MPC","Machuquei","4M RECORDS",86,110,5,"1896091"
87,"spotify:track:2hloKDkwGLjtYvAoqn39gV","Mc Jacaré, Luan Pereira","Senta Pro Bruto","Croco Hits",50,121,13,"1887751"
88,"spotify:track:2xVe3wMbesHcOhqW8OoyS8","fhop music, Hamilton Rabelo","Tu és + Águas Purificadoras - Ao Vivo","FHOP Music",71,92,13,"1886706"
89,"spotify:track:1NcqLEg2r2LXqMVbam2BJD","Matheus Fernandes, Matheus & Kauan","Triplex - Ao Vivo","Som Livre",89,-1,1,"1860193"
90,"spotify:track:7z2hqtAyf6FR39ZZmVkvcO","DJ RENAN DA BL, Dj Jl Do Tp, Mc Pretchako, Mc Menor Thalis","Eu Vou Cair na Noite","Belo Music Produtora",51,95,33,"1857152"
91,"spotify:track:4D25RP3yiJWfW9utK9dMyv","Rayane & Rafaela, Henrique & Juliano","Ali Te Ama - Ao Vivo","Henrique e Juliano oficial",64,119,33,"1834814"
92,"spotify:track:54FV2rMVwLusAVnzROB0c1","Orochi, Caio Luccas, Pedro Lotto, Mainstreet, Galdino, Ribb","Mesma História","Mainstreet Records",56,103,35,"1832975"
93,"spotify:track:0bor3AJ8QV6RRbyV64ZsOO","Fiduma & Jeca, Fernando & Sorocaba","Cortando as BR (F&J 10 Anos) - Ao Vivo","Fiduma & Jeca",93,136,2,"1812728"
94,"spotify:track:5DcysyjaPrLzXgDauvzvn6","George Henrique & Rodrigo, Guilherme & Benuto","Beijo Equivocado","Worldshow Promoções e Eventos",44,116,38,"1797360"
95,"spotify:track:53PpijFATt35Zxfl6LTxoK","Marília Mendonça","Leão","Som Livre",1,107,79,"1793947"
96,"spotify:track:5g7sDjBhZ4I3gcFIpkrLuI","Bruno Mars","Locked out of Heaven","Atlantic Records",67,111,28,"1792640"
97,"spotify:track:7umgf0NrHZgIAI0ep64sLc","Mc IG, Veigh, Toledo, Bvga Beatz, Galdino, Honaiser","Olá, Moça","WM Brazil",29,123,12,"1769544"
98,"spotify:track:5RKHkJ5tpJXeBRsWlxz1Ly","Henry Freitas, Xand Avião","Alteradão (feat. Xand Avião)","Sony Music Entertainment",98,154,2,"1769125"
99,"spotify:track:5F6xDGrQJMDg2sFEZimwGl","Henry Freitas, Mc Gw, PEDRO SAMPAIO","Barulho do Prazer - Ao Vivo","Sony Music Entertainment",66,101,8,"1764354"
100,"spotify:track:7McCAKExE8KsI2q4Y8wx4U","Murilo Huff, Marília Mendonça","Dois Enganados","M Show",49,108,98,"1763185"
101,"spotify:track:3pLyNmLlw6uRrKaNwMnXOR","Josué Bom de Faixa","Não Precisa Negar","PAX MUSIC",74,122,22,"1761882"
102,"spotify:track:7bEr5WRLPVKM6pdpZFiheb","Xand Avião, Simone Mendes","Primeiro Passo / Ânsia / Volta Vai - Ao Vivo","Som Livre",44,44,13,"1751466"
103,"spotify:track:7CyPwkp0oE8Ro9Dd5CUDjW","The Weeknd, JENNIE, Lily-Rose Depp","One Of The Girls (with JENNIE, Lily Rose Depp)","XO / Republic Records",61,112,27,"1749125"
104,"spotify:track:697gwO5YoSGVAnlfREIZll","MC PH, Borges, WIU, Pedro Lotto, WEY","Tenho Que Me Decidir","GR6 Music",4,114,28,"1743019"
105,"spotify:track:7sopDXkuzXtHt8AQpdBxmT","Ana Castela","DONA DE MIM","AgroPlay",13,134,77,"1742718"
106,"spotify:track:6RqEGo7zvc8g31ZyG1Mm6Q","Mc Jacaré, MC Kevin o Chris","A Culpa Não É Minha","Croco Hits",106,-1,1,"1717922"
107,"spotify:track:4bDvY5oGtCWTYH5Vi36bc5","Henrique & Juliano","Mais Amor E Menos Drama (Ao Vivo)","Vida Nova Produções, sob licença exclusiva para Virgin Music Group",107,-1,79,"1710283"
108,"spotify:track:0zxWyvrKyz031tFfBnkYLr","Henrique & Juliano","Como É Que A Gente Fica (Ao Vivo)","Vida Nova Produções, sob licença exclusiva para Virgin Music Group",23,105,82,"1685154"
109,"spotify:track:2QjOHCTQ1Jl3zawyYOpxh6","The Neighbourhood","Sweater Weather","Columbia",97,113,78,"1682378"
110,"spotify:track:17phhZDn6oGtzMe56NuWvj","Teddy Swims","Lose Control","Warner Records",82,126,17,"1682016"
111,"spotify:track:7uPInsxTeMbyrJkDQaRwPh","DJ THG, Mc Arizinho, Tavin","É Que Eu Te Sarrei","A2M Produtora",111,150,4,"1669311"
112,"spotify:track:7r8yMaSOy4XmuhRz7iv1gi","Henrique & Juliano","Traumatizei (Ao Vivo Em Brasília)","Vida Nova Produções, sob licença exclusiva para Virgin Music Group",6,127,71,"1660344"
113,"spotify:track:2IGh6DnMiX408xwoJP9Lmb","LUDMILLA, Mari Fernandez","Falta de Mim - Ao Vivo","SEM QUERER MUSIC",51,77,18,"1652727"
114,"spotify:track:4OOoK6nkSn6OSVWBdrEKB0","Pedro Paulo & Alex, Murilo Huff","Se Eu Beber Uma Lata - Ao Vivo","Roça Music",114,182,6,"1643563"
115,"spotify:track:6zFpImDYig0CQhLL2NIfyN","AgroPlay, Ana Castela","Nosso Quadro","AgroPlay",1,146,71,"1641288"
116,"spotify:track:3lHV3YbZNltXHyZaDDpios","Mc Laranjinha, Dj Lv Mdp","Ligou na Madruga","DC MUSIC",108,131,9,"1639014"
117,"spotify:track:6xW61JP2f3hcsbOwn7dzi5","Mc IG, MC Ryan SP, MC PH, DJ Glenner","É Isso Bebê, Tá Certa!","WM Brazil",6,138,12,"1638336"
118,"spotify:track:3knAG9kd3jNNuJlZZUAOoQ","Gusttavo Lima, Murilo Huff","Cep Novo - Ao Vivo","Sony Music Entertainment",98,129,9,"1637205"
119,"spotify:track:31ruhXo3xWYJUfGk1uU77y","MC PH, WEY, Pedro Lotto, Gustah","Me Chama Pelo Meu Vulgo","GR6 Music",119,160,2,"1636858"
120,"spotify:track:4BW3EWKB6wg9jyQb32tcv1","Léo & Raphael, Luan Pereira, AgroPlay","Tipo Yellowstone","AgroPlay",78,148,7,"1635736"
121,"spotify:track:1OwoPY7wYgKQIyl9maWmSM","Gusttavo Lima, Ana Castela","Canudinho - Ao Vivo","Sony Music Entertainment",2,93,41,"1631639"
122,"spotify:track:0oQCRjrWGvkqkdf82UlXI3","PEDRO SAMPAIO","POCPOC","WM Brazil",1,145,28,"1630174"
123,"spotify:track:5mmxylfcIlTaTftZwIIj3W","Henrique & Juliano","Você Vai Ser Fiel (Ao Vivo Em Nova Iorque) (2022)","Vida Nova Produções, sob licença exclusiva para Virgin Music Group",85,128,28,"1628168"
124,"spotify:track:0QcKkN8b4iVkmVsbaze8OS","Henrique & Juliano","Devia Ser Proibido (Ao Vivo Em Brasília)","Vida Nova Produções, sob licença exclusiva para Virgin Music Group",23,115,46,"1627358"
125,"spotify:track:00Nh5jZl5ilpe6aCrhvZTb","Diego & Victor Hugo","Bem Mais Que Eu (Você Quer Caçar Seu Rumo) - Ao Vivo","Sony Music Entertainment",91,91,5,"1626748"
126,"spotify:track:0h7m2GwOZFptFrg7e7tiTn","Mc Kelvinho, MC Hariel, MC Ryan SP, MC Neguinho do Kaxeta, Mc Daniel, Kyan","Avisa Lá, Pt. 4","GR6 Music",101,124,5,"1624796"
127,"spotify:track:4f0aDk7HX37SfzerfznYlr","Grupo Menos É Mais, Matheus Fernandes","Lapada Dela - Ao Vivo","Som Livre",4,117,68,"1620571"
128,"spotify:track:60JOVAVMWEl4JgYHwaVx8l","Márcia Fellipe","A Mulher Mais Foda do Brasil - Ao Vivo","Marcia Fellipe",50,50,4,"1585453"
129,"spotify:track:07gyedLla60LsxCljcKCiv","Felipe Amorim","Eu Só Quero Tu","One Play",109,109,2,"1565474"
130,"spotify:track:6QxaJjXCxZSGKq98arP8Nw","Julliany Souza","Lindo Momento - Ao Vivo","PART",121,140,8,"1550821"
131,"spotify:track:5XeFesFbtLpXzIVDNQP22n","Arctic Monkeys","I Wanna Be Yours","Domino Recording Co",78,144,92,"1543460"
132,"spotify:track:0OBv4CEP5FKS19ZQGHAUM6","Mc Paiva ZS, DJ Ak beats, Love Funk","Fala na Cara","Love Funk",85,163,24,"1542997"
133,"spotify:track:2prqm9sPLj10B4Wg0wE5x9","Billie Eilish","BLUE","Darkroom/Interscope Records",62,142,4,"1540027"
134,"spotify:track:6BWWgcNJWXQ4qRuzY5LzBP","Felipe Amorim, MC PH, WIU, DG e Batidão Stronda","Tenho que Me Decidir","One Play",110,-1,14,"1528553"
135,"spotify:track:2twZl1jsRbJRTNCE6VB6eW","Chefin, Mainstreet, LB Único","10 Carros","Mainstreet Records",8,158,29,"1521586"
136,"spotify:track:6nvbXA95vgyThzj2Tbhank","Mc Ws da leste, MC Cothiê, Dj Chadin do C","Tipo Hollywood","Fera Entretenimento",2,141,30,"1512162"
137,"spotify:track:4Dvkj6JhhA12EX05fT7y2e","Harry Styles","As It Was","Columbia",10,133,112,"1510128"
138,"spotify:track:7Cf2Hsy3cPlA4e115tElXv","Henrique & Juliano","Liberdade Provisória (Live - Ibirapuera / 2019)","Vida Nova Produções, sob licença exclusiva para Virgin Music Group",1,132,116,"1509706"
139,"spotify:track:3fYzMA9OWy0lgOUv79alde","DJ BIEL PRADO, Mc KF, C.Z, VORTEX, VYRUS","Last Night (Versão BH)","DJ BIEL PRADO",107,161,10,"1508429"
140,"spotify:track:1BpnfIGAoWr04mls61Hf5n","Thiago e Samuel, Simone Mendes","Amor Diferente - Ao Vivo","Universal Music Ltda.",24,59,7,"1493924"
141,"spotify:track:6zdL0aLZs6g61SPGrlMvrM","DJ JOÃO PEREIRA, MC Koringa","DANÇA PRA ME PROVOCAR","DJ JOÃO PEREIRA x MC Koringa",18,155,27,"1482608"
142,"spotify:track:0gg3QtCcPZn4aJ0D7dRNul","Manim Vaqueiro","Forró e Desmantelo","Feeling",142,-1,1,"1480352"
143,"spotify:track:4hKLzFvNwHF6dPosGT30ed","Veigh, Bvga Beatz, Prod Malax, Supernova Ent","Novo Balanço","Supernova Entertainment Under Exclusive License to UnitedMasters",2,164,56,"1455442"
144,"spotify:track:3jTyFoGeD3DTu9cnnctMWN","Luan Pereira, Mc Daniel, MC Ryan SP","DENTRO DA HILUX","Som Livre",2,176,42,"1453473"
145,"spotify:track:4utAAjfVe1vIeaVWKUmKhD","Kadu Martins","Biscoiteira","Kadu Martins",145,-1,1,"1444793"
146,"spotify:track:0HlioiDYWAqP6p73XFUOP7","Guilherme & Benuto, Simone Mendes","Manda um Oi - Ao Vivo","Sony Music Entertainment",5,76,57,"1444495"
147,"spotify:track:4QCwvUs4ob87Tq9VP07Uo3","Borges, MC Cabelinho, Veigh, RUXN, Palma, Kizzy","Loucura","Mainstreet Records",11,137,27,"1430653"
148,"spotify:track:348iPnOQyUchyO8LFfX9z9","Simone Mendes","Beleza Ignorante - Ao Vivo","Universal Music Ltda.",75,75,4,"1429402"
149,"spotify:track:1Vy9Wn5sbiduZKBqBlH3Mc","Vulgo FK, MC PH, Veigh, Pedro Lotto, Fepache","Ballena","Som Livre",3,156,48,"1425619"
150,"spotify:track:3QaPy1KgI7nu9FJEQUgn6h","Billie Eilish","WILDFLOWER","Darkroom/Interscope Records",66,152,4,"1422728"
151,"spotify:track:2IDf0IZ9dfw0uDYV2n1bJc","Luan Santana, Ana Castela","DEJA VU","Sony Music Entertainment",1,171,27,"1417017"
152,"spotify:track:5BpNdbgj7stB4AwaV1Tu2R","Djay L Beats, Gerson Neves","MTG Já Que Cê Gosta Tanto de Rua","Djay L Beats",152,-1,1,"1415883"
153,"spotify:track:2329XxRFYoAPdQSb4DmjXQ","Mc IG, Mc Kevin, DJ WN, MC PH","Deus, Por favor","WM Brazil",16,168,12,"1404086"
154,"spotify:track:60cnRRDftZPrzn2iFutTkV","Nilson Neto","Lua","Roça Music",75,-1,7,"1402764"
155,"spotify:track:2l6YkP5Rj1w3GsrhE7cDqx","DJ GUIZIN DA SERRA, MC Marlon PH","MTG - BARRACO DELA LÁ","DJ GUIZIN DA SERRA",127,157,10,"1392446"
156,"spotify:track:4WXVqLSRHF4ypdiBngbcqU","Dj GM, Mc Paiva ZS, Triz, MC Paulin da Capital, Mc Lipi, Mc Lele JP, MC Ryan SP, Gabb MC, Mc Daniel, MC Cebezinho, MC GH do 7, MC Marks, Mc Negão Original, GREGO","Set Dj Gm 6.0","Love Funk",90,170,23,"1391589"
157,"spotify:track:4xAGuRRKOgoaZbMGdmTD3N","Zé Neto & Cristiano","Oi Balde - Ao Vivo","Som Livre",3,162,69,"1389273"
158,"spotify:track:3eHeTsX6W9iIEfn8l2xrWO","Henrique & Juliano","Meu Amor (Ao Vivo)","Vida Nova Produções, sob licença exclusiva para Virgin Music Group",76,174,68,"1376046"
159,"spotify:track:3ZNjlT5zR0jkEVzSSZCQeJ","DJ WN, MC Hariel, MC Ryan SP, MC Paulin da Capital, Mc Lipi, MC Vinny, Gabb MC, Mc Kadu, Mc Daniel, MC GH do 7, NOG, Love Funk","Ritmista 1.0","Love Funk",14,188,23,"1370029"
160,"spotify:track:2d2gzh9YHgJBl7usdvKqgR","Gusttavo Lima, Matheus & Kauan","Mala dos Porta-Mala - Ao Vivo","Sony Music Entertainment",8,167,48,"1363628"
161,"spotify:track:0ReK3QrsiVIyjcFpHyEEsA","Diego & Victor Hugo, Guilherme & Benuto","Vestido Curto - Ao Vivo","Sony Music Entertainment",37,172,25,"1357857"
162,"spotify:track:2HWogzHGTVaCYoj3ZRVwRa","Mc IG, DJ Glenner","Goodnight Menina 3","WM Brazil",52,187,7,"1357845"
163,"spotify:track:5HFvMPiNjclAq8DbEAPWMw","Gilsons","Várias Queixas","Xirê",146,191,40,"1357589"
164,"spotify:track:3PqU6gHWUaBTtIZi5oxEJ7","Zé Neto & Cristiano","Um Mês E Pouco - Ao Vivo","Som Livre",11,173,51,"1356236"
165,"spotify:track:7BqBn9nzAq8spo5e7cZ0dJ","Bruno Mars","Just the Way You Are","Elektra (NEK)",129,175,9,"1348754"
166,"spotify:track:6hu4HvpNzrW2RIEEAZC3vD","KayBlack, Marquinho no Beat, Wall Hein","Segredo","WM Brazil",19,185,63,"1343800"
167,"spotify:track:4ML8zKHATI6s31xmdQD0Qa","Tz da Coronel, MC Ryan SP, KayBlack, Dj Murillo e LT no Beat, Cúpula","Ela joga no 7","Cúpula",92,189,29,"1341376"
168,"spotify:track:5TtTijiNYtFc6ktQARjY30","KayBlack, Wall Hein","Preferida","WM Brazil",13,195,60,"1336965"
169,"spotify:track:45czXKyGyd9g060ogyRjx3","Wesley Safadão","Ninguém Sabe","Wesley Safadao",22,57,10,"1331068"
170,"spotify:track:2LQ67PtoEgJSaRSqoh4k2E","Israel & Rodolffo","Greve De Beijo - Ao Vivo","Som Livre",86,-1,11,"1328932"
171,"spotify:track:2GxrNKugF82CnoRFbQfzPf","Artemas","i like the way you kiss me","Artemas",53,165,11,"1327911"
172,"spotify:track:616O3f20hgTgpmiZf7XgEI","Ryu, The Runner, Yunk Vino, Teto","Embalo","Som Livre",49,159,7,"1318497"
173,"spotify:track:3PGg3V56krasXrPKNvVLQU","Filipe Ret","Amor Livre - Ao Vivo","Som Livre",29,169,26,"1309581"
174,"spotify:track:0redQHBfejmPUhonR5ppGC","Guilherme & Benuto, Ana Castela, Adriano Rhod","Duas Três","Sony Music Entertainment",8,178,69,"1308153"
175,"spotify:track:1ZgsY3WkkS9p1BjHOGeKKh","L7NNON, Veigh, Nagalli","Foto da Unha","HHR Records",70,-1,19,"1303804"
176,"spotify:track:73SIgqXr3oRzzWbX1muX3I","Rionegro & Solimões","Fivela Com Fivela - Ao Vivo","Rionegro e Solimões",176,-1,1,"1290950"
177,"spotify:track:1sTGINNEM4sT3H2hDdQiPe","Fred & Fabrício, Clayton & Romário","Gotejou No Celular - Ao Vivo","Som Livre",126,166,11,"1283324"
178,"spotify:track:1kWcd9h9HoeXsKaDVhSOtj","Sorriso Maroto, Ferrugem","Ela - Ao Vivo","Sony Music Entertainment",44,151,39,"1281712"
179,"spotify:track:006pMMCuRo2TFjh8sNGSov","Charlie Brown Jr.","Dias De Luta, Dias De Gloria","EMI Brazil",110,193,48,"1281502"
180,"spotify:track:4VI4yOAb7fWrFCnuGBIaeG","MC Cabelinho","carta aberta","Bairro 13",46,-1,27,"1280826"
181,"spotify:track:6mIAta8vOaOhCM4yh8P2FJ","George Henrique & Rodrigo, Henrique & Juliano","Seu Oposto","World Show Produções",158,-1,8,"1278674"
182,"spotify:track:2cZ62VBKsdZ7u1kKKJdFOc","Marshmello, Luísa Sonza","Sou Musa do Verão","Sony Music Latin",12,-1,28,"1278480"
183,"spotify:track:2nRMW95dnOILirpjbksLTs","Jung Kook","Never Let Go","BIGHIT MUSIC",183,-1,1,"1273670"
184,"spotify:track:7MLX5VV97CcXIpH2QUIy13","GREGO, Paulo Pires, ÉaBest","Pane no Sistema","ÉaBest",8,-1,32,"1272907"
185,"spotify:track:2LTlykcdu0gwb7zcKneo2a","KayBlack, Baco Exu do Blues, Marquinho no Beat","Melhor Só","WM Brazil",3,192,61,"1267247"
186,"spotify:track:2Kuf7IkhGSFLHVRNojyxV2","Luísa Sonza, Maiara & Maraisa","Bêbada Favorita","Sony Music Entertainment",186,194,2,"1265976"
187,"spotify:track:6xCAXCTuUeY2nT0p9cAdvB","DJ YAPPER","MORENA TROPICANA - MTG","DJ YAPPER",187,-1,1,"1262115"
188,"spotify:track:1mH3uSZus9IiMagMCJa4vB","TrapLaudo, MC PH, Murillo e LT no Beat","Tropa Do Pisa","GR6 Music",21,196,19,"1261052"
189,"spotify:track:4tuFNhM69UakXdPg4RrNvp","Filipe Ret, Dallass, Hunter","Deus Perdoa","Som Livre",45,-1,30,"1257758"
190,"spotify:track:4ksSf8cL3VlUvQSkFcRHy3","Henrique & Juliano","Até Você Voltar - Ao Vivo","Som Livre",153,-1,15,"1257057"
