rank,uri,artist_names,track_name,source,peak_rank,previous_rank,weeks_on_chart,streams,duration_ms
1,spotify:track:38Ps9Kui6qJjpVqdBOfN5M,"Grupo Menos É Mais, Simone Mendes",P do Pecado - Ao Vivo,Som Livre,1,1,24,10184618,192367
2,spotify:track:1JUmsSEfVwhdJCVBG83XGU,"PEDRO SAMPAIO, Mc Gw, Mc Jhey, Mc Rodrigo do CN, MC Nito",SEQUÊNCIA FEITICEIRA,WM Brazil,2,2,7,7894924,129692
3,spotify:track:6tUdNbB9aYbX0sUDXOzX1u,Diego & Victor Hugo,Tubarões - Ao Vivo,Sony Music Entertainment,1,3,35,7110108,162580
4,spotify:track:4ukpXdplqDEMk3Fy2i30oI,"MC GP, Mc Lele JP, DJ DAVI DOGDOG, Dj Andrabeat",ME POSTOU NO DAILY - FESTA DO BIG G,WM Brazil,4,11,3,6901098,177230
5,spotify:track:4SjcIkVc4cvFgURD1EHxDM,Vitinho Imperador,Eu Me Apaixonei,Vitinho Imperador,5,5,8,6711138,205714
6,spotify:track:6B7ot6Wlqf7zt3FCkYl2FJ,"Grupo Menos É Mais, NATTAN",Pela Última Vez - Ao Vivo,Som Livre,3,7,8,6089979,162325
7,spotify:track:4c4tcqYfqiFc527gqNdRE5,"Clayton & Romário, Zé Felipe",Se Eu Te Perdoar - Ao Vivo,WM Brazil,6,6,5,5929914,164892
8,spotify:track:5Nj2UVsxXAvhfYNpcre3al,"Dj Caio Vieira, MC Meno K, Mc Rodrigo do CN",FAMOSINHA,BR MUSIC DIREITOS MUSICAIS LTDA.,1,10,22,5592249,133384
9,spotify:track:2ejSYn4SfoE07mXPlnYVED,"Rafa e Junior, Hugo & Guilherme, DJ Ari SL",Ama Um Maloqueiro,WM Brazil,4,9,21,5581923,162580
10,spotify:track:25CffgwZg6vlUdCsHJijZo,"Panda, Ícaro e Gilmar, MJ Records",Baqueado - Ao Vivo,MJ Records.,9,16,30,5438552,146750
11,spotify:track:4y93vvzu2h8MITw7YyUTcI,Henrique & Juliano,Última Saudade (Ao Vivo),"Vida Nova Produções, sob licença exclusiva para Virgin Music Group",1,15,55,5269325,150449
12,spotify:track:44CTudFZ0kbaIF9n0jk7oU,"Matheus & Kauan, Ana Castela",Ilusão De Ótica - Ao Vivo,Universal Music Ltda (S&D),11,13,38,5246846,179504
13,spotify:track:17tg01y3RhlfRKMnd333yL,Danilo e Davi,Apaga Apaga Apaga - Ao Vivo,Som Livre,1,17,49,5245674,178882
14,spotify:track:6Kyl2nFgU0J8WBlbBvDv6g,Grupo Menos É Mais,Coração Partido (Corazón Partío) - Ao Vivo,Som Livre,1,12,59,5190712,195794
15,spotify:track:53iuhJlwXhSER5J2IYYv1W,Taylor Swift,The Fate of Ophelia,Taylor Swift,4,4,2,5061939,226073
16,spotify:track:2GylVVMD21R4SqgAt8gGC5,"Felipe Amorim, Vitão, BIN, Malibu",Eu Vou na Sua Casa,One Play,2,14,17,5026968,179039
17,spotify:track:4G7bbgD2DHORU4frrWoCXp,"DJ Japa NK, MC Meno K, MC Ryan SP, Mc Jacaré, DJ DAVI DOGDOG",Posso Até Não Te Dar Flores,BOLOLO REC,17,80,4,5025375,158769
18,spotify:track:4j9UHHiN68z5WL0AdYZC6a,"Zé Felipe, Ana Castela",Sua Boca Mente (You're Still The One),Som Livre,8,8,2,4988921,194303
19,spotify:track:2Hw0LzrD6ic8AckKBxJhiO,Murilo Huff,Deixa Eu - Ao Vivo,M Show,15,18,9,4761943,158470
20,spotify:track:0IBCX7PC9NcfFLuyoHxTNt,Zé Neto & Cristiano,Escondendo o Ouro - Ao Vivo,Som Livre,8,19,21,4591392,171207
21,spotify:track:7tesyGMnAFNI0l2xaxcFKi,Henrique & Juliano,Saudade De Quem Eu Sou (Ao Vivo),"Vida Nova Produções, sob licença exclusiva para Virgin Music Group",11,20,31,4440458,153103
22,spotify:track:2De1EHbIhepIVLHZ16bySE,"Veigh, Supernova Ent",Talvez você precise de mim,Supernova Entertainment,21,21,16,4136480,126800
23,spotify:track:280QfKhmWGn3LbyB39aA7u,Léo Foguete,Cópia Proibida,Acertei Produções,5,22,50,4022153,159480
24,spotify:track:5k7JSycp97vL45zSOoUsTE,Henrique & Juliano,Seja Ex (Ao Vivo),"Vida Nova Produções, sob licença exclusiva para Virgin Music Group",20,27,55,3674754,192034
25,spotify:track:1I6TdHxz61Kf9EFje0dQvg,Luan Santana,OLHO MARROM - Ao Vivo em Lisboa,Sony Music Entertainment,25,31,3,3489589,145491
26,spotify:track:4l2Fyw7EYB5XjcKwqcwuHQ,"DJ Zigão, MC Roger",Tô na Brasilia com o Zigão,MSTT Records,26,42,3,3474726,155307
27,spotify:track:3cwVKjzKSTfvacYJF6Tkub,Léo Foguete,Última Noite - Solo,Acertei Produções,5,28,53,3465391,154553
28,spotify:track:4W9nFl732s6NdToGaCfiSl,"Guilherme & Benuto, Grupo Menos É Mais, Matheus Fernandes",Grau de Maluca - Ao Vivo,Sony Music Entertainment,11,23,15,3446709,172440
29,spotify:track:6zxthXT7GUBX83vRmQiN3x,Felipe e Rodrigo,Caos De Alguém (Ao Vivo),MK Records,6,30,13,3437321,154097
30,spotify:track:07kLShG3HTeLXTqnFCqNAJ,Henrique & Juliano,Amigo Da Minha Saudade (Ao Vivo),"Vida Nova Produções, sob licença exclusiva para Virgin Music Group",18,33,41,3311495,150992
31,spotify:track:6OPfBo0J6yqzSY9WxNlbA5,"MC Willian, DJ Japa NK, DJ DAVI DOGDOG",Valentino,Cria Hit BR,23,29,7,3290338,157033
32,spotify:track:5aMgTcyBPH90hWHhbNKTwR,Diego & Victor Hugo,Entregador de Flor - Ao Vivo em Brasília,Sony Music Entertainment,4,26,57,3277530,190276
33,spotify:track:3M4HJl7D77l86gL1QXGJHG,"Lauana Prado, Simone Mendes",Saudade Burra - Ao Vivo,Universal Music Ltda.,11,36,40,3219876,157173
34,spotify:track:6IFF888dQ0P6ilbj4kL6G8,Grupo Menos É Mais,Aquele Lugar - Ao Vivo,Som Livre,15,35,35,3195178,167528
35,spotify:track:2gLUZtZN1gfercLP9guft3,"Léo Santana, Melody","Desliza (""Ólhinho"" No Corpinho)",Universal Music Ltda.,35,46,11,3140566,146560
36,spotify:track:1N19UVD4GRBFT6UrDaX6rk,"Turma do Pagode, Grupo Menos É Mais",Bebe e Vem Me Procurar / Quem Ama Sente Saudade (Ao Vivo),Sony Music Entertainment,15,34,64,3140305,216818
37,spotify:track:0qZwqMsGSClyrKzbVbRto9,"Diego & Arnaldo, Zé Neto & Cristiano",Vai Cair Água - Ao Vivo,Som Livre,21,37,11,3043881,150936
38,spotify:track:5BI4zdNsBNEBSPzYkO2EXZ,"Luan Pereira, Felipe Amorim",DENTRO DA LAND ROVER - Ao Vivo,Som Livre,32,32,4,3023936,159082
39,spotify:track:2j7IPPMZt5nE5R4r2AbKZ8,"Panda, Humberto & Ronaldo, Ícaro e Gilmar, MJ Records",12 Horas / Pra Você Acreditar - Ao Vivo,MJ Records.,18,47,28,2997616,250453
40,spotify:track:4QZqSqxdcgAbtZle4MS4ph,Gusttavo Lima,Retrovisor,Sony Music Entertainment,13,39,9,2972928,185984
41,spotify:track:73SqSkZt2yseVL513HyMgA,"J. Eskine, Alef Donk, Oruam",AMOR BANDIDO,HITLAB BREGA,38,38,4,2953656,194303
42,spotify:track:3lKOC96UdjCG47HZDJVyih,Simone Mendes,Saudade Proibida - Ao Vivo,Universal Music Ltda.,1,44,28,2937704,160634
43,spotify:track:6vGZfODFI1FxMImSUbdJhz,Zé Neto & Cristiano,Resumindo - Ao Vivo,Som Livre,17,52,21,2879282,145177
44,spotify:track:3p58wJmZqIc9RjsdeZ5Jfq,"Mc Negão Original, MC Jvila, MC Willian, DJ Japa NK, MC Meno K, DJ Guh Mix",Vou pela Madrugada,Cria Hit BR,23,43,14,2836727,281774
45,spotify:track:1mnMkTvrPi4iTblXaRvOoi,"Gusttavo Lima, Luis Fonsi",Vagabundo,Sony Music Entertainment,45,-1,1,2813886,207136
46,spotify:track:473DqaeIno75pBbp0bNrkT,"Matheus Vargas, Cleber & Cauan",Desocupa,MV Produções Artisticas,46,-1,1,2747491,150442
47,spotify:track:708yXS1fLm1gAXFyIQxtX2,Henrique & Juliano,Romântico (Ao Vivo),"Vida Nova Produções, sob licença exclusiva para Virgin Music Group",25,51,50,2682835,183758
48,spotify:track:7CIx2glE3HjBtXRrZzfowf,"Hugo & Guilherme, Ana Castela",Todo Mundo Menos Eu - Ao Vivo,Som Livre,20,41,6,2592411,126285
49,spotify:track:47lS4QkejzTxY058UmbQhv,"CountryBeat, Rionegro & Solimões",Apaixona Muita Gente - Ao Vivo,CountryBeat,33,45,7,2507173,160225
50,spotify:track:1butVubqmo2gXoAgZiM7hY,"Kaique e Felipe, Luan Pereira",Vacilona - Ao Vivo,Sony Music Entertainment,20,56,16,2493698,136367
51,spotify:track:27xkOIER6uDLKALIelHylZ,Jin,Don’t Say You Love Me,BIGHIT MUSIC,40,57,22,2387448,180716
52,spotify:track:4SHKz1SM7aikyK9WLAuN1J,Grupo Menos É Mais,Tarde Demais / Mágica / Oh! Chuva - Ao Vivo,Som Livre,52,64,10,2309634,266256
53,spotify:track:10MsXPpQLz5ZrOEZxTtkIm,Ana Castela,Olha Onde Eu Tô,Ana Castela,15,67,20,2260701,181693
54,spotify:track:3yWuTOYDztXjZxdE2cIRUa,Taylor Swift,Opalite,Taylor Swift,24,24,2,2235609,235355
55,spotify:track:2gfn28JSINCJGLrUimmu0l,Jorge & Mateus,Cantada Boba - Ao Vivo,Som Livre,11,69,49,2222793,183249
56,spotify:track:7obLUtc7Q3mXPt1LvHyE86,Léo Foguete,Beijo Beija-Flor,Acertei Produções,41,58,7,2212893,142952
57,spotify:track:4V2rUOmaevK0C1bKAkeFf5,"Panda, MJ Records",Eu Te Seguro - Ao Vivo,Sony Music Entertainment,57,79,4,2206567,148561
58,spotify:track:1gftPqMrQEkdJh2WbVRA1f,Simone Mendes,Me Ama Ou Me Larga - Ao Vivo,Universal Music Ltda.,3,65,37,2202172,148719
59,spotify:track:2W8XL6iRGMmGHpqW2TKcXc,Gusttavo Lima,Pelo Bem da Minha Saudade,Sony Music Entertainment,46,61,9,2183950,171797
60,spotify:track:3R8dmcSyROSR73XsdeSd7g,Clayton & Romário,Opa Cadê Eu - Ao Vivo,WM Brazil,4,53,36,2166699,154925
61,spotify:track:1h0yBDChztCJRTqmI5U6ou,MORADA,É Tudo Sobre Você / Ser Mudado - Ao Vivo,Onimusic,50,73,32,2158674,442406
62,spotify:track:7yRlmQTjZ5pdtlq7ska9mj,"Veigh, Supernova Ent",Artista Genérico,Supernova Entertainment,1,59,16,2146318,150861
63,spotify:track:1oJEZzbrzsxH5o5KryEG2I,Lauana Prado,Fama De Ruim - Ao Vivo,Universal Music Ltda.,63,103,2,2109075,161845
64,spotify:track:5QbtKOsjbEGkx0GMiQGBZt,"fhop music, Hamilton Rabelo",Tu és + Águas Purificadoras - Ao Vivo,FHOP Music,32,71,81,2102401,476736
65,spotify:track:2Z1DmmPWD3Lm0dWAxMfjxG,"MC Jvila, Mc Negão Original, DJ Dael, DJ Guh Mix",Pirocada Quente,Legenda Records,11,72,35,2097092,195692
66,spotify:track:035Q417M83JnP3wvSlyFEK,Julliany Souza,Quem É Esse? - Ao Vivo,Julliany Souza,60,77,31,2085018,468953
67,spotify:track:1VbJ9rEBlTfqpVQA7tGLqo,"Oruam, Maurin",Freestyle Depois da Cadeia,MSTT RECORDS,67,-1,1,2035067,146086
68,spotify:track:4PCK1yo22yS5BzE5Uy4ua1,CountryBeat,Um Maluco Cowboy - Ao Vivo,CountryBeat,34,48,7,1992493,117029
69,spotify:track:4f0aDk7HX37SfzerfznYlr,"Grupo Menos É Mais, Matheus Fernandes",Lapada Dela - Ao Vivo,Som Livre,4,68,138,1975918,159322
70,spotify:track:5oI9blwsXC8AkTWw6wASY8,Matuê,Máquina do Tempo,Sony Music Entertainment,2,70,108,1952775,230400
71,spotify:track:3ZbetlcfZ0tgVWdvnRzuLB,"Talita Mel, Xand Avião",Melzinho,Sua Música Digital,23,83,17,1933000,144160
72,spotify:track:2RkZ5LkEzeHGRsmDqKwmaJ,Alex Warren,Ordinary,Atlantic Records,30,74,27,1931007,186964
73,spotify:track:38jMHjnOAJDR4QUdk3IXsw,"Murilo Huff, Marília Mendonça",Dois Enganados,M Show,49,88,166,1915648,172751
74,spotify:track:5dcOxj5o672WzZCc7OOUkX,"Felipe Amorim, Carol Biazin",Amor Traumatizado,One Play,18,76,12,1913035,167076
75,spotify:track:6JKkP9ABQzYZUFSKSVDKIc,"1Kilo, Baviera, Knust, Pablo Martins",Deixe Me Ir (feat. Pablo Martins) - Acústico 1Kilo,1Kilo Records,1,94,165,1909415,213191
76,spotify:track:6Tp4LCJ5r5IJaEf8lnlPfG,Henrique & Juliano,De Trás Pra Frente (Ao Vivo),"Vida Nova Produções, sob licença exclusiva para Virgin Music Group",17,92,157,1905846,163089
77,spotify:track:64dVFcA71XYsuqTYgIWzqf,"DJ Arana, Mc Diguinho, Mc Buret, MC D2 DA BAIXADA",Senta Olhando Pra Mim,JB MUSIC,40,91,15,1898474,119720
78,spotify:track:7MnT7msJZg3XBAS0OTfGrB,Legião Urbana,Tempo Perdido,EMI Brazil,72,84,93,1895801,302200
79,spotify:track:1CPZ5BxNNd0n0nF4Orb9JS,"HUNTR/X, EJAE, AUDREY NUNA, REI AMI, KPop Demon Hunters Cast",Golden,K-Pop Demon Hunters,79,126,15,1889831,194607
80,spotify:track:3vpmGewnBcIfbm252E3Xx8,"Luccas & Rodrigo, Vitor e Luan",Cara da Serenata - Live,L & R PRODUÇÕES,15,90,24,1875908,134516
81,spotify:track:4pOGEJRVOuaa9oyy7qTGf6,"Nilo, Mc Paiva ZS, DJ Di Marques, Tropa da W&S, FamousKyo",Fui Mlk,WMD,1,78,47,1873131,174110
82,spotify:track:2Sm8DwUGV8ve14lpEtt7RT,Diego & Victor Hugo,Dama do Baralho - Ao Vivo,Sony Music Entertainment,28,96,29,1867098,165452
83,spotify:track:4dGx53NJZJyuuLP5ownH1p,"Wesley Safadão, Natanzinho Lima",Mentira Estampada,Wesley Safadao,11,99,56,1829017,173206
84,spotify:track:3tA0vALUwrzkTgHcm9j6oJ,Zé Neto & Cristiano,Notificação Preferida - Ao Vivo,Som Livre,2,97,137,1822379,182340
85,spotify:track:1jweGFaVZxEVrOHKsLpPY4,Grupo Menos É Mais,Adorei - Ao Vivo,Som Livre,52,87,52,1821558,179452
86,spotify:track:1VpOT1TfTivUmFjSGSRt1U,"MC LUUKY, MC Jvila, DJ Dael",Olha pra Cara de Quem Te...,EDITORA E GRAVADORA A BASE RECORDS,21,75,31,1820907,120916
87,spotify:track:65vJAh07BdwurqR9SRa6f8,"Ferrugem, Sorriso Maroto",Apaguei Pra Todos - Ao Vivo,WM Brazil,17,85,78,1819578,198678
88,spotify:track:55X6DSZ3CEWeIQrVxMOR9h,"DJ KELVINHO DA ZS, Iraqui ZL",Sobe Na Moto Roubadona,TREM / One Seven Music,47,81,8,1808906,128306
89,spotify:track:29DLL9iGJZFwtGyubk5g9v,"Mc Jacaré, Mc Negão Original, DJ Japa NK",Eu Até Gosto de Você,Croco Hits,75,114,21,1789528,149543
90,spotify:track:79Wou8NwYEFzTyDQudjENF,Diego & Victor Hugo,Desbloqueado - Ao Vivo,Sony Music Entertainment,17,86,65,1788568,188671
91,spotify:track:2QUl20UtEsH85livMYnbQr,"Murilo Huff, Zé Neto & Cristiano",Veneno - Ao Vivo,M Show,5,95,31,1777481,178131
92,spotify:track:5asabafNzfAzjUecDvuNES,Henrique & Juliano,Aquela Pessoa (Ao Vivo),"Vida Nova Produções, sob licença exclusiva para Virgin Music Group",34,108,194,1771702,166838
93,spotify:track:1qyiBNYS01TjMkmoeTLJXN,Matuê,A Morte do Autotune,30PRAUM,33,89,80,1746944,216710
94,spotify:track:0zxWyvrKyz031tFfBnkYLr,Henrique & Juliano,Como É Que A Gente Fica (Ao Vivo),"Vida Nova Produções, sob licença exclusiva para Virgin Music Group",23,107,152,1732988,163913
95,spotify:track:7pkpWcko6KEZANj0xKsCsu,Matheus & Kauan,Cronômetro - Ao Vivo,Universal Music Ltda (S&D),15,101,67,1717419,165301
96,spotify:track:2je7f5dovpUabOqTSfyD5V,Grupo Menos É Mais,Jejum de Amor / Caixa Postal / Vida Vazia - Ao Vivo,Som Livre,69,93,13,1710539,311077
97,spotify:track:1FoV9rUsKIecaQpSap2YLn,"Guilherme & Benuto, Luan Santana",Quarto 67 - Ao Vivo,Sony Music Entertainment,97,104,4,1706249,178526
98,spotify:track:5ntUQs7jxnUH8SukZy4830,"Vitor Limma, Yan",Meu Jeito de Amar / Final de Tarde - Ao Vivo,3 Desejos Produções Artísticas,66,105,11,1699878,223875
99,spotify:track:4jUZymsR3lkia9wkP0o9cX,"DJ TOPO, Mc Livinho",MTG NA IMAGINAÇÃO - TOPO SESSIONS VOL. 1,DJ TOPO,6,100,54,1695880,144923
100,spotify:track:0hB6UKgc3iKTphmGuWpNOg,"Prod Gomes, DJ Gomes Original, Yuri Redicopa, Bisqui",Faz assim,Rua B Records,100,152,2,1681043,149333
101,spotify:track:4EVIYtNeI4O8h0lmE0wycC,"Mc Pedrinho, Teko Bolado, Rizzi Get Busy, Tropa da W&S",Encosta na Parede,WMD,10,106,22,1678514,131822
102,spotify:track:5q0NlM6Pm8Pp3orq7zGiRn,"Matheus & Kauan, Jorge & Mateus",Quarta Cadeira - Ao Vivo,Universal Music Ltda.,10,102,113,1670721,224001
103,spotify:track:1eORtIzTN1UR0ewZWPGFl7,"Diego & Victor Hugo, Lauana Prado",Camisola e Fio - Ao Vivo,Sony Music Entertainment,41,120,18,1664325,180610
104,spotify:track:1jgTiNob5cVyXeJ3WgX5bL,Taylor Swift,Elizabeth Taylor,Taylor Swift,25,25,2,1660184,208291
105,spotify:track:07YFNeWYEuQ4XQfDd8571k,"MC Guh SR, Detagaz, Dj Pikeno Mpc, DJ Silvério",MTG Perna Bamba X Piranhas do Helipa,Mandelão Records,105,113,6,1652856,108923
106,spotify:track:06VStvBWfFbepR97LhRo8D,"Mc IG, Mc Negão Original, MC Ryan SP, MC Jvila, DJ Guh Mix, Mc Lele JP, Murillo e LT no Beat",Contagem Regressiva,WM Brazil,96,115,10,1621785,288372
107,spotify:track:2yo0j2FctlAjVUP3PLl0i1,Danilo e Davi,Mudou O Texto,Som Livre,68,130,17,1614009,163455
108,spotify:track:4gBLQeJrre7DklMZIaPXPd,"Bruno Rosa, Jorge & Mateus",A Grama do Vizinho - Ao Vivo,WM Brazil,35,66,14,1602811,180658
109,spotify:track:0sy2mtvcM7V5ETtmQIbGVt,"Orochi, Filipe Ret, Portugal No Beat",Van Cleef,Mainstreet Records,51,110,18,1594774,169071
110,spotify:track:7so0lgd0zP2Sbgs2d7a1SZ,"Lady Gaga, Bruno Mars",Die With A Smile,Interscope Records,5,116,61,1586020,251667
111,spotify:track:6m8AgjfI28ER6odzMxmHtR,Racionais MC's,"Vida Loka, Pt. 1",Boogie Naipe,83,111,51,1576721,303560
112,spotify:track:2655xYZ347fG2N6OjkoMQ8,Jorge & Mateus,Logo Eu,Som Livre,81,125,52,1573720,155720
113,spotify:track:4bioqBfAE9nhxwecok2cYB,"Dj Gustomares, MC Flavinho, Iraqui ZL",Bandido problemático,TREM,113,-1,1,1564258,162461
114,spotify:track:2jpbtp5N679x92uB8s8p9h,"Suel, Grupo Menos É Mais",Vitamina C - Ao Vivo,Virgin Music Label And Artist Services (S&D),83,121,53,1562325,154170
115,spotify:track:1S9fKs0sAdZPlL8ViOARnS,Vitor Santana,João 20 + pra Sempre - Ao Vivo,Vitor Santana,43,124,31,1557687,289313
116,spotify:track:4v6SAnzwEr7s2m0gFQnJFJ,Diego & Victor Hugo,Áudio - Ao Vivo em Brasília,Sony Music Entertainment,27,133,86,1535480,190244
117,spotify:track:2mpGU5kPAtPjN7SiovHE1C,Mari Fernandez,Meu Tchau É Uma Vez Só - Ao Vivo,Som Livre,117,168,2,1534007,147683
118,spotify:track:4VNRWHoiKHZJIoQHPbmJIv,Felipe e Rodrigo,Gosta De Rua (Ao Vivo),MK Records,1,141,80,1533159,171335
119,spotify:track:7GNbFvEP3uKNASe3oaLl8U,"Mc IG, MC Ryan SP, Mc Negão Original, MC GP, DJ DAVI DOGDOG, DJ Japa NK, DU'L, MC Meno K, Mc guizinho niazi, Nickz Beatz, SiarBeats",Ta Rico Os Menino Do Gueto 🍀,WM Brazil,5,131,24,1529316,459692
120,spotify:track:2Gs0iF27my40p0dANv2rAg,"MXZI, Dj Samir, DJ Javi26",MONTAGEM XONADA,Lunar Media,49,122,12,1511497,75682
121,spotify:track:6HqkE4XccT7AmAMRSfzOcp,Rey Vaqueiro,Body Splash,Potencia Music,89,118,4,1497194,162883
122,spotify:track:3nI0piSOxAik2RCpHGloB7,Charlie Brown Jr.,Só Os Loucos Sabem,Best,82,134,26,1497091,210493
123,spotify:track:2LzXPUzL9sgeRl9a5miHMA,"tarisiix, fire hair, WenHard",OUTRA,NOISQTA,36,109,26,1480732,128000
124,spotify:track:5Y75hEuJlHvdsB8ArcfK1F,"DJ CZ, DJ Katrip, Mc Rodrigo do CN, MC Nito",Construção de Amor,DJ CZ,112,129,6,1479776,129230
125,spotify:track:2kBxNuYFT0J8w9CD4ugLpJ,"Marcos & Fernando, Henrique & Juliano",Trocaria Tudo - Ao Vivo,Work Show,75,145,18,1478789,192133
126,spotify:track:7lZrRxcqaKvrtY76PLyPBD,Ferrugem,Apagar (Fundo Raso),Warner Music Group - X5 Music Group,66,140,17,1457788,208933
127,spotify:track:2o2xhyri4aJUtgMGkf5P0J,"ANAVITÓRIA, Lenine",Lisboa,F/SIMAS,83,149,50,1456832,219302
128,spotify:track:60a0Rd6pjrkxjPbaKzXjfq,Linkin Park,In the End,Warner Records,48,151,53,1452736,216880
129,spotify:track:4HQByPPgZOGbzvgJFZX61K,"Diego & Victor Hugo, Henrique & Juliano",O Alvo (feat. Henrique & Juliano) - Ao Vivo,Sony Music Entertainment,12,112,96,1452432,164956
130,spotify:track:69sdOLKjgnwdA2smmct2a9,Gabriel Guedes de Almeida,Santo Pra Sempre - Ao Vivo,Onimusic,93,137,17,1447610,312219
131,spotify:track:3eHeTsX6W9iIEfn8l2xrWO,Henrique & Juliano,Meu Amor (Ao Vivo),"Vida Nova Produções, sob licença exclusiva para Virgin Music Group",65,146,138,1444182,174134
132,spotify:track:4ssHL7bSnOAE7HjiuLx6Co,Matuê,Crack com Mussilon,30PRAUM,1,148,58,1442896,154418
133,spotify:track:03bTIHJElXZ0O0jqOQvAbY,Taylor Swift,Father Figure,Taylor Swift,40,40,2,1437070,212777
134,spotify:track:6xgf2Nigvj0JuyNFFDAG7t,"MC Jvila, G.A, Nagalli, Toledo, Honaiser",Pantera,GR6 Music,134,-1,1,1435054,191250
135,spotify:track:0KDxhAvKeiVFL1bZccQVJs,Zé Neto & Cristiano,Pulando o Muro - Ao Vivo,Som Livre,62,181,50,1421906,152279
136,spotify:track:17phhZDn6oGtzMe56NuWvj,Teddy Swims,Lose Control,Warner Records,69,138,85,1414862,210688
137,spotify:track:0vFVkEDrV58pAPEtKJLvP5,"Songs Five Music, José Jr",Yeshua - Ao Vivo,The Bow,97,143,24,1412744,500993
138,spotify:track:5W7OZVxOtnQsPVLOEUvu1G,"Yan, Sorriso Maroto",Fica com Deus - Ao Vivo,WM Brazil,138,157,10,1408616,199871
139,spotify:track:7pzD7EudQxP4EhT5UeQjc7,"Felipe Amorim, Xand Avião, Zé Vaqueiro, Talita Mel, Mc Lekão",Medley Muído de Vaquejada - Desce do Cavalo / Balada do Vaqueiro / Monta Logo Vai / Calma / Senta No Fazendeiro / Deixa Ela Montar Na Minha Garupa / Botadão Do GW,One Play,64,117,6,1405002,362713
140,spotify:track:43e3pqrdIaP8RcP77Xavhw,Jhonas Serra,Furioso Oceano,Brasas Music,127,165,19,1392945,392695
141,spotify:track:1Nmcs8zk7LfcvHRgLtTM5J,"Orochi, Papatinho",Amor de Fim de Noite,Mainstreet Records,36,139,111,1391642,221142
142,spotify:track:4m8kG46clzxMxyrDuFo1Uq,"WIU, Oruam",Horas Iguais,Sony Music Entertainment,77,132,50,1386236,246942
143,spotify:track:2E6Xbl5VQSM79TiL6P3Ngi,"Mc IG, Dj Victor",Pé na Areia 🍀,WM Brazil,29,123,8,1379908,178203
144,spotify:track:7bukHRNgGLRySTJEVvLoIR,Henrique & Juliano,Briga Feia (Ao Vivo),"Vida Nova Produções, sob licença exclusiva para Virgin Music Group",22,147,155,1369449,194580
145,spotify:track:6ATNNv8tZF61fa7VwDH89j,Alexsander Lucio,O Fogo Arderá - Ao Vivo,ID1736 - Céu Music,87,161,19,1368243,624000
146,spotify:track:0Ao4OLBAduB4y8H80EKqTO,Natanzinho Lima,Sonho de Amor - Ao Vivo,Sua Música Digital,136,171,6,1366987,193548
147,spotify:track:0cQVqPuHQP4KEwc7ZUQmj6,The Neighbourhood,Sweater Weather,Columbia,79,158,146,1365234,240426
148,spotify:track:7tI8dRuH2Yc6RuoTjxo4dU,Jimin,Who,BIGHIT MUSIC,7,135,65,1361313,170887
149,spotify:track:2edxm0kdL7puUTm3ZCzRAy,Traia Véia,Os Corações Não São Iguais - Ao Vivo,Show Mix.,109,167,5,1360854,226000
150,spotify:track:7snQQk1zcKl8gZ92AnueZW,Guns N' Roses,Sweet Child O' Mine,Guns N Roses P&D,110,184,31,1354242,356066
151,spotify:track:1jxQFCC0ukN7AaUwXWK0N8,"DJ Biel Divulga, DJ Dozabri, Mc Lekão",Tipo Nino Vs Kabrinha,Mandela Music,5,154,19,1339944,201230
152,spotify:track:0jC7CITOLqQhFIjd7Wb3aL,"Mc Rodrigo do CN, MC 2jhow, DJ Cayoo, Mc Ws da leste",Macetada nas do Job,Malô Produtora,95,179,14,1338336,162461
153,spotify:track:3nCuLb5HKpHYpUY3u47KG1,"Panda, Humberto & Ronaldo, Ícaro e Gilmar, MJ Records",Tem Que Ser Você / O Que Combina Comigo É Você - Ao Vivo,MJ Records.,147,155,6,1337851,208554
154,spotify:track:6sRLrSetyIwIKhW1eMlUNP,"Matheus & Kauan, Marília Mendonça",Vou Ter Que Superar - Ao Vivo,Universal Music Ltda.,2,150,104,1337081,189059
155,spotify:track:1xOqGUkyxGQRdCvGpvWKmL,KATSEYE,Gabriela,HYBE/Geffen,100,162,16,1332553,197226
156,spotify:track:5bPVaf87iW31GGfmk2yqsd,"Dj Guuh, Mc Rodrigo do CN",VAI NO CHÃO BANDIDA,Prodok Music Group,54,172,15,1332372,140307
157,spotify:track:5XhG8HGyxLrkJAASxLA463,"Orochi, PL Quest, BIN, Kizzy, Mainstreet",Champagne,Mainstreet Records,93,153,11,1329520,245070
158,spotify:track:1JSTJqkT5qHq8MDJnJbRE1,The Police,Every Breath You Take,Polydor Records,133,188,67,1328012,253920
159,spotify:track:67Y9xDcFPi0BWtoiAuvVSk,"PEDRO SAMPAIO, Mc Gw, Mc Debby, Mc Talibã",SEQUÊNCIA STRIPTEASE,WM Brazil,30,180,19,1325387,144179
160,spotify:track:6h3EEYgtIuOjeqQPIC3H37,"Eric Land, Natanzinho Lima",Pilantra e Meio,Eric Land,1,166,49,1324218,188823
161,spotify:track:4Hk1gmBr2KVEXr3hHwSgUi,"DG e Batidão Stronda, Mc Davi, J. Eskine, MC G15",Mãe Solteira,FORTAL MUSIC,1,144,27,1319234,144000
162,spotify:track:1RnPdd7EKKhKN3E4o4DRsh,"Repsaj, MXZI, ATLXS, Mc Jhey",MONTAGEM BAILÃO,repsaj,21,156,25,1316383,103727
163,spotify:track:288vtdFKV2sVkA1erDYi4C,Fred & Fabrício,Poder Que Cê Tem - Ao Vivo,Som Livre,163,-1,1,1306516,171153
164,spotify:track:3FB6FIh3OqLOhji5QD94O1,"Lekinho no Beat, MC CH da Z.O, Anderson Neiff, Mc Jajau, Trovão no Beat",Tira a Roupa,AT Produtora,156,159,3,1301336,136916
165,spotify:track:4yEKHiUQA70cjfWnEL2m13,"Drops INA, Paulo Vicente",É Ele,Onimusic,73,187,53,1298739,495857
166,spotify:track:4YELzWSQu7KOikguEsnzlZ,"Grelo, Henrique & Juliano",Paredões,Universal Music Ltda (S&D),23,170,41,1295707,175621
167,spotify:track:7J51wQCGi5RzK7k2k2EDVQ,"DG e Batidão Stronda, Mariana Fagundes, Breno Major, Felipe Farra, DLIMA7",Carro de Malandro,FORTAL MUSIC,142,142,4,1295336,142285
168,spotify:track:2fjqfFUq64thFsqfKN01kS,"Matuê, Veigh",Imagina esse Cenário,30PRAUM,4,177,29,1295031,155368
169,spotify:track:5q6p93gOrBy5dRkxOAylJ4,"Pedro Paulo & Alex, Diego & Victor Hugo",Carmed Chocolate,Roça Music,169,178,2,1292718,148403
170,spotify:track:2N3gZl0lnCb4M3A9zTFxdc,Grupo Menos É Mais,40 Graus De Amor / A Carta / Fica - Ao Vivo,Som Livre,125,-1,3,1290737,327050
171,spotify:track:4H9ZFTGkTG8Frqhqsxrgrs,"BK, Luccas Carlos, Nansy Silvvz, Gigantes",Músicas de amor nunca mais,Gigantes,101,175,29,1278410,202899
172,spotify:track:020De83tFmcTrgEpzdUCNS,"Mc Lele JP, MC Leozinho ZS, MC GH Original, MC Menor ZL, DJ GORDINHO DA VF, MC Meno K, MC PR",Vai Tomando Pock Pock,GRINGOS WORLD PRODUTORA,172,197,2,1272599,335999
173,spotify:track:2ThEetsRrVOEoCNpoFVDjM,Felipe e Rodrigo,Melhor Me Bloquear (Ao Vivo),MK Records,96,-1,12,1268658,191623
174,spotify:track:14KMQgJYGx0WMwmSLRnlHd,"Turma do Pagode, Ferrugem, Mumuzinho",Duvido - Ao Vivo,Sony Music Entertainment,80,190,33,1257759,163300
175,spotify:track:44pllb9f5QwcrD2kKc0gS0,Matheus & Kauan,Que Sorte A Nossa - Ao Vivo,Universal Music Ltda.,59,-1,27,1256268,188346
176,spotify:track:3aDV90V6vHUSYKKYDLNdQ8,"Israel & Rodolffo, Jorge & Mateus",Marca Evidente - Ao Vivo,DAMASCENO MUSIC,58,160,42,1255669,190432
177,spotify:track:2aJm1uVFVtTlbEXSIxcOAs,João Gomes,Aquelas Coisas,JG Shows,3,-1,52,1253963,147072
178,spotify:track:1bCaoRRWUoDFuGJsORcV19,"Mc Jacaré, DJ JHOW BEATS",Senta e Cala a Boca,Croco Hits,10,-1,27,1249663,147221
179,spotify:track:49nzU1Ig8Cq110dnZXYIX7,"Guilherme & Santiago, Ana Castela",Sigo Sofrendo - Ao Vivo,Deolli Music,128,136,4,1247622,193076
180,spotify:track:5iUSzWbmhFKBauhqWuLg7e,"Panda, MJ Records",Má Influência - Ao Vivo,Sony Music Entertainment,180,-1,1,1245117,195475
181,spotify:track:3xkHsmpQCBMytMJNiDf3Ii,Benson Boone,Beautiful Things,"Night Street Records, Inc./Warner Records Inc.",40,185,83,1244992,180304
182,spotify:track:6Uiq1haT1Y38F56TrQKA99,Marcos & Belutti,Sonho de Todo Casal - Ao Vivo,Som Livre,163,-1,6,1240004,169557
183,spotify:track:7tz0PRdO9wOCHL5wr8Rne4,"Gustavo Mioto, Ana Castela",Princesa - Ao Vivo,Universal Music Ltda.,28,182,19,1234274,208917
184,spotify:track:6XX6DTK8eugxgZqmlwcvkG,"DJ Ryder, Dj Dudu Coupper, Mc Gw, DJ Victor Falcão",Sequência da Botação,DJ Ryder,184,-1,2,1232840,145777
185,spotify:track:4hVTpP7CV9imY9U53p45sX,Matuê,Anos Luz,30PRAUM,67,-1,78,1228625,264035
186,spotify:track:7CyPwkp0oE8Ro9Dd5CUDjW,"The Weeknd, JENNIE, Lily-Rose Depp","One Of The Girls (with JENNIE, Lily Rose Depp)",XO / Republic Records,61,194,87,1223747,244684
187,spotify:track:7fdAc48FnW2P7LGuTMajcn,Natanzinho Lima,Uma e Quinze da Manhã,Sua Música Digital,2,189,38,1220380,164466
188,spotify:track:4TnEIYOXZ9KBGHOIqG5Xs5,"PEDRO SAMPAIO, Marina Sena",ESCADA DO PRÉDIO,WM Brazil,8,198,29,1214270,137272
189,spotify:track:6vq7r1Pqd3pyI07u63cPZV,Simone Mendes,Erro Gostoso - Ao Vivo,Universal Music Ltda.,3,193,131,1212877,178811
190,spotify:track:5EdklDMsIXhvHSbzwMo5v3,Henrique & Juliano,Novo Eu (Ao Vivo),"Vida Nova Produções, sob licença exclusiva para Virgin Music Group",190,-1,1,1212535,186647
191,spotify:track:5PCOOngROV9jWsUViSy4Ed,"j-hope, GloRilla",Killin' It Girl (feat. GloRilla),BIGHIT MUSIC,58,199,13,1208150,148714
