rank,uri,artist_names,track_name,source,peak_rank,previous_rank,weeks_on_chart,streams,duration_ms
1,spotify:track:1597vvneWf0zoQrg2D8yH6,"MC MENOR HR, MC MENOR SG, DJ ESCOBAR",Evoque Prata,GUETTO RECORDS,1,1,7,9197080,107076
2,spotify:track:4o6v3Oooyt7HF20idztRD4,"Israel & Rodolffo, Ana Castela",Bombonzinho - Ao Vivo,Som Livre,2,2,6,7837512,154701
3,spotify:track:4ASA1PZyWGbuc4d9N8OAcF,"Gustavo Mioto, Mari Fernandez",Eu Gosto Assim - Ao Vivo,Universal Music Ltda.,1,3,13,7604479,148800
4,spotify:track:1ELsaYdj2NlxLvkx9g24xZ,"Guilherme & Benuto, Hugo & Guilherme",Haja Colírio (feat. Hugo & Guilherme) - Ao Vivo,Sony Music Entertainment,2,4,25,5713923,173366
5,spotify:track:2hkwwmmLC90T8BQ7t3xufq,"Zé Felipe, Ana Castela, Luan Pereira",Roça Em Mim,Som Livre,5,5,4,5576503,158171
6,spotify:track:2M4kQD87lKnAS9vFlb4Bez,"Matheus & Kauan, Jorge & Mateus",Pactos - Ao Vivo,Universal Music Ltda.,6,8,9,5134457,183694
7,spotify:track:2orGm2E68ODFYOURjaES62,"WIU, MC Ryan SP",Felina,Sony Music Entertainment,5,6,12,5125300,225882
8,spotify:track:3yHXEidSu4gYVRqKoI653O,"Guilherme & Benuto, Xand Avião",Assunto Delicado - Ao Vivo,Sony Music Entertainment,3,10,17,4976892,180504
9,spotify:track:1OZ4uv7OAP24Ix6j3vojLt,"Mc Paiva ZS, MC Ryan SP, Kotim",Casei Com a Putaria,Love Funk,1,7,23,4903793,157500
10,spotify:track:77UrDaIQq6JZIJWeLgJaRf,"Orochi, MC Ryan SP, Oruam, Xamã, Neo Beats, Kizzy, Mainstreet",Sereia,Mainstreet Records,9,9,7,4742491,294418
11,spotify:track:4UldILPVpnZO69ffK4B9aA,"Dj LK da Escócia, Tchakabum, MC Ryan SP, mc jhenny, Mc RF",Tubarão Te Amo,Nas Nuvens Music Group,11,12,10,4522093,149076
12,spotify:track:6gyhp7IcNhTYzwlk8utsgP,"Diego & Victor Hugo, Jorge & Mateus",Beijo de Glicose - Ao Vivo,Sony Music Entertainment,6,11,15,4301521,171007
13,spotify:track:3gCWngngUs1uojw33vrE8K,Jorge & Mateus,5 Regras - Ao Vivo,Som Livre,7,14,20,3953151,161469
14,spotify:track:5DoYLtsVnNMcrgpMdEPOsI,"DJ Dozabri, DJ Arana, Silva Mc, MC Luiggi, Meno Saaint",É Só Um Lance Lero Lero,Barulho Das Favelas,14,18,4,3855521,116307
15,spotify:track:1dMyIigB6MDsfD3xuG6TbO,Felipe e Rodrigo,Média Boa (Ao Vivo),MK Records,15,22,9,3847852,148900
16,spotify:track:7LUZT12r4xmwR1Kh8TJgjv,Gusttavo Lima,Ex dos Meus Sonhos - Ao Vivo,Sony Music Entertainment,7,13,10,3834944,182805
17,spotify:track:0oB3IBEhbmgTrL7mV0VnFq,Kadu Martins,Novinha do Onlyfans - Tchan Ran Tchan Tchan,Kadu Martins,15,15,7,3719252,137660
18,spotify:track:6Zw25LRLP0j0MsezDFIUM4,"Hugo & Guilherme, Marília Mendonça",Mal Feito - Ao Vivo,Som Livre,2,16,48,3444159,177934
19,spotify:track:4r2O8NHomHiJnFKqhYnqy1,"Israel & Rodolffo, Jorge & Mateus",Perdoou Nada - Ao Vivo,Som Livre,19,63,2,3399239,163120
20,spotify:track:7bhvRvE56NHBvedx0EeALS,"Mari Fernandez, NATTAN",Comunicação Falhou - Ao Vivo,Sony Music Entertainment,12,19,33,2998076,180410
21,spotify:track:2YAOJkRWy382bRMXaj48FP,"Guilherme & Benuto, Matheus & Kauan",Esse B.O é Meu - Ao Vivo,Sony Music Entertainment,21,24,6,2912722,160710
22,spotify:track:7AwVSKaQxpidrtYBerkHKk,"Ana Castela, Melody, Dj Chris No Beat",Pipoco,Ana Castela,1,17,29,2852385,194022
23,spotify:track:5vC8UAOHeG95ehRzZChniB,"L7NNON, DJ Biel do Furduncinho, Bianca",Ai preto,Papatunes Records,1,20,27,2815093,131583
24,spotify:track:7qoIhutxU269Zqo9PG5IOj,"Pineapple StormTv, Chris MC, Salve Malak, Tz da Coronel, MC Cabelinho, Chefin, L7NNON, Luísa Sonza, Oruam, Xamã, N.I.N.A",Poesia Acústica 13,Pineapple StormTV,1,23,13,2807598,628124
25,spotify:track:4NNZZXHgn9F3cCgC1YGmLl,Jorge & Mateus,Todo Seu - Ao Vivo,Som Livre,9,21,32,2797746,171712
26,spotify:track:4cxQWmXmmbFoWvV8qipQTe,"Murilo Huff, Maiara & Maraisa",Perfeito Pra Ficar Sozinho - Ao Vivo,M Show,22,32,19,2767887,170568
27,spotify:track:7nFvKgVumc9FcU97zGjjei,WIU,Coração de Gelo,Sony Music Entertainment,27,68,2,2738551,168000
28,spotify:track:6bwx7pcKJY05D9S6CVa1k6,"Israel & Rodolffo, Maiara & Maraisa",Nem Namorado e Nem Ficante - Ao Vivo | Faixa Bônus,Som Livre,22,25,29,2732069,166600
29,spotify:track:2HMbGPbGiqGaHXzFkQAmZI,Matheus & Kauan,Basiquinho - Ao Vivo,Universal Music Ltda.,16,26,19,2731469,164383
30,spotify:track:4Dvkj6JhhA12EX05fT7y2e,Harry Styles,As It Was,Columbia,10,31,37,2684062,167303
31,spotify:track:4xxeEWGQNFQ6qehlnev5LS,Marília Mendonça,Te Amo Demais,Som Livre,4,27,21,2591280,205685
32,spotify:track:0oZrvoCYEbKGCsU7cQqNnw,"Yago Oproprio, Rô Rosa, Skeeter Beats",Imprevisto,Som Livre,32,37,8,2567520,139703
33,spotify:track:3nqQXoyQOWXiESFLlDF1hG,"Sam Smith, Kim Petras",Unholy (feat. Kim Petras),Capitol Records UK / EMI,5,28,12,2527184,156943
34,spotify:track:0XyPPyGes0omXppV5YE8gy,Felipe Amorim,Gostosinha é Ela,One Play,24,36,20,2373473,138000
35,spotify:track:42nZBOwXNdO24Ml032bLBS,Matheus & Kauan,Gatilho - Ao Vivo,Universal Music Ltda.,13,33,39,2370170,155284
36,spotify:track:2XaEn8iznBz9ZE9YJqJdQ6,"MC Ryan SP, MC Hariel, Mc Don Juan, MC Joãozinho VT, MD Chefe, Mc Daniel, Mc Davi, Mc IG, Mc Kevin, Mc Paiva ZS, POCAH",Revoada do Tubarão 3,WM Brazil,30,30,4,2357792,669157
37,spotify:track:2qmG7dokbGpDGD0T5wORWt,"Matheus Fernandes, Xand Avião",Balanço da Rede,Som Livre,1,29,40,2336827,166435
38,spotify:track:0dcHD9QhnWRA41zoLnC83X,"MC Cabelinho, Dallass",X1,MC Cabelinho,30,34,32,2283601,188852
39,spotify:track:4x5q5T5mhE1xvoCVXY6qrN,"DJ AK BR, Dj Darge, Niack",Melodia Alucinógena,DJ AK BR,7,43,20,2243172,183716
40,spotify:track:0i4UV3HjjvsUuV3BajEXoD,"MC Tairon, Mc Vitin Da Igrejinha, Dj Win, life song",Baile no Morro,ID1642 - Life Song Records,1,35,26,2186672,140307
41,spotify:track:4pjznsLeoyimnxGlVpmyJI,"MC Cabelinho, Victor WAO, Bairro 13",NÉ SEGREDO,MC Cabelinho,34,41,12,2186243,155771
42,spotify:track:5PSkF3QpVMlAx8U5Inxj39,"Mc Jacaré, Dj Tk",Vento Forte,A Chave,3,39,22,2115045,123711
43,spotify:track:5t7E1z1kVtHyPxWNmUtXN4,Kevi Jonny,Te Love - Ao Vivo,Kevi Jonny,26,38,14,2096741,169002
44,spotify:track:04vzhKfl5HtPEgrdZJCZ7L,"Mc Paiva ZS, Kotim",Bagulho Louco,Love Funk,27,44,31,2080042,124238
45,spotify:track:3IMLoeLerS7TMpKjxUgAhx,Henrique & Juliano,Arranhão (Ao Vivo),"Vida Nova Produções, sob licença exclusiva para Virgin Music Group",1,46,71,2037170,153409
46,spotify:track:11fqunD6qlOCrRd88kMOk6,Henrique & Juliano,Evento Cancelado (Ao Vivo),"Vida Nova Produções, sob licença exclusiva para Virgin Music Group",22,47,30,1942045,183244
47,spotify:track:2ykYxd8UGHOsdjP3Z5jSHh,"Hugo & Guilherme, Gusttavo Lima",Cheiro de Balada - Ao Vivo,Som Livre,11,40,19,1932434,171077
48,spotify:track:4QWumyD2uwiePBBha9XBHI,Felipe Amorim,No Ouvidinho,One Play,1,42,38,1913272,183870
49,spotify:track:1ACALdBWViTpLBC14Ecv8E,"MC Ryan SP, Mc Daniel, Kotim",Namora Aí,WM Brazil,49,-1,1,1862232,148615
50,spotify:track:0tM4J8aID6qYZOE3e14sCj,Henrique & Juliano,Acordo (Ao Vivo),"Vida Nova Produções, sob licença exclusiva para Virgin Music Group",21,54,60,1808520,169771
51,spotify:track:6gEOM9IEBzvTdbwNrSkBdC,Gusttavo Lima,Fala Mal de Mim - Ao Vivo,Sony Music Entertainment,6,50,23,1807143,204937
52,spotify:track:2wSCalnGOnXdAJC0Fn8OUY,"George Henrique & Rodrigo, Marília Mendonça",Vai Lá Em Casa Hoje - Ao Vivo,Worldshow Promoções e Eventos,1,52,60,1797217,191523
53,spotify:track:5mJFh4iRzgmWuEVPG8257V,"MC Marks, DJ BOY, Dj GM",Quem Não Conhece Tá Sem Internet,GR6 Music,40,60,14,1767891,146823
54,spotify:track:6Ulh9GPYz6JKdv04qc3q2U,João Gomes,Dengo,JG Shows,3,49,32,1739974,153958
55,spotify:track:3XF598RmEUF3XW4XKo1lyP,"Hugo & Guilherme, Jorge & Mateus",Meu Número - Ao Vivo,Som Livre,17,48,35,1737167,208007
56,spotify:track:2K9kZpwD2CzTa6iiSYYOoO,Marília Mendonça,Leão,Som Livre,56,-1,1,1721842,166774
57,spotify:track:0BWEkqsmPe3qOzrRVztHU3,"Paulo e Nathan, Hugo & Guilherme",Acabei de Terminar - Ao Vivo,Sony Music Entertainment,22,53,36,1703428,223489
58,spotify:track:6bTdZ7xfKp3NqqADJ8HLyj,"Matuê, WIU, Teto",Vampiro,Sony Music Entertainment,1,51,37,1697802,250434
59,spotify:track:3gx9a8ea1nI0Wym9hJpdbJ,"BIN, Orochi, Mc Daniel, Caio Passos, Mainstreet",Hino dos Mlks,Mainstreet Records,45,45,8,1671993,209032
60,spotify:track:1K8AtBJXcdq5mywMnZuARP,Gusttavo Lima,Termina Comigo Antes - Ao Vivo,Sony Music Entertainment,3,64,37,1669829,187381
61,spotify:track:4qsOrxBv09HhNSpsgMRXdC,"Marília Mendonça, Maiara & Maraisa",Esqueça-Me Se For Capaz,Som Livre,1,62,61,1668183,169058
62,spotify:track:5cCwZJUf8QiCQGnyakhpmF,"Oruam, Mainstreet",Papo de Agustinho,Mainstreet Records,59,61,9,1658242,173333
63,spotify:track:2TdOWHAolNaQx8gyRDVS1N,"Luan Santana, Henrique & Juliano",ERRO PLANEJADO - Ao Vivo,Sony Music Entertainment,4,55,35,1634341,154868
64,spotify:track:2SOeAhvJfh7HsGYPVtGG8H,"DJ CIRILO DE CAXIAS, Kaeny Mc",Aqui Na Parma Tu Vem Pra Fuder,Gufo Records,48,65,8,1620788,171428
65,spotify:track:1JIKO27MqvSpjrnUCT6fLC,"DJ Patrick Muniz, Mc L3, MC DOM LP",A Caminho do Bega,Tratto Entretenimentos,56,56,11,1605957,119304
66,spotify:track:2bWVxK5GlPtS4D3FcLjGgQ,Gusttavo Lima,Cara da Derrota - Ao Vivo,Sony Music Entertainment,66,74,10,1599598,161685
67,spotify:track:4aoZBldNDVYmTwmeoI49ud,"Mc Gabzin, DJ TAK VADIÃO, dj sv",O Poder Dessa Garota,Sony Music Entertainment,56,66,33,1587198,136615
68,spotify:track:4vWh6tEfcLzdvYWp2IlOJS,"Luan Santana, Luísa Sonza",CORAÇÃO CIGANO - Ao Vivo,Sony Music Entertainment,3,57,19,1563022,209928
69,spotify:track:3ITkrUvAA6gzxer2UIom3P,Jorge & Mateus,Molhando o Volante,Som Livre,8,59,53,1561915,162538
70,spotify:track:1JzMOnuyabzpRuSudDD4Cq,"WIU, Matuê, Teto",Brinca Demais,Sony Music Entertainment,69,69,2,1551501,194400
71,spotify:track:2PtpfX7sX870xeOfdTMyx2,Guilherme & Benuto,Meus Vícios - Ao Vivo,Sony Music Entertainment,52,71,12,1547402,151091
72,spotify:track:3ShKPhFkexrwl7WoyTtNND,"Rogerinho, Wesley Safadão",Tchuco Nela,AgitoFunk,5,58,35,1516993,170880
73,spotify:track:0jAAnWNbcHf6X1EXOtvOT7,MC Kevin o Chris,Incendeia,MC Kevin o Chris,14,67,23,1508862,239999
74,spotify:track:4QQTPEwqE4Aq7LXSyIgSci,"Mc Kitinho, Mc guizinho niazi, DJ DEIVÃO, Silva Mc",Primeiro Beck Ela Me Mamou,Fluxos Records,28,77,14,1504225,139153
75,spotify:track:3DNhR7P04alm9S4JA6Llvg,"Felipe Amorim, Teto",Mó Viagem,One Play,75,140,2,1468736,197647
76,spotify:track:4uUG5RXrOk84mYEfFvj3cK,"David Guetta, Bebe Rexha",I'm Good (Blue),Parlophone UK,51,82,14,1464555,175238
77,spotify:track:5TGkZGCUoV1zvFxQOIQM5O,"HITMAKER, Ana Castela",Reverse,Universal Music Ltda.,56,70,10,1440954,120405
78,spotify:track:44U6wTQDkos958gqTbilSw,"Mc Daniel, Caio Passos, OGBEATZZ",Balmain,Lyons Produções,78,81,8,1423475,197500
79,spotify:track:3sd2p4kE7xQmFH3lPnFl6h,"Davi Kneip, Mc Frog, Dj Gabriel do Borel, Luísa Sonza",sentaDONA (Remix) s2,Davi Kneip,1,73,39,1417467,125245
80,spotify:track:1t5dhHyXMwdbAcI3EQRqFV,Diego & Victor Hugo,Meio Fio - Ao Vivo,Sony Music Entertainment,60,83,19,1393163,153055
81,spotify:track:7fzgTaVhUxmEzjtcd9NdWo,"Tayrone, Marília Mendonça",Cê Tá Preparada - Ao Vivo,Universal Music Ltda.,16,95,74,1390434,213006
82,spotify:track:7woVi4HBuv0rsO98Ox2Fcq,"Mc Paiva ZS, Love Funk, Kotim",Doce Veneno,Love Funk,60,75,13,1387856,208941
83,spotify:track:7HdWqZjUmIHK5B8zwPCRds,"Léo Santana, Mc Don Juan, Mari Fernandez",Áudio Que Te Entrega - Faixa Bônus,Universal Music Ltda.,19,72,38,1382946,171409
84,spotify:track:5A35xC90Nk6tXmcOAOOavi,Luan Santana,ABALO EMOCIONAL - Ao Vivo,Sony Music Entertainment,6,76,45,1341119,153225
85,spotify:track:3o5LmE0gNsEBwz7VCmc3bV,"Hugo & Vitor, Clayton & Romário",Problemão - Ao Vivo,Universal Music Ltda.,85,89,7,1338727,137957
86,spotify:track:5IgjP7X4th6nMNDh4akUHb,Chris Brown,Under The Influence,Chris Brown Entertainment/RCA Records,48,80,20,1327819,184203
87,spotify:track:4PQ5AInr4YoBauth9YPduL,"Anitta, Mc Danny, HITMAKER",Ai Papai,WM Brazil,87,97,2,1326288,148048
88,spotify:track:75vGTHuhbJDrZ0oPb3FXQ9,"Os Quebradeiras, Machadez, Mousik",Pagodão do Birimbola (Tchubirabirom),Mousik,88,155,2,1323696,125333
89,spotify:track:0WtM2NBVQNNJLh6scP13H8,"Rema, Selena Gomez",Calm Down (with Selena Gomez),Mavin Records / Jonzing World,89,106,10,1319733,239317
90,spotify:track:5IcPYzR2bkS4W3MabMpi4Z,Zé Neto & Cristiano,Melhor Ser uma Saudade,Som Livre,13,78,46,1317679,158716
91,spotify:track:1xzi1Jcr7mEi9K2RfzLOqS,Beyoncé,CUFF IT,Parkwood Entertainment/Columbia,50,84,15,1313819,225388
92,spotify:track:11BKm0j4eYoCPPpCONAVwA,Lady Gaga,Bloody Mary,Interscope,86,86,2,1311710,244760
93,spotify:track:2ebFBmle5uXcdbrCAOvPcZ,Guilherme & Benuto,Vagabundo Chora - Ao Vivo,Sony Music Entertainment,20,88,44,1306284,161845
94,spotify:track:58VUikMywNpRelwEx8khdh,"Dj JL O Único, MC LENADRO ABUSADA, Funk Maia",Aqui no Baile do Egito,Funk Maia,90,93,10,1293343,111500
95,spotify:track:5r9CZJMoMmxio2AnJdxuDS,"Grupo Menos É Mais, Di Propósito, Vou Zuar",Pot-Pourri: Melhor Eu Ir / Ligando Os Fatos / Sonho de Amor / Deixa Eu Te Querer - Ao Vivo,Som Livre,21,103,132,1269829,521088
96,spotify:track:52kcarcX0FQ6wPulXm2bMJ,"Vulgo FK, MC Cebezinho, KayBlack, Pedro Lotto, AMUSIK",Meca Cereja,Elenko Music,92,99,6,1269464,234193
97,spotify:track:0MKd4uZd8Ag8qyReZBTarP,Murilo Huff,Pino da Granada - Ao Vivo em Rio Preto,M Show,35,79,29,1242761,185407
98,spotify:track:14JKzKrJbPDflw8XyATMey,Henrique & Juliano,A Maior Saudade (Ao Vivo),"Vida Nova Produções, sob licença exclusiva para Virgin Music Group",10,98,67,1240619,190161
99,spotify:track:3l5VjEAeUTqrlD50iEo8Yn,"KayBlack, CVSTRO, Wall Hein, AMUSIK",Licor 43,Elenko Music,86,90,13,1237997,142470
100,spotify:track:6Hio4nlyWL2WBL8nYlbuGt,"MC K.K, Dj TG Beats, Dj Aurélio, MC Lipivox, Authentic Records",Agudo Mágico 3,Authentic Records OFC,100,-1,1,1226033,174008
101,spotify:track:4pzRxLzkLjnqnrOL0VMV5w,"Wesley Safadão, Lucas Aboiador",Não Fosse Tão Tarde - Ao Vivo,Wesley Safadao,101,123,5,1224484,142500
102,spotify:track:6T5TyMUmqcg8ZIvTDYaJ1o,GIULIA BE,DEPOIS DO UNIVERSO,WM Brazil,57,92,6,1224107,184160
103,spotify:track:3EM71GPnUGJ75uDhkH77pq,"LUDMILLA, Marília Mendonça",Insônia - Ao Vivo,WM Brazil,46,116,16,1182199,181157
104,spotify:track:5UcQhx8ulCedDE43IQZNV3,Anitta,Macetar,WM Brazil,87,87,2,1179617,114461
105,spotify:track:7afaZ37wJJL6880z1NRgJS,Teto,Fim de Semana no Rio,Sony Music Entertainment,3,96,37,1177167,165882
106,spotify:track:28m65cMH7QXHzFnZSTtNHY,"Marília Mendonça, Maiara & Maraisa",Não Sei o Que Lá,Som Livre,21,104,63,1176414,169586
107,spotify:track:5TPXcKSOlPaz2pkYbWiWHU,Clayton & Romário,Ai Eu Chorei - Ao Vivo,Virgin Music Label And Artist Services (S&D),45,100,24,1161199,176491
108,spotify:track:7qD2vjd3btuOgwpQPEY7ci,"Mc Don Juan, MC G15, Mc Davi",EU VOU COM CARINHO ELA QUER COM FORÇA,WM Brazil,4,101,30,1157230,144000
109,spotify:track:6UelLqGlWMcVH1E5c4H7lY,Harry Styles,Watermelon Sugar,Columbia,27,137,149,1152048,173991
110,spotify:track:71VNsncPcTfQiklVO9uXfB,"Felipe & Murillo, Ana Castela",Ô Lá na Roça - Ao Vivo,Felipe & Murillo,97,112,16,1130164,160000
111,spotify:track:0V3wPSX9ygBnCm8psDIegu,Taylor Swift,Anti-Hero,Taylor Swift,10,107,8,1126648,200690
112,spotify:track:0NBgyml7T0IvUNbXIkcSpH,"Xamã, Gustah, Neo Beats, Bagua Records",Malvadão 3,Bagua Records,1,105,54,1120234,141769
113,spotify:track:14uWxelOuAUajP8fDvc0Ct,Thiaguinho,Falta Você,Virgin Music Label And Artist Services (S&D),87,118,28,1116750,220437
114,spotify:track:4AAIAVjSyiq1N7SXKkwXZe,Marília Mendonça,Troca de Calçada,Som Livre,7,114,98,1101823,203158
115,spotify:track:30rrBGpna63eIJ2BrXlWDC,Henrique & Juliano,Minha Cópia Atual (Ao Vivo),"Vida Nova Produções, sob licença exclusiva para Virgin Music Group",58,110,37,1094485,183382
116,spotify:track:7KWKWJnbGJ3Soag6Oopion,Luísa Sonza,CACHORRINHAS,Sony Music Entertainment,2,109,22,1080425,134936
117,spotify:track:5fstoJBdyj9Yvhe4W5hmEP,"Dj GM, Mc Lipi, Oldilla, Mc Piedro, MC Paulin da Capital, MC Lemos, Mc Lele JP, MC Ryan SP, Gabb MC, Mc Paiva ZS, Love Funk",Set Wesley Alemão,Love Funk,55,108,15,1069720,578666
118,spotify:track:6nkoWsFZeFt5dUdNmlIceh,Gusttavo Lima,Bloqueado - Ao Vivo,Sony Music Entertainment,4,128,55,1059687,168689
119,spotify:track:5FNdfRpHs4u5vto9YdY3ft,Wesley Safadão,Eu Já Tava Bem - Ao Vivo,Wesley Safadao,19,113,54,1058335,135325
120,spotify:track:48LEhRW4gLMCVSYFEZvt8b,"João Bosco e Gabriel, Diego & Victor Hugo",Assume a Gente - Ao Vivo,Som Livre,40,119,38,1055563,171524
121,spotify:track:57nvtO3EJuh6zuB67R3QeF,"Mc Poze do Rodo, João Gomes, jess beats, DiCastro",Frio e Calculista,Mainstreet Records,83,115,5,1054972,223689
122,spotify:track:4kpj0mNvse4mclBHpluw4g,Clayton & Romário,O Grau Bateu - Ao Vivo,Virgin Music Label And Artist Services (S&D),107,141,5,1053614,166015
123,spotify:track:5Y35SjAfXjjG0sFQ3KOxmm,SZA,Nobody Gets Me,Top Dawg Entertainment/RCA Records,123,-1,1,1049301,180853
124,spotify:track:1RDvyOk4WtPCtoqciJwVn8,"Jung Kook, BTS, FIFA Sound",Dreamers [Music from the FIFA World Cup Qatar 2022 Official Soundtrack],Katara Studios | 2101 Records under exclusive license to UnitedMasters LLC,56,85,4,1041573,201391
125,spotify:track:3lQnTQFBxk1HMsj8aa4syY,Kadu Martins,Virando o Olhinho,Kadu Martins,57,124,23,1038593,142694
126,spotify:track:5ghSPv2tPkGZN8DESSvKZl,dreko,Ultimamente Speed,FUNDO REC,80,132,11,1032436,130254
127,spotify:track:6BF3nZQkAg9qvE0DLVSfyH,"Baco Exu do Blues, Luísa Sonza",Hotel Caro,Baco Exu do Blues,4,126,27,1031779,221857
128,spotify:track:0yDMhYTryvQoR634wDgQ1j,"MC Hariel, DJ BOY",O Fim é Triste (feat. DJ BOY),WM Brazil,62,117,25,1029422,158117
129,spotify:track:7G2LNG0EDgU5IyeeP6pevW,"Mari Fernandez, Xand Avião",Pode Apostar - Ao Vivo,Sony Music Entertainment,128,158,17,1025499,193834
130,spotify:track:6kNZdlmjH4BQnSUfHeJIuc,"Dj GBR, Mc IG, MC Ryan SP, MC Marks, Mc Don Juan, MC PH, Mc Luki, Mc Paiva ZS, MC GP, Makalo","Let's Go 3 (feat. MC Marks, Mc Don Juan, MC PH, Mc Luki, Mc Paiva ZS, MC GP & Makalo)",Sony Music Entertainment,96,131,7,1024478,508586
131,spotify:track:6JIC3hbC28JZKZ8AlAqX8h,"Elton John, Dua Lipa, PNAU",Cold Heart - PNAU Remix,EMI,52,129,66,1019546,202735
132,spotify:track:4m8kG46clzxMxyrDuFo1Uq,"WIU, Oruam",Horas Iguais,Sony Music Entertainment,77,127,10,1010182,246942
133,spotify:track:368AZulYBAvuqDeIAEIpcB,Marília Mendonça,Morango do Nordeste,Som Livre,133,-1,1,999757,312097
134,spotify:track:4a0sqvCBo7aRIS4GzBQpnp,"MC Braz, MC Tairon, Dj Win",Kikando e Me Olhando,Duetti,14,121,36,998846,210461
135,spotify:track:0pZIBIJ253pH9gJtXE0Ouf,"KayBlack, Marquinho no Beat, Wall Hein",Vestido da Fendi,Elenko Music,107,122,29,995988,164203
136,spotify:track:5XeFesFbtLpXzIVDNQP22n,Arctic Monkeys,I Wanna Be Yours,Domino Recording Co,96,125,14,994267,183956
137,spotify:track:1a5LfJGq0vuCWQ9Mme0Ac7,Maria Marçal,Deserto (Ao Vivo),MK Network,137,166,10,987663,268000
138,spotify:track:2zpiccjPSl315SqthyDf9j,"Mc Livinho, Theus Costa, MC Bruna Alves, Faixa Rosa",Na Movimentação (feat. Faixa Rosa),MBB Diamond,80,142,16,984434,116307
139,spotify:track:4EVzu5mYyigjyLrryKbZs7,Gloria Groove,VERMELHO,SB Music,9,134,44,983549,152690
140,spotify:track:3ZtHHGpAPSWC7Gnios4lmK,sxmmerx,Metflix,sxmmerx,31,130,21,972578,133333
141,spotify:track:5PZAbR6JHYYV9xp5gv0XES,"Zé Felipe, MC Mari",Bandido,Som Livre,1,120,26,964861,132044
142,spotify:track:6zJejIfVYLgjud3lTk4DLB,Rosa Linn,SNAP,Nvak Collective,91,148,20,958872,179551
143,spotify:track:13Rf6RaZT13TW4xLQR3MQr,"MC Cabelinho, Bob do Contra, Azzy, Filipe Ret, Dudu, Xamã, Orochi, Maquiny, Pineapple StormTv",Poesia Acústica #6 Era uma Vez,Pineapple StormTV,18,138,183,958773,577819
144,spotify:track:0yL7K9MzC20uBesZTPY81r,"DJ Matt D, Menor MC, MC GP, Vulgo FK",Pandora,GREE CASSUA,6,135,54,954117,177000
145,spotify:track:3S10amTMcZq79dYofmZkHD,Marília Mendonça,Pra Falar a Verdade,Som Livre,145,-1,1,953093,252088
146,spotify:track:5PjdY0CKGZdEuoNab3yDmX,"The Kid LAROI, Justin Bieber",STAY (with Justin Bieber),Columbia,30,145,75,950933,141805
147,spotify:track:4GOs8fPjp4M9CBHanTMwsQ,Henrique & Juliano,Seu Perfil (Ao Vivo),"Vida Nova Produções, sob licença exclusiva para Virgin Music Group",67,170,44,949130,183568
148,spotify:track:4eTtgdIXEy2LvLeg7NNSov,"Dallass, Anezzi, Tz da Coronel, Caio Luccas, PJ HOUDINI, MC Maneirinho, NADAMAL, Filipe Ret",Vizão de Cria 2,NadamalRecords,97,149,19,948123,306141
149,spotify:track:25rz3D4oroFC0GXm3xFXnG,"Nivaldo Marques, NATTAN",Tem Cabaré Essa Noite,SUA Musica/ WK Records,12,139,22,939208,202562
150,spotify:track:4h9wh7iOZ0GGn8QVp4RAOB,OneRepublic,I Ain't Worried,Interscope Records,103,171,15,938165,148485
151,spotify:track:2rtsT3CefzKc05JdAm8aQ5,"João Gomes, L7NNON",Digo ou Não Digo - Ao Vivo,JG Shows,147,162,8,928816,189800
152,spotify:track:1Qrg8KqiBpW07V7PNxwwwL,SZA,Kill Bill,Top Dawg Entertainment/RCA Records,152,-1,1,925773,153946
153,spotify:track:7yYrG1nIPeZdLoA9tfU8LL,Mc Jacaré,Boca de Mel,A Chave,95,146,14,925275,124174
154,spotify:track:7HjZD0NPC1hzFpjUjo45GR,"Mc Poze do Rodo, Filipe Ret, Mainstreet, Ajaxx",Me Sinto Abençoado,Mainstreet Records,33,136,53,922927,214235
155,spotify:track:1uFn76RxZ8KBXWRtF1D7Nl,Luan Santana,PERIGOSA - Ao Vivo,Sony Music Entertainment,77,133,5,918234,149501
156,spotify:track:3xt7v3bMNnQ8ie8RjhmkX2,Matheus & Kauan,Imagina A Sentada - Ao Vivo,Universal Music Ltda.,18,143,53,918105,171500
157,spotify:track:0QHEIqNKsMoOY5urbzN48u,Meghan Trainor,Made You Look,Epic,157,177,4,906551,134256
158,spotify:track:7LRjGCQdXzkBJj03e1kHkq,Paulo e Nathan,Fala Alguma Coisa - Ao Vivo,Sony Music Entertainment,74,153,15,901560,161802
159,spotify:track:2VbKpQWIMRelKmEy8rSCAf,"Kako, MC Erik, MC GP, MC Ryan SP, MC Marks, MC Joãozinho VT, DJ BOY, Dj GM",Set Tatuapé Conceito 2,Sonar Music,63,147,23,900905,406588
160,spotify:track:2gkKA2pRAsMzbiGPo9gxsc,"Clayton & Romário, Jorge & Mateus",Água Nos Zói - Ao Vivo,Virgin Music Label And Artist Services (S&D),35,151,61,898716,188951
161,spotify:track:1XcmAgREOuJQb91sr68AAD,"Dyamante DJ, Mc Gw",Sentadinha Diferente,NWS,51,165,23,896477,123230
162,spotify:track:0VjIjW4GlUZAMYd2vXMi3b,The Weeknd,Blinding Lights,Republic Records,25,176,149,896028,200040
163,spotify:track:7jtQIBanIiJOMS6RyCx6jZ,Tom Odell,Another Love,ITNO/Columbia,145,169,15,893901,244360
164,spotify:track:2QjOHCTQ1Jl3zawyYOpxh6,The Neighbourhood,Sweater Weather,Columbia,121,150,47,892987,240400
165,spotify:track:4cxApmpAxYi9UlB6AT2H8S,WIU,Oração,Sony Music Entertainment,91,91,2,892485,206896
166,spotify:track:1TFqH3zKOiTZoVe0OQuJte,Grupo Menos É Mais,Até Que Durou / Tu Mandas No Meu Coração / Adorei / Supera - Ao Vivo,Som Livre,131,157,26,889989,453018
167,spotify:track:0K3u2t8YNuJ5NR9lKC1frv,"Pabllo Vittar, Gloria Groove",AMEIANOITE,Sony Music Entertainment,52,160,8,887280,165996
168,spotify:track:0TTQIX6HnkeQ5w9TOzoQF3,"Mari Fernandez, Marcynho Sensação",Parada Louca,Sony Music Entertainment,8,159,57,886701,179031
169,spotify:track:3xdEjqUOiLBkRmTrSst1GX,"Mc Don Juan, Mc Paiva ZS, DJ Yuri Martins",Final do Ano,WM Brazil,149,156,3,886355,199384
170,spotify:track:6m84TzSTM5nbwZxIxkYHz6,Jorge & Mateus,Namorando Com Saudade,Som Livre,39,161,72,882232,174081
171,spotify:track:3QGxgNaqaFSpORp2OVLXHR,"Chefin, Mainstreet",212,Mainstreet Records,2,164,48,874012,150610
172,spotify:track:1RgJ4lexKGNBlKnyxB5SRt,"Teto, Mateca",Balazul,Sony Music Entertainment,31,154,28,872217,202909
173,spotify:track:0ssgd2ZvDawP0KHGfBYRpv,"Filipe Ret, Caio Luccas, Dallass",Good Vibe,Som Livre,67,178,26,872134,181818
174,spotify:track:5zNxUkUW9WiV5oyg6gh2wB,"PEDRO SAMPAIO, Mc Pedrinho",DANÇARINA,WM Brazil,1,174,41,864604,110222
175,spotify:track:0roEMqT0P7Z82rJTwcID3Z,Hugo & Guilherme,Felicidade Dela - Ao Vivo,Som Livre,42,163,38,861739,165558
176,spotify:track:4b5rbmik2mSrGo8IvjDUUp,"PEDRO SAMPAIO, Pabllo Vittar",SAL,WM Brazil,101,175,5,861004,120000
177,spotify:track:7pLgk3pIcImzn1JiXBGplw,"Felipe Araújo, MC Hariel",Até Achar Alguém - Ao Vivo,Universal Music Ltda.,177,195,2,854798,213183
178,spotify:track:2xebCnKCjYWBhJ4Ai8hO5E,"Mc Davi, Mc Kevin, Mc Don Juan, MC Hariel, MC Marks, MC G15, Mc Phe Cachorrera, Gaab, MC Menor da VG, MC Ryan SP, MC Kapela, Perera DJ, Veiga no Beat",Set dos Casados,GR6 Music,22,167,62,850151,643200
179,spotify:track:4grGI2vFnknrfmHT1JOVFU,"George Henrique & Rodrigo, Gusttavo Lima",Tesão Da Madrugada - Ao Vivo,World Show Produções,41,172,44,850125,173375
180,spotify:track:130HVxaVe9EYcLJmuOR9Rw,Henrique & Juliano,Até A Próxima Vida (Ao Vivo),"Vida Nova Produções, sob licença exclusiva para Virgin Music Group",87,183,42,844518,194310
181,spotify:track:2Vl7x4BkNhhJkEmQQMcV0V,Mc Jacaré,Toma Tapa,A Chave,181,-1,1,839550,122994
182,spotify:track:0CiCGHEbBn1xJG9vOtnIGm,Marília Mendonça,Café da Manhã,Som Livre,182,-1,1,833618,233083
183,spotify:track:1qEmFfgcLObUfQm0j1W2CK,Harry Styles,Late Night Talking,Columbia,43,-1,8,828749,177954
184,spotify:track:5vOLqik7QlFD5eq3otyXBm,"Dj Mt Oliveira, Mc Alysson",Eu Vou Tacar x Essas Hora da Noite,Tiger Records,153,-1,3,826378,136615
185,spotify:track:4nRa5qkXIfswPbt20rkslI,"Felipe Amorim, João Gomes",Debaixo do Cobertor,One Play,69,185,22,825155,154285
186,spotify:track:3FkeNbs9Zeiqkr3WkbOiGp,Anitta,Envolver,Warner Records,1,168,53,820794,193805
187,spotify:track:74Le949TrZk4zwDjtWzH23,"Bruno & Denner, Gusttavo Lima",Cavalo de Pau,Balada Music,122,-1,9,820463,164029
188,spotify:track:3CIyK1V4JEJkg02E4EJnDl,"Imagine Dragons, JID, Arcane, League of Legends",Enemy (with JID) - from the series Arcane League of Legends,Kid Ina Korner / Interscope,39,180,58,819912,173381
189,spotify:track:5DhiTYpD599fu3q7fCepgL,"BIN, Major RD, Mainstreet, Ajaxx",Dior,Mainstreet Records,54,152,26,816665,229894
190,spotify:track:5HFvMPiNjclAq8DbEAPWMw,Gilsons,Várias Queixas,Xirê,162,-1,14,816152,170109
191,spotify:track:7GvJL7IG958R87MphADwR6,"KayBlack, Wall Hein, AMUSIK",Maturidade,Elenko Music,154,186,9,813860,142026
192,spotify:track:6igNhmOPWCEwgbqVM2fned,"Tierry, Hugo & Guilherme",Lara - Ao Vivo,Virgin Music Label And Artist Services (S&D),132,-1,3,813354,183783
193,spotify:track:3YvE7uo4ffseBoJPh8IhHp,"Marília Mendonça, Maiara & Maraisa",Presepada,Som Livre,3,198,55,810997,196209
