rank,uri,artist_names,track_name,source,peak_rank,previous_rank,weeks_on_chart,streams,duration_ms
1,spotify:track:4Hk1gmBr2KVEXr3hHwSgUi,"DG e Batidão Stronda, Mc Davi, J. Eskine, MC G15",Mãe Solteira,FORTAL MUSIC,1,1,5,8614849,144000
2,spotify:track:6Emsu0BaMpG0ilZCRT8KHZ,Diego & Victor Hugo,Tubarões - Ao Vivo,Sony Music Entertainment,2,2,7,7923588,162580
3,spotify:track:4pOGEJRVOuaa9oyy7qTGf6,"Nilo, Mc Paiva ZS, DJ Di Marques, Tropa da W&S, FamousKyo",Fui Mlk,WMD,1,5,19,5318887,174110
4,spotify:track:2OMkXPz6pHdKJSkzxG0MwZ,"Kew, Dj LK da Escócia",Descer,Legenda Records,4,4,6,4813854,111653
5,spotify:track:6Kyl2nFgU0J8WBlbBvDv6g,Grupo Menos É Mais,Coração Partido (Corazón Partío) - Ao Vivo,Som Livre,1,7,31,4681238,195794
6,spotify:track:0NQyryTVbjGMtWMA1eSqIn,"J. Eskine, Alef Donk",Resenha do Arrocha,Latin Brega by HITLAB Records,1,3,17,4596133,354857
7,spotify:track:0BUkQGUXgcvf3gdCWYbtnJ,"Oruam, Zé Felipe, MC Tuto, Dj Lc da Roça, Mc Rodrigo do CN, MC K9, mc pl alves",Oh Garota Eu Quero Você Só Pra Mim.,Mainstreet Records,1,6,15,4469592,166861
8,spotify:track:2TSYxcrcrtLpdbsLY9NmzL,Simone Mendes,Me Ama Ou Me Larga - Ao Vivo,Universal Music Ltda.,8,9,9,4141942,148719
9,spotify:track:4y93vvzu2h8MITw7YyUTcI,Henrique & Juliano,Última Saudade (Ao Vivo),"Vida Nova Produções, sob licença exclusiva para Virgin Music Group",1,8,27,3988117,150449
10,spotify:track:2tUIRX4wK0COoKEorOdEpZ,"Murilo Huff, Zé Neto & Cristiano",Veneno - Ao Vivo,M Show,10,18,3,3798700,178131
11,spotify:track:3M4HJl7D77l86gL1QXGJHG,"Lauana Prado, Simone Mendes",Saudade Burra - Ao Vivo,Universal Music Ltda.,11,11,12,3760785,157173
12,spotify:track:2cGRf9skACWnKRK1eLYBJn,Guilherme & Benuto,Sujeito Homem - Ao Vivo,Sony Music Entertainment,12,14,24,3673357,178983
13,spotify:track:77HhVmRv7IxDqkyMxElSrK,"Anitta, Mc Danny, HITMAKER",Sei Que Tu Me Odeia,Universal Music Ltda.,3,10,11,3455886,160846
14,spotify:track:3iDZj9V0RSElRwVgtmMYgJ,"Oruam, Maurin, Victor WAO",Lei Anti O.R.U.A.M,Mainstreet,10,20,6,3424543,158608
15,spotify:track:37QloSdzrjx2xCH0m65800,"Gustavo Mioto, Grupo Menos É Mais",Nada Com Nada - Ao Vivo,Universal Music Ltda.,15,39,17,3423804,161866
16,spotify:track:6s1kzj4EbhFLXbuAGJbhbn,"MC Tuto, DJ Glenner",Barbie,Sonar Music,1,25,24,3335131,192755
17,spotify:track:65vJAh07BdwurqR9SRa6f8,"Ferrugem, Sorriso Maroto",Apaguei Pra Todos - Ao Vivo,WM Brazil,17,23,50,3283369,198678
18,spotify:track:3WxetTBTlpfyknxJfPQ7eQ,"MC Cebezinho, Dj Yuri Pedrada, Love Funk",Observando Essa Salada,Love Funk,8,12,10,3255419,181644
19,spotify:track:44CTudFZ0kbaIF9n0jk7oU,"Matheus & Kauan, Ana Castela",Ilusão De Ótica - Ao Vivo,Universal Music Ltda (S&D),19,19,10,3234688,179504
20,spotify:track:7so0lgd0zP2Sbgs2d7a1SZ,"Lady Gaga, Bruno Mars",Die With A Smile,Interscope Records,5,24,33,3172969,251667
21,spotify:track:0UGGLKM970ymsBBN5TKjsD,"MC Tuto, DJ Oreia",2025,Sonar Produtora,11,16,14,3146666,172820
22,spotify:track:6VH6SBNNL2RVWwImq046ce,"Boladin 211, Dejinha, MC Rick, DJ AL4DDIN",Penélope Charmosa 2,Kave,5,15,12,3137736,171692
23,spotify:track:17tg01y3RhlfRKMnd333yL,Danilo e Davi,Apaga Apaga Apaga - Ao Vivo,Som Livre,23,42,21,3056430,178882
24,spotify:track:7pBPXkaVQaP3Y3Wwfkpvbn,"Hugo & Guilherme, Wesley Safadão",Mentirosa - Ao Vivo,Som Livre,6,13,15,3039556,165566
25,spotify:track:4jUZymsR3lkia9wkP0o9cX,"DJ TOPO, Mc Livinho",MTG NA IMAGINAÇÃO - TOPO SESSIONS VOL. 1,DJ TOPO,6,28,26,3002114,144923
26,spotify:track:6x6EA3N9xXgptSakS7VZUg,"GORDÃO DO PC, Mc Menor DN, Mc Leozin, Ana Laura Lopes",FANTASMA (versão GORDÃO DO PC),Alt Music,8,21,14,3001875,171162
27,spotify:track:280QfKhmWGn3LbyB39aA7u,Léo Foguete,Cópia Proibida,Acertei Produções,5,27,22,2970887,159480
28,spotify:track:48tyRFRqsKTYnViVA1XOk9,Lauana Prado,Kamasutra - Ao Vivo,Universal Music Ltda.,28,31,4,2962721,153335
29,spotify:track:3TnSAp3TfGMYptOqv234uK,"MC Tuto, Grelo",Do Job,Sonar Music,9,17,20,2958318,193432
30,spotify:track:6Ap9SM1WkmI4b4Mo2Cpa6f,"NATTAN, Léo Foguete",Última Noite,Nattan,8,29,24,2887058,157557
31,spotify:track:07kLShG3HTeLXTqnFCqNAJ,Henrique & Juliano,Amigo Da Minha Saudade (Ao Vivo),"Vida Nova Produções, sob licença exclusiva para Virgin Music Group",31,34,13,2858674,150992
32,spotify:track:5TOvA5Uhxti7FPh0EIdClV,"MC LUUKY, DJ JB Mix",Malvadinho,EDITORA E GRAVADORA A BASE RECORDS,1,35,22,2848676,120115
33,spotify:track:456hxgSVUAJVgPV0UncG68,"DENNIS, Luísa Sonza",MOTINHA 2.0 (Mete Marcha),Sony Music Entertainment,6,26,9,2836510,118081
34,spotify:track:7shkORZD3NNi6waqw7eIqT,Gusttavo Lima,Proibido Terminar - Ao Vivo,Sony Music Entertainment,13,22,8,2814443,165888
35,spotify:track:3CvpnVAV75lKCcaTtUTpgW,"Chefin, LB Único",Se Essa Bunda For Uma Empresa,Chefin Distribuição,35,53,4,2814140,162461
36,spotify:track:6ukVCqH77f6cwRHyJBhGgy,Israel & Rodolffo,Arruma Um Bão,Som Livre,13,43,26,2722638,175078
37,spotify:track:2Z1DmmPWD3Lm0dWAxMfjxG,"MC Jvila, Mc Negão Original, DJ Dael, DJ Guh Mix",Pirocada Quente,Legenda Records,36,41,7,2700998,195692
38,spotify:track:5aMgTcyBPH90hWHhbNKTwR,Diego & Victor Hugo,Entregador de Flor - Ao Vivo em Brasília,Sony Music Entertainment,22,37,29,2679078,190276
39,spotify:track:2gfn28JSINCJGLrUimmu0l,Jorge & Mateus,Cantada Boba - Ao Vivo,Som Livre,11,38,21,2650088,183249
40,spotify:track:11s2M1WFIZ5r04porN58m2,"DJ KN DE VILA VELHA, Mc Jacaré, Mc 2G Do SF, Mc Marcelo da Cj, TDK Rec",Sentar pro Trem,TDK Rec,40,-1,1,2615464,139384
41,spotify:track:0arxXBXzv96Q449DK1SmiX,"BK, Kolo, Evinha",Cacos De Vidro (sample: Esperar pra Ver),Gigantes,23,40,9,2602104,149373
42,spotify:track:6id4TFeHJgvVtCzrJEysl0,Henrique & Juliano,Saudade De Quem Eu Sou (Ao Vivo),"Vida Nova Produções, sob licença exclusiva para Virgin Music Group",42,114,3,2595249,153103
43,spotify:track:4eqOz5gdCYww9GB5q3q1pU,"DJ Douglinhas, DJ Miller Oficial, MC Torugo",Puta É Só um Detalhe,DJ DOUGLINHAS,13,36,14,2557906,158827
44,spotify:track:0vYrfm0eUQyi6fWbYnBiDc,"DJ NATAN 22, Mc Rodrigo do CN, DJ DN do Dick",Meu Carro Nao Tem Porta Luva - Remastered 2024,Snafu Records,44,45,13,2440541,159999
45,spotify:track:5wV5dO1GOI4srs4Um5cJXo,"J. Eskine, Alef Donk",Resenha de Ex-Love,HITLAB BREGA,7,32,6,2363913,246857
46,spotify:track:1VpOT1TfTivUmFjSGSRt1U,"MC LUUKY, MC Jvila, DJ Dael",Olha pra Cara de Quem Te...,EDITORA E GRAVADORA A BASE RECORDS,33,33,3,2303667,120916
47,spotify:track:3cwVKjzKSTfvacYJF6Tkub,Léo Foguete,Última Noite - Solo,Acertei Produções,5,47,25,2236468,154553
48,spotify:track:63Vdw2P2cw1Gf8ABQiEjXD,Gusttavo Lima,Sofrimento Simultâneo - Ao Vivo,Sony Music Entertainment,48,-1,1,2227060,156757
49,spotify:track:3R8dmcSyROSR73XsdeSd7g,Clayton & Romário,Opa Cadê Eu - Ao Vivo,WM Brazil,49,92,8,2221451,154925
50,spotify:track:4seW5sDVICaZw34NzrHPm0,"Nuzio Medeiros, Henry Freitas, Kadu Martins",Tando,Nuzio Medeiros,1,30,16,2145291,212000
51,spotify:track:5QbtKOsjbEGkx0GMiQGBZt,"fhop music, Hamilton Rabelo",Tu és + Águas Purificadoras - Ao Vivo,FHOP Music,48,48,53,2121341,476736
52,spotify:track:1l0wjEdL5zYutUW8tVFiZO,"Mc Negão Original, DJ Japa NK, DJ Guh Mix",Medley de Igaratá 3,Cria Hit BR,10,49,21,2109951,265848
53,spotify:track:6RzcNTnS02dnqoQMdTkQwi,"Brenno & Matheus, DJ Ari SL",Descer Pra BC,New Music,1,50,19,2106825,166451
54,spotify:track:6mYW4mUYMVwOJd8coMHPYE,"Kaique e Felipe, Felipe e Rodrigo",Caindo a Ficha - Ao Vivo,Sony Music Entertainment,54,96,3,2086962,160362
55,spotify:track:708yXS1fLm1gAXFyIQxtX2,Henrique & Juliano,Romântico (Ao Vivo),"Vida Nova Produções, sob licença exclusiva para Virgin Music Group",55,78,22,2070466,183758
56,spotify:track:096gZM7wp5GKHBwtWY3d0z,"Link do Zap, pluglip",a última dança,Link do Zap,56,83,6,2058582,126511
57,spotify:track:6ejIcf1OdUmtOJ7fpFcEXo,"Mc Negão Original, DJ Guh Mix",Medley de Igaratá 4,Cria Hit BR,11,51,8,2056008,299076
58,spotify:track:3xkHsmpQCBMytMJNiDf3Ii,Benson Boone,Beautiful Things,"Night Street Records, Inc./Warner Records Inc.",40,75,55,2046682,180304
59,spotify:track:4OrDHBIn0eJqwkzRHYsB0L,Brenno & Matheus,Falou Rodeio,New Music,59,61,4,2036722,118936
60,spotify:track:3bpNcH1SCEMn6zuynZGY5e,"Orochi, TkN, RUXN, Kizzy, ProdSmile",Fashion,Mainstreet Records,60,69,4,2025124,213284
61,spotify:track:2xTM0m9HD3gIqNSutA0LNJ,"Jorge & Mateus, Henrique & Juliano",Xonei,Som Livre,3,60,33,1990156,154555
62,spotify:track:6XXqPj8USz1oebSmMPCBLC,"DJ Gouveia, DJ Dozabri, Mc Rodrigo do CN",Tipo Nino Abravanel,Mandela Music,62,76,4,1967672,131076
63,spotify:track:2drZGdAOxfE2KoMGTkidmq,"MC Marks, MC Ryan SP, MC Jvila, MC Bruno MS, Mc Magal, Aaron Modesto, DJ Dael, MC LUUKY",365 Dias (Vida Mansa),Legenda Records,9,56,27,1959990,527220
64,spotify:track:7BGhllQfISbfkwYSkp5nRC,Teto,YES OR NO,30PRAUM,64,-1,1,1943995,188571
65,spotify:track:4MF0VMffyxHsy3GZwwUnAs,Matuê,A Morte do Autotune,30PRAUM,52,57,52,1942952,216710
66,spotify:track:3H7eBmcTJyuEMStfmKuLmG,"MC Cebezinho, DJ Oreia, MC Tuto, Love Funk, Kako",A Danada Me Ligando,Love Funk,1,55,31,1919884,283636
67,spotify:track:3yCtRV7LMeGBpvSHDR8uMV,"Boladin 211, MC Rick, MC Leozinho ZS, CAO$, Dj Lv Mdp, Dj Vitin do Pc",Chapa Máxima,WM Brazil,36,100,17,1850661,151384
68,spotify:track:06n87WQroP5WFD4aR45T8X,"DJ Japa NK, Mc Negão Original, MC Meno K",Comedinha Ficou Bravo,Love Funk,63,63,10,1849981,152355
69,spotify:track:17phhZDn6oGtzMe56NuWvj,Teddy Swims,Lose Control,Warner Records,69,87,57,1845066,210688
70,spotify:track:6Tp4LCJ5r5IJaEf8lnlPfG,Henrique & Juliano,De Trás Pra Frente (Ao Vivo),"Vida Nova Produções, sob licença exclusiva para Virgin Music Group",17,59,129,1827499,163089
71,spotify:track:5Fhr3wqeieN5WDkAsqL1JJ,j-hope,MONA LISA,BIGHIT MUSIC,46,46,2,1809419,137191
72,spotify:track:6dOtVTDdiauQNBQEDOtlAB,Billie Eilish,BIRDS OF A FEATHER,Darkroom/Interscope Records,33,77,46,1784289,210373
73,spotify:track:4yEKHiUQA70cjfWnEL2m13,"Drops INA, Paulo Vicente",É Ele,Onimusic,73,105,25,1782864,495857
74,spotify:track:0rosNwHC9T8YNu3EvXLPfX,Ferrugem,Me Bloqueia (Ao Vivo),WM Brazil,65,65,33,1769159,197027
75,spotify:track:5asabafNzfAzjUecDvuNES,Henrique & Juliano,Aquela Pessoa (Ao Vivo),"Vida Nova Produções, sob licença exclusiva para Virgin Music Group",34,54,166,1765218,166838
76,spotify:track:0UGkmvbIWUVwCg9MMusBxg,"Mc Negão Original, Mc IG, DJ Guh Mix",Medley de Igaratá 5,Fusion Records,70,70,2,1764860,221538
77,spotify:track:15CoBMXezZjfJuFpvuhYK3,"Oruam, Ajaxx, Gigant, Goldgrain",22 Meu Vulgo,Mainstreet,54,66,6,1759573,219677
78,spotify:track:5k7JSycp97vL45zSOoUsTE,Henrique & Juliano,Seja Ex (Ao Vivo),"Vida Nova Produções, sob licença exclusiva para Virgin Music Group",20,85,27,1727520,192034
79,spotify:track:7xeqjq45imp3qonWKqfyip,"PEDRO SAMPAIO, Mc Gw, Mc Debby, Mc Talibã",SEQUÊNCIA STRIPTEASE,WM Brazil,30,71,13,1722954,144179
80,spotify:track:4wJ5Qq0jBN4ajy7ouZIV1c,"ROSÉ, Bruno Mars",APT.,Atlantic Records,8,67,24,1716918,169917
81,spotify:track:5rHhO6SBSzo3E9m3KHyCtt,"Murilo Huff, Ana Castela",Peça Íntima,M Show,8,72,25,1707656,169634
82,spotify:track:4f0aDk7HX37SfzerfznYlr,"Grupo Menos É Mais, Matheus Fernandes",Lapada Dela - Ao Vivo,Som Livre,4,62,110,1697757,159322
83,spotify:track:7l9Tq5phzkLnhWUyfp702G,"Kaique e Felipe, Luan Pereira",Saveiro,Sony Music Entertainment,1,58,36,1687532,144665
84,spotify:track:7McCAKExE8KsI2q4Y8wx4U,"Murilo Huff, Marília Mendonça",Dois Enganados,M Show,49,74,138,1674298,172751
85,spotify:track:2wXqRqVGiGB2fyy9eoPJbP,"Mc Lele JP, MC Marks, MC Leozinho ZS, MC Joãozinho VT",Eu sou Cantor Não Sou Bandido,A Luz Records,19,88,27,1673889,266666
86,spotify:track:6h3EEYgtIuOjeqQPIC3H37,"Eric Land, Natanzinho Lima",Pilantra e Meio,Eric Land,1,80,21,1667534,188823
87,spotify:track:6YdJ2jJOo143KhXT9qvQVe,"MC GP, MC Jvila, MC LUUKY, Dj Yuri Pedrada",300 no 7,MC GP & GR6,11,107,38,1661006,195572
88,spotify:track:7HrDxxY2b7vOKxJHtqdXN6,"Henry Freitas, Mc Th",Imã de Problema,Sony Music Entertainment,2,44,26,1659167,137293
89,spotify:track:0pGsxpkJC9IwK93fmqEYXn,Grupo Menos É Mais,Aquele Lugar - Ao Vivo,Som Livre,86,86,7,1653677,167528
90,spotify:track:3QaPy1KgI7nu9FJEQUgn6h,Billie Eilish,WILDFLOWER,Darkroom/Interscope Records,66,93,34,1651479,261466
91,spotify:track:3PLdcrfVesYKyTpS1EXsxO,Dilsinho,Diferentão - Ao Vivo,Sony Music Entertainment,77,117,58,1641365,163038
92,spotify:track:3UEIObvIQMJzF09RWRcqcP,"Emilia, Luísa Sonza",bunda 🍑,Sony Music Latin,92,168,3,1632156,223855
93,spotify:track:4VNRWHoiKHZJIoQHPbmJIv,Felipe e Rodrigo,Gosta De Rua (Ao Vivo),MK Records,1,102,52,1617631,171335
94,spotify:track:4dGx53NJZJyuuLP5ownH1p,"Wesley Safadão, Natanzinho Lima",Mentira Estampada,Wesley Safadao,11,94,28,1616943,173206
95,spotify:track:5mPn4ueXc1oua018FDvknz,"MC Joãozinho VT, DJ JR No Beat",Calculista,Sonar Music,47,91,23,1575132,186165
96,spotify:track:4swtnATsndB7VJVq0n4EQE,"DJ CZ, MC Nito, DJ TS, Mc Pogba, Prime Funk",Rabetão De Terremoto,Prime Funk,96,-1,1,1569641,107076
97,spotify:track:4IlklRFZUgNQlwwW0PSLm7,"Grelo, Henrique & Juliano",Paredões,Henrique & Juliano,23,95,18,1554029,175621
98,spotify:track:344LzkpddPjSAkEtJK83QL,"Ana Castela, Léo Foguete, AgroPlay",Sem Você,AgroPlay,40,120,15,1553386,142098
99,spotify:track:3aDV90V6vHUSYKKYDLNdQ8,"Israel & Rodolffo, Jorge & Mateus",Marca Evidente - Ao Vivo,DAMASCENO MUSIC,82,82,14,1548716,190432
100,spotify:track:0zxWyvrKyz031tFfBnkYLr,Henrique & Juliano,Como É Que A Gente Fica (Ao Vivo),"Vida Nova Produções, sob licença exclusiva para Virgin Music Group",23,64,124,1546823,163913
101,spotify:track:0hWzBcYtmwsL1TwByzjiUG,"MC Joãozinho VT, Mc Negão Original, MC Tuto, Matheuszin DJ, Kako, MC Ryan SP",Boy Besta,Sonar Music,47,84,20,1545014,424615
102,spotify:track:63BroH3HiwxYD8T5qTZiJn,Gusttavo Lima,A Noite (La Notte) - Ao Vivo,Sony Music Entertainment,3,89,33,1528301,201557
103,spotify:track:0d7oIw2t0f6oCXJUfWYw8E,"Veigh, Supernova Ent",Mônaco Freestyle,Supernova Ent,53,90,5,1524182,112000
104,spotify:track:6dBNHXIJLpsgPlLroF4tf1,"MC Dricka, DJ S2K",Vou Raspar Seu Bigodin,Som Livre,27,73,10,1509845,104000
105,spotify:track:2kBxNuYFT0J8w9CD4ugLpJ,"Marcos & Fernando, Henrique & Juliano",Trocaria Tudo - Ao Vivo,Work Show,105,197,2,1508060,192133
106,spotify:track:18z8Px2zIsaQrtszgWdVZn,"BK, Deekapz, Evinha",Só Quero Ver,Gigantes,41,99,10,1501911,169546
107,spotify:track:7MnT7msJZg3XBAS0OTfGrB,Legião Urbana,Tempo Perdido,EMI Brazil,103,103,65,1495685,302200
108,spotify:track:7tI8dRuH2Yc6RuoTjxo4dU,Jimin,Who,BIGHIT MUSIC,7,109,37,1482641,170887
109,spotify:track:6xLka4rZhf5O0IWf0qLk4A,Léo Foguete,Quem de Nós Dois - Ao Vivo,Acertei Produções,101,104,3,1471525,181987
110,spotify:track:06VStvBWfFbepR97LhRo8D,"Mc IG, Mc Negão Original, MC Ryan SP, MC Jvila, DJ Guh Mix, Mc Lele JP, Murillo e LT no Beat",Contagem Regressiva,WM Brazil,110,-1,1,1466770,288372
111,spotify:track:2jpbtp5N679x92uB8s8p9h,"Suel, Grupo Menos É Mais",Vitamina C - Ao Vivo,Virgin Music Label And Artist Services (S&D),83,132,25,1455985,154170
112,spotify:track:1Nmcs8zk7LfcvHRgLtTM5J,"Orochi, Papatinho",Amor de Fim de Noite,Mainstreet Records,36,121,84,1455777,221142
113,spotify:track:0KDxhAvKeiVFL1bZccQVJs,Zé Neto & Cristiano,Pulando o Muro - Ao Vivo,Som Livre,62,98,22,1454838,152279
114,spotify:track:3eHeTsX6W9iIEfn8l2xrWO,Henrique & Juliano,Meu Amor (Ao Vivo),"Vida Nova Produções, sob licença exclusiva para Virgin Music Group",65,68,110,1436141,174134
115,spotify:track:0cQVqPuHQP4KEwc7ZUQmj6,The Neighbourhood,Sweater Weather,Columbia,79,115,118,1433591,240426
116,spotify:track:6wLTQ0PQAsFaTf4SfBDyYc,"Matheus Fernandes, Matheus & Kauan",Triplex - Ao Vivo,Som Livre,4,119,43,1428414,178170
117,spotify:track:5k21RXqN11N0TIeLLySlDv,Isadora Pompeo,Ovelhinha (Ao Vivo),Sony Music Entertainment,110,110,39,1423340,276453
118,spotify:track:5hFh5hsMEmfRYZvh4FRE8Z,Clayton & Romário,Sei Tocar Violão - Ao Vivo,WM Brazil,15,52,26,1422459,164596
119,spotify:track:3zXIfbjxSzPMNP6JDZsQsi,"Orochi, Kizzy",Mitsubishi,Mainstreet Records,119,135,17,1418790,182181
120,spotify:track:1h0yBDChztCJRTqmI5U6ou,MORADA,É Tudo Sobre Você / Ser Mudado - Ao Vivo,Onimusic,118,118,4,1416303,442406
121,spotify:track:2o2xhyri4aJUtgMGkf5P0J,"ANAVITÓRIA, Lenine",Lisboa,F/SIMAS,83,129,22,1408533,219302
122,spotify:track:1DLKuppSYytOuxhtI6KBGu,Tribalistas,Aliança,Phonomotor,74,136,30,1404062,237421
123,spotify:track:39O9PGzlZnVTOhAYQjyBRG,Natanzinho Lima,Uma e Quinze da Manhã,Sua Música Digital,2,106,18,1401469,164466
124,spotify:track:4fgnNikmEUvXze89h3X47m,NATTAN,Morena,Nattan,31,178,52,1395720,179234
125,spotify:track:207HLdUVIdZEUMRX15BIwD,"DJ OLIVEIRA ORIGINAL, MC Nito",Médio Versalico,DJ oliveira original,76,133,9,1395415,103344
126,spotify:track:47j8u38wfvxdQeRA7TBJrB,MORADA,É Tudo Sobre Você - Ao Vivo,Onimusic,126,144,10,1386822,372173
127,spotify:track:1AM8pZn5uY89vkItAH5bm3,"Felipe Araújo, Luan Pereira",Body Splash - Ao Vivo,Universal Music Ltda.,26,116,21,1360259,154727
128,spotify:track:3FB06ULqN0WNUSQ3UaMZnF,blicko,Amor Na Praia,blicko,7,137,48,1355820,156150
129,spotify:track:7jCgslBhuPF61B6yk90VYb,"MC Ryan SP, Mc IG, DJ Japa NK, Nilo, Boladin 211, MC LUUKY, Mc Negão Original",Sexta Feira Hoje Tem,WM Brazil,106,130,11,1348609,387711
130,spotify:track:7Elw15XWLpOi4qzHyAwa9e,Gloria Groove,Nosso Primeiro Beijo - Ao Vivo,SB Music,18,140,44,1344435,168805
131,spotify:track:5vT4pYzoIJHEZhkBx2BgOU,"Felipe Beats, Vitor Daslent's",Porsche Azul,Fb hits,57,145,10,1337791,111044
132,spotify:track:2ciksfz6WZKfqoMVrWq8Vb,"Luan Pereira, Léo Foguete",UM PALMO - Ao Vivo,Som Livre,14,81,16,1337753,138008
133,spotify:track:4ZrKyfCV1UcHuZjbLp03fM,"Mãolee, Filipe Ret, Vulgo FK",Nós Combina,WM Brazil,69,127,29,1331164,204813
134,spotify:track:7IFsTX5H1sWcEl8joV0IdD,"THE BOX, Mc Brinquedo, MC Cebezinho, MC Tuto, Mc Laranjinha, DJ Oreia",THE BOX MEDLEY FUNK 2,Sony Music Entertainment,1,125,49,1327574,266666
135,spotify:track:3LPLRNr58Z9Pn0clnEtkXb,Doechii,Anxiety,Top Dawg Entertainment/Capitol Records,63,97,4,1327502,249302
136,spotify:track:0fK7ie6XwGxQTIkpFoWkd1,JENNIE,like JENNIE,OA Entertainment/Columbia,85,113,4,1326237,123517
137,spotify:track:1edcyazKIdKrIuz9cWpXU6,Ariana Grande,twilight zone,Republic Records,137,-1,1,1321915,198320
138,spotify:track:2THXb1FE0uarBdzp42JL0Y,Gusttavo Lima,Morar Nesse Motel,Sony Music Entertainment,3,134,39,1314768,187037
139,spotify:track:1N19UVD4GRBFT6UrDaX6rk,"Turma do Pagode, Grupo Menos É Mais",Bebe e Vem Me Procurar / Quem Ama Sente Saudade (Ao Vivo),Sony Music Entertainment,103,150,38,1314183,216818
140,spotify:track:0rqn9g0GZtn5y4ogm5U3NF,"Mc Negão Original, MC Cebezinho, Dj Yuri Pedrada, Mc Fidelis, MC GP, MC Jvila, MC Ryan SP",Toma Que Toma,Cria Hit BR,46,124,12,1309530,461538
141,spotify:track:7bukHRNgGLRySTJEVvLoIR,Henrique & Juliano,Briga Feia (Ao Vivo),"Vida Nova Produções, sob licença exclusiva para Virgin Music Group",22,123,127,1303845,194580
142,spotify:track:6QSYz3Nlcxwv1x0RWIgMoj,"Major RD, Borges, MC Cabelinho, Young Ganni, Rock Danger, meLLo",Só Rock 3,Rock Danger,68,122,5,1300585,312240
143,spotify:track:3Sa2gVQioE31DcG4nKNDqD,"Matuê, Brandão85",Isso é Sério,30PRAUM,14,143,24,1297528,285000
144,spotify:track:7CyPwkp0oE8Ro9Dd5CUDjW,"The Weeknd, JENNIE, Lily-Rose Depp","One Of The Girls (with JENNIE, Lily Rose Depp)",XO / Republic Records,61,162,66,1296661,244684
145,spotify:track:1pjpPXl66t4FeQaFscpG73,Henrique & Juliano,Cidade Vizinha (Ao Vivo),"Vida Nova Produções, sob licença exclusiva para Virgin Music Group",6,156,105,1295668,178903
146,spotify:track:4ssHL7bSnOAE7HjiuLx6Co,Matuê,Crack com Mussilon,30PRAUM,1,142,30,1292792,154418
147,spotify:track:5DxPUI3cMU7EkayHlYLJCI,Maiara & Maraisa,Vai Lá - Ao Vivo em Goiânia,Work Show,4,139,27,1290855,140438
148,spotify:track:7pkpWcko6KEZANj0xKsCsu,Matheus & Kauan,Cronômetro - Ao Vivo,Universal Music Ltda (S&D),15,141,39,1288585,165301
149,spotify:track:74LohOvD6SpyKQHPt4WTGC,Ícaro e Gilmar,Voltável - Ao Vivo,MJ Records,149,177,2,1288499,167709
150,spotify:track:77ktPgR21JTA59L1R7NQn9,"Anderson Neiff, Mano Cheffe",Tua Ex É uma Delícia,Number One Produtora,131,131,10,1283336,197425
151,spotify:track:7izihBeq9rmGYnierSTjv8,Gamadinho,Instinto - Ao Vivo,Gamadinho,151,155,13,1282580,213559
152,spotify:track:4Nj2zoYULwyYnJTU3AZf6B,Diego & Victor Hugo,Dama do Baralho - Ao Vivo,Sony Music Entertainment,152,-1,1,1281208,165452
153,spotify:track:5g7sDjBhZ4I3gcFIpkrLuI,Bruno Mars,Locked out of Heaven,Atlantic Records,45,160,63,1276601,233653
154,spotify:track:4DhDNNhIDdduS6nZMbSMbs,"Mc Rodrigo do CN, DJ JOAO DA INESTAN",Amantes da Foda,Mc Rodrigo Do CN,51,166,23,1274028,81230
155,spotify:track:4nTrxp4aH0g2yLVPkFmljF,Racionais MC's,"Vida Loka, Pt. 2",Boogie Naipe,148,148,6,1272913,350560
156,spotify:track:7dKqPh21HpsysZvRWyNeM1,Isadora Pompeo,Bênçãos Que Não Têm Fim (Counting My Blessings),Sony Music Entertainment,10,157,67,1269007,209520
157,spotify:track:2LHNTC9QZxsL3nWpt8iaSR,Lady Gaga,Abracadabra,Interscope Records,12,128,9,1266253,223398
158,spotify:track:2655xYZ347fG2N6OjkoMQ8,Jorge & Mateus,Logo Eu,Som Livre,88,184,28,1263176,155720
159,spotify:track:7c2zWmVMYkqd86M1pL82rS,"Deejhay RB, MC Tuto, MC Joãozinho VT, Borges, Chefin, Kako, MC Vine7",Longe de Magnata,Sonar Produtora,75,147,15,1256084,452762
160,spotify:track:6UzGpz33nYXa3gAEJ1mndV,"Hugo & Guilherme, Maiara & Maraisa",O Meu Coração Em Suas Mãos (Colgando en tu manos) - Ao Vivo,Som Livre,10,146,35,1252200,204343
161,spotify:track:1ggAVLO5PbO0I2mWDlsFFQ,Henrique & Juliano,Recaídas (Ao Vivo),"Vida Nova Produções, sob licença exclusiva para Virgin Music Group",137,179,15,1250255,203154
162,spotify:track:6m8AgjfI28ER6odzMxmHtR,Racionais MC's,"Vida Loka, Pt. 1",Boogie Naipe,94,199,23,1247381,303560
163,spotify:track:6sRLrSetyIwIKhW1eMlUNP,"Matheus & Kauan, Marília Mendonça",Vou Ter Que Superar - Ao Vivo,Universal Music Ltda.,2,164,76,1241225,189059
164,spotify:track:6cwgSRunEtZnmnNZogBub7,"Ana Castela, MC PH, AgroPlay",Jet em Balneário,AgroPlay,60,158,14,1235161,132461
165,spotify:track:1FHifcx1A1oeY5q8A3dbsj,Os Barões Da Pisadinha,Sofre Bom Sofre Bebo,Sony Music Entertainment,165,-1,1,1234748,136368
166,spotify:track:6RjSXi9cPGroetXeNsWFGL,"DJ TOPO, Seu Jorge, Mc Leozin, MC G15",MTG QUEM NÃO QUER SOU EU,DJ TOPO,1,126,47,1234657,123692
167,spotify:track:7JtJjh9WfxUOpjFhurxVRW,Julliany Souza,Quem É Esse? - Ao Vivo,Julliany Souza,151,151,4,1228334,468953
168,spotify:track:5UBCGftdDXdaxomn1eloLC,"Teto, WIU",PRETTY LET GIRL,30PRAUM,168,-1,1,1219101,164307
169,spotify:track:5gA82C4xfyvmRtpD1QdsDz,"MC LUUKY, Oldilla",Nem Ligo Pro Amor,EDITORA E GRAVADORA A BASE RECORDS,15,186,25,1212794,164307
170,spotify:track:25CffgwZg6vlUdCsHJijZo,"Panda, Ícaro e Gilmar, MJ Records",Baqueado - Ao Vivo,MJ Records.,170,192,2,1211456,146750
171,spotify:track:6JKkP9ABQzYZUFSKSVDKIc,"1Kilo, Baviera, Knust, Pablo Martins",Deixe Me Ir (feat. Pablo Martins) - Acústico 1Kilo,1Kilo Records,1,-1,148,1209219,213191
172,spotify:track:3xsYqPvotPUjk8vcIPBNTg,"Felipe Beats, Zé Felipe, Vitor Daslent's",Porsche Azul,Fb hits,67,154,9,1200938,109253
173,spotify:track:1K14aw84e0i5IHFHkq7aNn,"KayBlack, Murillo e LT no Beat",Mistérios,WM Brazil,5,153,23,1199460,136695
174,spotify:track:4TnEIYOXZ9KBGHOIqG5Xs5,"PEDRO SAMPAIO, Marina Sena",ESCADA DO PRÉDIO,WM Brazil,8,169,26,1197843,137272
175,spotify:track:2nLtzopw4rPReszdYBJU6h,Linkin Park,Numb,Warner Records,58,191,20,1197821,187520
176,spotify:track:5XeFesFbtLpXzIVDNQP22n,Arctic Monkeys,I Wanna Be Yours,Domino Recording Co,78,175,126,1197177,183956
177,spotify:track:2HRqTpkrJO5ggZyyK6NPWz,Sabrina Carpenter,Espresso,Island Records,49,173,51,1192348,175459
178,spotify:track:1FCvRATk4Wa30LW608ecEN,Natanzinho Lima,Chuva de Arroz,Sua Música Digital,140,182,6,1191837,195504
179,spotify:track:5Bp7TFENcgsdLCL8fMOSKs,"Supernova Ent, G.A, Ghard, Veigh, Niink","Adora a bunda, odeia o rosto (feat. Veigh & Niink)",Supernova Entertainment,32,170,16,1188813,173859
180,spotify:track:1JSTJqkT5qHq8MDJnJbRE1,The Police,Every Breath You Take,Polydor Records,140,167,41,1184215,253920
181,spotify:track:2t878JZCl8Ftd2mVzzakYc,"Jorge & Mateus, Lauana Prado",Haverá Sinais - Ao Vivo,Som Livre,2,193,55,1183985,191365
182,spotify:track:1S9fKs0sAdZPlL8ViOARnS,Vitor Santana,João 20 + pra Sempre - Ao Vivo,Vitor Santana,180,180,3,1182024,289313
183,spotify:track:3fxDcaiomBMomHdMeCSsZ2,Ariana Grande,dandelion,Republic Records,183,-1,1,1181769,204815
184,spotify:track:1yX9gy5fK02j6nBnGJ1S3k,"j-hope, Miguel",Sweet Dreams (feat. Miguel),BIGHIT MUSIC,79,79,4,1177294,172952
185,spotify:track:0GbvYZsvz7bWyijBDESebX,Simone Mendes,Mulher Foda - Ao Vivo,Universal Music Ltda.,10,-1,36,1176953,162190
186,spotify:track:3L1lh7PRwrseRi5sy4QgQl,"Paulo Pires, ÉaBest",Talarico - Live,Paulo Pires,101,101,2,1175181,142230
187,spotify:track:5EOA2TZ6f1D9mKuRPmpdIS,"MC Cebezinho, MC Tuto, DJ Oreia, Love Funk, MC Ryan SP",Pam Pam,Love Funk,161,161,2,1172330,224000
188,spotify:track:2Xcc5Rsawh7EkzUwdVFrnn,Henrique & Juliano,Mudando De Assunto (Ao Vivo),"Vida Nova Produções, sob licença exclusiva para Virgin Music Group",159,-1,2,1156450,195807
189,spotify:track:4PnYbyk6EA0zcASUc9huHP,"Guilherme & Santiago, Jorge & Mateus",Pijama Amarelo - Ao Vivo,Deolli Music,181,181,2,1153291,199503
190,spotify:track:5kuUOpHZlZjL8b7HXkxRsm,"Xamã, Bagua Records, Neo Beats, Matuê",Luxúria,Baguá Records,169,-1,29,1153126,185310
191,spotify:track:4sTlQPMyoFMPdhAJvErBN3,ATLXS,PASSO BEM SOLTO - Slowed,broke,191,-1,1,1152971,116072
192,spotify:track:7Cf2Hsy3cPlA4e115tElXv,Henrique & Juliano,Liberdade Provisória (Live - Ibirapuera / 2019),"Vida Nova Produções, sob licença exclusiva para Virgin Music Group",1,149,153,1152520,186379
193,spotify:track:35ISBknsCeZQtq66xABI9g,Lola Young,Messy,Universal-Island Records Ltd.,149,174,12,1152331,284066
194,spotify:track:2262bWmqomIaJXwCRHr13j,Gigi Perez,Sailor Song,Gigi Perez PS/ Island,194,196,2,1152261,211978
195,spotify:track:7BqBn9nzAq8spo5e7cZ0dJ,Bruno Mars,Just the Way You Are,Elektra (NEK),77,183,31,1151973,220734
