rank,uri,artist_names,track_name,source,peak_rank,previous_rank,weeks_on_chart,streams
1,"spotify:track:7IFsTX5H1sWcEl8joV0IdD","THE BOX, Mc Brinquedo, MC Cebezinho, MC Tuto, Mc Laranjinha, DJ Oreia","THE BOX MEDLEY FUNK 2","Sony Music Entertainment",1,2,13,"7419538"
2,"spotify:track:6W196uVRkmQFHbc1XV8DNk","CountryBeat, Félix, Léo Souzza","Sonho Dela (Cowboy)","CountryBeat",1,1,11,"7373165"
3,"spotify:track:0HDMisLsuGNml98Xq7atpm","Luan Santana, Luan Pereira","EU SOU SENTIMENTO","Sony Music Entertainment",3,4,7,"6714029"
4,"spotify:track:1NcqLEg2r2LXqMVbam2BJD","Matheus Fernandes, Matheus & Kauan","Triplex - Ao Vivo","Som Livre",4,5,7,"6477809"
5,"spotify:track:6RjSXi9cPGroetXeNsWFGL","DJ TOPO, Seu Jorge, Mc Leozin, MC G15","MTG QUEM NÃO QUER SOU EU","DJ TOPO",1,3,11,"6280282"
6,"spotify:track:5QpcLTQjh0qO7OIuR9q8IR","Gusttavo Lima","Morar Nesse Motel","Sony Music Entertainment",6,11,4,"6080449"
7,"spotify:track:5496lks6V3fh1mZAB6IAap","Sevdaliza, Pabllo Vittar, Yseult","Alibi (with Pabllo Vittar & Yseult)","Twisted Elegance",7,9,4,"5621567"
8,"spotify:track:4VNRWHoiKHZJIoQHPbmJIv","Felipe e Rodrigo","Gosta De Rua (Ao Vivo)","MK Records",1,10,16,"5611233"
9,"spotify:track:0agjQg7eWrwFtqBQRKu1CX","Zé Neto & Cristiano, Ana Castela","Foi Intenso - Ao Vivo","Som Livre",5,6,12,"5537926"
10,"spotify:track:7ldcYtMOjtX1eFVEYzj2kJ","Luísa Sonza, KayBlack","Sagrado Profano","Sony Music Entertainment",2,8,9,"5281916"
11,"spotify:track:106SKHXoytRADjpxHBkJpV","dj sv, Doug Hits, Manim Vaqueiro","Mtg Forró e Desmantelo","Doug Filmes",1,7,14,"5220153"
12,"spotify:track:6mTpK40yIRk1xGGNvRMHGg","Murilo Huff, Gustavo Mioto","Me Caiu Tão Bem - Ao Vivo","M Show",12,12,7,"4981934"
13,"spotify:track:5Qqpplbu8ROd71c0brQxyy","Mc IG, MC Ryan SP, DJ Glenner, Mc Poze do Rodo, Oruam","Filha do Deputado","WM Brazil",12,13,4,"4794746"
14,"spotify:track:368hYqtNCKCAeUduMoSHhh","Clayton & Romário","Aproveita - Ao Vivo","Virgin Music Label And Artist Services (S&D)",14,24,6,"4512484"
15,"spotify:track:6gjsnEQxLqVkieeloQTozN","Lou Garcia, Dj Luan Gomes","Não Fosse Tão Tarde - MTG Remix","Universal Music Ltda.",15,28,4,"4466194"
16,"spotify:track:5GV7OpSEb8MPTryL0Q5i6c","DJ JZ, Humberto & Ronaldo, Mc Mininin, DJ LG PROD, Silvanno Salles","Mtg Quero Te Encontrar","Tropa do Serrão",1,14,20,"4412422"
17,"spotify:track:3kBYuWrGtx1tSHjzr0vlZh","Mc IG, Murillo e LT no Beat, DJ Glenner","Sorriso no Rosto","WM Brazil",3,17,8,"4219881"
18,"spotify:track:7tI8dRuH2Yc6RuoTjxo4dU","Jimin","Who","BIGHIT MUSIC",18,-1,1,"4193935"
19,"spotify:track:6FllOXq1UDCFDt1V4YvN3K","Mc Daniel, DJ WN, Dj GM","Vamo de Pagodin","Lyons Produções",16,16,10,"4186736"
20,"spotify:track:1CpneInvFvGYcDVU4CCDgI","Ana Castela","Minha Herança - Ao Vivo","AgroPlay",17,19,8,"4111934"
21,"spotify:track:6X6jKoyw1OjogRghMEQAZV","Jorge & Mateus, Lauana Prado","Haverá Sinais - Ao Vivo","Som Livre",2,26,22,"4095208"
22,"spotify:track:6hNREzgHbVM5AkGwP4SPmU","Luan Pereira, Murilo Huff","FALTA DE QUÊ?","Som Livre",4,15,10,"4079881"
23,"spotify:track:7Elw15XWLpOi4qzHyAwa9e","Gloria Groove","Nosso Primeiro Beijo - Ao Vivo","SB Music",18,20,8,"4044367"
24,"spotify:track:7JMtl41kGPDlzxsH3FkkqD","Dj Luan Gomes, Tropa da W&S","MTG QUERO VER SE VOCÊ TEM ATITUDE","PDF Records / W&S Music",4,18,10,"4041462"
25,"spotify:track:0w7vodPWFEcuEYvWpbNbOu","WIU","Rainha da Finesse","30PRAUM",25,42,3,"4006607"
26,"spotify:track:2o4hr5HCAKShrbFtmxm7Dg","Manu, Guilherme & Benuto","Torre Eiffel - Ao Vivo","manuoficial",17,22,21,"3959450"
27,"spotify:track:3Na9gwLmFdEJH2l54AYwpk","Lauana Prado, Zé Neto & Cristiano","Sombra Desconhecida - Ao Vivo","Universal Music Ltda.",23,23,5,"3843526"
28,"spotify:track:6cFW2FPaUL4YRJfS9zFJaV","Simone Mendes","Dois Tristes - Ao Vivo","UME - Global Clearing House",4,25,21,"3827687"
29,"spotify:track:2ZI7HOZoBqrV3lFlHKJshI","Zé Neto & Cristiano, Luan Santana","Melação - Ao Vivo","Som Livre",29,46,2,"3740053"
30,"spotify:track:1WHDOr19zyyqu6XXIvdgfX","Hugo & Guilherme, Maiara & Maraisa","Morena De Goiânia - Ao Vivo","Som Livre",11,29,18,"3585500"
31,"spotify:track:7eoRm37Ta1jvGMiMRfOQoa","Dj VN Maestro, MC G DS","Eu So Comi Ela uma Vez","Love Funk Records",13,27,6,"3526745"
32,"spotify:track:4VZNgofGpFZ8FrQM3VYosB","Zé Neto & Cristiano","Deu Moral - Ao Vivo","Som Livre",5,21,15,"3413953"
33,"spotify:track:0S7o4sti5I5CAbbotTUzTM","Traia Véia, Luan Pereira","Wi-Fi - Ao Vivo","Show Mix.",33,-1,1,"3349544"
34,"spotify:track:6IFMz6Buh3dKoUjULWE26n","Mari Fernandez","Página De Ex - Ao Vivo","Som Livre",22,32,12,"3335464"
35,"spotify:track:3FB06ULqN0WNUSQ3UaMZnF","blicko","Amor Na Praia","blicko",7,39,20,"3325309"
36,"spotify:track:5r0JHIjcY7dLWHkljNeQbj","Murilo Huff","Anestesiado - Ao Vivo","M Show",4,30,36,"3312905"
37,"spotify:track:6u9tu5yRDTHpWlY86J1GDa","Yasmin Santos, Simone Mendes","Nem a Pau (feat. Simone Mendes) - Ao Vivo","Sony Music Entertainment",37,45,4,"3182252"
38,"spotify:track:42JNab8NPeCADJ9D3Cl5wS","Zé Neto & Cristiano","Barulho Do Foguete - Ao Vivo","Som Livre",4,38,56,"3164020"
39,"spotify:track:2RX89Di479sc53wkaNgt9E","Hugo & Guilherme","Vazou Na Braquiara - Ao Vivo","Som Livre",15,40,27,"3125647"
40,"spotify:track:2ORC76autQ7QTfBCkZl4Wo","Murilo Huff","Dedo do Meio - Ao Vivo","M Show",20,36,17,"3077310"
41,"spotify:track:6Tp4LCJ5r5IJaEf8lnlPfG","Henrique & Juliano","De Trás Pra Frente (Ao Vivo)","Vida Nova Produções, sob licença exclusiva para Virgin Music Group",17,41,93,"3041433"
42,"spotify:track:5G0kKNRYFCoORvJ2VzwvrY","Mc Livinho, DJ TOPO","MTG PASSA PASSA PRA EU SARRAR","Mc Livinho",29,35,6,"2980156"
43,"spotify:track:4W87Hv4pBFsE0JEi7enRBQ","TrapLaudo, Mc IG, MC PH, MC Ryan SP, Mc Don Juan, Murillo e LT no Beat","Malvada","4M RECORDS",28,37,6,"2876176"
44,"spotify:track:5asabafNzfAzjUecDvuNES","Henrique & Juliano","Aquela Pessoa (Ao Vivo)","Vida Nova Produções, sob licença exclusiva para Virgin Music Group",34,34,130,"2867319"
45,"spotify:track:0GbvYZsvz7bWyijBDESebX","Simone Mendes","Mulher Foda - Ao Vivo","Universal Music Ltda.",45,122,2,"2864911"
46,"spotify:track:24R0oyjvhV4HIFFvoK3XkP","Tropa do Bruxo, SMU, Dj Vitin do Pc, MC JF, MC NAHARA","TUMBÁTUM","Tropa Do Bruxo",11,43,24,"2829125"
47,"spotify:track:5brVlCCt8gp4pP0iJOOctj","MC Ryan SP, Filipe Ret, Caio Luccas, Chefin, Dallass, Rocco","Melhor Vibe","WM Brazil",22,47,18,"2791134"
48,"spotify:track:5qMyN3dzXKb5P1MiKyqupZ","Fred & Fabrício, Traia Véia","Poder de Mentir - Ao Vivo","Som Livre",31,31,3,"2767794"
49,"spotify:track:65vJAh07BdwurqR9SRa6f8","Ferrugem, Sorriso Maroto","Apaguei Pra Todos - Ao Vivo","WM Brazil",35,44,14,"2734181"
50,"spotify:track:3iam4WkRoqMoBBCwDFZNgd","Henrique & Juliano","Quase Algo (Ao Vivo Em Nova Iorque) (2022)","Vida Nova Produções, sob licença exclusiva para Virgin Music Group",17,33,45,"2732589"
51,"spotify:track:4XaLEsmrRGSDkgd7qpn4Nl","MC LUUKY, MC Ryan SP, Dj Victor, Boladin 211, MC Vine7","Sempre na Simplicidade","EDITORA E GRAVADORA A BASE RECORDS",51,-1,1,"2625613"
52,"spotify:track:3l5VjEAeUTqrlD50iEo8Yn","KayBlack, CVSTRO, Wall Hein, AMUSIK","Licor 43","Elenko Music",52,54,97,"2607770"
53,"spotify:track:7sAyqOe0BHySvFjSI5tnBA","Ícaro e Gilmar, Luan Pereira","Diferentona","MJ Records",53,109,2,"2595563"
54,"spotify:track:1K14aw84e0i5IHFHkq7aNn","KayBlack, Murillo e LT no Beat","Mistérios","WM Brazil",54,-1,1,"2593879"
55,"spotify:track:5jrQZnYInM6YUjr2yFSa3E","MC PH, Vulgo FK, Veigh, Pedro Lotto, prodbyeros","Vem Desestressar","GR6 Music",22,48,16,"2557201"
56,"spotify:track:6dOtVTDdiauQNBQEDOtlAB","Billie Eilish","BIRDS OF A FEATHER","Darkroom/Interscope Records",42,49,10,"2549387"
57,"spotify:track:60wgnlVBEsyswrTB6pYiTi","amblu","Como Um Beijo","amblu",19,58,8,"2535857"
58,"spotify:track:3hfCle1QRfbwIpQ1B746lV","MC Saci, Complexo dos Hits, DJ Sammer, Mc Pretchako","Aquariano Nato","eumcsaci",2,53,43,"2493828"
59,"spotify:track:2GcK73z8rjy5IKc4cjV7oG","CountryBeat, Luan Pereira","Filho do Fazendeiro","CountryBeat",59,76,3,"2278985"
60,"spotify:track:00hbGsdy4tMD2R0Y5n5E0C","Flozimbar","Hysteria","Robin",26,51,8,"2278566"
61,"spotify:track:0zxWyvrKyz031tFfBnkYLr","Henrique & Juliano","Como É Que A Gente Fica (Ao Vivo)","Vida Nova Produções, sob licença exclusiva para Virgin Music Group",23,74,88,"2261008"
62,"spotify:track:0Q1ySdDoHDiotYn4nbMXNm","Nagalli, KayBlack, Veigh, Supernova Ent","CONFISSÕES PT2","Supernova Ent",8,55,13,"2258669"
63,"spotify:track:2IvsDK2p7Kq3aDrVtESDIg","Ana Castela, Gustavo Mioto","Fronteira - Ao Vivo","AgroPlay",7,62,36,"2200270"
64,"spotify:track:6GmyQws2xpUFIN5dXBNTrl","AgroPlay, Ana Castela, LUDMILLA","Dia de Fluxo","AgroPlay",4,67,31,"2200113"
65,"spotify:track:5mJcnekfy4DEpAZ6uAHM7Y","Thullio Milionário","Casca de Bala","Thullio Milionário",10,59,16,"2198185"
66,"spotify:track:0bor3AJ8QV6RRbyV64ZsOO","Fiduma & Jeca, Fernando & Sorocaba","Cortando as BR (F&J 10 Anos) - Ao Vivo","Fiduma & Jeca",66,69,8,"2152794"
67,"spotify:track:448158cOtdLyR59DJnzpON","DJ Zigão, DJ Lafon Do Md, Mc Rodrigo do CN, Mc Rf","Te Maceto Depois Do Baile","Dj Zigão",20,57,7,"2148799"
68,"spotify:track:7pnqm6UEb7SzpDxb53wULT","Mc IG, MC Ryan SP, Oruam, MC PH, Mc Poze do Rodo, MC GP, TrapLaudo, Mc Luki, MC GH do 7, MC Nego Micha, Murillo e LT no Beat","Diz Aí Qual é o Plano?","WM Brazil",1,61,20,"2138736"
69,"spotify:track:6RqEGo7zvc8g31ZyG1Mm6Q","Mc Jacaré, MC Kevin o Chris","A Culpa Não É Minha","Croco Hits",69,83,7,"2132884"
70,"spotify:track:1i2kguziI3ZbUZnZMKNhQ2","Mc IG, DJ Jorgin","400K","GR6 Music",45,78,33,"2122830"
71,"spotify:track:6Gn8SHd3RIWjOermcidCJk","Dj Lc, DJ JOAO DA INESTAN, Mc Pretchako, MC Saci, Complexo dos Hits","A Internet É Toxica","Complexo dos Hits",7,56,38,"2111924"
72,"spotify:track:3IjUrdmAjmjiSY7LUbYXVd","Dj Victor, MC Tuto, MC LUUKY, Mc Kadu","Mó Fita","Nova Era Produtora",72,75,5,"2100243"
73,"spotify:track:5u7Xi0QhfkYy3qETJJ5lae","MC Paulin da Capital, Love Funk, Mc Piedro, Dj GM, DJ WN, MC Ryan SP, Mc Daniel","Samba de Malandro","Love Funk",22,64,19,"2096166"
74,"spotify:track:1tAls12jSoUZPoj9cv7OAh","Guilherme & Benuto","Chorosa - Ao Vivo","Sony Music Entertainment",70,119,7,"2075270"
75,"spotify:track:4A59ygOlOd3V0GbyEmUxKs","NATTAN, Ana Castela","Pega Cabuloso - Ao Vivo em São Paulo","Nattan",75,181,2,"2070906"
76,"spotify:track:7BRD7x5pt8Lqa1eGYC4dzj","Billie Eilish","CHIHIRO","Darkroom/Interscope Records",17,60,10,"2029083"
77,"spotify:track:4jbTB2Kj4CrZCjngkQUQS2","Murilo Huff","A Cerveja Abre Sozinha - Ao Vivo","M Show",16,70,28,"2024068"
78,"spotify:track:5QbtKOsjbEGkx0GMiQGBZt","fhop music, Hamilton Rabelo","Tu és + Águas Purificadoras - Ao Vivo","FHOP Music",65,65,19,"2022699"
79,"spotify:track:0cvVetonbe66pOOPMtuSOC","L7NNON, MC Cabelinho, Palma, HHR","Vamo Marolar","HHR Records",12,68,15,"2016903"
80,"spotify:track:2InS5VWKJQbsFBKOsf1cJB","Dj GBR, Mc IG, MC Ryan SP, MC PH, Mc Davi, Mc Luki, Mc Don Juan, Mc Kadu, TrapLaudo, MC GP, MC GH do 7","Let's Go 4","GR6 Music",1,73,46,"2009401"
81,"spotify:track:5DcysyjaPrLzXgDauvzvn6","George Henrique & Rodrigo, Guilherme & Benuto","Beijo Equivocado","Worldshow Promoções e Eventos",44,95,44,"1986755"
82,"spotify:track:1agDCV4zQqaFwJQNsTgmL1","Jimin, Loco","Smeraldo Garden Marching Band (feat. Loco)","BIGHIT MUSIC",59,135,4,"1964132"
83,"spotify:track:7pkpWcko6KEZANj0xKsCsu","Matheus & Kauan","Cronômetro - Ao Vivo","Universal Music Ltda (S&D)",83,180,3,"1928493"
84,"spotify:track:4G0CNdwFI4oeHFVZDcqLvK","Henrique Casttro, Marília Mendonça","Experiência - Ao Vivo","Sony Music Entertainment",84,-1,3,"1906656"
85,"spotify:track:2qSkIjg1o9h3YT9RAgYN75","Sabrina Carpenter","Espresso","Island Records",49,71,15,"1906303"
86,"spotify:track:2sYFUcurlISdHlAsnYCEgD","Lauana Prado","Me Leva Pra Casa / Escrito Nas Estrelas / Saudade - Ao Vivo","Universal Music Ltda.",1,66,34,"1905919"
87,"spotify:track:5DrDpWyvharQkhsloNTN9W","Mc J Mito, DJ Borest","Clack Bum","Som Livre",87,-1,1,"1902938"
88,"spotify:track:0VybBobSYSzliyEJ1VqwGR","WIU, Teto","Problemas de um Milionário","30PRAUM",17,63,15,"1899009"
89,"spotify:track:6r6wTVl7sBndpdlzBSEYnF","Ana Castela, Hungria, Alok","Lua","AgroPlay",6,80,23,"1891933"
90,"spotify:track:7Cf2Hsy3cPlA4e115tElXv","Henrique & Juliano","Liberdade Provisória (Live - Ibirapuera / 2019)","Vida Nova Produções, sob licença exclusiva para Virgin Music Group",1,82,122,"1891284"
91,"spotify:track:4v7UrPWZL4FJWeL5ZWQ62E","Henrique & Juliano","Seu Erro (Ao Vivo Em Nova Iorque) (2022)","Vida Nova Produções, sob licença exclusiva para Virgin Music Group",43,81,40,"1877957"
92,"spotify:track:73SIgqXr3oRzzWbX1muX3I","Rionegro & Solimões","Fivela Com Fivela - Ao Vivo","Rionegro e Solimões",84,84,7,"1872828"
93,"spotify:track:7dKqPh21HpsysZvRWyNeM1","Isadora Pompeo","Bênçãos Que Não Têm Fim (Counting My Blessings)","Sony Music Entertainment",10,72,37,"1872619"
94,"spotify:track:4sAoshwHCmh4IHMQxZHwRD","TR, Mc Menor RV, Tropa da W&S","Baby Eu Tava na Rua da Água","WMD",1,79,27,"1856489"
95,"spotify:track:3eHeTsX6W9iIEfn8l2xrWO","Henrique & Juliano","Meu Amor (Ao Vivo)","Vida Nova Produções, sob licença exclusiva para Virgin Music Group",76,85,74,"1854297"
96,"spotify:track:3xkHsmpQCBMytMJNiDf3Ii","Benson Boone","Beautiful Things","Night Street Records, Inc./Warner Records Inc.",40,86,24,"1844992"
97,"spotify:track:4f0aDk7HX37SfzerfznYlr","Grupo Menos É Mais, Matheus Fernandes","Lapada Dela - Ao Vivo","Som Livre",4,93,74,"1830406"
98,"spotify:track:7sopDXkuzXtHt8AQpdBxmT","Ana Castela","DONA DE MIM","AgroPlay",13,103,83,"1825823"
99,"spotify:track:4xEYeY9OSYP7c8dSwlpBFD","Mc Daniel, MC Ryan SP, Kotim, Blakbone","Só Vou Namorar","Lyons Produções",99,107,2,"1781076"
100,"spotify:track:0gg3QtCcPZn4aJ0D7dRNul","Manim Vaqueiro","Forró e Desmantelo","Feeling",75,90,7,"1763685"
101,"spotify:track:53PpijFATt35Zxfl6LTxoK","Marília Mendonça","Leão","Som Livre",1,98,85,"1749689"
102,"spotify:track:2QjOHCTQ1Jl3zawyYOpxh6","The Neighbourhood","Sweater Weather","Columbia",79,89,84,"1738025"
103,"spotify:track:7CyPwkp0oE8Ro9Dd5CUDjW","The Weeknd, JENNIE, Lily-Rose Depp","One Of The Girls (with JENNIE, Lily Rose Depp)","XO / Republic Records",61,96,33,"1735469"
104,"spotify:track:17phhZDn6oGtzMe56NuWvj","Teddy Swims","Lose Control","Warner Records",82,94,23,"1729100"
105,"spotify:track:6mIAta8vOaOhCM4yh8P2FJ","George Henrique & Rodrigo, Henrique & Juliano","Seu Oposto","World Show Produções",105,116,14,"1695673"
106,"spotify:track:7McCAKExE8KsI2q4Y8wx4U","Murilo Huff, Marília Mendonça","Dois Enganados","M Show",49,104,104,"1688757"
107,"spotify:track:4Dvkj6JhhA12EX05fT7y2e","Harry Styles","As It Was","Columbia",10,97,118,"1673197"
108,"spotify:track:4D25RP3yiJWfW9utK9dMyv","Rayane & Rafaela, Henrique & Juliano","Ali Te Ama - Ao Vivo","Henrique e Juliano oficial",64,102,39,"1667193"
109,"spotify:track:1b4OldCIxTO7DcqYdvdlOM","Marília Tavares","Palavras de Perdão - Ao Vivo","Marilia Tavares",78,91,6,"1666981"
110,"spotify:track:6vq7r1Pqd3pyI07u63cPZV","Simone Mendes","Erro Gostoso - Ao Vivo","Universal Music Ltda.",3,100,78,"1666352"
111,"spotify:track:5N3hjp1WNayUPZrA8kJmJP","Sabrina Carpenter","Please Please Please","Island Records",52,87,7,"1639277"
112,"spotify:track:6QxaJjXCxZSGKq98arP8Nw","Julliany Souza","Lindo Momento - Ao Vivo","PART",99,99,14,"1634237"
113,"spotify:track:1VbunACv3Z4cGfBenC7oTx","Felipe e Rodrigo","Saudade Butequeira (Ao Vivo)","MK Records",113,134,5,"1612267"
114,"spotify:track:5Z0UnEtpLDQyYlWwgi8m9C","Hozier","Too Sweet","Rubyworks / Universal-Island Records Ltd",45,101,16,"1586846"
115,"spotify:track:1m5nbZiPpCIi9J2irLNoxh","Oruam, Didi, Dj Lc da Roça, MC K9, MC Smith, Mainstreet","Rolé na Favela de Nave","Mainstreet Records",9,105,25,"1580915"
116,"spotify:track:006pMMCuRo2TFjh8sNGSov","Charlie Brown Jr.","Dias De Luta, Dias De Gloria","EMI Brazil",110,112,54,"1544064"
117,"spotify:track:6mJCx80Wc91GPi9ew9bkmD","DENNIS, Ana Castela, Mc Gw","RAM TCHUM","Sony Music Entertainment",3,108,21,"1519857"
118,"spotify:track:5mmxylfcIlTaTftZwIIj3W","Henrique & Juliano","Você Vai Ser Fiel (Ao Vivo Em Nova Iorque) (2022)","Vida Nova Produções, sob licença exclusiva para Virgin Music Group",84,92,34,"1501236"
119,"spotify:track:1OwoPY7wYgKQIyl9maWmSM","Gusttavo Lima, Ana Castela","Canudinho - Ao Vivo","Sony Music Entertainment",2,130,47,"1494561"
120,"spotify:track:2hloKDkwGLjtYvAoqn39gV","Mc Jacaré, Luan Pereira","Senta Pro Bruto","Croco Hits",50,128,19,"1493876"
121,"spotify:track:5LCegtYPODbcqbTE5CZVv8","Manu, Simone Mendes","Daqui pra Sempre","manuoficial",3,114,43,"1488818"
122,"spotify:track:5XeFesFbtLpXzIVDNQP22n","Arctic Monkeys","I Wanna Be Yours","Domino Recording Co",78,115,98,"1486997"
123,"spotify:track:5RTMpECEVHy3H9jtn7HKi5","Tz da Coronel, Ryu, The Runner, Nagalli","Qual é seu desejo?","Cúpula",1,111,21,"1485575"
124,"spotify:track:2VUUzKS50OxWyTRu1J0YKH","Matheus & Kauan","Não Recomendo - Ao Vivo","Universal Music Ltda (S&D)",11,77,34,"1480792"
125,"spotify:track:6BWWgcNJWXQ4qRuzY5LzBP","Felipe Amorim, MC PH, WIU, DG e Batidão Stronda","Tenho que Me Decidir","One Play",84,113,20,"1478026"
126,"spotify:track:6zFpImDYig0CQhLL2NIfyN","AgroPlay, Ana Castela","Nosso Quadro","AgroPlay",1,125,77,"1476845"
127,"spotify:track:4YKujFSyakVjLdH1sDllVc","Simone Mendes","Dois Fugitivos - Ao Vivo","Universal Music Ltda.",5,118,45,"1473928"
128,"spotify:track:0oQCRjrWGvkqkdf82UlXI3","PEDRO SAMPAIO","POCPOC","WM Brazil",1,133,34,"1471024"
129,"spotify:track:7r8yMaSOy4XmuhRz7iv1gi","Henrique & Juliano","Traumatizei (Ao Vivo Em Brasília)","Vida Nova Produções, sob licença exclusiva para Virgin Music Group",6,117,77,"1469625"
130,"spotify:track:1WwJveqGQoABRF22Nmwv88","Tz da Coronel","Acordado eu Sonho","Cúpula",124,124,2,"1462298"
131,"spotify:track:7uPInsxTeMbyrJkDQaRwPh","DJ THG, Mc Arizinho, Tavin","É Que Eu Te Sarrei","A2M Produtora",95,129,10,"1459380"
132,"spotify:track:4xAGuRRKOgoaZbMGdmTD3N","Zé Neto & Cristiano","Oi Balde - Ao Vivo","Som Livre",3,120,75,"1441772"
133,"spotify:track:4ZrKyfCV1UcHuZjbLp03fM","Mãolee, Filipe Ret, Vulgo FK","Nós Combina","WM Brazil",131,131,7,"1419246"
134,"spotify:track:1ovpVYLiuIQpLB8F0PrJ4N","Simone Mendes","Meu Pra Sempre Não Era Meu - Ao Vivo","Universal Music Ltda.",134,137,4,"1408662"
135,"spotify:track:2yrBejsWFNxY5ICWwmx9ae","Iguinho e Lulinha","Fora do Comum","IL SHOWS",106,106,3,"1403548"
136,"spotify:track:2lKiWWoeqOHhXwyZT8flw6","Isadora Pompeo","Ovelhinha (Ao Vivo)","Sony Music Entertainment",136,146,5,"1398476"
137,"spotify:track:6xW61JP2f3hcsbOwn7dzi5","Mc IG, MC Ryan SP, MC PH, DJ Glenner","É Isso Bebê, Tá Certa!","WM Brazil",6,142,18,"1393604"
138,"spotify:track:4hKLzFvNwHF6dPosGT30ed","Veigh, Bvga Beatz, Prod Malax, Supernova Ent","Novo Balanço","Supernova Entertainment Under Exclusive License to UnitedMasters",2,132,62,"1390745"
139,"spotify:track:4bDvY5oGtCWTYH5Vi36bc5","Henrique & Juliano","Mais Amor E Menos Drama (Ao Vivo)","Vida Nova Produções, sob licença exclusiva para Virgin Music Group",106,123,85,"1388166"
140,"spotify:track:3tGiBHrLSYXuUtaDZ4jmXt","MC PH, Teto, Pedro Lotto, WEY","Dentro Da Mala","GR6 Music",140,149,5,"1387305"
141,"spotify:track:6P1mkNAmgihFwFRBhpaev3","Luan Pereira, Mc Daniel","ENTRA NA DEFENDER","Som Livre",3,141,18,"1372132"
142,"spotify:track:2jPCbFrFlyGbKgblxub8Lm","The Outfield","Your Love","Columbia/Legacy",142,152,6,"1361192"
143,"spotify:track:4dSDTAZ7ohybHBonbtMBpP","Bruno & Marrone, Zé Felipe, Mc Jacaré, Loirin prod","Desilusão (MTG) (feat. Loirin Prod)","Sony Music Entertainment",14,50,3,"1340837"
144,"spotify:track:5AJ9hqTS2wcFQCELCFRO7A","Tommy Richman","MILLION DOLLAR BABY","PULSE Records",53,121,12,"1340611"
145,"spotify:track:697gwO5YoSGVAnlfREIZll","MC PH, Borges, WIU, Pedro Lotto, WEY","Tenho Que Me Decidir","GR6 Music",4,143,34,"1326723"
146,"spotify:track:4OMSfAavn8k6HxZ0HwVtV1","Nagalli, Menor MC, Dfideliz, CJota, Leviano, Supernova Ent","CONFISSÕES PT1","Supernova Ent",84,127,13,"1315433"
147,"spotify:track:0redQHBfejmPUhonR5ppGC","Guilherme & Benuto, Ana Castela, Adriano Rhod","Duas Três","Sony Music Entertainment",8,161,74,"1314575"
148,"spotify:track:40IXmplKTcyWPr9HNCik7e","Matuê, MC Ryan SP","Filho da Noite","Sony Music Entertainment",14,150,13,"1312810"
149,"spotify:track:3pLyNmLlw6uRrKaNwMnXOR","Josué Bom de Faixa","Não Precisa Negar","PAX MUSIC",74,138,28,"1309007"
150,"spotify:track:6qafqn8bBMy7t5c5WqpyRk","Jimin","Closer Than This","BIGHIT MUSIC",150,-1,1,"1308992"
151,"spotify:track:3PGg3V56krasXrPKNvVLQU","Filipe Ret","Amor Livre - Ao Vivo","Som Livre",29,156,32,"1308731"
152,"spotify:track:4ksSf8cL3VlUvQSkFcRHy3","Henrique & Juliano","Até Você Voltar - Ao Vivo","Som Livre",116,126,21,"1297765"
153,"spotify:track:7xjV9rXbAUDCreKgx2pkGY","Mari Fernandez, Zé Felipe","Louco, Louco - Ao Vivo","Som Livre",153,-1,1,"1290352"
154,"spotify:track:2LTlykcdu0gwb7zcKneo2a","KayBlack, Baco Exu do Blues, Marquinho no Beat","Melhor Só","WM Brazil",3,148,67,"1288174"
155,"spotify:track:08CzlOB0r2a21LVg5L30UT","KayBlack, Vulgo FK, Mãolee","Camarim","WM Brazil",155,-1,1,"1279441"
156,"spotify:track:3LWVXp636uLT356Rj08Jaz","Jimin","Be Mine","BIGHIT MUSIC",156,-1,1,"1279368"
157,"spotify:track:2BlFIe0712LBUtTHxbqjme","NATTAN, Felipe Amorim","Love Gostosinho - Ao Vivo","Vybbe",12,147,67,"1278435"
158,"spotify:track:0OBv4CEP5FKS19ZQGHAUM6","Mc Paiva ZS, DJ Ak beats, Love Funk","Fala na Cara","Love Funk",85,155,28,"1276515"
159,"spotify:track:4IdM33qInoQEbAp5q2sg8L","João Gomes","Me Ama Sem Pausa - Aquelas Paradas","JG Shows",159,-1,1,"1272756"
160,"spotify:track:3lHV3YbZNltXHyZaDDpios","Mc Laranjinha, Dj Lv Mdp","Ligou na Madruga","DC MUSIC",104,136,15,"1269214"
161,"spotify:track:3ODUgIaqdpkMXXlsH1kDLh","MC GP, MC Jvila, MC LUUKY, Dj Yuri Pedrada","300 no 7","MC GP NOVA ERA",161,166,2,"1267142"
162,"spotify:track:5HFvMPiNjclAq8DbEAPWMw","Gilsons","Várias Queixas","Xirê",146,157,43,"1264824"
163,"spotify:track:2l6YkP5Rj1w3GsrhE7cDqx","DJ GUIZIN DA SERRA, MC Marlon PH","MTG - BARRACO DELA LÁ","DJ GUIZIN DA SERRA",120,139,16,"1261113"
164,"spotify:track:1JSTJqkT5qHq8MDJnJbRE1","The Police","Every Breath You Take","Polydor Records",140,168,21,"1252755"
165,"spotify:track:5t53gEhwkInr9ooCmWBVtu","Diego & Victor Hugo, Guilherme & Benuto","Vestido Curto - Ao Vivo","Sony Music Entertainment",37,165,31,"1251990"
166,"spotify:track:5TtTijiNYtFc6ktQARjY30","KayBlack, Wall Hein","Preferida","WM Brazil",13,162,66,"1251659"
167,"spotify:track:60a0Rd6pjrkxjPbaKzXjfq","Linkin Park","In the End","Warner Records",48,160,13,"1248313"
168,"spotify:track:2329XxRFYoAPdQSb4DmjXQ","Mc IG, Mc Kevin, DJ WN, MC PH","Deus, Por favor","WM Brazil",16,178,15,"1247241"
169,"spotify:track:6zdL0aLZs6g61SPGrlMvrM","DJ JOÃO PEREIRA, MC Koringa","DANÇA PRA ME PROVOCAR","DJ JOÃO PEREIRA x MC Koringa",18,145,33,"1245240"
170,"spotify:track:1Vy9Wn5sbiduZKBqBlH3Mc","Vulgo FK, MC PH, Veigh, Pedro Lotto, Fepache","Ballena","Som Livre",3,153,54,"1244980"
171,"spotify:track:1kWcd9h9HoeXsKaDVhSOtj","Sorriso Maroto, Ferrugem","Ela - Ao Vivo","Sony Music Entertainment",44,173,45,"1238787"
172,"spotify:track:0aGBJDgysbTnnE27oYkx0N","Ícaro e Gilmar","Trauma - Ao Vivo","MJ Records",144,144,4,"1237870"
173,"spotify:track:3hRV0jL3vUpRrcy398teAU","Lord Huron","The Night We Met","Lord Huron",86,164,11,"1235903"
174,"spotify:track:3PqU6gHWUaBTtIZi5oxEJ7","Zé Neto & Cristiano","Um Mês E Pouco - Ao Vivo","Som Livre",11,151,57,"1229180"
175,"spotify:track:0GtGtRY3SB3tlfLYiFtrEw","Mulú, DUDA BEAT","CHIHIRO","Universal Music Ltda.",175,-1,1,"1227700"
176,"spotify:track:6m8AgjfI28ER6odzMxmHtR","Racionais MC's","Vida Loka, Pt. 1","Boogie Naipe",176,177,6,"1217256"
177,"spotify:track:0ODlZu2uJ13I29NfFJJVir","Luan Santana, MC Kevin o Chris","PEGA ESCANDALOSO","Sony Music Entertainment",21,169,17,"1216488"
178,"spotify:track:1V2RBDA7cvLniTAt3fQZoC","Wesley Safadão, Felipe Amorim","Novinha Não Chora","Wesley Safadao",178,-1,1,"1216313"
179,"spotify:track:0WbMK4wrZ1wFSty9F7FCgu","Chappell Roan","Good Luck, Babe!","Chappell Roan PS/ Island",167,167,2,"1214132"
180,"spotify:track:6ZnVSNNryDmF0w1j73Fndd","Pineapple StormTv, MC Cabelinho, Bob do Contra, Azzy, Filipe Ret, Dudu, Xamã, Orochi, Maquiny, Salve Malak","Poesia Acústica #6 Era uma Vez","Pineapple StormTV",18,154,225,"1212479"
181,"spotify:track:1M35NDVCYIGoyHimP6VV2W","Sorriso Maroto, Thiaguinho","Promessas - Ao Vivo","Sony Music Entertainment",181,-1,1,"1211912"
182,"spotify:track:3CJiho39iutZrDxQG5Vubl","LUDMILLA","Maliciosa - Ao Vivo","SEM QUERER MUSIC",13,-1,19,"1208296"
183,"spotify:track:2WfaOiMkCvy7F5fcp2zZ8L","a-ha","Take on Me","Rhino",183,-1,1,"1198371"
184,"spotify:track:1iYZYlUzDHrfxKqgC99cRZ","CountryBeat, Brenno & Matheus, Félix, Léo Souzza","Xona no Peão","CountryBeat",184,189,2,"1197869"
185,"spotify:track:3d2bsbugow8JiNvuaRupFH","Jimin, Sofia Carson","Slow Dance (feat. Sofia Carson)","BIGHIT MUSIC",185,-1,1,"1197089"
186,"spotify:track:0LGGo9eY1aJX6tqgxa87kd","KayBlack, Wall Hein, Yokame","Freestyle","Bunker Concept",68,170,32,"1196070"
187,"spotify:track:7IIDB25xKfPbw595U53Ose","George Henrique & Rodrigo, Marília Mendonça","Vai Lá Em Casa Hoje - Ao Vivo","Worldshow Promoções e Eventos",1,-1,82,"1195746"
188,"spotify:track:2BYQzRnQvFvLwfJSLYQjfn","Pabllo Vittar","São Amores","Sony Music Entertainment",143,-1,4,"1186230"
189,"spotify:track:4tuFNhM69UakXdPg4RrNvp","Filipe Ret, Dallass, Hunter","Deus Perdoa","Som Livre",45,172,36,"1182700"
190,"spotify:track:1jN0ysNJ2d9VZwVdlgspjr","MC Saci, MC Fahah, DJ Sammer, Dj Lc","De 10 Mulher 11 É Maluca","eumcsaci",6,163,22,"1179930"
191,"spotify:track:3QpDKVHmf9RDQkJbAUNWzI","Gustavo Moura & Rafael","Digitando","Astro Produções",1,52,22,"1178344"
192,"spotify:track:5rRlZJz8A17nqeKLdjDvsx","Tz da Coronel","Não Temos Medo","Cúpula",192,-1,1,"1176067"
193,"spotify:track:3jTyFoGeD3DTu9cnnctMWN","Luan Pereira, Mc Daniel, MC Ryan SP","DENTRO DA HILUX","Som Livre",2,196,47,"1175113"
